sample_id,imos_site_code,coastal_id,utc_date_sampled,utc_time_sampled,collection_date,notes,depth,tot_depth_water_col,samp_size,samp_vol_we_dna_ext,sample_volume_notes,sample_integrity_warnings,temp,AM_internal_notes,dna_concentration_submitter,absorbance_260_280_ratio_submitter,ammonium,chlorophyll_a,chlorophyll_ctd,conductivity_aqueous,fluor,nitrate_nitrite,nitrite,oxygen,par,part_org_carb,ph,phosphate,salinity,salinity_lab,secchi_depth,silicate,transmittance,tss,turbidity,nitrate,tot_nitro,tot_phosp
102.100.100/138778,CSBAI,,18/06/2020,0:44:00,2020-06-18T00:44:00Z,,2,,2,2,,,17,,,,,,,,,,,,,,,,,,,,,,,,,
102.100.100/138777,CSBAI,,18/06/2020,0:53:00,2020-06-18T00:53:00Z,,2,,2,2,,,17,,,,,,,,,,,,,,,,,,,,,,,,,
102.100.100/138776,CSBAI,,18/06/2020,1:02:00,2020-06-18T01:02:00Z,,2,,2,2,,,17,,,,,,,,,,,,,,,,,,,,,,,,,
102.100.100/138775,CSBAI,,2/07/2020,0:53:00,2020-07-02T00:53:00Z,,2,,2,2,,,16.5,,,,,,,,,,,,,,,,,,,,,,,,,
102.100.100/138774,CSBAI,,2/07/2020,1:05:00,2020-07-02T01:05:00Z,,2,,2,2,,,16.5,,,,,,,,,,,,,,,,,,,,,,,,,
102.100.100/138773,CSBAI,,2/07/2020,1:17:00,2020-07-02T01:17:00Z,,2,,2,2,,,16.5,,,,,,,,,,,,,,,,,,,,,,,,,
102.100.100/138772,CSBAI,,16/07/2020,0:56:00,2020-07-16T00:56:00Z,,2,,2,2,,,17,,,,,,,,,,,,,,,,,,,,,,,,,
102.100.100/138771,CSBAI,,16/07/2020,1:07:00,2020-07-16T01:07:00Z,,2,,2,2,,,17,,,,,,,,,,,,,,,,,,,,,,,,,
102.100.100/138770,CSBAI,,16/07/2020,1:15:00,2020-07-16T01:15:00Z,,2,,2,2,,,17,,,,,,,,,,,,,,,,,,,,,,,,,
102.100.100/138769,CSBAI,,30/07/2020,0:55:00,2020-07-30T00:55:00Z,,2,,2,2,,,14,,,,,,,,,,,,,,,,,,,,,,,,,
102.100.100/138768,CSBAI,,30/07/2020,1:01:00,2020-07-30T01:01:00Z,,2,,2,2,,,14,,,,,,,,,,,,,,,,,,,,,,,,,
102.100.100/138767,CSBAI,,30/07/2020,1:11:00,2020-07-30T01:11:00Z,,2,,2,2,,,14,,,,,,,,,,,,,,,,,,,,,,,,,
102.100.100/138766,CSBAI,,13/08/2020,2:45:00,2020-08-13T02:45:00Z,,2,,2,2,,,14.5,,,,,,,,,,,,,,,,,,,,,,,,,
102.100.100/138765,CSBAI,,13/08/2020,2:56:00,2020-08-13T02:56:00Z,,2,,2,2,,,14.5,,,,,,,,,,,,,,,,,,,,,,,,,
102.100.100/138764,CSBAI,,13/08/2020,3:08:00,2020-08-13T03:08:00Z,,2,,2,2,,,14.5,,,,,,,,,,,,,,,,,,,,,,,,,
102.100.100/138763,CSBAI,,27/08/2020,0:05:00,2020-08-27T00:05:00Z,,2,,2,2,,,14,,,,,,,,,,,,,,,,,,,,,,,,,
102.100.100/138762,CSBAI,,27/08/2020,0:18:00,2020-08-27T00:18:00Z,,2,,2,2,,,14,,,,,,,,,,,,,,,,,,,,,,,,,
102.100.100/138761,CSBAI,,27/08/2020,0:40:00,2020-08-27T00:40:00Z,,2,,2,2,,,14,,,,,,,,,,,,,,,,,,,,,,,,,
102.100.100/138760,CSBAI,,10/09/2020,0:10:00,2020-09-10T00:10:00Z,Unusually low sample volume and counts across picoplankton groupings,2,,2,2,,,14.5,,,,,,,,,,,,,,,,,,,,,,,,,
102.100.100/138759,CSBAI,,10/09/2020,0:23:00,2020-09-10T00:23:00Z,Unusually low sample volume and counts across picoplankton groupings,2,,2,2,,,14.5,,,,,,,,,,,,,,,,,,,,,,,,,
102.100.100/138758,CSBAI,,10/09/2020,0:35:00,2020-09-10T00:35:00Z,"no flow cytometry data - incorrect sample type, filter submitted instead of liquid",2,,2,2,,,14.5,,,,,,,,,,,,,,,,,,,,,,,,,
102.100.100/138755,CSBAI,,24/09/2020,0:50:00,2020-09-24T00:50:00Z,,2,,2,2,,,15,,,,,,,,,,,,,,,,,,,,,,,,,
102.100.100/138756,CSBAI,,24/09/2020,1:05:00,2020-09-24T01:05:00Z,,2,,2,2,,,15,,,,,,,,,,,,,,,,,,,,,,,,,
102.100.100/138757,CSBAI,,24/09/2020,1:20:00,2020-09-24T01:20:00Z,,2,,2,2,,,15,,,,,,,,,,,,,,,,,,,,,,,,,
102.100.100/138754,CSBAI,,8/10/2020,1:02:00,2020-10-08T01:02:00Z,Unusually low sample volume and counts across picoplankton groupings,2,,2,2,,,16.5,,,,,,,,,,,,,,,,,,,,,,,,,
102.100.100/138753,CSBAI,,8/10/2020,1:12:00,2020-10-08T01:12:00Z,Unusually low sample volume and counts across picoplankton groupings,2,,2,2,,,16.5,,,,,,,,,,,,,,,,,,,,,,,,,
102.100.100/138752,CSBAI,,8/10/2020,1:21:00,2020-10-08T01:21:00Z,Unusually low sample volume and counts across picoplankton groupings,2,,2,2,,,16.5,,,,,,,,,,,,,,,,,,,,,,,,,
102.100.100/138751,CSBAI,,22/10/2020,0:52:00,2020-10-22T00:52:00Z,,2,,2,2,,,17,,,,,,,,,,,,,,,,,,,,,,,,,
102.100.100/138750,CSBAI,,22/10/2020,0:59:00,2020-10-22T00:59:00Z,,2,,2,2,,,17,,,,,,,,,,,,,,,,,,,,,,,,,
102.100.100/138749,CSBAI,,22/10/2020,1:10:00,2020-10-22T01:10:00Z,,2,,2,2,,,17,,,,,,,,,,,,,,,,,,,,,,,,,
102.100.100/138748,CSBAI,,5/11/2020,0:45:00,2020-11-05T00:45:00Z,,2,,2,2,,,16,,,,,,,,,,,,,,,,,,,,,,,,,
102.100.100/138747,CSBAI,,5/11/2020,1:05:00,2020-11-05T01:05:00Z,,2,,2,2,,,16,,,,,,,,,,,,,,,,,,,,,,,,,
102.100.100/138746,CSBAI,,5/11/2020,1:25:00,2020-11-05T01:25:00Z,,2,,2,2,,,16,,,,,,,,,,,,,,,,,,,,,,,,,
102.100.100/138745,CSBAI,,19/11/2020,0:36:00,2020-11-19T00:36:00Z,,2,,2,2,,,19.5,,,,,,,,,,,,,,,,,,,,,,,,,
102.100.100/138744,CSBAI,,19/11/2020,0:47:00,2020-11-19T00:47:00Z,,2,,2,2,,,19.5,,,,,,,,,,,,,,,,,,,,,,,,,
102.100.100/138743,CSBAI,,19/11/2020,0:54:00,2020-11-19T00:54:00Z,,2,,2,2,,,19.5,,,,,,,,,,,,,,,,,,,,,,,,,
102.100.100/138742,CSBAI,,3/12/2020,2:01:00,2020-12-03T02:01:00Z,,2,,2,2,,,18,,,,,,,,,,,,,,,,,,,,,,,,,
102.100.100/138741,CSBAI,,3/12/2020,2:10:00,2020-12-03T02:10:00Z,,2,,2,2,,,18,,,,,,,,,,,,,,,,,,,,,,,,,
102.100.100/138740,CSBAI,,3/12/2020,2:16:00,2020-12-03T02:16:00Z,,2,,2,2,,,18,,,,,,,,,,,,,,,,,,,,,,,,,
102.100.100/138739,CSBAI,,17/12/2020,0:19:00,2020-12-17T00:19:00Z,,2,,2,2,,,22,,,,,,,,,,,,,,,,,,,,,,,,,
102.100.100/138738,CSBAI,,17/12/2020,0:27:00,2020-12-17T00:27:00Z,,2,,2,2,,,22,,,,,,,,,,,,,,,,,,,,,,,,,
102.100.100/138737,CSBAI,,17/12/2020,0:34:00,2020-12-17T00:34:00Z,,2,,2,2,,,22,,,,,,,,,,,,,,,,,,,,,,,,,
102.100.100/138736,CSBAI,,31/12/2020,0:30:00,2020-12-31T00:30:00Z,,2,,2,2,,,22,,,,,,,,,,,,,,,,,,,,,,,,,
102.100.100/138735,CSBAI,,31/12/2020,0:55:00,2020-12-31T00:55:00Z,,2,,2,2,,,22,,,,,,,,,,,,,,,,,,,,,,,,,
102.100.100/138734,CSBAI,,31/12/2020,1:30:00,2020-12-31T01:30:00Z,,2,,2,2,,,22,,,,,,,,,,,,,,,,,,,,,,,,,
102.100.100/138733,CSBAI,,14/01/2021,0:14:00,2021-01-14T00:14:00Z,,2,,2,2,,,21,,,,,,,,,,,,,,,,,,,,,,,,,
102.100.100/138732,CSBAI,,14/01/2021,0:30:00,2021-01-14T00:30:00Z,,2,,2,2,,,21,,,,,,,,,,,,,,,,,,,,,,,,,
102.100.100/138731,CSBAI,,14/01/2021,0:44:00,2021-01-14T00:44:00Z,,2,,2,2,,,21,,,,,,,,,,,,,,,,,,,,,,,,,
102.100.100/138730,CSBAI,,28/01/2021,1:44:00,2021-01-28T01:44:00Z,,2,,2,2,,,20,,,,,,,,,,,,,,,,,,,,,,,,,
102.100.100/138729,CSBAI,,28/01/2021,1:59:00,2021-01-28T01:59:00Z,,2,,2,2,,,20,,,,,,,,,,,,,,,,,,,,,,,,,
102.100.100/138728,CSBAI,,28/01/2021,2:09:00,2021-01-28T02:09:00Z,,2,,2,2,,,20,,,,,,,,,,,,,,,,,,,,,,,,,
102.100.100/138727,CSBAI,,11/02/2021,0:28:00,2021-02-11T00:28:00Z,,2,,2,2,,,21,,,,,,,,,,,,,,,,,,,,,,,,,
102.100.100/138726,CSBAI,,11/02/2021,0:38:00,2021-02-11T00:38:00Z,,2,,2,2,,,21,,,,,,,,,,,,,,,,,,,,,,,,,
102.100.100/138725,CSBAI,,11/02/2021,0:47:00,2021-02-11T00:47:00Z,,2,,2,2,,,21,,,,,,,,,,,,,,,,,,,,,,,,,
102.100.100/138724,CSBAI,,25/02/2021,0:21:00,2021-02-25T00:21:00Z,,2,,2,2,,,22,,,,,,,,,,,,,,,,,,,,,,,,,
102.100.100/138723,CSBAI,,25/02/2021,0:35:00,2021-02-25T00:35:00Z,,2,,2,2,,,22,,,,,,,,,,,,,,,,,,,,,,,,,
102.100.100/138722,CSBAI,,25/02/2021,0:47:00,2021-02-25T00:47:00Z,,2,,2,2,,,22,,,,,,,,,,,,,,,,,,,,,,,,,
102.100.100/138721,CSBAI,,11/03/2021,0:49:00,2021-03-11T00:49:00Z,,2,,2,2,,,23.5,,,,,,,,,,,,,,,,,,,,,,,,,
102.100.100/138720,CSBAI,,11/03/2021,1:03:00,2021-03-11T01:03:00Z,,2,,2,2,,,23.5,,,,,,,,,,,,,,,,,,,,,,,,,
102.100.100/138719,CSBAI,,11/03/2021,1:15:00,2021-03-11T01:15:00Z,,2,,2,2,,,23.5,,,,,,,,,,,,,,,,,,,,,,,,,
102.100.100/138718,CSBAI,,25/03/2021,0:41:00,2021-03-25T00:41:00Z,,2,,0.8,0.8,High biomass/particulate matter,,24,,,,,,,,,,,,,,,,,,,,,,,,,
102.100.100/138717,CSBAI,,25/03/2021,0:46:00,2021-03-25T00:46:00Z,,2,,0.8,0.8,High biomass/particulate matter,,24,,,,,,,,,,,,,,,,,,,,,,,,,
102.100.100/138716,CSBAI,,25/03/2021,0:53:00,2021-03-25T00:53:00Z,,2,,0.8,0.8,High biomass/particulate matter,,24,,,,,,,,,,,,,,,,,,,,,,,,,
102.100.100/138715,CSBAI,,8/04/2021,0:27:00,2021-04-08T00:27:00Z,,2,,2,2,,,23.5,,,,,,,,,,,,,,,,,,,,,,,,,
102.100.100/138714,CSBAI,,8/04/2021,0:32:00,2021-04-08T00:32:00Z,,2,,2,2,,,23.5,,,,,,,,,,,,,,,,,,,,,,,,,
102.100.100/138713,CSBAI,,8/04/2021,0:35:00,2021-04-08T00:35:00Z,,2,,2,2,,,23.5,,,,,,,,,,,,,,,,,,,,,,,,,
102.100.100/138712,CSBAI,,22/04/2021,0:05:00,2021-04-22T00:05:00Z,,2,,2,2,,,18,,,,,,,,,,,,,,,,,,,,,,,,,
102.100.100/138711,CSBAI,,22/04/2021,0:09:00,2021-04-22T00:09:00Z,,2,,2,2,,,18,,,,,,,,,,,,,,,,,,,,,,,,,
102.100.100/138710,CSBAI,,22/04/2021,0:14:00,2021-04-22T00:14:00Z,,2,,2,2,,,18,,,,,,,,,,,,,,,,,,,,,,,,,
102.100.100/138709,CSBAI,,6/05/2021,0:15:00,2021-05-06T00:15:00Z,,2,,2,2,,,17.5,,,,,,,,,,,,,,,,,,,,,,,,,
102.100.100/138708,CSBAI,,6/05/2021,0:30:00,2021-05-06T00:30:00Z,,2,,2,2,,,17.5,,,,,,,,,,,,,,,,,,,,,,,,,
102.100.100/138707,CSBAI,,6/05/2021,0:39:00,2021-05-06T00:39:00Z,,2,,2,2,,,17.5,,,,,,,,,,,,,,,,,,,,,,,,,
102.100.100/138705,CSBAI,,20/05/2021,0:05:00,2021-05-20T00:05:00Z,,2,,2,2,,,19.5,,,,,,,,,,,,,,,,,,,,,,,,,
102.100.100/138704,CSBAI,,20/05/2021,0:10:00,2021-05-20T00:10:00Z,,2,,2,2,,,19.5,,,,,,,,,,,,,,,,,,,,,,,,,
102.100.100/138703,CSBAI,,20/05/2021,0:15:00,2021-05-20T00:15:00Z,,2,,2,2,,,19.5,,,,,,,,,,,,,,,,,,,,,,,,,
102.100.100/138702,CSBAI,,3/06/2021,0:15:00,2021-06-03T00:15:00Z,,2,,2,2,,,18,,,,,,,,,,,,,,,,,,,,,,,,,
102.100.100/138701,CSBAI,,3/06/2021,0:20:00,2021-06-03T00:20:00Z,,2,,2,2,,,18,,,,,,,,,,,,,,,,,,,,,,,,,
102.100.100/138700,CSBAI,,3/06/2021,0:30:00,2021-06-03T00:30:00Z,,2,,2,2,,,18,,,,,,,,,,,,,,,,,,,,,,,,,
102.100.100/142685,CSBAI,,17/06/2021,11:30:00,2021-06-17T11:30:00Z,,2,,2,2,,,,,,,,,,,,,,,,,,,,,,,,,,,,
102.100.100/142684,CSBAI,,17/06/2021,11:40:00,2021-06-17T11:40:00Z,,2,,2,2,,,,,,,,,,,,,,,,,,,,,,,,,,,,
102.100.100/142683,CSBAI,,17/06/2021,11:48:00,2021-06-17T11:48:00Z,,2,,2,2,,,,,,,,,,,,,,,,,,,,,,,,,,,,
102.100.100/142682,CSBAI,,1/07/2021,12:05:00,2021-07-01T12:05:00Z,,2,,2,2,,,,,,,,,,,,,,,,,,,,,,,,,,,,
102.100.100/142681,CSBAI,,1/07/2021,12:08:00,2021-07-01T12:08:00Z,,2,,2,2,,,,,,,,,,,,,,,,,,,,,,,,,,,,
102.100.100/142680,CSBAI,,1/07/2021,12:15:00,2021-07-01T12:15:00Z,,2,,2,2,,,,,,,,,,,,,,,,,,,,,,,,,,,,
102.100.100/142679,CSBAI,,29/07/2021,12:09:00,2021-07-29T12:09:00Z,nutrient sample compromised not analysed,2,,2,2,,,,,,,,,,,,,,,,,,,,,,,,,,,,
102.100.100/142678,CSBAI,,29/07/2021,12:14:00,2021-07-29T12:14:00Z,nutrient sample compromised not analysed,2,,2,2,,,,,,,,,,,,,,,,,,,,,,,,,,,,
102.100.100/142677,CSBAI,,29/07/2021,12:19:00,2021-07-29T12:19:00Z,,2,,2,2,,,,,,,,,,,,,,,,,,,,,,,,,,,,
102.100.100/142676,CSBAI,,12/08/2021,9:50:00,2021-08-12T09:50:00Z,nutrient sample compromised not analysed,2,,2,2,,,,,,,,,,,,,,,,,,,,,,,,,,,,
102.100.100/142675,CSBAI,,12/08/2021,10:00:00,2021-08-12T10:00:00Z,nutrient sample compromised not analysed,2,,2,2,,,,,,,,,,,,,,,,,,,,,,,,,,,,
102.100.100/142674,CSBAI,,12/08/2021,10:10:00,2021-08-12T10:10:00Z,nutrient sample compromised not analysed,2,,2,2,,,,,,,,,,,,,,,,,,,,,,,,,,,,
102.100.100/142673,CSBAI,,26/08/2021,9:05:00,2021-08-26T09:05:00Z,nutrient sample compromised not analysed,2,,2,2,,,,,,,,,,,,,,,,,,,,,,,,,,,,
102.100.100/142672,CSBAI,,26/08/2021,9:15:00,2021-08-26T09:15:00Z,,2,,2,2,,,,,,,,,,,,,,,,,,,,,,,,,,,,
102.100.100/142671,CSBAI,,26/08/2021,9:20:00,2021-08-26T09:20:00Z,nutrient sample compromised not analysed,2,,2,2,,,,,,,,,,,,,,,,,,,,,,,,,,,,
102.100.100/142670,CSBAI,,9/09/2021,10:00:00,2021-09-09T10:00:00Z,nutrient sample compromised not analysed,2,,2,2,,,,,,,,,,,,,,,,,,,,,,,,,,,,
102.100.100/142669,CSBAI,,9/09/2021,10:05:00,2021-09-09T10:05:00Z,nutrient sample compromised not analysed,2,,2,2,,,,,,,,,,,,,,,,,,,,,,,,,,,,
102.100.100/142668,CSBAI,,9/09/2021,10:10:00,2021-09-09T10:10:00Z,nutrient sample compromised not analysed,2,,2,2,,,,,,,,,,,,,,,,,,,,,,,,,,,,
102.100.100/142667,CSBAI,,22/09/2021,11:29:00,2021-09-22T11:29:00Z,,2,,2,2,,,,,,,,,,,,,,,,,,,,,,,,,,,,
102.100.100/142666,CSBAI,,22/09/2021,11:34:00,2021-09-22T11:34:00Z,,2,,2,2,,,,,,,,,,,,,,,,,,,,,,,,,,,,
102.100.100/142665,CSBAI,,22/09/2021,11:39:00,2021-09-22T11:39:00Z,,2,,2,2,,,,,,,,,,,,,,,,,,,,,,,,,,,,
102.100.100/142664,CSBAI,,7/10/2021,9:05:00,2021-10-07T09:05:00Z,nutrient sample compromised not analysed,2,,2,2,,,,,,,,,,,,,,,,,,,,,,,,,,,,
102.100.100/142663,CSBAI,,7/10/2021,9:15:00,2021-10-07T09:15:00Z,,2,,2,2,,,,,,,,,,,,,,,,,,,,,,,,,,,,
102.100.100/142662,CSBAI,,7/10/2021,9:20:00,2021-10-07T09:20:00Z,nutrient sample compromised not analysed,2,,2,2,,,,,,,,,,,,,,,,,,,,,,,,,,,,
102.100.100/142661,CSBAI,,21/10/2021,10:20:00,2021-10-21T10:20:00Z,nutrient sample compromised not analysed,2,,2,2,,,,,,,,,,,,,,,,,,,,,,,,,,,,
102.100.100/142660,CSBAI,,21/10/2021,10:25:00,2021-10-21T10:25:00Z,,2,,2,2,,,,,,,,,,,,,,,,,,,,,,,,,,,,
102.100.100/142659,CSBAI,,21/10/2021,10:30:00,2021-10-21T10:30:00Z,nutrient sample compromised not analysed,2,,2,2,,,,,,,,,,,,,,,,,,,,,,,,,,,,
102.100.100/142658,CSBAI,,4/11/2021,7:55:00,2021-11-04T07:55:00Z,nutrient sample compromised not analysed,2,,2,2,,,,,,,,,,,,,,,,,,,,,,,,,,,,
102.100.100/142657,CSBAI,,4/11/2021,8:00:00,2021-11-04T08:00:00Z,,2,,2,2,,,,,,,,,,,,,,,,,,,,,,,,,,,,
102.100.100/142656,CSBAI,,4/11/2021,8:05:00,2021-11-04T08:05:00Z,,2,,2,2,,,,,,,,,,,,,,,,,,,,,,,,,,,,
102.100.100/142655,CSBAI,,18/11/2021,9:20:00,2021-11-18T09:20:00Z,,2,,2,2,,,,,,,,,,,,,,,,,,,,,,,,,,,,
102.100.100/142654,CSBAI,,18/11/2021,9:26:00,2021-11-18T09:26:00Z,,2,,2,2,,,,,,,,,,,,,,,,,,,,,,,,,,,,
102.100.100/142653,CSBAI,,18/11/2021,9:33:00,2021-11-18T09:33:00Z,,2,,2,2,,,,,,,,,,,,,,,,,,,,,,,,,,,,
102.100.100/142652,CSBAI,,2/12/2021,8:40:00,2021-12-02T08:40:00Z,,2,,2,2,,,,,,,,,,,,,,,,,,,,,,,,,,,,
102.100.100/142651,CSBAI,,2/12/2021,8:47:00,2021-12-02T08:47:00Z,,2,,2,2,,,,,,,,,,,,,,,,,,,,,,,,,,,,
102.100.100/142650,CSBAI,,2/12/2021,8:54:00,2021-12-02T08:54:00Z,,2,,2,2,,,,,,,,,,,,,,,,,,,,,,,,,,,,
102.100.100/142649,CSBAI,,16/12/2021,10:20:00,2021-12-16T10:20:00Z,nutrient sample compromised not analysed,2,,2,2,,,,,,,,,,,,,,,,,,,,,,,,,,,,
102.100.100/142648,CSBAI,,16/12/2021,10:30:00,2021-12-16T10:30:00Z,,2,,2,2,,,,,,,,,,,,,,,,,,,,,,,,,,,,
102.100.100/142647,CSBAI,,16/12/2021,10:38:00,2021-12-16T10:38:00Z,,2,,2,2,,,,,,,,,,,,,,,,,,,,,,,,,,,,
102.100.100/142646,CSBAI,,28/12/2021,10:57:00,2021-12-28T10:57:00Z,,2,,2,2,,,,,,,,,,,,,,,,,,,,,,,,,,,,
102.100.100/142645,CSBAI,,28/12/2021,11:03:00,2021-12-28T11:03:00Z,,2,,2,2,,,,,,,,,,,,,,,,,,,,,,,,,,,,
102.100.100/142644,CSBAI,,28/12/2021,11:08:00,2021-12-28T11:08:00Z,,2,,2,2,,,,,,,,,,,,,,,,,,,,,,,,,,,,
102.100.100/142643,CSBAI,,13/01/2022,8:00:00,2022-01-13T08:00:00Z,,2,,2,2,,,,,,,,,,,,,,,,,,,,,,,,,,,,
102.100.100/142642,CSBAI,,13/01/2022,8:10:00,2022-01-13T08:10:00Z,,2,,2,2,,,,,,,,,,,,,,,,,,,,,,,,,,,,
102.100.100/142641,CSBAI,,13/01/2022,8:20:00,2022-01-13T08:20:00Z,,2,,2,2,,,,,,,,,,,,,,,,,,,,,,,,,,,,
102.100.100/142640,CSBAI,,27/01/2022,9:06:00,2022-01-27T09:06:00Z,,2,,2,2,,,,,,,,,,,,,,,,,,,,,,,,,,,,
102.100.100/142639,CSBAI,,27/01/2022,9:11:00,2022-01-27T09:11:00Z,,2,,2,2,,,,,,,,,,,,,,,,,,,,,,,,,,,,
102.100.100/142638,CSBAI,,27/01/2022,9:18:00,2022-01-27T09:18:00Z,,2,,2,2,,,,,,,,,,,,,,,,,,,,,,,,,,,,
102.100.100/142637,CSBAI,,10/02/2022,10:45:00,2022-02-10T10:45:00Z,,2,,2,2,,,,,,,,,,,,,,,,,,,,,,,,,,,,
102.100.100/142636,CSBAI,,10/02/2022,10:50:00,2022-02-10T10:50:00Z,,2,,2,2,,,,,,,,,,,,,,,,,,,,,,,,,,,,
102.100.100/142635,CSBAI,,10/02/2022,10:55:00,2022-02-10T10:55:00Z,,2,,2,2,,,,,,,,,,,,,,,,,,,,,,,,,,,,
102.100.100/142634,CSBAI,,24/02/2022,11:33:00,2022-02-24T11:33:00Z,,2,,2,2,,,,,,,,,,,,,,,,,,,,,,,,,,,,
102.100.100/142633,CSBAI,,24/02/2022,11:42:00,2022-02-24T11:42:00Z,,2,,2,2,,,,,,,,,,,,,,,,,,,,,,,,,,,,
102.100.100/142632,CSBAI,,24/02/2022,11:47:00,2022-02-24T11:47:00Z,,2,,2,2,,,,,,,,,,,,,,,,,,,,,,,,,,,,
102.100.100/142631,CSBAI,,24/03/2022,9:05:00,2022-03-24T09:05:00Z,,2,,2,2,,,,,105,1.95,,,,,,,,,,,,,,,,,,,,,,
102.100.100/142630,CSBAI,,24/03/2022,9:10:00,2022-03-24T09:10:00Z,,2,,2,2,,,,,153.4,1.93,,,,,,,,,,,,,,,,,,,,,,
102.100.100/142629,CSBAI,,24/03/2022,9:15:00,2022-03-24T09:15:00Z,,2,,2,2,,,,,102.3,1.92,,,,,,,,,,,,,,,,,,,,,,
102.100.100/142628,CSBAI,,8/04/2022,10:00:00,2022-04-08T10:00:00Z,,2,,0.6,0.6,High biomass/particulate matter,,,,36.96,1.91,,,,,,,,,,,,,,,,,,,,,,
102.100.100/142627,CSBAI,,8/04/2022,10:10:00,2022-04-08T10:10:00Z,,2,,0.6,0.6,High biomass/particulate matter,,,,41.92,1.86,,,,,,,,,,,,,,,,,,,,,,
102.100.100/142626,CSBAI,,8/04/2022,10:20:00,2022-04-08T10:20:00Z,,2,,0.6,0.6,High biomass/particulate matter,,,,34.2,1.87,,,,,,,,,,,,,,,,,,,,,,
102.100.100/142625,CSBAI,,21/04/2022,8:20:00,2022-04-21T08:20:00Z,,2,,2,2,,,,,86.06,1.99,,,,,,,,,,,,,,,,,,,,,,
102.100.100/142624,CSBAI,,21/04/2022,8:25:00,2022-04-21T08:25:00Z,,2,,2,2,,,,,80.46,1.91,,,,,,,,,,,,,,,,,,,,,,
102.100.100/142623,CSBAI,,21/04/2022,8:30:00,2022-04-21T08:30:00Z,,2,,2,2,,,,,74.8,1.91,,,,,,,,,,,,,,,,,,,,,,
102.100.100/142622,CSBAI,,5/05/2022,9:35:00,2022-05-05T09:35:00Z,,2,,2,2,,,,,91.65,1.94,,,,,,,,,,,,,,,,,,,,,,
102.100.100/142621,CSBAI,,5/05/2022,9:40:00,2022-05-05T09:40:00Z,,2,,2,2,,,,,104.8,1.96,,,,,,,,,,,,,,,,,,,,,,
102.100.100/142620,CSBAI,,5/05/2022,9:45:00,2022-05-05T09:45:00Z,,2,,2,2,,,,,101.3,1.88,,,,,,,,,,,,,,,,,,,,,,
102.100.100/142619,CSBAI,,19/05/2022,10:50:00,2022-05-19T10:50:00Z,,2,,2,2,,,,,22.54,1.98,,,,,,,,,,,,,,,,,,,,,,
102.100.100/142618,CSBAI,,19/05/2022,10:55:00,2022-05-19T10:55:00Z,,2,,2,2,,,,,38.95,1.88,,,,,,,,,,,,,,,,,,,,,,
102.100.100/142617,CSBAI,,19/05/2022,11:02:00,2022-05-19T11:02:00Z,,2,,2,2,,,,,29.79,2.14,,,,,,,,,,,,,,,,,,,,,,
102.100.100/142616,CSBAI,,2/06/2022,10:48:00,2022-06-02T10:48:00Z,,2,,2,2,,,,,6.65,,,,,,,,,,,,,,,,,,,,,,,
102.100.100/142615,CSBAI,,2/06/2022,10:54:00,2022-06-02T10:54:00Z,,2,,2,2,,,,,9.92,,,,,,,,,,,,,,,,,,,,,,,
102.100.100/142614,CSBAI,,2/06/2022,10:59:00,2022-06-02T10:59:00Z,,2,,2,2,,,,,14.9,,,,,,,,,,,,,,,,,,,,,,,
102.100.100/142613,CSBAI,,16/06/2022,2:50:00,2022-06-16T02:50:00Z,,2,,2,2,,,,,6.12,,,,,,,,,,,,,,,,,,,,,,,
102.100.100/142612,CSBAI,,16/06/2022,2:56:00,2022-06-16T02:56:00Z,,2,,2,2,,,,,7.16,,,,,,,,,,,,,,,,,,,,,,,
102.100.100/142611,CSBAI,,16/06/2022,3:00:00,2022-06-16T03:00:00Z,,2,,2,2,,,,,8.34,,,,,,,,,,,,,,,,,,,,,,,
102.100.100/142608,CSBAI,,30/06/2022,1:00:00,2022-06-30T01:00:00Z,,2,,2,2,,,,,8.17,,,,,,,,,,,,,,,,,,,,,,,
102.100.100/142609,CSBAI,,30/06/2022,1:10:00,2022-06-30T01:10:00Z,,2,,2,2,,,,,12.2,,,,,,,,,,,,,,,,,,,,,,,
102.100.100/142610,CSBAI,,30/06/2022,1:15:00,2022-06-30T01:15:00Z,,2,,2,2,,,,,9.04,,,,,,,,,,,,,,,,,,,,,,,
102.100.100/402376,CSBAI,,14/07/2022,1:30:00,2022-07-14T01:30:00Z,,2,,2,2,,,,,10.3,,,,,,,,,,,,,,,,,,,,,,,
102.100.100/402375,CSBAI,,14/07/2022,1:35:00,2022-07-14T01:35:00Z,,2,,2,2,,,,,18.6,,,,,,,,,,,,,,,,,,,,,,,
102.100.100/402374,CSBAI,,14/07/2022,1:40:00,2022-07-14T01:40:00Z,,2,,2,2,,,,,18.5,,,,,,,,,,,,,,,,,,,,,,,
102.100.100/402373,CSBAI,,28/07/2022,23:30:00,2022-07-28T23:30:00Z,,2,,2,2,,,,,9.41,,,,,,,,,,,,,,,,,,,,,,,
102.100.100/402372,CSBAI,,28/07/2022,23:35:00,2022-07-28T23:35:00Z,,2,,2,2,,,,,6.69,,,,,,,,,,,,,,,,,,,,,,,
102.100.100/402371,CSBAI,,28/07/2022,23:40:00,2022-07-28T23:40:00Z,,2,,2,2,,,,,13.4,,,,,,,,,,,,,,,,,,,,,,,
102.100.100/402368,CSBAI,,11/08/2022,2:15:00,2022-08-11T02:15:00Z,,2,,2,2,,,,,24.7,,,,,,,,,,,,,,,,,,,,,,,
102.100.100/402369,CSBAI,,11/08/2022,2:20:00,2022-08-11T02:20:00Z,,2,,2,2,,,,,30.3,,,,,,,,,,,,,,,,,,,,,,,
102.100.100/402370,CSBAI,,11/08/2022,2:25:00,2022-08-11T02:25:00Z,,2,,2,2,,,,,20.2,,,,,,,,,,,,,,,,,,,,,,,
102.100.100/402367,CSBAI,,25/08/2022,1:01:00,2022-08-25T01:01:00Z,,2,,2,2,,,,,15.8,,,,,,,,,,,,,,,,,,,,,,,
102.100.100/402365,CSBAI,,25/08/2022,12:57:00,2022-08-25T12:57:00Z,,2,,2,2,,,,,28,,,,,,,,,,,,,,,,,,,,,,,
102.100.100/402366,CSBAI,,25/08/2022,12:59:00,2022-08-25T12:59:00Z,,2,,2,2,,,,,15.2,,,,,,,,,,,,,,,,,,,,,,,
102.100.100/402364,CSBAI,,8/09/2022,23:43:00,2022-09-08T23:43:00Z,,2,,2,2,,,,,18.1,,,,,,,,,,,,,,,,,,,,,,,
102.100.100/402363,CSBAI,,8/09/2022,23:48:00,2022-09-08T23:48:00Z,,2,,2,2,,,,,,,,,,,,,,,,,,,,,,,,,,,,
102.100.100/402362,CSBAI,,8/09/2022,23:53:00,2022-09-08T23:53:00Z,,2,,2,2,,,,,28.5,,,,,,,,,,,,,,,,,,,,,,,
102.100.100/402361,CSBAI,,21/09/2022,22:30:00,2022-09-21T22:30:00Z,,2,,2,2,,,,,47.5,,,,,,,,,,,,,,,,,,,,,,,
102.100.100/402360,CSBAI,,21/09/2022,22:35:00,2022-09-21T22:35:00Z,,2,,2,2,,,,,50.4,,,,,,,,,,,,,,,,,,,,,,,
102.100.100/402359,CSBAI,,21/09/2022,22:40:00,2022-09-21T22:40:00Z,,2,,2,2,,,,,27.5,,,,,,,,,,,,,,,,,,,,,,,
102.100.100/402356,CSBAI,,6/10/2022,1:50:00,2022-10-06T01:50:00Z,,2,,2,2,,,,,39,,,,,,,,,,,,,,,,,,,,,,,
102.100.100/402357,CSBAI,,6/10/2022,1:55:00,2022-10-06T01:55:00Z,,2,,2,2,,,,,15.3,,,,,,,,,,,,,,,,,,,,,,,
102.100.100/402358,CSBAI,,6/10/2022,2:00:00,2022-10-06T02:00:00Z,,2,,2,2,,,,,29.7,,,,,,,,,,,,,,,,,,,,,,,
102.100.100/402353,CSBAI,,20/10/2022,21:10:00,2022-10-20T21:10:00Z,,2,,2,2,,,,,41.3,,,,,,,,,,,,,,,,,,,,,,,
102.100.100/402354,CSBAI,,20/10/2022,21:12:00,2022-10-20T21:12:00Z,,2,,2,2,,,,,,,,,,,,,,,,,,,,,,,,,,,,
102.100.100/402355,CSBAI,,20/10/2022,21:15:00,2022-10-20T21:15:00Z,,2,,2,2,,,,,,,,,,,,,,,,,,,,,,,,,,,,
102.100.100/402350,CSBAI,,3/11/2022,21:20:00,2022-11-03T21:20:00Z,,2,,2,2,,,,,40.9,,,,,,,,,,,,,,,,,,,,,,,
102.100.100/402351,CSBAI,,3/11/2022,21:25:00,2022-11-03T21:25:00Z,,2,,2,2,,,,,,,,,,,,,,,,,,,,,,,,,,,,
102.100.100/402352,CSBAI,,3/11/2022,21:30:00,2022-11-03T21:30:00Z,,2,,2,2,,,,,62.3,,,,,,,,,,,,,,,,,,,,,,,
102.100.100/402349,CSBAI,,17/11/2022,20:00:00,2022-11-17T20:00:00Z,,2,,2,2,,,,,56.7,,,,,,,,,,,,,,,,,,,,,,,
102.100.100/402348,CSBAI,,17/11/2022,20:03:00,2022-11-17T20:03:00Z,,2,,2,2,,,,,49.3,,,,,,,,,,,,,,,,,,,,,,,
102.100.100/402347,CSBAI,,17/11/2022,20:06:00,2022-11-17T20:06:00Z,,2,,2,2,,,,,,,,,,,,,,,,,,,,,,,,,,,,
102.100.100/402346,CSBAI,,1/12/2022,21:05:00,2022-12-01T21:05:00Z,,2,,2,2,,,,,42.3,,,,,,,,,,,,,,,,,,,,,,,
102.100.100/402345,CSBAI,,1/12/2022,21:07:00,2022-12-01T21:07:00Z,,2,,2,2,,,,,38.2,,,,,,,,,,,,,,,,,,,,,,,
102.100.100/402344,CSBAI,,1/12/2022,21:10:00,2022-12-01T21:10:00Z,,2,,2,2,,,,,37.1,,,,,,,,,,,,,,,,,,,,,,,
102.100.100/402343,CSBAI,,15/12/2022,21:45:00,2022-12-15T21:45:00Z,,2,,2,2,,,,,40,,,,,,,,,,,,,,,,,,,,,,,
102.100.100/402342,CSBAI,,15/12/2022,21:50:00,2022-12-15T21:50:00Z,,2,,2,2,,,,,23.1,,,,,,,,,,,,,,,,,,,,,,,
102.100.100/402341,CSBAI,,15/12/2022,21:55:00,2022-12-15T21:55:00Z,,2,,2,2,,,,,44.6,,,,,,,,,,,,,,,,,,,,,,,
102.100.100/402340,CSBAI,,28/12/2022,22:50:00,2022-12-28T22:50:00Z,,2,,2,2,,,,,25.9,,,,,,,,,,,,,,,,,,,,,,,
102.100.100/402339,CSBAI,,28/12/2022,22:55:00,2022-12-28T22:55:00Z,,2,,2,2,,,,,28.3,,,,,,,,,,,,,,,,,,,,,,,
102.100.100/402338,CSBAI,,28/12/2022,22:59:00,2022-12-28T22:59:00Z,,2,,2,2,,,,,37.6,,,,,,,,,,,,,,,,,,,,,,,
102.100.100/402337,CSBAI,,11/01/2023,23:15:00,2023-01-11T23:15:00Z,,2,,2,2,,,,,16.1,,,,,,,,,,,,,,,,,,,,,,,
102.100.100/402336,CSBAI,,11/01/2023,23:19:00,2023-01-11T23:19:00Z,,2,,2,2,,,,,30.5,,,,,,,,,,,,,,,,,,,,,,,
102.100.100/402335,CSBAI,,11/01/2023,23:25:00,2023-01-11T23:25:00Z,,2,,2,2,,,,,20,,,,,,,,,,,,,,,,,,,,,,,
102.100.100/402329,CSBAI,,9/02/2023,20:59:00,2023-02-09T20:59:00Z,,2,,2,2,,,,,12.8,,,,,,,,,,,,,,,,,,,,,,,
102.100.100/402330,CSBAI,,9/02/2023,21:02:00,2023-02-09T21:02:00Z,,2,,2,2,,,,,21.5,,,,,,,,,,,,,,,,,,,,,,,
102.100.100/402331,CSBAI,,9/02/2023,21:05:00,2023-02-09T21:05:00Z,,2,,2,2,,,,,11.8,,,,,,,,,,,,,,,,,,,,,,,
102.100.100/402323,CSBAI,,9/03/2023,22:23:00,2023-03-09T22:23:00Z,,2,,2,2,,,,,34.1,,,,,,,,,,,,,,,,,,,,,,,
102.100.100/402324,CSBAI,,9/03/2023,22:26:00,2023-03-09T22:26:00Z,,2,,2,2,,,,,14.4,,,,,,,,,,,,,,,,,,,,,,,
102.100.100/402325,CSBAI,,9/03/2023,22:28:00,2023-03-09T22:28:00Z,,2,,2,2,,,,,23.5,,,,,,,,,,,,,,,,,,,,,,,
102.100.100/402328,CSBAI,,22/03/2023,23:15:00,2023-03-22T23:15:00Z,,2,,2,2,,,,,22.6,,,,,,,,,,,,,,,,,,,,,,,
102.100.100/402327,CSBAI,,22/03/2023,23:19:00,2023-03-22T23:19:00Z,,2,,2,2,,,,,16.1,,,,,,,,,,,,,,,,,,,,,,,
102.100.100/402326,CSBAI,,22/03/2023,23:24:00,2023-03-22T23:24:00Z,,2,,2,2,,,,,14.2,,,,,,,,,,,,,,,,,,,,,,,
102.100.100/402320,CSBAI,,23/03/2023,20:09:00,2023-03-23T20:09:00Z,,2,,2,2,,,,,7.45,,,,,,,,,,,,,,,,,,,,,,,
102.100.100/402321,CSBAI,,23/03/2023,20:12:00,2023-03-23T20:12:00Z,,2,,2,2,,,,,10.9,,,,,,,,,,,,,,,,,,,,,,,
102.100.100/402322,CSBAI,,23/03/2023,20:15:00,2023-03-23T20:15:00Z,,2,,2,2,,,,,22.2,,,,,,,,,,,,,,,,,,,,,,,
102.100.100/402317,CSBAI,,6/04/2023,20:04:00,2023-04-06T20:04:00Z,,2,,2,2,,,,,15.1,,,,,,,,,,,,,,,,,,,,,,,
102.100.100/402318,CSBAI,,6/04/2023,20:08:00,2023-04-06T20:08:00Z,,2,,2,2,,,,,14,,,,,,,,,,,,,,,,,,,,,,,
102.100.100/402319,CSBAI,,6/04/2023,20:11:00,2023-04-06T20:11:00Z,,2,,2,2,,,,,11.7,,,,,,,,,,,,,,,,,,,,,,,
102.100.100/402314,CSBAI,,20/04/2023,20:08:00,2023-04-20T20:08:00Z,no flow cytometry data - sample compromised,2,,2,,,,,,,,,,,,,,,,,,,,,,,,,,,,,
102.100.100/402315,CSBAI,,20/04/2023,20:08:00,2023-04-20T20:08:00Z,,2,,2,2,,,,,9.61,,,,,,,,,,,,,,,,,,,,,,,
102.100.100/402316,CSBAI,,20/04/2023,20:11:00,2023-04-20T20:11:00Z,,2,,2,2,,,,,11.4,,,,,,,,,,,,,,,,,,,,,,,
102.100.100/402311,CSBAI,,4/05/2023,0:04:00,2023-05-04T00:04:00Z,,2,,2,2,,,,,5.15,,,,,,,,,,,,,,,,,,,,,,,
102.100.100/402312,CSBAI,,4/05/2023,0:09:00,2023-05-04T00:09:00Z,,2,,2,2,,,,,4.79,,,,,,,,,,,,,,,,,,,,,,,
102.100.100/402313,CSBAI,,4/05/2023,0:14:00,2023-05-04T00:14:00Z,,2,,2,2,,,,,4.99,,,,,,,,,,,,,,,,,,,,,,,
102.100.100/402308,CSBAI,,18/05/2023,0:10:00,2023-05-18T00:10:00Z,,2,,2,2,,,,,13.2,,,,,,,,,,,,,,,,,,,,,,,
102.100.100/402309,CSBAI,,18/05/2023,0:15:00,2023-05-18T00:15:00Z,,2,,2,2,,,,,15.3,,,,,,,,,,,,,,,,,,,,,,,
102.100.100/402310,CSBAI,,18/05/2023,0:20:00,2023-05-18T00:20:00Z,,2,,2,2,,,,,13.5,,,,,,,,,,,,,,,,,,,,,,,
102.100.100/402305,CSBAI,,1/06/2023,21:03:00,2023-06-01T21:03:00Z,,2,,2,2,,,,,8.69,,,,,,,,,,,,,,,,,,,,,,,
102.100.100/402306,CSBAI,,1/06/2023,21:08:00,2023-06-01T21:08:00Z,,2,,2,2,,,,,5.99,,,,,,,,,,,,,,,,,,,,,,,
102.100.100/402307,CSBAI,,1/06/2023,21:13:00,2023-06-01T21:13:00Z,,2,,2,2,,,,,10,,,,,,,,,,,,,,,,,,,,,,,
102.100.100/402304,CSBAI,,15/06/2023,23:03:00,2023-06-15T23:03:00Z,,2,,2,2,,,,,4.12,,,,,,,,,,,,,,,,,,,,,,,
102.100.100/402303,CSBAI,,15/06/2023,23:08:00,2023-06-15T23:08:00Z,,2,,2,2,,,,,8.07,,,,,,,,,,,,,,,,,,,,,,,
102.100.100/402302,CSBAI,,15/06/2023,23:13:00,2023-06-15T23:13:00Z,,2,,2,2,,,,,6.61,,,,,,,,,,,,,,,,,,,,,,,
102.100.100/402301,CSBAI,,29/06/2023,19:03:00,2023-06-29T19:03:00Z,,2,,2,2,,,,,5.46,,,,,,,,,,,,,,,,,,,,,,,
102.100.100/402300,CSBAI,,29/06/2023,19:08:00,2023-06-29T19:08:00Z,,2,,2,2,,,,,7.23,,,,,,,,,,,,,,,,,,,,,,,
102.100.100/402299,CSBAI,,29/06/2023,19:13:00,2023-06-29T19:13:00Z,,2,,2,2,,,,,2.14,,,,,,,,,,,,,,,,,,,,,,,
102.100.100/403396,CSBAI,,13/07/2023,21:40:00,2023-07-13T21:40:00Z,,2,,2,2,,,,,5.26,,,,,,,,,,,,,,,,,,,,,,,
102.100.100/403395,CSBAI,,13/07/2023,21:45:00,2023-07-13T21:45:00Z,,2,,2,2,,,,,5.86,,,,,,,,,,,,,,,,,,,,,,,
102.100.100/403394,CSBAI,,13/07/2023,21:50:00,2023-07-13T21:50:00Z,,2,,2,2,,,,,6.46,,,,,,,,,,,,,,,,,,,,,,,
102.100.100/403391,CSBAI,,27/07/2023,21:10:00,2023-07-27T21:10:00Z,,2,,2,2,,,,,14.2,,,,,,,,,,,,,,,,,,,,,,,
102.100.100/403392,CSBAI,,27/07/2023,21:15:00,2023-07-27T21:15:00Z,,2,,2,2,,,,,14,,,,,,,,,,,,,,,,,,,,,,,
102.100.100/403393,CSBAI,,27/07/2023,21:20:00,2023-07-27T21:20:00Z,,2,,2,2,,,,,14.4,,,,,,,,,,,,,,,,,,,,,,,
102.100.100/403388,CSBAI,,10/08/2023,20:40:00,2023-08-10T20:40:00Z,,2,,2,2,,,,,10.3,,,,,,,,,,,,,,,,,,,,,,,
102.100.100/403389,CSBAI,,10/08/2023,20:45:00,2023-08-10T20:45:00Z,,2,,2,2,,,,,5.39,,,,,,,,,,,,,,,,,,,,,,,
102.100.100/403390,CSBAI,,10/08/2023,20:50:00,2023-08-10T20:50:00Z,,2,,2,2,,,,,5.6,,,,,,,,,,,,,,,,,,,,,,,
102.100.100/403385,CSBAI,,24/08/2023,23:45:00,2023-08-24T23:45:00Z,,2,,2,2,,,,,42.5,,,,,,,,,,,,,,,,,,,,,,,
102.100.100/403386,CSBAI,,24/08/2023,23:50:00,2023-08-24T23:50:00Z,,2,,2,2,,,,,8.87,,,,,,,,,,,,,,,,,,,,,,,
102.100.100/403387,CSBAI,,24/08/2023,23:55:00,2023-08-24T23:55:00Z,,2,,2,2,,,,,45.6,,,,,,,,,,,,,,,,,,,,,,,
102.100.100/403382,CSBAI,,7/09/2023,21:10:00,2023-09-07T21:10:00Z,,2,,2,2,,,,,4.61,,,,,,,,,,,,,,,,,,,,,,,
102.100.100/403383,CSBAI,,7/09/2023,21:15:00,2023-09-07T21:15:00Z,,2,,2,2,,,,,8.48,,,,,,,,,,,,,,,,,,,,,,,
102.100.100/403384,CSBAI,,7/09/2023,21:20:00,2023-09-07T21:20:00Z,,2,,2,2,,,,,7.91,,,,,,,,,,,,,,,,,,,,,,,
102.100.100/403379,CSBAI,,21/09/2023,20:35:00,2023-09-21T20:35:00Z,,2,,2,2,,,,,12.8,,,,,,,,,,,,,,,,,,,,,,,
102.100.100/403380,CSBAI,,21/09/2023,20:40:00,2023-09-21T20:40:00Z,,2,,2,2,,,,,0.105,,,,,,,,,,,,,,,,,,,,,,,
102.100.100/403381,CSBAI,,21/09/2023,20:45:00,2023-09-21T20:45:00Z,,2,,2,2,,,,,7.71,,,,,,,,,,,,,,,,,,,,,,,
102.100.100/403466,CSBAI,,5/10/2023,21:00:00,2023-10-05T21:00:00Z,,2,,2,2,,,,,10.2,,,,,,,,,,,,,,,,,,,,,,,
102.100.100/403467,CSBAI,,5/10/2023,21:10:00,2023-10-05T21:10:00Z,,2,,2,2,,,,,18.7,,,,,,,,,,,,,,,,,,,,,,,
102.100.100/403468,CSBAI,,5/10/2023,21:15:00,2023-10-05T21:15:00Z,,2,,2,2,,,,,21.7,,,,,,,,,,,,,,,,,,,,,,,
102.100.100/403465,CSBAI,,19/10/2023,20:50:00,2023-10-19T20:50:00Z,,2,,2,2,,,,,5.58,,,,,,,,,,,,,,,,,,,,,,,
102.100.100/403464,CSBAI,,19/10/2023,20:55:00,2023-10-19T20:55:00Z,,2,,2,2,,,,,4.38,,,,,,,,,,,,,,,,,,,,,,,
102.100.100/403463,CSBAI,,19/10/2023,21:00:00,2023-10-19T21:00:00Z,,2,,2,2,,,,,4.4,,,,,,,,,,,,,,,,,,,,,,,
102.100.100/403462,CSBAI,,2/11/2023,20:54:00,2023-11-02T20:54:00Z,,2,,2,2,,,,,12,,,,,,,,,,,,,,,,,,,,,,,
102.100.100/403461,CSBAI,,2/11/2023,21:00:00,2023-11-02T21:00:00Z,,2,,2,2,,,,,12.3,,,,,,,,,,,,,,,,,,,,,,,
102.100.100/403460,CSBAI,,2/11/2023,21:05:00,2023-11-02T21:05:00Z,,2,,2,2,,,,,13.2,,,,,,,,,,,,,,,,,,,,,,,
102.100.100/403459,CSBAI,,16/11/2023,20:05:00,2023-11-16T20:05:00Z,,2,,2,2,,,,,14.9,,,,,,,,,,,,,,,,,,,,,,,
102.100.100/403458,CSBAI,,16/11/2023,20:10:00,2023-11-16T20:10:00Z,,2,,2,2,,,,,0.0288,,,,,,,,,,,,,,,,,,,,,,,
102.100.100/403457,CSBAI,,16/11/2023,20:15:00,2023-11-16T20:15:00Z,,2,,2,2,,,,,0.0248,,,,,,,,,,,,,,,,,,,,,,,
102.100.100/403456,CSBAI,,30/11/2023,23:00:00,2023-11-30T23:00:00Z,,2,,2,2,,,,,19.4,,,,,,,,,,,,,,,,,,,,,,,
102.100.100/403455,CSBAI,,30/11/2023,23:10:00,2023-11-30T23:10:00Z,,2,,2,2,,,,,15.6,,,,,,,,,,,,,,,,,,,,,,,
102.100.100/403454,CSBAI,,30/11/2023,23:15:00,2023-11-30T23:15:00Z,,2,,2,2,,,,,20.6,,,,,,,,,,,,,,,,,,,,,,,
102.100.100/403453,CSBAI,,14/12/2023,22:10:00,2023-12-14T22:10:00Z,,2,,2,2,,,,,26.9,,,,,,,,,,,,,,,,,,,,,,,
102.100.100/403452,CSBAI,,14/12/2023,22:15:00,2023-12-14T22:15:00Z,,2,,2,2,,,,,13.7,,,,,,,,,,,,,,,,,,,,,,,
102.100.100/403451,CSBAI,,14/12/2023,22:20:00,2023-12-14T22:20:00Z,,2,,2,2,,,,,21.7,,,,,,,,,,,,,,,,,,,,,,,
102.100.100/403450,CSBAI,,28/12/2023,1:20:00,2023-12-28T01:20:00Z,,2,,2,2,,,,,20.7,,,,,,,,,,,,,,,,,,,,,,,
102.100.100/403449,CSBAI,,28/12/2023,1:25:00,2023-12-28T01:25:00Z,,2,,2,2,,,,,10.2,,,,,,,,,,,,,,,,,,,,,,,
102.100.100/403448,CSBAI,,28/12/2023,1:30:00,2023-12-28T01:30:00Z,,2,,2,2,,,,,34,,,,,,,,,,,,,,,,,,,,,,,
102.100.100/403558,CSBAI,,10/01/2024,23:11:00,2024-01-10T23:11:00Z,,2,,2,2,,,,,17.9,,,,,,,,,,,,,,,,,,,,,,,
102.100.100/403557,CSBAI,,10/01/2024,23:17:00,2024-01-10T23:17:00Z,,2,,2,2,,,,,11.5,,,,,,,,,,,,,,,,,,,,,,,
102.100.100/403556,CSBAI,,10/01/2024,23:23:00,2024-01-10T23:23:00Z,,2,,2,2,,,,,18.9,,,,,,,,,,,,,,,,,,,,,,,
102.100.100/403555,CSBAI,,24/01/2024,23:45:00,2024-01-24T23:45:00Z,,2,,2,2,,,,,10.9,,,,,,,,,,,,,,,,,,,,,,,
102.100.100/403554,CSBAI,,24/01/2024,23:51:00,2024-01-24T23:51:00Z,,2,,2,2,,,,,20.2,,,,,,,,,,,,,,,,,,,,,,,
102.100.100/403553,CSBAI,,24/01/2024,23:56:00,2024-01-24T23:56:00Z,,2,,2,2,,,,,21.4,,,,,,,,,,,,,,,,,,,,,,,
102.100.100/403552,CSBAI,,8/02/2024,22:05:00,2024-02-08T22:05:00Z,,2,,2,2,,,,,23.6,,,,,,,,,,,,,,,,,,,,,,,
102.100.100/403551,CSBAI,,8/02/2024,22:10:00,2024-02-08T22:10:00Z,,2,,2,2,,,,,27.4,,,,,,,,,,,,,,,,,,,,,,,
102.100.100/403550,CSBAI,,8/02/2024,22:15:00,2024-02-08T22:15:00Z,,2,,2,2,,,,,12.5,,,,,,,,,,,,,,,,,,,,,,,
102.100.100/403549,CSBAI,,23/02/2024,21:10:00,2024-02-23T21:10:00Z,,2,,2,2,,,,,23.1,,,,,,,,,,,,,,,,,,,,,,,
102.100.100/403548,CSBAI,,23/02/2024,21:15:00,2024-02-23T21:15:00Z,,2,,2,2,,,,,27.1,,,,,,,,,,,,,,,,,,,,,,,
102.100.100/403547,CSBAI,,23/02/2024,21:20:00,2024-02-23T21:20:00Z,,2,,2,2,,,,,21.1,,,,,,,,,,,,,,,,,,,,,,,
102.100.100/403546,CSBAI,,7/03/2024,22:20:00,2024-03-07T22:20:00Z,,2,,2,2,,,,,15.8,,,,,,,,,,,,,,,,,,,,,,,
102.100.100/403545,CSBAI,,7/03/2024,22:25:00,2024-03-07T22:25:00Z,,2,,2,2,,,,,11.5,,,,,,,,,,,,,,,,,,,,,,,
102.100.100/403544,CSBAI,,7/03/2024,22:30:00,2024-03-07T22:30:00Z,,2,,2,2,,,,,8.95,,,,,,,,,,,,,,,,,,,,,,,
102.100.100/403543,CSBAI,,21/03/2024,22:10:00,2024-03-21T22:10:00Z,,2,,2,2,,,,,5.17,,,,,,,,,,,,,,,,,,,,,,,
102.100.100/403542,CSBAI,,21/03/2024,22:15:00,2024-03-21T22:15:00Z,,2,,2,2,,,,,7.21,,,,,,,,,,,,,,,,,,,,,,,
102.100.100/403541,CSBAI,,21/03/2024,22:20:00,2024-03-21T22:20:00Z,,2,,2,2,,,,,2.41,,,,,,,,,,,,,,,,,,,,,,,
102.100.100/403540,CSBAI,,3/04/2024,4:00:00,2024-04-03T04:00:00Z,,2,,2,2,,,,,7.8,,,,,,,,,,,,,,,,,,,,,,,
102.100.100/403539,CSBAI,,3/04/2024,4:05:00,2024-04-03T04:05:00Z,,2,,2,2,,,,,8.56,,,,,,,,,,,,,,,,,,,,,,,
102.100.100/403538,CSBAI,,3/04/2024,4:10:00,2024-04-03T04:10:00Z,,2,,2,2,,,,,5.18,,,,,,,,,,,,,,,,,,,,,,,
102.100.100/403537,CSBAI,,18/04/2024,3:15:00,2024-04-18T03:15:00Z,,2,,2,2,,,,,11.6,,,,,,,,,,,,,,,,,,,,,,,
102.100.100/403536,CSBAI,,18/04/2024,3:20:00,2024-04-18T03:20:00Z,,2,,2,2,,,,,12.2,,,,,,,,,,,,,,,,,,,,,,,
102.100.100/403535,CSBAI,,18/04/2024,3:25:00,2024-04-18T03:25:00Z,,2,,2,2,,,,,16.3,,,,,,,,,,,,,,,,,,,,,,,
102.100.100/403897,CSBAI,,2/05/2024,22:10:00,2024-05-02T22:10:00Z,,2,,2,2,,,,,7.97,,,,,,,,,,,,,,,,,,,,,,,
102.100.100/403896,CSBAI,,2/05/2024,22:15:00,2024-05-02T22:15:00Z,,2,,2,2,,,,,4.84,,,,,,,,,,,,,,,,,,,,,,,
102.100.100/403895,CSBAI,,2/05/2024,22:20:00,2024-05-02T22:20:00Z,,2,,2,2,,,,,,,,,,,,,,,,,,,,,,,,,,,,
102.100.100/403894,CSBAI,,16/05/2024,21:00:00,2024-05-16T21:00:00Z,,2,,2,2,,,,,32.2,,,,,,,,,,,,,,,,,,,,,,,
102.100.100/403893,CSBAI,,16/05/2024,21:05:00,2024-05-16T21:05:00Z,,2,,2,2,,,,,45.6,,,,,,,,,,,,,,,,,,,,,,,
102.100.100/403892,CSBAI,,16/05/2024,21:10:00,2024-05-16T21:10:00Z,,2,,2,2,,,,,40.1,,,,,,,,,,,,,,,,,,,,,,,
102.100.100/403891,CSBAI,,30/05/2024,21:32:00,2024-05-30T21:32:00Z,,2,,2,2,,,,,8.15,,,,,,,,,,,,,,,,,,,,,,,
102.100.100/403890,CSBAI,,30/05/2024,21:36:00,2024-05-30T21:36:00Z,,2,,2,2,,,,,14.4,,,,,,,,,,,,,,,,,,,,,,,
102.100.100/403889,CSBAI,,30/05/2024,21:45:00,2024-05-30T21:45:00Z,,2,,2,2,,,,,14.1,,,,,,,,,,,,,,,,,,,,,,,
102.100.100/403888,CSBAI,,13/06/2024,20:10:00,2024-06-13T20:10:00Z,,2,,2,2,,,,,10.1,,,,,,,,,,,,,,,,,,,,,,,
102.100.100/403887,CSBAI,,13/06/2024,20:14:00,2024-06-13T20:14:00Z,,2,,2,2,,,,,16,,,,,,,,,,,,,,,,,,,,,,,
102.100.100/403886,CSBAI,,13/06/2024,20:20:00,2024-06-13T20:20:00Z,,2,,2,2,,,,,11.8,,,,,,,,,,,,,,,,,,,,,,,
102.100.100/403885,CSBAI,,27/06/2024,2:10:00,2024-06-27T02:10:00Z,,2,,2,2,,,,,27.1,,,,,,,,,,,,,,,,,,,,,,,
102.100.100/403884,CSBAI,,27/06/2024,2:15:00,2024-06-27T02:15:00Z,,2,,2,2,,,,,22.9,,,,,,,,,,,,,,,,,,,,,,,
102.100.100/403883,CSBAI,,27/06/2024,2:20:00,2024-06-27T02:20:00Z,,2,,2,2,,,,,17.1,,,,,,,,,,,,,,,,,,,,,,,
102.100.100/403882,CSBAI,,11/07/2024,21:10:00,2024-07-11T21:10:00Z,,2,,2,2,,,,,26.1,,,,,,,,,,,,,,,,,,,,,,,
102.100.100/403881,CSBAI,,11/07/2024,21:15:00,2024-07-11T21:15:00Z,,2,,2,2,,,,,16,,,,,,,,,,,,,,,,,,,,,,,
102.100.100/403880,CSBAI,,11/07/2024,21:18:00,2024-07-11T21:18:00Z,,2,,2,2,,,,,22.4,,,,,,,,,,,,,,,,,,,,,,,
102.100.100/403879,CSBAI,,25/07/2024,20:30:00,2024-07-25T20:30:00Z,,2,,2,2,,,,,1.98,,,,,,,,,,,,,,,,,,,,,,,
102.100.100/403878,CSBAI,,25/07/2024,20:35:00,2024-07-25T20:35:00Z,,2,,2,2,,,,,14.6,,,,,,,,,,,,,,,,,,,,,,,
102.100.100/403877,CSBAI,,25/07/2024,20:40:00,2024-07-25T20:40:00Z,,2,,2,2,,,,,10.9,,,,,,,,,,,,,,,,,,,,,,,
102.100.100/403876,CSBAI,,8/08/2024,20:35:00,2024-08-08T20:35:00Z,,2,,2,2,,,,,11.1,,,,,,,,,,,,,,,,,,,,,,,
102.100.100/403875,CSBAI,,8/08/2024,20:40:00,2024-08-08T20:40:00Z,,2,,2,2,,,,,7.17,,,,,,,,,,,,,,,,,,,,,,,
102.100.100/403874,CSBAI,,8/08/2024,20:45:00,2024-08-08T20:45:00Z,,2,,2,2,,,,,11.2,,,,,,,,,,,,,,,,,,,,,,,
102.100.100/403870,CSBAI,,5/09/2024,22:10:00,2024-09-05T22:10:00Z,,2,,2,2,,,,,18.5,,,,,,,,,,,,,,,,,,,,,,,
102.100.100/403869,CSBAI,,5/09/2024,22:15:00,2024-09-05T22:15:00Z,,2,,2,2,,,,,17.9,,,,,,,,,,,,,,,,,,,,,,,
102.100.100/403868,CSBAI,,5/09/2024,22:22:00,2024-09-05T22:22:00Z,,2,,2,2,,,,,16.1,,,,,,,,,,,,,,,,,,,,,,,
102.100.100/403867,CSBAI,,19/09/2024,22:33:00,2024-09-19T22:33:00Z,,2,,2,2,,,,,14.6,,,,,,,,,,,,,,,,,,,,,,,
102.100.100/403866,CSBAI,,19/09/2024,22:43:00,2024-09-19T22:43:00Z,,2,,2,2,,,,,24.1,,,,,,,,,,,,,,,,,,,,,,,
102.100.100/403865,CSBAI,,19/09/2024,22:55:00,2024-09-19T22:55:00Z,,2,,2,2,,,,,29.3,,,,,,,,,,,,,,,,,,,,,,,
102.100.100/404315,CSBAI,,3/10/2024,10:38:00,2024-10-03T00:38:00T,,2,,2,2,,,,,11.1,,,,,,,,,,,,,,,,,,,,,,,
102.100.100/404316,CSBAI,,3/10/2024,10:47:00,2024-10-03T00:47:00T,,2,,2,2,,,,,7.61,,,,,,,,,,,,,,,,,,,,,,,
102.100.100/404317,CSBAI,,3/10/2024,10:55:00,2024-10-03T00:55:00T,,2,,2,2,,,,,8.95,,,,,,,,,,,,,,,,,,,,,,,
102.100.100/404321,CSBAI,,17/10/2024,11:23:00,2024-10-16T22:51:00T,,2,,2,2,,,,,26.8,,,,,,,,,,,,,,,,,,,,,,,
102.100.100/404323,CSBAI,,17/10/2024,11:23:00,2024-10-16T22:58:00T,,2,,2,2,,,,,28.7,,,,,,,,,,,,,,,,,,,,,,,
102.100.100/404322,CSBAI,,17/10/2024,11:28:00,2024-10-16T23:05:00T,,2,,2,2,,,,,36.4,,,,,,,,,,,,,,,,,,,,,,,
102.100.100/404383,CSBAI,,31/10/2024,20:10:05,2024-10-31T20:10:05T,,2,,2,2,,,,,41.4,,,,,,,,,,,,,,,,,,,,,,,
102.100.100/404382,CSBAI,,31/10/2024,20:10:10,2024-10-31T20:10:10T,,2,,2,2,,,,,39.9,,,,,,,,,,,,,,,,,,,,,,,
102.100.100/404381,CSBAI,,31/10/2024,20:10:16,2024-10-31T20:10:16T,,2,,2,2,,,,,46.2,,,,,,,,,,,,,,,,,,,,,,,
102.100.100/404380,CSBAI,,14/11/2024,21:20:00,2024-11-14T21:20:00T,,2,,2,2,,,,,28.4,,,,,,,,,,,,,,,,,,,,,,,
102.100.100/404379,CSBAI,,14/11/2024,21:26:00,2024-11-14T21:26:00T,,2,,2,2,,,,,23.9,,,,,,,,,,,,,,,,,,,,,,,
102.100.100/404378,CSBAI,,14/11/2024,21:30:00,2024-11-14T21:30:00T,,2,,2,2,,,,,16.2,,,,,,,,,,,,,,,,,,,,,,,
102.100.100/404377,CSBAI,,28/11/2024,19:40:00,2024-11-28T19:40:00T,,2,,2,2,,,,,29.3,,,,,,,,,,,,,,,,,,,,,,,
102.100.100/404376,CSBAI,,28/11/2024,19:45:00,2024-11-28T19:45:00T,,2,,2,2,,,,,30.5,,,,,,,,,,,,,,,,,,,,,,,
102.100.100/404375,CSBAI,,28/11/2024,19:51:00,2024-11-28T19:51:00T,,2,,2,2,,,,,14,,,,,,,,,,,,,,,,,,,,,,,
102.100.100/404374,CSBAI,,12/12/2024,20:30:00,2024-12-12T20:30:00T,,2,,2,2,,,,,31.5,,,,,,,,,,,,,,,,,,,,,,,
102.100.100/404373,CSBAI,,12/12/2024,20:35:00,2024-12-12T20:35:00T,,2,,2,2,,,,,32.1,,,,,,,,,,,,,,,,,,,,,,,
102.100.100/404372,CSBAI,,12/12/2024,20:38:00,2024-12-12T20:38:00T,,2,,2,2,,,,,27.7,,,,,,,,,,,,,,,,,,,,,,,
102.100.100/404368,CSBAI,,9/01/2025,4:10:00,2025-01-09T04:10:00T,,2,,2,2,,,,,15.5,,,,,,,,,,,,,,,,,,,,,,,
102.100.100/404367,CSBAI,,9/01/2025,4:15:00,2025-01-09T04:15:00T,,2,,2,2,,,,,15,,,,,,,,,,,,,,,,,,,,,,,
102.100.100/404366,CSBAI,,9/01/2025,4:21:00,2025-01-09T04:21:00T,,2,,2,2,,,,,17.8,,,,,,,,,,,,,,,,,,,,,,,
102.100.100/404365,CSBAI,,23/01/2025,1:20:00,2025-01-23T01:20:00T,,2,,2,2,,,,,22.7,,,,,,,,,,,,,,,,,,,,,,,
102.100.100/404364,CSBAI,,23/01/2025,1:25:00,2025-01-23T01:25:00T,,2,,2,2,,,,,23.7,,,,,,,,,,,,,,,,,,,,,,,
102.100.100/404363,CSBAI,,23/01/2025,1:31:00,2025-01-23T01:31:00T,,2,,2,2,,,,,20.9,,,,,,,,,,,,,,,,,,,,,,,
102.100.100/404362,CSBAI,,6/02/2025,3:12:00,2025-02-06T03:12:00T,,2,,2,2,,,,,20.2,,,,,,,,,,,,,,,,,,,,,,,
102.100.100/404361,CSBAI,,6/02/2025,3:18:00,2025-02-06T03:18:00T,,2,,2,2,,,,,23.4,,,,,,,,,,,,,,,,,,,,,,,
102.100.100/404360,CSBAI,,6/02/2025,3:22:00,2025-02-06T03:22:00T,,2,,2,2,,,,,24.3,,,,,,,,,,,,,,,,,,,,,,,
102.100.100/404359,CSBAI,,20/02/2025,3:22:00,2025-02-20T03:22:00T,,2,,2,2,,,,,15.6,,,,,,,,,,,,,,,,,,,,,,,
102.100.100/404358,CSBAI,,20/02/2025,3:27:00,2025-02-20T03:27:00T,,2,,2,2,,,,,20.2,,,,,,,,,,,,,,,,,,,,,,,
102.100.100/404357,CSBAI,,20/02/2025,3:32:00,2025-02-20T03:32:00T,,2,,2,2,,,,,15.8,,,,,,,,,,,,,,,,,,,,,,,
102.100.100/404356,CSBAI,,6/03/2025,3:40:00,2025-03-06T03:40:00T,,2,,2,2,,,,,33.5,,,,,,,,,,,,,,,,,,,,,,,
102.100.100/404355,CSBAI,,6/03/2025,3:44:00,2025-03-06T03:44:00T,,2,,2,2,,,,,43.9,,,,,,,,,,,,,,,,,,,,,,,
102.100.100/404354,CSBAI,,6/03/2025,3:52:00,2025-03-06T03:52:00T,,2,,2,2,,,,,45.4,,,,,,,,,,,,,,,,,,,,,,,
102.100.100/404386,CSBAI,,20/03/2025,23:07:00,2025-03-20T23:07:00T,"Other - sterivex not fully purged, full of water",2,,2,2,,,,,0.387,,,,,,,,,,,,,,,,,,,,,,,
102.100.100/404385,CSBAI,,20/03/2025,23:12:00,2025-03-20T23:12:00T,,2,,2,2,,,,,14.5,,,,,,,,,,,,,,,,,,,,,,,
102.100.100/404384,CSBAI,,20/03/2025,23:18:00,2025-03-20T23:18:00T,,2,,2,2,,,,,55.7,,,,,,,,,,,,,,,,,,,,,,,
102.100.100/404425,CSBAI,,3/04/2025,20:15:00,2025-04-03T20:15:00T,,2,,2,2,,,,,,,,,,,,,,,,,,,,,,,,,,,,
102.100.100/404424,CSBAI,,3/04/2025,20:23:00,2025-04-03T20:23:00T,,2,,2,2,,,,,,,,,,,,,,,,,,,,,,,,,,,,
102.100.100/404423,CSBAI,,3/04/2025,20:30:00,2025-04-03T20:30:00T,,2,,2,2,,,,,,,,,,,,,,,,,,,,,,,,,,,,
102.100.100/404422,CSBAI,,17/04/2025,23:07:05,2025-04-17T23:07:05T,,2,,2,2,,,,,,,,,,,,,,,,,,,,,,,,,,,,
102.100.100/404421,CSBAI,,17/04/2025,23:12:05,2025-04-17T23:12:05T,,2,,2,2,,,,,,,,,,,,,,,,,,,,,,,,,,,,
102.100.100/404420,CSBAI,,17/04/2025,23:17:05,2025-04-17T23:17:05T,,2,,2,2,,,,,,,,,,,,,,,,,,,,,,,,,,,,
102.100.100/404419,CSBAI,,1/05/2025,20:39:00,2025-05-01T20:39:00T,,2,,2,2,,,,,,,,,,,,,,,,,,,,,,,,,,,,
102.100.100/404418,CSBAI,,1/05/2025,20:45:00,2025-05-01T20:45:00T,,2,,2,2,,,,,,,,,,,,,,,,,,,,,,,,,,,,
102.100.100/404417,CSBAI,,1/05/2025,20:55:00,2025-05-01T20:55:00T,,2,,2,2,,,,,,,,,,,,,,,,,,,,,,,,,,,,
102.100.100/404416,CSBAI,,29/05/2025,18:30:00,2025-05-29T18:30:00T,,2,,2,2,,,,,,,,,,,,,,,,,,,,,,,,,,,,
102.100.100/404415,CSBAI,,29/05/2025,18:37:00,2025-05-29T18:37:00T,,2,,2,2,,,,,,,,,,,,,,,,,,,,,,,,,,,,
102.100.100/404414,CSBAI,,29/05/2025,18:43:00,2025-05-29T18:43:00T,,2,,2,2,,,,,,,,,,,,,,,,,,,,,,,,,,,,
102.100.100/404413,CSBAI,,12/06/2025,20:31:00,2025-06-12T20:31:00T,,2,,2,2,,,,,,,,,,,,,,,,,,,,,,,,,,,,
102.100.100/404412,CSBAI,,12/06/2025,20:36:00,2025-06-12T20:36:00T,,2,,2,2,,,,,,,,,,,,,,,,,,,,,,,,,,,,
102.100.100/404411,CSBAI,,12/06/2025,20:42:00,2025-06-12T20:42:00T,,2,,2,2,,,,,,,,,,,,,,,,,,,,,,,,,,,,
102.100.100/404410,CSBAI,,25/06/2025,23:19,2025-06-25T23:19:00T,,2,,2,2,,,,,,,,,,,,,,,,,,,,,,,,,,,,
102.100.100/404409,CSBAI,,25/06/2025,23:27:00,2025-06-25T23:27:00T,,2,,2,2,,,,,,,,,,,,,,,,,,,,,,,,,,,,
102.100.100/404408,CSBAI,,25/06/2025,23:33,2025-06-25T23:33:00T,,2,,2,2,,,,,,,,,,,,,,,,,,,,,,,,,,,,
102.100.100/404405,CSBAI,,10/07/2025,0:16:00,2025-07-10T00:16:00Z,,2,,2,2,,,,,,,,,,,,,,,,,,,,,,,,,,,,
102.100.100/404406,CSBAI,,10/07/2025,0:09:00,2025-07-10T00:09:00Z,,2,,2,2,,,,,,,,,,,,,,,,,,,,,,,,,,,,
102.100.100/404407,CSBAI,,10/07/2025,0:00:00,2025-07-10T00:00:00Z,,2,,2,2,,,,,,,,,,,,,,,,,,,,,,,,,,,,
102.100.100/405353,CSBAI,,24/07/2025,0:10:00,2025-07-24T00:10:00Z,,2,,2,2,,,,,,,,,,,,,,,,,,,,,,,,,,,,
102.100.100/405354,CSBAI,,24/07/2025,0:02:00,2025-07-24T00:02:00Z,,2,,2,2,,,,,,,,,,,,,,,,,,,,,,,,,,,,
102.100.100/405355,CSBAI,,23/07/2025,23:55:00,2025-07-23T23:55:00Z,,2,,2,2,,,,,,,,,,,,,,,,,,,,,,,,,,,,
102.100.100/405356,CSBAI,,7/08/2025,21:02:00,2025-08-07T21:02:00Z,,2,,2,2,,,,,,,,,,,,,,,,,,,,,,,,,,,,
102.100.100/405357,CSBAI,,7/08/2025,21:06:00,2025-08-07T21:06:00Z,,2,,2,2,,,,,,,,,,,,,,,,,,,,,,,,,,,,
102.100.100/405358,CSBAI,,7/08/2025,21:10:00,2025-08-07T21:10:00Z,,2,,2,2,,,,,,,,,,,,,,,,,,,,,,,,,,,,
102.100.100/405359,CSBAI,,22/08/2025,20:30:00,2025-08-22T20:30:00Z,,2,,2,2,,,,,,,,,,,,,,,,,,,,,,,,,,,,
102.100.100/405360,CSBAI,,22/08/2025,20:35:00,2025-08-22T20:35:00Z,,2,,2,2,,,,,,,,,,,,,,,,,,,,,,,,,,,,
102.100.100/405361,CSBAI,,22/08/2025,20:40:00,2025-08-22T20:40:00Z,,2,,2,2,,,,,,,,,,,,,,,,,,,,,,,,,,,,
102.100.100/405362,CSBAI,,4/09/2025,0:10:00,2025-09-04T00:10:00Z,,2,,2,2,,,,,,,,,,,,,,,,,,,,,,,,,,,,
102.100.100/405363,CSBAI,,4/09/2025,0:15:00,2025-09-04T00:15:00Z,,2,,2,2,,,,,,,,,,,,,,,,,,,,,,,,,,,,
102.100.100/405364,CSBAI,,4/09/2025,0:22:00,2025-09-04T00:22:00Z,,2,,2,2,,,,,,,,,,,,,,,,,,,,,,,,,,,,
102.100.100/405365,CSBAI,,18/09/2025,20:15:00,2025-09-18T20:15:00Z,,2,,2,2,,,,,,,,,,,,,,,,,,,,,,,,,,,,
102.100.100/405366,CSBAI,,18/09/2025,20:20:00,2025-09-18T20:20:00Z,,2,,2,2,,,,,,,,,,,,,,,,,,,,,,,,,,,,
102.100.100/405367,CSBAI,,18/09/2025,20:27:00,2025-09-18T20:27:00Z,,2,,2,2,,,,,,,,,,,,,,,,,,,,,,,,,,,,
102.100.100/405368,CSBAI,,2/10/2025,23:10:00,2025-10-02T23:10:00Z,,2,,2,2,,,,,,,,,,,,,,,,,,,,,,,,,,,,
102.100.100/405369,CSBAI,,2/10/2025,23:15:00,2025-10-02T23:15:00Z,,2,,2,2,,,,,,,,,,,,,,,,,,,,,,,,,,,,
102.100.100/405370,CSBAI,,2/10/2025,23:22:00,2025-10-02T23:22:00Z,,2,,2,2,,,,,,,,,,,,,,,,,,,,,,,,,,,,
102.100.100/405371,CSBAI,,16/10/2025,1:10:00 AM,2025-10-16T01:10:00Z,,2,,2,2,,,,,,,,,,,,,,,,,,,,,,,,,,,,
102.100.100/405372,CSBAI,,16/10/2025,1:14:00 AM,2025-10-16T01:14:00Z,,2,,2,2,,,,,,,,,,,,,,,,,,,,,,,,,,,,
102.100.100/405373,CSBAI,,16/10/2025,1:20:00 AM,2025-10-16T01:20:00Z,,2,,2,2,,,,,,,,,,,,,,,,,,,,,,,,,,,,
102.100.100/405374,CSBAI,,30/10/2025,21:30.00,2025-10-30T00:21:30Z,,2,,2,2,,,,,,,,,,,,,,,,,,,,,,,,,,,,
102.100.100/405375,CSBAI,,30/10/2025,21:35.00,2025-10-30T00:21:35Z,,2,,2,2,,,,,,,,,,,,,,,,,,,,,,,,,,,,
102.100.100/405376,CSBAI,,30/10/2025,21:42.00,2025-10-30T00:21:42Z,,2,,2,2,,,,,,,,,,,,,,,,,,,,,,,,,,,,
102.100.100/405377,CSBAI,,12/11/2025,1:13:00,2025-11-12T01:13:00Z,,2,,2,2,,,,,,,,,,,,,,,,,,,,,,,,,,,,
102.100.100/405378,CSBAI,,12/11/2025,1:18:00,2025-11-12T01:18:00Z,,2,,2,2,,,,,,,,,,,,,,,,,,,,,,,,,,,,
102.100.100/405379,CSBAI,,12/11/2025,2:22:00,2025-11-12T02:22:00Z,,2,,2,2,,,,,,,,,,,,,,,,,,,,,,,,,,,,
102.100.100/138839,CSCTL,WQQ191_D0,14/07/2020,4:53:00,2020-07-14T04:53:00Z,,0.5,18,2,2,,,23.297,,,,0.0127,0.254,0.291,,,0.15,BDL,,,6.85,,0.065,34.9,34.896,3.5,4.81,79.9,1.44,ND,,,
102.100.100/138840,CSCTL,WQQ191_D0,14/07/2020,4:53:00,2020-07-14T04:53:00Z,,0.5,18,2,2,,,23.297,,,,0.0127,0.254,0.291,,,0.15,BDL,,,6.85,,0.065,34.9,34.896,3.5,4.81,79.9,1.44,ND,,,
102.100.100/138841,CSCTL,WQQ191_D0,14/07/2020,4:53:00,2020-07-14T04:53:00Z,,0.5,18,2,2,,,23.297,,,,0.0127,0.254,0.291,,,0.15,BDL,,,6.85,,0.065,34.9,34.896,3.5,4.81,79.9,1.44,ND,,,
102.100.100/138842,CSCTL,WQQ191_D1,14/07/2020,4:53:00,2020-07-14T04:53:00Z,,14,18,2,2,,,23.356,,,,0.0091,0.265,0.446,,,0.09,BDL,,,6.3,,0.055,34.9,34.889,3.5,5.14,78.9,1.91,ND,,,
102.100.100/138843,CSCTL,WQQ191_D1,14/07/2020,4:53:00,2020-07-14T04:53:00Z,,14,18,2,2,,,23.356,,,,0.0091,0.265,0.446,,,0.09,BDL,,,6.3,,0.055,34.9,34.889,3.5,5.14,78.9,1.91,ND,,,
102.100.100/138844,CSCTL,WQQ191_D1,14/07/2020,4:53:00,2020-07-14T04:53:00Z,,14,18,2,2,,,23.356,,,,0.0091,0.265,0.446,,,0.09,BDL,,,6.3,,0.055,34.9,34.889,3.5,5.14,78.9,1.91,ND,,,
102.100.100/138887,CSCTL,WQQ244_D0,29/09/2020,5:35:00,2020-09-29T05:35:00Z,,0.5,18,2,2,,,26.079,,,,BDL,0.129,0.191,,,0.15,0.02,,,6.59,,0.06,35.18,35.1,3.5,3.27,79.1,0.77,1.92,,,
102.100.100/138888,CSCTL,WQQ244_D0,29/09/2020,5:35:00,2020-09-29T05:35:00Z,,0.5,18,2,2,,,26.079,,,,BDL,0.129,0.191,,,0.15,0.02,,,6.59,,0.06,35.18,35.1,3.5,3.27,79.1,0.77,1.92,,,
102.100.100/138889,CSCTL,WQQ244_D0,29/09/2020,5:35:00,2020-09-29T05:35:00Z,,0.5,18,2,2,,,26.079,,,,BDL,0.129,0.191,,,0.15,0.02,,,6.59,,0.06,35.18,35.1,3.5,3.27,79.1,0.77,1.92,,,
102.100.100/138890,CSCTL,WQQ244_D1,29/09/2020,5:40:00,2020-09-29T05:40:00Z,,15,18,2,2,,,25.991,,,,0.003,0.197,0.221,,,0.13,BDL,,,7.97,,0.06,35.18,35.173,3.5,3.32,78.2,2.11,2.01,,,
102.100.100/138891,CSCTL,WQQ244_D1,29/09/2020,5:40:00,2020-09-29T05:40:00Z,,15,18,2,2,,,25.991,,,,0.003,0.197,0.221,,,0.13,BDL,,,7.97,,0.06,35.18,35.173,3.5,3.32,78.2,2.11,2.01,,,
102.100.100/138892,CSCTL,WQQ244_D1,29/09/2020,5:40:00,2020-09-29T05:40:00Z,,15,18,2,2,,,25.991,,,,0.003,0.197,0.221,,,0.13,BDL,,,7.97,,0.06,35.18,35.173,3.5,3.32,78.2,2.11,2.01,,,
102.100.100/138923,CSCTL,WQQ319_D0,14/02/2021,23:45:00,2021-02-14T23:45:00Z,,0.5,19,2,2,,,29.92,,,,0.0058,0.121,0.105,,,0.06,BDL,,,3.67,,BDL,33.16,32.748,12,5.24,82.6,0.13,ND,,,
102.100.100/138924,CSCTL,WQQ319_D0,14/02/2021,23:45:00,2021-02-14T23:45:00Z,,0.5,19,2,2,,,29.92,,,,0.0058,0.121,0.105,,,0.06,BDL,,,3.67,,BDL,33.16,32.748,12,5.24,82.6,0.13,ND,,,
102.100.100/138925,CSCTL,WQQ319_D0,14/02/2021,23:46:00,2021-02-14T23:46:00Z,,0.5,19,2,2,,,29.92,,,,0.0058,0.121,0.105,,,0.06,BDL,,,3.67,,BDL,33.16,32.748,12,5.24,82.6,0.13,ND,,,
102.100.100/138926,CSCTL,WQQ319_D1,14/02/2021,23:47:00,2021-02-14T23:47:00Z,,15,19,2,2,,,29.319,,,,0.0163,0.606,0.692,,,0.02,BDL,,,12.09,,BDL,34.2,34.214,12,2.27,71.7,1.81,ND,,,
102.100.100/138927,CSCTL,WQQ319_D1,14/02/2021,23:47:00,2021-02-14T23:47:00Z,,15,19,2,2,,,29.319,,,,0.0163,0.606,0.692,,,0.02,BDL,,,12.09,,BDL,34.2,34.214,12,2.27,71.7,1.81,ND,,,
102.100.100/138928,CSCTL,WQQ319_D1,14/02/2021,23:48:00,2021-02-14T23:48:00Z,,15,19,2,2,,,29.319,,,,0.0163,0.606,0.692,,,0.02,BDL,,,12.09,,BDL,34.2,34.214,12,2.27,71.7,1.81,ND,,,
102.100.100/138965,CSCTL,WQQ445_D0,3/10/2021,5:34:00,2021-10-03T05:34:00Z,,0,19,2,2,,,25.629,,,,0.16,0.2266,0.1437,,,0.06,BDL,,,6.695,,0.07,35.2087,35.21,5.5,2.215,77.6877,1.209,ND,,,
102.100.100/138966,CSCTL,WQQ445_D0,3/10/2021,5:35:00,2021-10-03T05:35:00Z,,0,19,2,2,,,25.629,,,,0.16,0.2266,0.1437,,,0.06,BDL,,,6.695,,0.07,35.2087,35.21,5.5,2.215,77.6877,1.209,ND,,,
102.100.100/138967,CSCTL,WQQ445_D0,3/10/2021,5:36:00,2021-10-03T05:36:00Z,,0,19,2,2,,,25.629,,,,0.16,0.2266,0.1437,,,0.06,BDL,,,6.695,,0.07,35.2087,35.21,5.5,2.215,77.6877,1.209,ND,,,
102.100.100/138968,CSCTL,WQQ445_D1,3/10/2021,5:37:00,2021-10-03T05:37:00Z,,14,19,2,2,,,25.147,,,,0.145,0.2277,0.1809,,,0.045,BDL,,,5.778,,0.065,35.2119,35.212,5.5,2.205,83.2328,1.229,ND,,,
102.100.100/138969,CSCTL,WQQ445_D1,3/10/2021,5:38:00,2021-10-03T05:38:00Z,,14,19,2,2,,,25.147,,,,0.145,0.2277,0.1809,,,0.045,BDL,,,5.778,,0.065,35.2119,35.212,5.5,2.205,83.2328,1.229,ND,,,
102.100.100/138970,CSCTL,WQQ445_D1,3/10/2021,5:39:00,2021-10-03T05:39:00Z,,14,19,2,2,,,25.147,,,,0.145,0.2277,0.1809,,,0.045,BDL,,,5.778,,0.065,35.2119,35.212,5.5,2.205,83.2328,1.229,ND,,,
102.100.100/142714,CSCTL,WQQ518_D1,12/02/2022,23:13:00,2022-02-12T23:13:00Z,,16,20,2,2,,,29.711,,,,0.315,0.1532,0.0903,,,0.045,0.025,,,6.02,,BDL,33.7911,33.799,17,4.61,96.9845,0.145,ND,,,
102.100.100/142715,CSCTL,WQQ518_D1,12/02/2022,23:15:00,2022-02-12T23:15:00Z,,16,20,2,2,,,29.711,,,,0.315,0.1532,0.0903,,,0.045,0.025,,,6.02,,BDL,33.7911,33.799,17,4.61,96.9845,0.145,ND,,,
102.100.100/142716,CSCTL,WQQ518_D1,12/02/2022,23:16:00,2022-02-12T23:16:00Z,,16,20,2,2,,,29.711,,,,0.315,0.1532,0.0903,,,0.045,0.025,,,6.02,,BDL,33.7911,33.799,17,4.61,96.9845,0.145,ND,,,
102.100.100/142711,CSCTL,WQQ518_D0,12/02/2022,23:18:00,2022-02-12T23:18:00Z,,0,20,2,2,,,29.718,,,,0.295,0.1424,0.1055,,,0.03,0.02,,,4.962,,0.025,33.7926,33.798,17,4.58,95.6443,0.114,ND,,,
102.100.100/142712,CSCTL,WQQ518_D0,12/02/2022,23:20:00,2022-02-12T23:20:00Z,,0,20,2,2,,,29.718,,,,0.295,0.1424,0.1055,,,0.03,0.02,,,4.962,,0.025,33.7926,33.798,17,4.58,95.6443,0.114,ND,,,
102.100.100/142713,CSCTL,WQQ518_D0,12/02/2022,23:21:00,2022-02-12T23:21:00Z,,0,20,2,2,,,29.718,,,,0.295,0.1424,0.1055,,,0.03,0.02,,,4.962,,0.025,33.7926,33.798,17,4.58,95.6443,0.114,ND,,,
102.100.100/142744,CSCTL,WQQ584_D1,8/06/2022,4:52:00,2022-06-08T04:52:00Z,,15,18,2,2,,,26.408,,40.4,,0.205,0.4413,0.5915,,,0.055,BDL,,,7.612,,0.04,33.7187,33.707,4.5,4.535,78.3874,1.654,1.4693,,,
102.100.100/142745,CSCTL,WQQ584_D1,8/06/2022,4:56:00,2022-06-08T04:56:00Z,,15,18,2,2,,,26.408,,15.4,,0.205,0.4413,0.5915,,,0.055,BDL,,,7.612,,0.04,33.7187,33.707,4.5,4.535,78.3874,1.654,1.4693,,,
102.100.100/142746,CSCTL,WQQ584_D1,8/06/2022,4:58:00,2022-06-08T04:58:00Z,,15,18,2,2,,,26.408,,15,,0.205,0.4413,0.5915,,,0.055,BDL,,,7.612,,0.04,33.7187,33.707,4.5,4.535,78.3874,1.654,1.4693,,,
102.100.100/142741,CSCTL,WQQ584_D0,8/06/2022,4:59:00,2022-06-08T04:59:00Z,,0,18,2,2,,,26.418,,17.3,,0.125,0.437,0.6008,,,0.145,BDL,,,6.962,,0.04,33.7147,33.71,4.5,4.285,83.0465,1.469,0.9465,,,
102.100.100/142742,CSCTL,WQQ584_D0,8/06/2022,5:00:00,2022-06-08T05:00:00Z,,0,18,2,2,,,26.418,,14.8,,0.125,0.437,0.6008,,,0.145,BDL,,,6.962,,0.04,33.7147,33.71,4.5,4.285,83.0465,1.469,0.9465,,,
102.100.100/142743,CSCTL,WQQ584_D0,8/06/2022,5:05:00,2022-06-08T05:05:00Z,,0,18,2,2,,,26.418,,4.28,,0.125,0.437,0.6008,,,0.145,BDL,,,6.962,,0.04,33.7147,33.71,4.5,4.285,83.0465,1.469,0.9465,,,
102.100.100/142795,CSCTL,WQQ645_D0,2/11/2022,10:30:00,2022-11-02T10:30:00Z,,0,18.5,2,2,,,28.342,,,,0.205,0.292425,0.2675,,,0.15,0.01,,,5.83167,,0.07,34.9934,35.02938,5,2.44,83.7382,1,0.9421,,,
102.100.100/400480,CSCTL,WQQ645_D0,2/11/2022,10:31:00,2022-11-02T10:31:00Z,,0,18.5,2,2,,,28.342,,,,0.205,0.292425,0.2675,,,0.15,0.01,,,5.83167,,0.07,34.9934,35.02938,5,2.44,83.7382,1,0.9421,,,
102.100.100/400481,CSCTL,WQQ645_D0,2/11/2022,10:33:00,2022-11-02T10:33:00Z,,0,18.5,2,2,,,28.342,,,,0.205,0.292425,0.2675,,,0.15,0.01,,,5.83167,,0.07,34.9934,35.02938,5,2.44,83.7382,1,0.9421,,,
102.100.100/400482,CSCTL,WQQ645_D1,2/11/2022,10:35:00,2022-11-02T10:35:00Z,,15,18.5,2,2,,,28.325,,,,0.1,0.313975,0.3685,,,0.03,0.01,,,6.006665,,0.06,34.9941,35.02991,5,2.395,83.1033,0.93,1.0196,,,
102.100.100/400483,CSCTL,WQQ645_D1,2/11/2022,10:38:00,2022-11-02T10:38:00Z,,15,18.5,2,2,,,28.325,,,,0.1,0.313975,0.3685,,,0.03,0.01,,,6.006665,,0.06,34.9941,35.02991,5,2.395,83.1033,0.93,1.0196,,,
102.100.100/400484,CSCTL,WQQ645_D1,2/11/2022,10:41:00,2022-11-02T10:41:00Z,,15,18.5,2,2,,,28.325,,,,0.1,0.313975,0.3685,,,0.03,0.01,,,6.006665,,0.06,34.9941,35.02991,5,2.395,83.1033,0.93,1.0196,,,
102.100.100/400521,CSCTL,WQQ718_D0,24/02/2023,22:21:00,2023-02-24T22:21:00Z,,0,16,2,2,,,27.862,,18.6,,0.175,0.4971,0.2675,,,0.065,0.01,,,15.246665,,0.01,30.0889,29.81215,2.5,8.46,69.8852,1.99,ND,,,
102.100.100/400522,CSCTL,WQQ718_D0,24/02/2023,22:23:00,2023-02-24T22:23:00Z,,0,16,2,2,,,27.862,,20.5,,0.175,0.4971,0.2675,,,0.065,0.01,,,15.246665,,0.01,30.0889,29.81215,2.5,8.46,69.8852,1.99,ND,,,
102.100.100/400523,CSCTL,WQQ718_D0,24/02/2023,22:24:00,2023-02-24T22:24:00Z,,0,16,2,2,,,27.862,,16.2,,0.175,0.4971,0.2675,,,0.065,0.01,,,15.246665,,0.01,30.0889,29.81215,2.5,8.46,69.8852,1.99,ND,,,
102.100.100/400524,CSCTL,WQQ718_D1,24/02/2023,22:26:00,2023-02-24T22:26:00Z,,14,16,2,2,,,28.571,,15.4,,0.195,0.46211,0.3685,,,0.06,0.01,,,6.79667,,0.015,32.2589,32.25425,2.5,17.015,77.883,1.77,ND,,,
102.100.100/400525,CSCTL,WQQ718_D1,24/02/2023,22:28:00,2023-02-24T22:28:00Z,,14,16,2,2,,,28.571,,12,,0.195,0.46211,0.3685,,,0.06,0.01,,,6.79667,,0.015,32.2589,32.25425,2.5,17.015,77.883,1.77,ND,,,
102.100.100/400526,CSCTL,WQQ718_D1,24/02/2023,22:31:00,2023-02-24T22:31:00Z,,14,16,2,2,,,28.571,,17.3,,0.195,0.46211,0.3685,,,0.06,0.01,,,6.79667,,0.015,32.2589,32.25425,2.5,17.015,77.883,1.77,ND,,,
102.100.100/400563,CSCTL,WQQ784_D0,21/06/2023,22:19:00,2023-06-21T22:19:00Z,,0,19,2,2,,,24.531,,10.4,,0.285,0.12453,0.2791,,,0.015,0.01,,,4.006665,,0.06,33.99,34.01613,11,4.505,91.6561,0.255,ND,,,
102.100.100/400564,CSCTL,WQQ784_D0,21/06/2023,22:21:00,2023-06-21T22:21:00Z,,0,19,1.93,1.93,,,24.531,,8.09,,0.285,0.12453,0.2791,,,0.015,0.01,,,4.006665,,0.06,33.99,34.01613,11,4.505,91.6561,0.255,ND,,,
102.100.100/400565,CSCTL,WQQ784_D0,21/06/2023,22:23:00,2023-06-21T22:23:00Z,,0,19,2,2,,,24.531,,7.61,,0.285,0.12453,0.2791,,,0.015,0.01,,,4.006665,,0.06,33.99,34.01613,11,4.505,91.6561,0.255,ND,,,
102.100.100/400566,CSCTL,WQQ784_D1,21/06/2023,22:25:00,2023-06-21T22:25:00Z,,15,19,2,2,,,24.783,,5.36,,0.47,0.20275,0.2995,,,0.035,0.01,,,3.831665,,0.065,34.3651,34.36114,11,3.64,89.0411,0.255,ND,,,
102.100.100/400567,CSCTL,WQQ784_D1,21/06/2023,22:28:00,2023-06-21T22:28:00Z,,15,19,2,2,,,24.783,,9.56,,0.47,0.20275,0.2995,,,0.035,0.01,,,3.831665,,0.065,34.3651,34.36114,11,3.64,89.0411,0.255,ND,,,
102.100.100/400568,CSCTL,WQQ784_D1,21/06/2023,22:30:00,2023-06-21T22:30:00Z,,15,19,2,2,,,24.783,,9.8,,0.47,0.20275,0.2995,,,0.035,0.01,,,3.831665,,0.065,34.3651,34.36114,11,3.64,89.0411,0.255,ND,,,
102.100.100/403496,CSCTL,WQQ845_D0,26/10/2023,6:01:00,2023-10-26T06:01:00Z,,0,,2,2,,,27.337,,7.78,,0.285,0.1015,0.3423,,,0.02,0.015,,,7.24,,0.095,35.3129,35.322,9,3.26,91.4898,0.36,,,,
102.100.100/403497,CSCTL,WQQ845_D0,26/10/2023,6:02:00,2023-10-26T06:02:00Z,,0,,2,2,,,27.337,,10.4,,0.285,0.1015,0.3423,,,0.02,0.015,,,7.24,,0.095,35.3129,35.322,9,3.26,91.4898,0.36,,,,
102.100.100/403498,CSCTL,WQQ845_D0,26/10/2023,6:04:00,2023-10-26T06:04:00Z,,0,,2,2,,,27.337,,9.85,,0.285,0.1015,0.3423,,,0.02,0.015,,,7.24,,0.095,35.3129,35.322,9,3.26,91.4898,0.36,,,,
102.100.100/403499,CSCTL,WQQ845_D1,26/10/2023,6:05:00,2023-10-26T06:05:00Z,,14,,2,2,,,26.273,,3.76,,0.285,0.0805,0.1021,,,0.02,0.01,,,5.555,,0.125,35.3126,35.344,9,1.73,86.9568,1.505,,,,
102.100.100/403500,CSCTL,WQQ845_D1,26/10/2023,6:07:00,2023-10-26T06:07:00Z,,14,,2,2,,,26.273,,1.1,,0.285,0.0805,0.1021,,,0.02,0.01,,,5.555,,0.125,35.3126,35.344,9,1.73,86.9568,1.505,,,,
102.100.100/403501,CSCTL,WQQ845_D1,26/10/2023,6:09:00,2023-10-26T06:09:00Z,,14,,2,2,,,26.273,,3.57,,0.285,0.0805,0.1021,,,0.02,0.01,,,5.555,,0.125,35.3126,35.344,9,1.73,86.9568,1.505,,,,
102.100.100/403588,CSCTL,WQQ918_D0,21/02/2024,5:00:00,2024-02-21T05:00:00Z,,0,,2,2,,,0,,4.28,,0.22,0.1835,0.2213,,,0.01,0.01,,,11.18,,0.035,32.5291,32.719,8,9.855,,0.615,0.8455,,,
102.100.100/403589,CSCTL,WQQ918_D0,21/02/2024,5:00:00,2024-02-21T05:00:00Z,,0,,2,2,,,0,,7.66,,0.22,0.1835,0.2213,,,0.01,0.01,,,11.18,,0.035,32.5291,32.719,8,9.855,,0.615,0.8455,,,
102.100.100/403590,CSCTL,WQQ918_D0,21/02/2024,5:00:00,2024-02-21T05:00:00Z,,0,,2,2,,,0,,8.7,,0.22,0.1835,0.2213,,,0.01,0.01,,,11.18,,0.035,32.5291,32.719,8,9.855,,0.615,0.8455,,,
102.100.100/403591,CSCTL,WQQ918_D1,21/02/2024,5:00:00,2024-02-21T05:00:00Z,,15,,2,2,,,0,,10.3,,0.14,0.3355,0.5293,,,0.01,0.01,,,7.755,,0.04,33.0518,32.981,8,8.885,,0.88,1.2399,,,
102.100.100/403592,CSCTL,WQQ918_D1,21/02/2024,5:00:00,2024-02-21T05:00:00Z,,15,,2,2,,,0,,5.68,,0.14,0.3355,0.5293,,,0.01,0.01,,,7.755,,0.04,33.0518,32.981,8,8.885,,0.88,1.2399,,,
102.100.100/403593,CSCTL,WQQ918_D1,21/02/2024,5:00:00,2024-02-21T05:00:00Z,,15,,2,2,,,0,,6.84,,0.14,0.3355,0.5293,,,0.01,0.01,,,7.755,,0.04,33.0518,32.981,8,8.885,,0.88,1.2399,,,
102.100.100/403814,CSCTL,WQQ984_D0,9/06/2024,22:50:00,2024-06-09T22:50:00Z,,0,,2,2,,,24.345,,22.9,,0.14,0.267,0.3747,,,0.07,0.01,,,9.415,,0.085,34.6183,34.597,3,8.635,71.5329,0,3.0478,,,
102.100.100/403815,CSCTL,WQQ984_D0,9/06/2024,22:50:00,2024-06-09T22:50:00Z,,0,,2,2,,,24.345,,20.3,,0.14,0.267,0.3747,,,0.07,0.01,,,9.415,,0.085,34.6183,34.597,3,8.635,71.5329,0,3.0478,,,
102.100.100/403816,CSCTL,WQQ984_D0,9/06/2024,22:50:00,2024-06-09T22:50:00Z,,0,,2,2,,,24.345,,12.9,,0.14,0.267,0.3747,,,0.07,0.01,,,9.415,,0.085,34.6183,34.597,3,8.635,71.5329,0,3.0478,,,
102.100.100/403817,CSCTL,WQQ984_D1,9/06/2024,22:50:00,2024-06-09T22:50:00Z,,14,,2,2,,,24.434,,22.2,,0.115,0.2445,0.4228,,,0.045,0.01,,,7.28,,0.11,34.7214,34.735,3,7.71,74.9159,0,3.1975,,,
102.100.100/403818,CSCTL,WQQ984_D1,9/06/2024,22:50:00,2024-06-09T22:50:00Z,,14,,2,2,,,24.434,,14,,0.115,0.2445,0.4228,,,0.045,0.01,,,7.28,,0.11,34.7214,34.735,3,7.71,74.9159,0,3.1975,,,
102.100.100/403819,CSCTL,WQQ984_D1,9/06/2024,22:50:00,2024-06-09T22:50:00Z,,14,,2,2,,,24.434,,18.9,,0.115,0.2445,0.4228,,,0.045,0.01,,,7.28,,0.11,34.7214,34.735,3,7.71,74.9159,0,3.1975,,,
102.100.100/404278,CSCTL,WQR056_D1,26/10/2024,23:58,2024-10-26T23:58:00Z,,13,,2,2,,,26.192,,8.34,,0.11,0.212,0.2736,,,0.01,0.01,,,6.675,,0.08,35.4917,35.545,3.5,3.285,77.5439,1.45,2.3984,,,
102.100.100/404279,CSCTL,WQR056_D1,26/10/2024,23:59,2024-10-26T23:59:00Z,,13,,2,2,,,26.192,,5.03,,0.11,0.212,0.2736,,,0.01,0.01,,,6.675,,0.08,35.4917,35.545,3.5,3.285,77.5439,1.45,2.3984,,,
102.100.100/404280,CSCTL,WQR056_D1,27/10/2024,0:01,2024-10-27T00:01:00Z,,13,,2,2,,,26.192,,11.7,,0.11,0.212,0.2736,,,0.01,0.01,,,6.675,,0.08,35.4917,35.545,3.5,3.285,77.5439,1.45,2.3984,,,
102.100.100/404275,CSCTL,WQR056_D0,27/10/2024,0:03,2024-10-27T00:03:00Z,,0,,2,2,,,27.338,,15.4,,0.17,0.2495,0.2726,,,0.015,0.01,,,7.1,,0.09,35.4931,35.545,3.5,3.075,76.8301,1.46,2.2777,,,
102.100.100/404276,CSCTL,WQR056_D0,27/10/2024,0:04,2024-10-27T00:04:00Z,,0,,2,2,,,27.338,,5.67,,0.17,0.2495,0.2726,,,0.015,0.01,,,7.1,,0.09,35.4931,35.545,3.5,3.075,76.8301,1.46,2.2777,,,
102.100.100/404277,CSCTL,WQR056_D0,27/10/2024,0:05,2024-10-27T00:05:00Z,,0,,2,2,,,27.338,,6.84,,0.17,0.2495,0.2726,,,0.015,0.01,,,7.1,,0.09,35.4931,35.545,3.5,3.075,76.8301,1.46,2.2777,,,
102.100.100/404481,CSCTL,WQR139_D0,13/02/2025,5:05,2025-02-13T05:05:00Z,,0,,2,2,,,29.45304,,12.1,,0.13,0.562,0.2891,,,0.045,0.015,,,9.91,,0.035,30.22,30.409,9,12.145,,0.48,0.4878,,,
102.100.100/404482,CSCTL,WQR139_D0,13/02/2025,5:07,2025-02-13T05:07:00Z,,0,,2,2,,,29.45304,,10.6,,0.13,0.562,0.2891,,,0.045,0.015,,,9.91,,0.035,30.22,30.409,9,12.145,,0.48,0.4878,,,
102.100.100/404483,CSCTL,WQR139_D0,13/02/2025,5:09,2025-02-13T05:09:00Z,,0,,2,2,,,29.45304,,11.9,,0.13,0.562,0.2891,,,0.045,0.015,,,9.91,,0.035,30.22,30.409,9,12.145,,0.48,0.4878,,,
102.100.100/404484,CSCTL,WQR139_D1,13/02/2025,5:10,2025-02-13T05:10:00Z,,37,,2,2,,,29.50593,,13.1,,0.245,0.673,0.5781,,,0.095,0.03,,,9.35,,0.05,33.535,32.579,9,10.665,,1.225,1.7367,,,
102.100.100/404485,CSCTL,WQR139_D1,13/02/2025,5:11,2025-02-13T05:11:00Z,,37,,2,2,,,29.50593,,8.48,,0.245,0.673,0.5781,,,0.095,0.03,,,9.35,,0.05,33.535,32.579,9,10.665,,1.225,1.7367,,,
102.100.100/404486,CSCTL,WQR139_D1,13/02/2025,5:13,2025-02-13T05:13:00Z,,37,,2,2,,,29.50593,,6.18,,0.245,0.673,0.5781,,,0.095,0.03,,,9.35,,0.05,33.535,32.579,9,10.665,,1.225,1.7367,,,
102.100.100/405295,CSCTL,WQR215_D1,22/06/2025,4:39,2025-06-22T04:39:00Z,,12,,2,2,,"Other - sterivex not purged, 1/3 full water",23.4158,,0.119,,0.105,0.524,0.7359,,,0.02,0.01,,,13.525,,0.115,34.2045,34.236,2,7.86,57.1987,5.59,,,,
102.100.100/405296,CSCTL,WQR215_D1,22/06/2025,4:40,2025-06-22T04:40:00Z,,12,,2,2,,,23.4158,,17.4,,0.105,0.524,0.7359,,,0.02,0.01,,,13.525,,0.115,34.2045,34.236,2,7.86,57.1987,5.59,,,,
102.100.100/405297,CSCTL,WQR215_D1,22/06/2025,4:41,2025-06-22T04:41:00Z,,12,,2,2,,,23.4158,,23.4,,0.105,0.524,0.7359,,,0.02,0.01,,,13.525,,0.115,34.2045,34.236,2,7.86,57.1987,5.59,,,,
102.100.100/405292,CSCTL,WQR215_D0,22/06/2025,4:42,2025-06-22T04:42:00Z,,0,,2,2,,"Other - sterivex not purged, 1/3 full water",23.4418,,0.425,,0.155,0.713,0.8334,,,0.02,0.02,,,12.74,,0.11,34.1616,34.175,2,8.185,58.2563,4.18,,,,
102.100.100/405293,CSCTL,WQR215_D0,22/06/2025,4:45,2025-06-22T04:45:00Z,,0,,2,2,,,23.4418,,13.9,,0.155,0.713,0.8334,,,0.02,0.02,,,12.74,,0.11,34.1616,34.175,2,8.185,58.2563,4.18,,,,
102.100.100/405294,CSCTL,WQR215_D0,22/06/2025,4:47,2025-06-22T04:47:00Z,,0,,2,2,,,23.4418,,11.5,,0.155,0.713,0.8334,,,0.02,0.02,,,12.74,,0.11,34.1616,34.175,2,8.185,58.2563,4.18,,,,
102.100.100/138845,CSDBI,WQQ189_D0,15/07/2020,0:00:00,2020-07-15T00:00:00Z,,0.5,20,2,2,,,22.788,,,,0.0123,0.276,0.308,,,0.06,BDL,,,6.75,,0.055,35.11,35.102,3.5,5.35,74.8,1.96,ND,,,
102.100.100/138846,CSDBI,WQQ189_D0,15/07/2020,0:00:00,2020-07-15T00:00:00Z,,0.5,20,2,2,,,22.788,,,,0.0123,0.276,0.308,,,0.06,BDL,,,6.75,,0.055,35.11,35.102,3.5,5.35,74.8,1.96,ND,,,
102.100.100/138847,CSDBI,WQQ189_D0,15/07/2020,0:00:00,2020-07-15T00:00:00Z,,0.5,20,2,2,,,22.788,,,,0.0123,0.276,0.308,,,0.06,BDL,,,6.75,,0.055,35.11,35.102,3.5,5.35,74.8,1.96,ND,,,
102.100.100/138848,CSDBI,WQQ189_D1,15/07/2020,0:05:00,2020-07-15T00:05:00Z,,17,20,2,2,,,22.783,,,,0.0214,0.308,0.429,,,0.06,BDL,,,6.63,,0.05,35.1,35.114,3.5,5.29,75.4,2.21,ND,,,
102.100.100/138849,CSDBI,WQQ189_D1,15/07/2020,0:05:00,2020-07-15T00:05:00Z,,17,20,2,2,,,22.783,,,,0.0214,0.308,0.429,,,0.06,BDL,,,6.63,,0.05,35.1,35.114,3.5,5.29,75.4,2.21,ND,,,
102.100.100/138850,CSDBI,WQQ189_D1,15/07/2020,0:05:00,2020-07-15T00:05:00Z,,17,20,2,2,,,22.783,,,,0.0214,0.308,0.429,,,0.06,BDL,,,6.63,,0.05,35.1,35.114,3.5,5.29,75.4,2.21,ND,,,
102.100.100/138893,CSDBI,WQQ242_D0,29/09/2020,23:37:00,2020-09-29T23:37:00Z,,0.5,21,2,2,,,24.946,,,,0.026,0.195,0.177,,,0.78,BDL,,,6.93,,0.07,35.19,35.196,3,4.22,76.4,2.2,2.08,,,
102.100.100/138894,CSDBI,WQQ242_D0,29/09/2020,23:37:00,2020-09-29T23:37:00Z,,0.5,21,2,2,,,24.946,,,,0.026,0.195,0.177,,,0.78,BDL,,,6.93,,0.07,35.19,35.196,3,4.22,76.4,2.2,2.08,,,
102.100.100/138895,CSDBI,WQQ242_D0,29/09/2020,23:37:00,2020-09-29T23:37:00Z,,0.5,21,2,2,,,24.946,,,,0.026,0.195,0.177,,,0.78,BDL,,,6.93,,0.07,35.19,35.196,3,4.22,76.4,2.2,2.08,,,
102.100.100/138896,CSDBI,WQQ242_D1,29/09/2020,23:50:00,2020-09-29T23:50:00Z,,18,21,2,2,,,25.388,,,,0.0227,0.211,0.208,,,0.03,BDL,,,7.88,,0.065,35.19,35.201,3,4.13,79.4,2.47,2.12,,,
102.100.100/138897,CSDBI,WQQ242_D1,29/09/2020,23:50:00,2020-09-29T23:50:00Z,,18,21,2,2,,,25.388,,,,0.0227,0.211,0.208,,,0.03,BDL,,,7.88,,0.065,35.19,35.201,3,4.13,79.4,2.47,2.12,,,
102.100.100/138898,CSDBI,WQQ242_D1,29/09/2020,23:50:00,2020-09-29T23:50:00Z,,18,21,2,2,,,25.388,,,,0.0227,0.211,0.208,,,0.03,BDL,,,7.88,,0.065,35.19,35.201,3,4.13,79.4,2.47,2.12,,,
102.100.100/138935,CSDBI,WQQ317_D0,15/02/2021,5:00:00,2021-02-15T05:00:00Z,,0.5,21,2,2,,,ND,,,,0.129,0.089,0.074,,,0.3,BDL,,,4.62,,BDL,32.36,32.351,18,6.48,95.7,BDL,ND,,,
102.100.100/138936,CSDBI,WQQ317_D0,15/02/2021,5:00:00,2021-02-15T05:00:00Z,,0.5,21,2,2,,,ND,,,,0.129,0.089,0.074,,,0.3,BDL,,,4.62,,BDL,32.36,32.351,18,6.48,95.7,BDL,ND,,,
102.100.100/138937,CSDBI,WQQ317_D0,15/02/2021,5:01:00,2021-02-15T05:01:00Z,,0.5,21,2,2,,,ND,,,,0.129,0.089,0.074,,,0.3,BDL,,,4.62,,BDL,32.36,32.351,18,6.48,95.7,BDL,ND,,,
102.100.100/138938,CSDBI,WQQ317_D1,15/02/2021,5:01:00,2021-02-15T05:01:00Z,,17,21,2,2,,,29.138,,,,0.0031,0.601,0.151,,,0.09,BDL,,,14.5,,0.03,33.22,34.384,18,2.2,95.7,1.74,ND,,,
102.100.100/138939,CSDBI,WQQ317_D1,15/02/2021,5:02:00,2021-02-15T05:02:00Z,,17,21,2,2,,,29.138,,,,0.0031,0.601,0.151,,,0.09,BDL,,,14.5,,0.03,33.22,34.384,18,2.2,95.7,1.74,ND,,,
102.100.100/138940,CSDBI,WQQ317_D1,15/02/2021,5:02:00,2021-02-15T05:02:00Z,,17,21,2,2,,,29.138,,,,0.0031,0.601,0.151,,,0.09,BDL,,,14.5,,0.03,33.22,34.384,18,2.2,95.7,1.74,ND,,,
102.100.100/138978,CSDBI,WQQ443_D0,4/10/2021,1:23:00,2021-10-04T01:23:00Z,,0,20,2,2,,,27.57,,,,0.11,0.1618,0.0884,,,0.205,BDL,,,5.895,,0.045,34.98,34.988,9,6.19,88.9615,0.224,ND,,,
102.100.100/138979,CSDBI,WQQ443_D0,4/10/2021,1:24:00,2021-10-04T01:24:00Z,,0,20,2,2,,,27.57,,,,0.11,0.1618,0.0884,,,0.205,BDL,,,5.895,,0.045,34.98,34.988,9,6.19,88.9615,0.224,ND,,,
102.100.100/138980,CSDBI,WQQ443_D0,4/10/2021,1:25:00,2021-10-04T01:25:00Z,,0,20,2,2,,,27.57,,,,0.11,0.1618,0.0884,,,0.205,BDL,,,5.895,,0.045,34.98,34.988,9,6.19,88.9615,0.224,ND,,,
102.100.100/138981,CSDBI,WQQ443_D1,4/10/2021,1:26:00,2021-10-04T01:26:00Z,,17,20,2,2,,,25.03,,,,0.105,0.287,0.2199,,,0.665,BDL,,,6.395,,0.065,35.1852,35.19,9,2.87,76.2691,1.699,ND,,,
102.100.100/138982,CSDBI,WQQ443_D1,4/10/2021,1:27:00,2021-10-04T01:27:00Z,,17,20,2,2,,,25.03,,,,0.105,0.287,0.2199,,,0.665,BDL,,,6.395,,0.065,35.1852,35.19,9,2.87,76.2691,1.699,ND,,,
102.100.100/138983,CSDBI,WQQ443_D1,4/10/2021,1:28:00,2021-10-04T01:28:00Z,,17,20,2,2,,,25.03,,,,0.105,0.287,0.2199,,,0.665,BDL,,,6.395,,0.065,35.1852,35.19,9,2.87,76.2691,1.699,ND,,,
102.100.100/142720,CSDBI,WQQ516_D1,13/02/2022,4:13:00,2022-02-13T04:13:00Z,,17,20,2,2,,,29.633,,,,0.235,0.2913,0.2152,,,0.04,0.03,,,8.645,,BDL,33.7615,33.784,9,4.465,89.1907,0.649,ND,,,
102.100.100/142721,CSDBI,WQQ516_D1,13/02/2022,4:15:00,2022-02-13T04:15:00Z,,17,20,2,2,,,29.633,,,,0.235,0.2913,0.2152,,,0.04,0.03,,,8.645,,BDL,33.7615,33.784,9,4.465,89.1907,0.649,ND,,,
102.100.100/142722,CSDBI,WQQ516_D1,13/02/2022,4:17:00,2022-02-13T04:17:00Z,,17,20,2,2,,,29.633,,,,0.235,0.2913,0.2152,,,0.04,0.03,,,8.645,,BDL,33.7615,33.784,9,4.465,89.1907,0.649,ND,,,
102.100.100/142717,CSDBI,WQQ516_D0,13/02/2022,4:19:00,2022-02-13T04:19:00Z,,0,20,2,2,,,29.65,,,,0.105,0.2277,1.041,,,0.04,0.02,,,5.828,,BDL,33.7582,33.78,9,4.36,90.2583,0.484,ND,,,
102.100.100/142718,CSDBI,WQQ516_D0,13/02/2022,4:20:00,2022-02-13T04:20:00Z,,0,20,2,2,,,29.65,,,,0.105,0.2277,1.041,,,0.04,0.02,,,5.828,,BDL,33.7582,33.78,9,4.36,90.2583,0.484,ND,,,
102.100.100/142719,CSDBI,WQQ516_D0,13/02/2022,4:21:00,2022-02-13T04:21:00Z,,0,20,2,2,,,29.65,,,,0.105,0.2277,1.041,,,0.04,0.02,,,5.828,,BDL,33.7582,33.78,9,4.36,90.2583,0.484,ND,,,
102.100.100/142756,CSDBI,WQQ582_D1,9/06/2022,0:47:00,2022-06-09T00:47:00Z,,17,21,2,2,,,26.098,,13.1,,0.13,0.3938,0.3432,,,0.04,BDL,,,6.512,,0.04,34.0647,34.118,5,2.75,80.0841,1.404,1.471,,,
102.100.100/142757,CSDBI,WQQ582_D1,9/06/2022,0:48:00,2022-06-09T00:48:00Z,,17,21,2,2,,,26.098,,1.17,,0.13,0.3938,0.3432,,,0.04,BDL,,,6.512,,0.04,34.0647,34.118,5,2.75,80.0841,1.404,1.471,,,
102.100.100/142758,CSDBI,WQQ582_D1,9/06/2022,0:52:00,2022-06-09T00:52:00Z,,17,21,2,2,,,26.098,,8.63,,0.13,0.3938,0.3432,,,0.04,BDL,,,6.512,,0.04,34.0647,34.118,5,2.75,80.0841,1.404,1.471,,,
102.100.100/142753,CSDBI,WQQ582_D0,9/06/2022,0:54:00,2022-06-09T00:54:00Z,,0,21,2,2,,,26.107,,1.77,,0.4,0.3658,0.3426,,,0.105,BDL,,,6.662,,0.045,34.0587,34.118,5,2.755,76.1106,1.334,1.7746,,,
102.100.100/142754,CSDBI,WQQ582_D0,9/06/2022,0:55:00,2022-06-09T00:55:00Z,,0,21,2,2,,,26.107,,4.52,,0.4,0.3658,0.3426,,,0.105,BDL,,,6.662,,0.045,34.0587,34.118,5,2.755,76.1106,1.334,1.7746,,,
102.100.100/142755,CSDBI,WQQ582_D0,9/06/2022,0:56:00,2022-06-09T00:56:00Z,,0,21,2,2,,,26.107,,2.66,,0.4,0.3658,0.3426,,,0.105,BDL,,,6.662,,0.045,34.0587,34.118,5,2.755,76.1106,1.334,1.7746,,,
102.100.100/400485,CSDBI,WQQ643_D0,3/11/2022,3:11:00,2022-11-03T03:11:00Z,,0,20.5,2,2,,,28.326,,,,0.13,0.19803,0.0731,,,0.03,0.01,,,5.64,,0.035,35.0146,35.02851,8,4.41,87.3124,0.595,0.558,,,
102.100.100/400486,CSDBI,WQQ643_D0,3/11/2022,3:13:00,2022-11-03T03:13:00Z,,0,20.5,2,2,,,28.326,,,,0.13,0.19803,0.0731,,,0.03,0.01,,,5.64,,0.035,35.0146,35.02851,8,4.41,87.3124,0.595,0.558,,,
102.100.100/400487,CSDBI,WQQ643_D0,3/11/2022,3:15:00,2022-11-03T03:15:00Z,,0,20.5,2,2,,,28.326,,,,0.13,0.19803,0.0731,,,0.03,0.01,,,5.64,,0.035,35.0146,35.02851,8,4.41,87.3124,0.595,0.558,,,
102.100.100/400488,CSDBI,WQQ643_D1,3/11/2022,3:18:00,2022-11-03T03:18:00Z,,16,20.5,2,2,,,28.248,,,,0.11,0.21034,0.4014,,,0.03,0.01,,,6.123335,,0.035,35.0102,35.02275,8,4.29,82.4515,0.92,0.9656,,,
102.100.100/400489,CSDBI,WQQ643_D1,3/11/2022,3:20:00,2022-11-03T03:20:00Z,,16,20.5,2,2,,,28.248,,,,0.11,0.21034,0.4014,,,0.03,0.01,,,6.123335,,0.035,35.0102,35.02275,8,4.29,82.4515,0.92,0.9656,,,
102.100.100/400490,CSDBI,WQQ643_D1,3/11/2022,3:24:00,2022-11-03T03:24:00Z,,16,20.5,2,2,,,28.248,,,,0.11,0.21034,0.4014,,,0.03,0.01,,,6.123335,,0.035,35.0102,35.02275,8,4.29,82.4515,0.92,0.9656,,,
102.100.100/400527,CSDBI,WQQ716_D0,25/02/2023,2:54:00,2023-02-25T02:54:00Z,,0,19,2,2,,,28.517,,25.6,,0.13,0.506365,ND,,,0.06,0.01,,,7.398335,,0.01,32.5367,32.55151,9,7.58,89.6916,0.515,ND,,,
102.100.100/400528,CSDBI,WQQ716_D0,25/02/2023,2:56:00,2023-02-25T02:56:00Z,,0,19,2,2,,,28.517,,18.9,,0.13,0.506365,ND,,,0.06,0.01,,,7.398335,,0.01,32.5367,32.55151,9,7.58,89.6916,0.515,ND,,,
102.100.100/400529,CSDBI,WQQ716_D0,25/02/2023,2:58:00,2023-02-25T02:58:00Z,,0,19,2,2,,,28.517,,24.5,,0.13,0.506365,ND,,,0.06,0.01,,,7.398335,,0.01,32.5367,32.55151,9,7.58,89.6916,0.515,ND,,,
102.100.100/400530,CSDBI,WQQ716_D1,25/02/2023,3:00:00,2023-02-25T03:00:00Z,,17,19,2,2,,,28.525,,26.9,,0.15,0.498135,ND,,,0.025,0.01,,,8.231665,,0.01,32.6975,32.72868,9,7.275,85.7534,0.83,ND,,,
102.100.100/400531,CSDBI,WQQ716_D1,25/02/2023,3:02:00,2023-02-25T03:02:00Z,,17,19,2,2,,,28.525,,17.6,,0.15,0.498135,ND,,,0.025,0.01,,,8.231665,,0.01,32.6975,32.72868,9,7.275,85.7534,0.83,ND,,,
102.100.100/400532,CSDBI,WQQ716_D1,25/02/2023,3:04:00,2023-02-25T03:04:00Z,,17,19,2,2,,,28.525,,14.7,,0.15,0.498135,ND,,,0.025,0.01,,,8.231665,,0.01,32.6975,32.72868,9,7.275,85.7534,0.83,ND,,,
102.100.100/400569,CSDBI,WQQ782_D0,22/06/2023,3:12:00,2023-06-22T03:12:00Z,,0,21,2,2,,,25.148,,9.28,,0.295,0.23713,0.2192,,,0.02,0.01,,,8.706665,,0.065,34.7428,34.70214,7,1.68,91.1211,0.785,ND,,,
102.100.100/400570,CSDBI,WQQ782_D0,22/06/2023,3:14:00,2023-06-22T03:14:00Z,,0,21,2,2,,,25.148,,6.83,,0.295,0.23713,0.2192,,,0.02,0.01,,,8.706665,,0.065,34.7428,34.70214,7,1.68,91.1211,0.785,ND,,,
102.100.100/400571,CSDBI,WQQ782_D0,22/06/2023,3:16:00,2023-06-22T03:16:00Z,,0,21,2,2,,,25.148,,5.67,,0.295,0.23713,0.2192,,,0.02,0.01,,,8.706665,,0.065,34.7428,34.70214,7,1.68,91.1211,0.785,ND,,,
102.100.100/400572,CSDBI,WQQ782_D1,22/06/2023,3:18:00,2023-06-22T03:18:00Z,,17,21,2,2,,,25.097,,8.18,,0.315,0.28509,0.4037,,,0.01,0.01,,,5.156665,,0.07,34.7572,34.76199,7,1.67,88.9507,1.06,ND,,,
102.100.100/400573,CSDBI,WQQ782_D1,22/06/2023,3:20:00,2023-06-22T03:20:00Z,,17,21,2,2,,,25.097,,5.73,,0.315,0.28509,0.4037,,,0.01,0.01,,,5.156665,,0.07,34.7572,34.76199,7,1.67,88.9507,1.06,ND,,,
102.100.100/400574,CSDBI,WQQ782_D1,22/06/2023,3:23:00,2023-06-22T03:23:00Z,,17,21,2,2,,,25.097,,4.14,,0.315,0.28509,0.4037,,,0.01,0.01,,,5.156665,,0.07,34.7572,34.76199,7,1.67,88.9507,1.06,ND,,,
102.100.100/403484,CSDBI,WQQ916_D0,26/10/2023,1:39:00,2023-10-26T01:39:00Z,,0,,1.9,1.9,,,27.319,,8.28,,0.15,0.1275,0.033,,,0.01,0.01,,,8.375,,0.09,35.291,35.332,7.5,4.51,89.4475,0.635,,,,
102.100.100/403485,CSDBI,WQQ916_D0,26/10/2023,1:41:00,2023-10-26T01:41:00Z,,0,,1.9,1.9,,,27.319,,3.95,,0.15,0.1275,0.033,,,0.01,0.01,,,8.375,,0.09,35.291,35.332,7.5,4.51,89.4475,0.635,,,,
102.100.100/403486,CSDBI,WQQ916_D0,26/10/2023,1:42:00,2023-10-26T01:42:00Z,,0,,2,2,,,27.319,,5.55,,0.15,0.1275,0.033,,,0.01,0.01,,,8.375,,0.09,35.291,35.332,7.5,4.51,89.4475,0.635,,,,
102.100.100/403487,CSDBI,WQQ916_D1,26/10/2023,1:44:00,2023-10-26T01:44:00Z,,18,,1.9,1.9,,,26.133,,8.52,,0.31,0.229,0.2986,,,0.03,0.01,,,8.915,,0.11,35.2432,35.264,7.5,4.16,79.4771,1.64,,,,
102.100.100/403488,CSDBI,WQQ916_D1,26/10/2023,1:47:00,2023-10-26T01:47:00Z,,18,,1.9,1.9,,,26.133,,12.8,,0.31,0.229,0.2986,,,0.03,0.01,,,8.915,,0.11,35.2432,35.264,7.5,4.16,79.4771,1.64,,,,
102.100.100/403489,CSDBI,WQQ916_D1,26/10/2023,1:49:00,2023-10-26T01:49:00Z,,18,,1.8,1.8,,,26.133,,11.7,,0.31,0.229,0.2986,,,0.03,0.01,,,8.915,,0.11,35.2432,35.264,7.5,4.16,79.4771,1.64,,,,
102.100.100/403600,CSDBI,WQQ843_D0,22/02/2024,0:11:00,2024-02-22T00:11:00Z,,0,,2,2,,,0,,7.7,,0.215,0.331,0.2987,,,0.01,0.01,,,6.09,,0.045,32.6188,32.614,16,9.705,,0.125,0.4568,,,
102.100.100/403601,CSDBI,WQQ843_D0,22/02/2024,0:11:00,2024-02-22T00:11:00Z,,0,,2,2,,,0,,8.26,,0.215,0.331,0.2987,,,0.01,0.01,,,6.09,,0.045,32.6188,32.614,16,9.705,,0.125,0.4568,,,
102.100.100/403602,CSDBI,WQQ843_D0,22/02/2024,0:11:00,2024-02-22T00:11:00Z,,0,,2,2,,,0,,5.42,,0.215,0.331,0.2987,,,0.01,0.01,,,6.09,,0.045,32.6188,32.614,16,9.705,,0.125,0.4568,,,
102.100.100/403603,CSDBI,WQQ843_D1,22/02/2024,0:11:00,2024-02-22T00:11:00Z,,16,,2,2,,,0,,9.89,,0.13,0.3135,0.235,,,0.01,0.01,,,5.69,,0.045,32.9002,32.684,16,9.44,,0.185,0.3597,,,
102.100.100/403604,CSDBI,WQQ843_D1,22/02/2024,0:11:00,2024-02-22T00:11:00Z,,16,,2,2,,,0,,6.57,,0.13,0.3135,0.235,,,0.01,0.01,,,5.69,,0.045,32.9002,32.684,16,9.44,,0.185,0.3597,,,
102.100.100/403605,CSDBI,WQQ843_D1,22/02/2024,0:11:00,2024-02-22T00:11:00Z,,16,,2,2,,,0,,10.7,,0.13,0.3135,0.235,,,0.01,0.01,,,5.69,,0.045,32.9002,32.684,16,9.44,,0.185,0.3597,,,
102.100.100/403820,CSDBI,WQQ982_D0,10/06/2024,3:23:00,2024-06-10T03:23:00Z,,0,,2,2,,,24.43,,16.5,,0.24,0.146,0.197,,,0.04,0.01,,,7.04,,0.08,34.9922,34.993,5,5.235,84.6286,0,1.8012,,,
102.100.100/403821,CSDBI,WQQ982_D0,10/06/2024,3:23:00,2024-06-10T03:23:00Z,,0,,2,2,,,24.43,,12.6,,0.24,0.146,0.197,,,0.04,0.01,,,7.04,,0.08,34.9922,34.993,5,5.235,84.6286,0,1.8012,,,
102.100.100/403822,CSDBI,WQQ982_D0,10/06/2024,3:23:00,2024-06-10T03:23:00Z,,0,,2,2,,,24.43,,6.29,,0.24,0.146,0.197,,,0.04,0.01,,,7.04,,0.08,34.9922,34.993,5,5.235,84.6286,0,1.8012,,,
102.100.100/403823,CSDBI,WQQ982_D1,10/06/2024,3:23:00,2024-06-10T03:23:00Z,,16,,2,2,,,24.298,,11.3,,0.225,0.2025,0.4167,,,0.02,0.01,,,6.97,,0.085,35.0095,35.026,5,4.925,81.4533,0,2.2603,,,
102.100.100/403824,CSDBI,WQQ982_D1,10/06/2024,3:23:00,2024-06-10T03:23:00Z,,16,,2,2,,,24.298,,9.05,,0.225,0.2025,0.4167,,,0.02,0.01,,,6.97,,0.085,35.0095,35.026,5,4.925,81.4533,0,2.2603,,,
102.100.100/403825,CSDBI,WQQ982_D1,10/06/2024,3:23:00,2024-06-10T03:23:00Z,,16,,2,2,,,24.298,,7.36,,0.225,0.2025,0.4167,,,0.02,0.01,,,6.97,,0.085,35.0095,35.026,5,4.925,81.4533,0,2.2603,,,
102.100.100/404284,CSDBI,WQR054_D1,27/10/2024,4:13,2024-10-27T04:13:00Z,,15,,2,2,,,27.314,,10.8,,0.135,0.141,0.1827,,,0.01,0.01,,,5.085,,0.08,35.4623,35.529,8,2.445,86.0441,0.615,1.7271,,,
102.100.100/404285,CSDBI,WQR054_D1,27/10/2024,4:16,2024-10-27T04:16:00Z,,15,,1.9,1.9,,,27.314,,9.77,,0.135,0.141,0.1827,,,0.01,0.01,,,5.085,,0.08,35.4623,35.529,8,2.445,86.0441,0.615,1.7271,,,
102.100.100/404286,CSDBI,WQR054_D1,27/10/2024,4:17,2024-10-27T04:17:00Z,,15,,2,2,,,27.314,,4.92,,0.135,0.141,0.1827,,,0.01,0.01,,,5.085,,0.08,35.4623,35.529,8,2.445,86.0441,0.615,1.7271,,,
102.100.100/404281,CSDBI,WQR054_D0,27/10/2024,4:18,2024-10-27T04:18:00Z,,0,,2,2,,,27.392,,14.8,,0.29,0.1565,0.1046,,,0.025,0.01,,,5.61,,0.08,35.4628,35.507,8,2.34,87.6611,0.635,1.4687,,,
102.100.100/404282,CSDBI,WQR054_D0,27/10/2024,4:19,2024-10-27T04:19:00Z,,0,,2,2,,,27.392,,8,,0.29,0.1565,0.1046,,,0.025,0.01,,,5.61,,0.08,35.4628,35.507,8,2.34,87.6611,0.635,1.4687,,,
102.100.100/404283,CSDBI,WQR054_D0,27/10/2024,4:20,2024-10-27T04:20:00Z,,0,,2,2,,,27.392,,3.72,,0.29,0.1565,0.1046,,,0.025,0.01,,,5.61,,0.08,35.4628,35.507,8,2.34,87.6611,0.635,1.4687,,,
102.100.100/404493,CSDBI,WQR137_D0,14/02/2025,0:10,2025-02-14T00:10:00Z,,0,,2,2,,,28.77683,,17.4,,0.18,0.7965,0.4638,,,0.085,0.06,,,11.285,,0.06,25.7395,27.049,9,12.69,,0.45,0.4597,,,
102.100.100/404494,CSDBI,WQR137_D0,14/02/2025,0:10,2025-02-14T00:10:00Z,,0,,2,2,,,28.77683,,16.4,,0.18,0.7965,0.4638,,,0.085,0.06,,,11.285,,0.06,25.7395,27.049,9,12.69,,0.45,0.4597,,,
102.100.100/404495,CSDBI,WQR137_D0,14/02/2025,0:11,2025-02-14T00:11:00Z,,0,,2,2,,,28.77683,,1.26,,0.18,0.7965,0.4638,,,0.085,0.06,,,11.285,,0.06,25.7395,27.049,9,12.69,,0.45,0.4597,,,
102.100.100/404496,CSDBI,WQR137_D1,14/02/2025,0:12,2025-02-14T00:12:00Z,,18,,2,2,,,28.92982,,6.76,,0.54,1.109,0.5672,,,0.36,0.16,,,7.775,,0.12,32.6368,32.218,9,8.275,,1.325,1.2984,,,
102.100.100/404497,CSDBI,WQR137_D1,14/02/2025,0:13,2025-02-14T00:13:00Z,,18,,2,2,,,28.92982,,12.5,,0.54,1.109,0.5672,,,0.36,0.16,,,7.775,,0.12,32.6368,32.218,9,8.275,,1.325,1.2984,,,
102.100.100/404498,CSDBI,WQR137_D1,14/02/2025,0:15,2025-02-14T00:15:00Z,,18,,2,2,,,28.92982,,2.85,,0.54,1.109,0.5672,,,0.36,0.16,,,7.775,,0.12,32.6368,32.218,9,8.275,,1.325,1.2984,,,
102.100.100/405298,CSDBI,WQR213_D0,22/06/2025,23:45,2025-06-22T23:45:00Z,,0,,2,2,,,23.455,,11.5,,0.11,0.4585,0.4619,,,0.015,0.015,,,8.51,,0.09,34.4147,34.421,4.5,4.86,78.5469,1.65,,,,
102.100.100/405299,CSDBI,WQR213_D0,22/06/2025,23:47,2025-06-22T23:47:00Z,,0,,2,2,,,23.455,,9.83,,0.11,0.4585,0.4619,,,0.015,0.015,,,8.51,,0.09,34.4147,34.421,4.5,4.86,78.5469,1.65,,,,
102.100.100/405300,CSDBI,WQR213_D0,22/06/2025,23:49,2025-06-22T23:49:00Z,,0,,2,2,,,23.455,,12,,0.11,0.4585,0.4619,,,0.015,0.015,,,8.51,,0.09,34.4147,34.421,4.5,4.86,78.5469,1.65,,,,
102.100.100/405301,CSDBI,WQR213_D1,22/06/2025,23:51,2025-06-22T23:51:00Z,,16,,2,2,,,23.419,,11.4,,0.145,0.5115,0.6453,,,0.02,0.01,,,8.71,,0.09,34.4216,34.435,4.5,4.735,77.3473,2.065,,,,
102.100.100/405302,CSDBI,WQR213_D1,22/06/2025,23:53,2025-06-22T23:53:00Z,,16,,2,2,,,23.419,,12.7,,0.145,0.5115,0.6453,,,0.02,0.01,,,8.71,,0.09,34.4216,34.435,4.5,4.735,77.3473,2.065,,,,
102.100.100/405303,CSDBI,WQR213_D1,22/06/2025,23:55,2025-06-22T23:55:00Z,,16,,2,2,,,23.419,,9.52,,0.145,0.5115,0.6453,,,0.02,0.01,,,8.71,,0.09,34.4216,34.435,4.5,4.735,77.3473,2.065,,,,
102.100.100/138857,CSFLB,WQQ187_D0,15/07/2020,3:20:00,2020-07-15T03:20:00Z,,0.5,8,2,2,,,22.611,,,,0.0204,0.231,0.227,,,0.1,BDL,,,7.8,,0.06,35.12,35.126,3,5.5,72.2,2.61,ND,,,
102.100.100/138858,CSFLB,WQQ187_D0,15/07/2020,3:20:00,2020-07-15T03:20:00Z,,0.5,8,2,2,,,22.611,,,,0.0204,0.231,0.227,,,0.1,BDL,,,7.8,,0.06,35.12,35.126,3,5.5,72.2,2.61,ND,,,
102.100.100/138859,CSFLB,WQQ187_D0,15/07/2020,3:20:00,2020-07-15T03:20:00Z,,0.5,8,2,2,,,22.611,,,,0.0204,0.231,0.227,,,0.1,BDL,,,7.8,,0.06,35.12,35.126,3,5.5,72.2,2.61,ND,,,
102.100.100/138860,CSFLB,WQQ187_D1,15/07/2020,3:25:00,2020-07-15T03:25:00Z,,5,8,2,2,,,22.593,,,,0.016,0.275,0.342,,,0.03,BDL,,,9.14,,0.055,35.12,35.116,3,5.2,70.8,2.81,ND,,,
102.100.100/138861,CSFLB,WQQ187_D1,15/07/2020,3:25:00,2020-07-15T03:25:00Z,,5,8,2,2,,,22.593,,,,0.016,0.275,0.342,,,0.03,BDL,,,9.14,,0.055,35.12,35.116,3,5.2,70.8,2.81,ND,,,
102.100.100/138862,CSFLB,WQQ187_D1,15/07/2020,3:25:00,2020-07-15T03:25:00Z,,5,8,2,2,,,22.593,,,,0.016,0.275,0.342,,,0.03,BDL,,,9.14,,0.055,35.12,35.116,3,5.2,70.8,2.81,ND,,,
102.100.100/138899,CSFLB,WQQ240_D0,30/09/2020,1:30:00,2020-09-30T01:30:00Z,,0.5,9,2,2,,,25.2,,,,0.0148,0.259,0.247,,,0.11,BDL,,,10.54,,0.055,35.18,35.24,2.5,4.38,54.8,4.88,4.17,,,
102.100.100/138900,CSFLB,WQQ240_D0,30/09/2020,1:30:00,2020-09-30T01:30:00Z,,0.5,9,2,2,,,25.2,,,,0.0148,0.259,0.247,,,0.11,BDL,,,10.54,,0.055,35.18,35.24,2.5,4.38,54.8,4.88,4.17,,,
102.100.100/138901,CSFLB,WQQ240_D0,30/09/2020,1:30:00,2020-09-30T01:30:00Z,,0.5,9,2,2,,,25.2,,,,0.0148,0.259,0.247,,,0.11,BDL,,,10.54,,0.055,35.18,35.24,2.5,4.38,54.8,4.88,4.17,,,
102.100.100/138902,CSFLB,WQQ240_D1,30/09/2020,1:40:00,2020-09-30T01:40:00Z,,5,9,2,2,,,25.474,,,,0.024,0.317,0.315,,,0.04,BDL,,,12.48,,0.06,35.18,35.194,2.5,4.14,54.5,6.55,4.56,,,
102.100.100/138903,CSFLB,WQQ240_D1,30/09/2020,1:40:00,2020-09-30T01:40:00Z,,5,9,2,2,,,25.474,,,,0.024,0.317,0.315,,,0.04,BDL,,,12.48,,0.06,35.18,35.194,2.5,4.14,54.5,6.55,4.56,,,
102.100.100/138904,CSFLB,WQQ240_D1,30/09/2020,1:40:00,2020-09-30T01:40:00Z,,5,9,2,2,,,25.474,,,,0.024,0.317,0.315,,,0.04,BDL,,,12.48,,0.06,35.18,35.194,2.5,4.14,54.5,6.55,4.56,,,
102.100.100/138941,CSFLB,WQQ315_D0,15/02/2021,6:42:00,2021-02-15T06:42:00Z,,0.5,9,2,2,,,ND,,,,0.0166,0.312,0.343,,,0.07,0.02,,,13.97,,BDL,32.12,32.022,4.5,10.14,80.1,0.96,ND,,,
102.100.100/138942,CSFLB,WQQ315_D0,15/02/2021,6:42:00,2021-02-15T06:42:00Z,,0.5,9,2,2,,,ND,,,,0.0166,0.312,0.343,,,0.07,0.02,,,13.97,,BDL,32.12,32.022,4.5,10.14,80.1,0.96,ND,,,
102.100.100/138943,CSFLB,WQQ315_D0,15/02/2021,6:43:00,2021-02-15T06:43:00Z,,0.5,9,2,2,,,ND,,,,0.0166,0.312,0.343,,,0.07,0.02,,,13.97,,BDL,32.12,32.022,4.5,10.14,80.1,0.96,ND,,,
102.100.100/138944,CSFLB,WQQ315_D1,15/02/2021,6:43:00,2021-02-15T06:43:00Z,,5,9,2,2,,,30.141,,,,0.0567,0.413,0.362,,,0.08,BDL,,,16.05,,BDL,32.55,33.161,4.5,6.15,71.9,2.38,ND,,,
102.100.100/138945,CSFLB,WQQ315_D1,15/02/2021,6:44:00,2021-02-15T06:44:00Z,,5,9,2,2,,,30.141,,,,0.0567,0.413,0.362,,,0.08,BDL,,,16.05,,BDL,32.55,33.161,4.5,6.15,71.9,2.38,ND,,,
102.100.100/138946,CSFLB,WQQ315_D1,15/02/2021,6:44:00,2021-02-15T06:44:00Z,,5,9,2,2,,,30.141,,,,0.0567,0.413,0.362,,,0.08,BDL,,,16.05,,BDL,32.55,33.161,4.5,6.15,71.9,2.38,ND,,,
102.100.100/138984,CSFLB,WQQ441_D0,4/10/2021,3:08:00,2021-10-04T03:08:00Z,,0,8,2,2,,,28.569,,,,0.075,0.4855,0.2989,,,0.06,BDL,,,15.72,,0.06,34.9298,34.916,2,8.15,47.9541,4.508,ND,,,
102.100.100/138985,CSFLB,WQQ441_D0,4/10/2021,3:09:00,2021-10-04T03:09:00Z,,0,8,2,2,,,28.569,,,,0.075,0.4855,0.2989,,,0.06,BDL,,,15.72,,0.06,34.9298,34.916,2,8.15,47.9541,4.508,ND,,,
102.100.100/138986,CSFLB,WQQ441_D0,4/10/2021,3:10:00,2021-10-04T03:10:00Z,,0,8,2,2,,,28.569,,,,0.075,0.4855,0.2989,,,0.06,BDL,,,15.72,,0.06,34.9298,34.916,2,8.15,47.9541,4.508,ND,,,
102.100.100/138987,CSFLB,WQQ441_D1,4/10/2021,3:11:00,2021-10-04T03:11:00Z,,4,8,2,2,,,26.596,,,,0.15,0.5621,0.4057,,,0.35,BDL,,,14.39,,0.06,35.0224,35.046,2,5.48,57.2239,3.538,ND,,,
102.100.100/138988,CSFLB,WQQ441_D1,4/10/2021,3:12:00,2021-10-04T03:12:00Z,,4,8,2,2,,,26.596,,,,0.15,0.5621,0.4057,,,0.35,BDL,,,14.39,,0.06,35.0224,35.046,2,5.48,57.2239,3.538,ND,,,
102.100.100/138989,CSFLB,WQQ441_D1,4/10/2021,3:13:00,2021-10-04T03:13:00Z,,4,8,2,2,,,26.596,,,,0.15,0.5621,0.4057,,,0.35,BDL,,,14.39,,0.06,35.0224,35.046,2,5.48,57.2239,3.538,ND,,,
102.100.100/142726,CSFLB,WQQ514_D1,13/02/2022,6:16:00,2022-02-13T06:16:00Z,,6,9,2,2,,,29.725,,,,0.145,0.2859,0.2617,,,0.04,0.025,,,10.69,,BDL,33.7266,33.722,3.5,4.905,77.5707,2.389,ND,,,
102.100.100/142727,CSFLB,WQQ514_D1,13/02/2022,6:17:00,2022-02-13T06:17:00Z,,6,9,2,2,,,29.725,,,,0.145,0.2859,0.2617,,,0.04,0.025,,,10.69,,BDL,33.7266,33.722,3.5,4.905,77.5707,2.389,ND,,,
102.100.100/142728,CSFLB,WQQ514_D1,13/02/2022,6:18:00,2022-02-13T06:18:00Z,,6,9,2,2,,,29.725,,,,0.145,0.2859,0.2617,,,0.04,0.025,,,10.69,,BDL,33.7266,33.722,3.5,4.905,77.5707,2.389,ND,,,
102.100.100/142723,CSFLB,WQQ514_D0,13/02/2022,6:20:00,2022-02-13T06:20:00Z,,0,9,2,2,,,29.716,,,,0.17,0.2697,0.2433,,,0.045,BDL,,,10.81,,BDL,33.7285,33.723,3.5,4.88,79.5732,1.814,ND,,,
102.100.100/142724,CSFLB,WQQ514_D0,13/02/2022,6:21:00,2022-02-13T06:21:00Z,,0,9,2,2,,,29.716,,,,0.17,0.2697,0.2433,,,0.045,BDL,,,10.81,,BDL,33.7285,33.723,3.5,4.88,79.5732,1.814,ND,,,
102.100.100/142725,CSFLB,WQQ514_D0,13/02/2022,6:22:00,2022-02-13T06:22:00Z,,0,9,2,2,,,29.716,,,,0.17,0.2697,0.2433,,,0.045,BDL,,,10.81,,BDL,33.7285,33.723,3.5,4.88,79.5732,1.814,ND,,,
102.100.100/142768,CSFLB,WQQ580_D1,9/06/2022,4:19:00,2022-06-09T04:19:00Z,,5,9,2,2,,,25.878,,,,0.11,0.6841,0.5142,,,0.05,0.025,,,12.33,,0.06,34.3758,34.307,4,3.59,74.3361,2.419,2.0661,,,
102.100.100/142769,CSFLB,WQQ580_D1,9/06/2022,4:20:00,2022-06-09T04:20:00Z,,5,9,2,2,,,25.878,,,,0.11,0.6841,0.5142,,,0.05,0.025,,,12.33,,0.06,34.3758,34.307,4,3.59,74.3361,2.419,2.0661,,,
102.100.100/142770,CSFLB,WQQ580_D1,9/06/2022,4:22:00,2022-06-09T04:22:00Z,,5,9,2,2,,,25.878,,,,0.11,0.6841,0.5142,,,0.05,0.025,,,12.33,,0.06,34.3758,34.307,4,3.59,74.3361,2.419,2.0661,,,
102.100.100/142765,CSFLB,WQQ580_D0,9/06/2022,4:23:00,2022-06-09T04:23:00Z,,0,9,2,2,,,25.889,,,,0.13,0.7186,0.4073,,,0.05,0.03,,,12.18,,0.07,34.3751,34.312,4,3.205,75.4323,2.419,1.4649,,,
102.100.100/142766,CSFLB,WQQ580_D0,9/06/2022,4:24:00,2022-06-09T04:24:00Z,,0,9,2,2,,,25.889,,,,0.13,0.7186,0.4073,,,0.05,0.03,,,12.18,,0.07,34.3751,34.312,4,3.205,75.4323,2.419,1.4649,,,
102.100.100/142767,CSFLB,WQQ580_D0,9/06/2022,4:25:00,2022-06-09T04:25:00Z,,0,9,2,2,,,25.889,,,,0.13,0.7186,0.4073,,,0.05,0.03,,,12.18,,0.07,34.3751,34.312,4,3.205,75.4323,2.419,1.4649,,,
102.100.100/400491,CSFLB,WQQ641_D0,3/11/2022,5:05:00,2022-11-03T05:05:00Z,,0,9.5,2,2,,,28.768,,,,0.19,0.297555,0.2954,,,0.03,0.01,,,9.64,,0.055,35.0613,35.11447,3.5,4.135,66.8543,2.635,2.0446,,,
102.100.100/400493,CSFLB,WQQ641_D0,3/11/2022,5:09:00,2022-11-03T05:09:00Z,,0,9.5,2,2,,,28.768,,,,0.19,0.297555,0.2954,,,0.03,0.01,,,9.64,,0.055,35.0613,35.11447,3.5,4.135,66.8543,2.635,2.0446,,,
102.100.100/400494,CSFLB,WQQ641_D1,3/11/2022,5:11:00,2022-11-03T05:11:00Z,,6,9.5,2,2,,,28.78,,,,0.105,0.292425,0.3179,,,0.02,0.01,,,12.306665,,0.06,35.0606,35.07824,3.5,2.505,66.7459,2.645,2.171,,,
102.100.100/400495,CSFLB,WQQ641_D1,3/11/2022,5:15:00,2022-11-03T05:15:00Z,,6,9.5,2,2,,,28.78,,,,0.105,0.292425,0.3179,,,0.02,0.01,,,12.306665,,0.06,35.0606,35.07824,3.5,2.505,66.7459,2.645,2.171,,,
102.100.100/400496,CSFLB,WQQ641_D1,3/11/2022,5:18:00,2022-11-03T05:18:00Z,,6,9.5,2,2,,,28.78,,,,0.105,0.292425,0.3179,,,0.02,0.01,,,12.306665,,0.06,35.0606,35.07824,3.5,2.505,66.7459,2.645,2.171,,,
102.100.100/400492,CSFLB,WQQ641_D0,3/11/2022,6:07:00,2022-11-03T06:07:00Z,,0,9.5,2,2,,,28.768,,,,0.19,0.297555,0.2954,,,0.03,0.01,,,9.64,,0.055,35.0613,35.11447,3.5,4.135,66.8543,2.635,2.0446,,,
102.100.100/400533,CSFLB,WQQ714_D0,25/02/2023,5:00:00,2023-02-25T05:00:00Z,,0,7,2,2,,,28.302,,33.7,,0.095,0.62781,0.2675,,,0.01,0.01,,,15.88,,0.02,32.136,32.25618,2.5,8.005,55.9559,3.78,ND,,,
102.100.100/400534,CSFLB,WQQ714_D0,25/02/2023,5:02:00,2023-02-25T05:02:00Z,,0,7,2,2,,,28.302,,31.9,,0.095,0.62781,0.2675,,,0.01,0.01,,,15.88,,0.02,32.136,32.25618,2.5,8.005,55.9559,3.78,ND,,,
102.100.100/400535,CSFLB,WQQ714_D0,25/02/2023,5:04:00,2023-02-25T05:04:00Z,,0,7,2,2,,,28.302,,32.9,,0.095,0.62781,0.2675,,,0.01,0.01,,,15.88,,0.02,32.136,32.25618,2.5,8.005,55.9559,3.78,ND,,,
102.100.100/400536,CSFLB,WQQ714_D1,25/02/2023,5:06:00,2023-02-25T05:06:00Z,,5,7,2,2,,,28.293,,31.5,,0.07,0.70397,0.349,,,0.01,0.01,,,17.663335,,0.01,32.1575,32.30567,2.5,7.845,55.6615,3.8,ND,,,
102.100.100/400537,CSFLB,WQQ714_D1,25/02/2023,5:07:00,2023-02-25T05:07:00Z,,5,7,2,2,,,28.293,,37.1,,0.07,0.70397,0.349,,,0.01,0.01,,,17.663335,,0.01,32.1575,32.30567,2.5,7.845,55.6615,3.8,ND,,,
102.100.100/400538,CSFLB,WQQ714_D1,25/02/2023,5:08:00,2023-02-25T05:08:00Z,,5,7,2,2,,,28.293,,33.5,,0.07,0.70397,0.349,,,0.01,0.01,,,17.663335,,0.01,,32.30567,2.5,7.845,55.6615,3.8,ND,,,
102.100.100/400575,CSFLB,WQQ780_D0,22/06/2023,5:13:00,2023-06-22T05:13:00Z,,0,8.5,1.9,1.9,,,24.64,,10.1,,0.58,0.274795,0.3583,,,0.015,0.01,,,9.24833,,0.075,,34.34659,4,2.965,77.213,1.79,0.0555,,,
102.100.100/400576,CSFLB,WQQ780_D0,22/06/2023,5:15:00,2023-06-22T05:15:00Z,,0,8.5,2,2,,,24.64,,12.7,,0.58,0.274795,0.3583,,,0.015,0.01,,,9.24833,,0.075,,34.34659,4,2.965,77.213,1.79,0.0555,,,
102.100.100/400577,CSFLB,WQQ780_D0,22/06/2023,5:16:00,2023-06-22T05:16:00Z,,0,8.5,2,2,,,24.64,,14.1,,0.58,0.274795,0.3583,,,0.015,0.01,,,9.24833,,0.075,,34.34659,4,2.965,77.213,1.79,0.0555,,,
102.100.100/400578,CSFLB,WQQ780_D1,22/06/2023,5:18:00,2023-06-22T05:18:00Z,,5,8.5,2,2,,,24.611,,12.7,,0.265,0.30773,0.4786,,,0.01,0.01,,,8.55667,,0.05,,34.3409,4,3.325,78.5603,1.765,ND,,,
102.100.100/400579,CSFLB,WQQ780_D1,22/06/2023,5:20:00,2023-06-22T05:20:00Z,,5,8.5,2,2,,,24.611,,15.1,,0.265,0.30773,0.4786,,,0.01,0.01,,,8.55667,,0.05,,34.3409,4,3.325,78.5603,1.765,ND,,,
102.100.100/138990,CSFLB,WQQ780_D1,22/06/2023,5:22:00,2023-06-22T05:22:00Z,,5,8.5,2,2,,,24.611,,9.44,,0.265,0.30773,0.4786,,,0.01,0.01,,,8.55667,,0.05,,34.3409,4,3.325,78.5603,1.765,ND,,,
102.100.100/403502,CSFLB,WQQ841_D0,25/10/2023,23:43:00,2023-10-25T23:43:00Z,,0,,2,2,,,27.034,,16.5,,0.185,0.37,0.2738,,,0.01,0.01,,,14.68,,0.105,35.2803,35.294,2.5,6.155,59.7485,3.91,,,,
102.100.100/403503,CSFLB,WQQ841_D0,25/10/2023,23:45:00,2023-10-25T23:45:00Z,,0,,2,2,,,27.034,,7.29,,0.185,0.37,0.2738,,,0.01,0.01,,,14.68,,0.105,35.2803,35.294,2.5,6.155,59.7485,3.91,,,,
102.100.100/403504,CSFLB,WQQ841_D0,25/10/2023,23:47:00,2023-10-25T23:47:00Z,,0,,2,2,,,27.034,,3.57,,0.185,0.37,0.2738,,,0.01,0.01,,,14.68,,0.105,35.2803,35.294,2.5,6.155,59.7485,3.91,,,,
102.100.100/403505,CSFLB,WQQ841_D1,25/10/2023,23:49:00,2023-10-25T23:49:00Z,,6,,2,2,,,26.966,,2.87,,0.135,0.3865,0.3989,,,0.01,0.01,,,15.55,,0.105,35.2737,35.28,2.5,6.145,58.298,3.83,,,,
102.100.100/403506,CSFLB,WQQ841_D1,25/10/2023,23:51:00,2023-10-25T23:51:00Z,,6,,2,2,,,26.966,,5.89,,0.135,0.3865,0.3989,,,0.01,0.01,,,15.55,,0.105,35.2737,35.28,2.5,6.145,58.298,3.83,,,,
102.100.100/403507,CSFLB,WQQ841_D1,25/10/2023,23:53:00,2023-10-25T23:53:00Z,,6,,2,2,,,26.966,,7.13,,0.135,0.3865,0.3989,,,0.01,0.01,,,15.55,,0.105,35.2737,35.28,2.5,6.145,58.298,3.83,,,,
102.100.100/403606,CSFLB,WQQ914_D0,22/02/2024,1:42:00,2024-02-22T01:42:00Z,,0,,2,2,,,0,,21.9,,0.135,0.6055,0.3405,,,0.01,0.01,,,10.32,,0.04,32.6592,32.663,6,8.84,,0.715,0.8826,,,
102.100.100/403607,CSFLB,WQQ914_D0,22/02/2024,1:42:00,2024-02-22T01:42:00Z,,0,,2,2,,,0,,18.4,,0.135,0.6055,0.3405,,,0.01,0.01,,,10.32,,0.04,32.6592,32.663,6,8.84,,0.715,0.8826,,,
102.100.100/403608,CSFLB,WQQ914_D0,22/02/2024,1:42:00,2024-02-22T01:42:00Z,,0,,2,2,,,0,,19.9,,0.135,0.6055,0.3405,,,0.01,0.01,,,10.32,,0.04,32.6592,32.663,6,8.84,,0.715,0.8826,,,
102.100.100/403609,CSFLB,WQQ914_D1,22/02/2024,1:42:00,2024-02-22T01:42:00Z,,6,,2,2,,,0,,12.5,,0.1,0.2435,0.561,,,0.01,0.01,,,9.505,,0.045,32.7541,32.664,6,8.785,,0.655,0.927,,,
102.100.100/403610,CSFLB,WQQ914_D1,22/02/2024,1:42:00,2024-02-22T01:42:00Z,,6,,2,2,,,0,,16.1,,0.1,0.2435,0.561,,,0.01,0.01,,,9.505,,0.045,32.7541,32.664,6,8.785,,0.655,0.927,,,
102.100.100/403611,CSFLB,WQQ914_D1,22/02/2024,1:42:00,2024-02-22T01:42:00Z,,6,,2,2,,,0,,16.4,,0.1,0.2435,0.561,,,0.01,0.01,,,9.505,,0.045,32.7541,32.664,6,8.785,,0.655,0.927,,,
102.100.100/403826,CSFLB,WQQ980_D0,10/06/2024,5:21:00,2024-06-10T05:21:00Z,,0,,2,2,,,24.15,,13.5,,0.16,0.2025,0.2493,,,0.25,0.01,,,11.46,,0.08,35.0244,35.021,3,5.215,77.9682,0,2.3266,,,
102.100.100/403827,CSFLB,WQQ980_D0,10/06/2024,5:21:00,2024-06-10T05:21:00Z,,0,,2,2,,,24.15,,18.4,,0.16,0.2025,0.2493,,,0.25,0.01,,,11.46,,0.08,35.0244,35.021,3,5.215,77.9682,0,2.3266,,,
102.100.100/403828,CSFLB,WQQ980_D0,10/06/2024,5:21:00,2024-06-10T05:21:00Z,,0,,2,2,,,24.15,,24.5,,0.16,0.2025,0.2493,,,0.25,0.01,,,11.46,,0.08,35.0244,35.021,3,5.215,77.9682,0,2.3266,,,
102.100.100/403829,CSFLB,WQQ980_D1,10/06/2024,5:21:00,2024-06-10T05:21:00Z,,4,,2,2,,,24.155,,22,,0.11,0.1955,0.327,,,0.025,0.01,,,12.4,,0.07,35.0245,35.021,3,5.32,78.17,0,2.4656,,,
102.100.100/403830,CSFLB,WQQ980_D1,10/06/2024,5:21:00,2024-06-10T05:21:00Z,,4,,2,2,,,24.155,,11.4,,0.11,0.1955,0.327,,,0.025,0.01,,,12.4,,0.07,35.0245,35.021,3,5.32,78.17,0,2.4656,,,
102.100.100/403831,CSFLB,WQQ980_D1,10/06/2024,5:21:00,2024-06-10T05:21:00Z,,4,,2,2,,,24.155,,19.9,,0.11,0.1955,0.327,,,0.025,0.01,,,12.4,,0.07,35.0245,35.021,3,5.32,78.17,0,2.4656,,,
102.100.100/404290,CSFLB,WQR052_D1,27/10/2024,6:02,2024-10-27T06:02:00Z,,5,,2,2,,,27.764,,8.64,,0.13,0.3065,0.2882,,,0.02,0.01,,,11.37,,0.1,35.5432,35.588,3,4.725,70.4638,2.27,3.0018,,,
102.100.100/404291,CSFLB,WQR052_D1,27/10/2024,6:04,2024-10-27T06:04:00Z,,5,,2,2,,,27.764,,1.36,,0.13,0.3065,0.2882,,,0.02,0.01,,,11.37,,0.1,35.5432,35.588,3,4.725,70.4638,2.27,3.0018,,,
102.100.100/404292,CSFLB,WQR052_D1,27/10/2024,6:08,2024-10-27T06:08:00Z,,5,,2,2,,,27.764,,5.99,,0.13,0.3065,0.2882,,,0.02,0.01,,,11.37,,0.1,35.5432,35.588,3,4.725,70.4638,2.27,3.0018,,,
102.100.100/404287,CSFLB,WQR052_D0,27/10/2024,6:09,2024-10-27T06:09:00Z,,0,,2,2,,,27.759,,8.12,,0.155,0.3195,0.2914,,,0.015,0.01,,,9.965,,0.1,35.5421,35.585,3,4.47,72.3548,2.365,3.1427,,,
102.100.100/404288,CSFLB,WQR052_D0,27/10/2024,6:10,2024-10-27T06:10:00Z,,0,,2,2,,,27.759,,8.35,,0.155,0.3195,0.2914,,,0.015,0.01,,,9.965,,0.1,35.5421,35.585,3,4.47,72.3548,2.365,3.1427,,,
102.100.100/404289,CSFLB,WQR052_D0,27/10/2024,6:12,2024-10-27T06:12:00Z,,0,,2,2,,,27.759,,3.77,,0.155,0.3195,0.2914,,,0.015,0.01,,,9.965,,0.1,35.5421,35.585,3,4.47,72.3548,2.365,3.1427,,,
102.100.100/404499,CSFLB,WQR135_D0,14/02/2025,1:37,2025-02-14T01:37:00Z,,0,,2,2,,,29.52701,,2.19,,0.235,1.217,0.5027,,,0.165,0.04,,,18.09,,0.05,24.1708,25.831,4.5,22.94,,1.915,1.1557,,,
102.100.100/404500,CSFLB,WQR135_D0,14/02/2025,1:38,2025-02-14T01:38:00Z,,0,,2,2,,,29.52701,,11.4,,0.235,1.217,0.5027,,,0.165,0.04,,,18.09,,0.05,24.1708,25.831,4.5,22.94,,1.915,1.1557,,,
102.100.100/404501,CSFLB,WQR135_D0,14/02/2025,1:38,2025-02-14T01:38:00Z,,0,,2,2,,,29.52701,,12.1,,0.235,1.217,0.5027,,,0.165,0.04,,,18.09,,0.05,24.1708,25.831,4.5,22.94,,1.915,1.1557,,,
102.100.100/404502,CSFLB,WQR135_D1,14/02/2025,1:40,2025-02-14T01:40:00Z,,6,,2,2,,,29.36145,,8.54,,0.265,2.117,2.1873,,,0.155,0.05,,,18.56,,0.06,31.3521,27.676,4.5,16.795,,2.53,2.0721,,,
102.100.100/404503,CSFLB,WQR135_D1,14/02/2025,1:41,2025-02-14T01:41:00Z,,6,,2,2,,,29.36145,,16.3,,0.265,2.117,2.1873,,,0.155,0.05,,,18.56,,0.06,31.3521,27.676,4.5,16.795,,2.53,2.0721,,,
102.100.100/404504,CSFLB,WQR135_D1,14/02/2025,1:44,2025-02-14T01:44:00Z,,6,,2,2,,,29.36145,,12.2,,0.265,2.117,2.1873,,,0.155,0.05,,,18.56,,0.06,31.3521,27.676,4.5,16.795,,2.53,2.0721,,,
102.100.100/405315,CSFLB,WQR211_D1,23/06/2025,2:14,2025-06-23T02:14:00Z,,3,,2,2,,,23.388,,16.1,,0.18,0.882,1.0386,,,0.03,0.04,,,22.565,,0.12,34.0382,34.051,1.5,7.395,20.4246,10.9,,,,
102.100.100/405314,CSFLB,WQR211_D1,23/06/2025,2:18,2025-06-23T02:18:00Z,,3,,2,2,,,23.388,,19.8,,0.18,0.882,1.0386,,,0.03,0.04,,,22.565,,0.12,34.0382,34.051,1.5,7.395,20.4246,10.9,,,,
102.100.100/405313,CSFLB,WQR211_D1,23/06/2025,2:19,2025-06-23T02:19:00Z,,3,,2,2,,,23.388,,29.7,,0.18,0.882,1.0386,,,0.03,0.04,,,22.565,,0.12,34.0382,34.051,1.5,7.395,20.4246,10.9,,,,
102.100.100/405312,CSFLB,WQR211_D0,23/06/2025,2:20,2025-06-23T02:20:00Z,,0,,2,2,,,23.426,,2.73,,0.16,0.989,1.0287,,,0.025,0.045,,,21.95,,0.12,34.0375,34.051,1.5,7.58,23.1514,10.26,,,,
102.100.100/405311,CSFLB,WQR211_D0,23/06/2025,2:22,2025-06-23T02:22:00Z,,0,,2,2,,,23.426,,20.5,,0.16,0.989,1.0287,,,0.025,0.045,,,21.95,,0.12,34.0375,34.051,1.5,7.58,23.1514,10.26,,,,
102.100.100/405310,CSFLB,WQR211_D0,23/06/2025,2:23,2025-06-23T02:23:00Z,,0,,2,2,,,23.426,,11,,0.16,0.989,1.0287,,,0.025,0.045,,,21.95,,0.12,34.0375,34.051,1.5,7.58,23.1514,10.26,,,,
102.100.100/138827,CSGNI,WQQ186_D0,13/07/2020,22:40:00,2020-07-13T22:40:00Z,,0.5,39,2,2,,,23.071,,,,0.031,0.146,0.256,,,0.08,BDL,,,4.34,,0.06,35.13,35.117,7,4.88,87.8,0.68,ND,,,
102.100.100/138828,CSGNI,WQQ186_D0,13/07/2020,22:40:00,2020-07-13T22:40:00Z,,0.5,39,2,2,,,23.071,,,,0.031,0.146,0.256,,,0.08,BDL,,,4.34,,0.06,35.13,35.117,7,4.88,87.8,0.68,ND,,,
102.100.100/138829,CSGNI,WQQ186_D0,13/07/2020,22:40:00,2020-07-13T22:40:00Z,,0.5,39,2,2,,,23.071,,,,0.031,0.146,0.256,,,0.08,BDL,,,4.34,,0.06,35.13,35.117,7,4.88,87.8,0.68,ND,,,
102.100.100/138830,CSGNI,WQQ186_D1,13/07/2020,22:45:00,2020-07-13T22:45:00Z,,34,39,2,2,,,23.072,,,,0.0345,0.161,0.257,,,0.06,BDL,,,4.5,,0.06,35.14,35.11,7,4.5,90.2,0.63,ND,,,
102.100.100/138831,CSGNI,WQQ186_D1,13/07/2020,22:45:00,2020-07-13T22:45:00Z,,34,39,2,2,,,23.072,,,,0.0345,0.161,0.257,,,0.06,BDL,,,4.5,,0.06,35.14,35.11,7,4.5,90.2,0.63,ND,,,
102.100.100/138832,CSGNI,WQQ186_D1,13/07/2020,22:45:00,2020-07-13T22:45:00Z,,34,39,2,2,,,23.072,,,,0.0345,0.161,0.257,,,0.06,BDL,,,4.5,,0.06,35.14,35.11,7,4.5,90.2,0.63,ND,,,
102.100.100/138869,CSGNI,WQQ239_D0,28/09/2020,22:40:00,2020-09-28T22:40:00Z,,0.5,40,2,2,,,25.604,,,,0.0065,0.058,ND,,,0.07,BDL,,,3.75,,0.075,35.22,35.255,12,2.23,95.4,0.88,0.73,,,
102.100.100/138870,CSGNI,WQQ239_D0,28/09/2020,22:40:00,2020-09-28T22:40:00Z,,0.5,40,2,2,,,25.604,,,,0.0065,0.058,ND,,,0.07,BDL,,,3.75,,0.075,35.22,35.255,12,2.23,95.4,0.88,0.73,,,
102.100.100/138871,CSGNI,WQQ239_D0,28/09/2020,22:40:00,2020-09-28T22:40:00Z,,0.5,40,2,2,,,25.604,,,,0.0065,0.058,ND,,,0.07,BDL,,,3.75,,0.075,35.22,35.255,12,2.23,95.4,0.88,0.73,,,
102.100.100/138872,CSGNI,WQQ239_D1,28/09/2020,22:45:00,2020-09-28T22:45:00Z,,37.7,40,2,2,,,25.292,,,,0.0137,0.151,0.189,,,0.09,BDL,,,2.81,,0.08,35.22,35.255,12,2.04,94.2,0.76,0.63,,,
102.100.100/138873,CSGNI,WQQ239_D1,28/09/2020,22:45:00,2020-09-28T22:45:00Z,,37.7,40,2,2,,,25.292,,,,0.0137,0.151,0.189,,,0.09,BDL,,,2.81,,0.08,35.22,35.255,12,2.04,94.2,0.76,0.63,,,
102.100.100/138874,CSGNI,WQQ239_D1,28/09/2020,22:45:00,2020-09-28T22:45:00Z,,37.7,40,2,2,,,25.292,,,,0.0137,0.151,0.189,,,0.09,BDL,,,2.81,,0.08,35.22,35.255,12,2.04,94.2,0.76,0.63,,,
102.100.100/138911,CSGNI,WQQ314_D0,14/02/2021,2:45:00,2021-02-14T02:45:00Z,,0.5,40,2,2,,,30.313,,,,BDL,0.113,0.233,,,0.65,BDL,,,4.95,,BDL,33.54,33.557,18,3.77,94.2,BDL,ND,,,
102.100.100/138914,CSGNI,WQQ314_D1,14/02/2021,2:45:00,2021-02-14T02:45:00Z,,36,40,2,2,,,28.79,,,,0.0217,0.243,0.493,,,0.04,BDL,,,3.45,,0.03,34.67,34.662,18,1.27,95.4,0.13,ND,,,
102.100.100/138912,CSGNI,WQQ314_D0,14/02/2021,2:47:00,2021-02-14T02:47:00Z,,0.5,40,2,2,,,30.313,,,,BDL,0.113,0.233,,,0.65,BDL,,,4.95,,BDL,33.54,33.557,18,3.77,94.2,BDL,ND,,,
102.100.100/138915,CSGNI,WQQ314_D1,14/02/2021,2:47:00,2021-02-14T02:47:00Z,,36,40,2,2,,,28.79,,,,0.0217,0.243,0.493,,,0.04,BDL,,,3.45,,0.03,34.67,34.662,18,1.27,95.4,0.13,ND,,,
102.100.100/138913,CSGNI,WQQ314_D0,14/02/2021,2:49:00,2021-02-14T02:49:00Z,,0.5,40,2,2,,,30.313,,,,BDL,0.113,0.233,,,0.65,BDL,,,4.95,,BDL,33.54,33.557,18,3.77,94.2,BDL,ND,,,
102.100.100/138916,CSGNI,WQQ314_D1,14/02/2021,2:49:00,2021-02-14T02:49:00Z,,36,40,2,2,,,28.79,,,,0.0217,0.243,0.493,,,0.04,BDL,,,3.45,,0.03,34.67,34.662,18,1.27,95.4,0.13,ND,,,
102.100.100/138953,CSGNI,WQQ440_D0,2/10/2021,22:46:00,2021-10-02T22:46:00Z,,0,40,2,2,,,25.722,,,,0.165,0.1025,0.0248,,,0.03,BDL,,,3.553,,0.07,35.226,35.228,18,2.115,91.941,0.184,ND,,,
102.100.100/138954,CSGNI,WQQ440_D0,2/10/2021,22:47:00,2021-10-02T22:47:00Z,,0,40,2,2,,,25.722,,,,0.165,0.1025,0.0248,,,0.03,BDL,,,3.553,,0.07,35.226,35.228,18,2.115,91.941,0.184,ND,,,
102.100.100/138955,CSGNI,WQQ440_D0,2/10/2021,22:48:00,2021-10-02T22:48:00Z,,0,40,2,2,,,25.722,,,,0.165,0.1025,0.0248,,,0.03,BDL,,,3.553,,0.07,35.226,35.228,18,2.115,91.941,0.184,ND,,,
102.100.100/138956,CSGNI,WQQ440_D1,2/10/2021,22:49:00,2021-10-02T22:49:00Z,,36,40,2,2,,,25.221,,,,0.195,0.136,0.0847,,,0.08,BDL,,,3.77,,0.08,35.1945,35.195,18,1.12,91.6156,0.279,ND,,,
102.100.100/138957,CSGNI,WQQ440_D1,2/10/2021,22:50:00,2021-10-02T22:50:00Z,,36,40,2,2,,,25.221,,,,0.195,0.136,0.0847,,,0.08,BDL,,,3.77,,0.08,35.1945,35.195,18,1.12,91.6156,0.279,ND,,,
102.100.100/138958,CSGNI,WQQ440_D1,2/10/2021,22:51:00,2021-10-02T22:51:00Z,,36,40,2,2,,,25.221,,,,0.195,0.136,0.0847,,,0.08,BDL,,,3.77,,0.08,35.1945,35.195,18,1.12,91.6156,0.279,ND,,,
102.100.100/142693,CSGNI,WQQ513_D0,11/02/2022,23:41:00,2022-02-11T23:41:00Z,,0,40,2,2,,,29.389,,,,0.32,0.3949,0.0388,,,0.04,BDL,,,4.212,,BDL,33.8043,33.809,22,4.89,96.8452,0.05,ND,,,
102.100.100/142694,CSGNI,WQQ513_D0,11/02/2022,23:42:00,2022-02-11T23:42:00Z,,0,40,2,2,,,29.389,,,,0.32,0.3949,0.0388,,,0.04,BDL,,,4.212,,BDL,33.8043,33.809,22,4.89,96.8452,0.05,ND,,,
102.100.100/142695,CSGNI,WQQ513_D0,11/02/2022,23:43:00,2022-02-11T23:43:00Z,,0,40,2,2,,,29.389,,,,0.32,0.3949,0.0388,,,0.04,BDL,,,4.212,,BDL,33.8043,33.809,22,4.89,96.8452,0.05,ND,,,
102.100.100/142696,CSGNI,WQQ513_D1,11/02/2022,23:45:00,2022-02-11T23:45:00Z,,37,40,2,2,,,29.125,,,,0.185,0.1597,0.3322,,,0.08,0.025,,,4.287,,0.045,34.443,34.456,22,2.375,93.3126,0.334,ND,,,
102.100.100/142697,CSGNI,WQQ513_D1,11/02/2022,23:48:00,2022-02-11T23:48:00Z,,37,40,2,2,,,29.125,,,,0.185,0.1597,0.3322,,,0.08,0.025,,,4.287,,0.045,34.443,34.456,22,2.375,93.3126,0.334,ND,,,
102.100.100/142698,CSGNI,WQQ513_D1,11/02/2022,23:50:00,2022-02-11T23:50:00Z,,37,40,2,2,,,29.125,,,,0.185,0.1597,0.3322,,,0.08,0.025,,,4.287,,0.045,34.443,34.456,22,2.375,93.3126,0.334,ND,,,
102.100.100/142738,CSGNI,WQQ579_D1,7/06/2022,23:35:00,2022-06-07T23:35:00Z,,35,39,2,2,,,26.815,,7.17,,0.475,0.4014,0.645,,,ND,ND,,,5.47,,0.2,34.8366,34.877,11,4.635,72.4655,1.709,1.9058,,,
102.100.100/142739,CSGNI,WQQ579_D1,7/06/2022,23:41:00,2022-06-07T23:41:00Z,,35,39,2,2,,,26.815,,21.3,,0.475,0.4014,0.645,,,ND,ND,,,5.47,,0.2,34.8366,34.877,11,4.635,72.4655,1.709,1.9058,,,
102.100.100/142740,CSGNI,WQQ579_D1,7/06/2022,23:45:00,2022-06-07T23:45:00Z,,35,39,2,2,,,26.815,,10.5,,0.475,0.4014,0.645,,,ND,ND,,,5.47,,0.2,34.8366,34.877,11,4.635,72.4655,1.709,1.9058,,,
102.100.100/142735,CSGNI,WQQ579_D0,7/06/2022,23:50:00,2022-06-07T23:50:00Z,,0,39,2,2,,,26.316,,3.73,,BDL,0.2654,0.3469,,,0.035,0.025,,,4.742,,0.035,34.1676,34.156,11,2.78,91.3689,0.169,0.4197,,,
102.100.100/142736,CSGNI,WQQ579_D0,7/06/2022,23:51:00,2022-06-07T23:51:00Z,,0,39,2,2,,,26.316,,7.7,,BDL,0.2654,0.3469,,,0.035,0.025,,,4.742,,0.035,34.1676,34.156,11,2.78,91.3689,0.169,0.4197,,,
102.100.100/142737,CSGNI,WQQ579_D0,7/06/2022,23:52:00,2022-06-07T23:52:00Z,,0,39,2,2,,,26.316,,21.4,,BDL,0.2654,0.3469,,,0.035,0.025,,,4.742,,0.035,34.1676,34.156,11,2.78,91.3689,0.169,0.4197,,,
102.100.100/142777,CSGNI,WQQ640_D0,2/11/2022,0:11:00,2022-11-02T00:11:00Z,,0,36,2,2,,,28.592,,,,0.655,0.095625,0.1739,,,0.04,0.045,,,3.823335,,0.05,35.0109,35.05528,15,2.25,75.8786,0.095,73.0377,,,
102.100.100/142778,CSGNI,WQQ640_D0,2/11/2022,0:13:00,2022-11-02T00:13:00Z,,0,36,2,2,,,28.592,,,,0.655,0.095625,0.1739,,,0.04,0.045,,,3.823335,,0.05,35.0109,35.05528,15,2.25,75.8786,0.095,73.0377,,,
102.100.100/142779,CSGNI,WQQ640_D0,2/11/2022,0:16:00,2022-11-02T00:16:00Z,no bacterial flow cytometry data - instrument error,0,36,2,2,,,28.592,,,,0.655,0.095625,0.1739,,,0.04,0.045,,,3.823335,,0.05,35.0109,35.05528,15,2.25,75.8786,0.095,73.0377,,,
102.100.100/142780,CSGNI,WQQ640_D1,2/11/2022,0:21:00,2022-11-02T00:21:00Z,,34,36,2,2,,,28.49,,,,0.16,0.14775,0.5288,,,0.035,0.01,,,4.323335,,0.06,34.978,34.99578,15,1.735,90.5035,0.3,0.4771,,,
102.100.100/142781,CSGNI,WQQ640_D1,2/11/2022,0:25:00,2022-11-02T00:25:00Z,,34,36,2,2,,,28.49,,,,0.16,0.14775,0.5288,,,0.035,0.01,,,4.323335,,0.06,34.978,34.99578,15,1.735,90.5035,0.3,0.4771,,,
102.100.100/142782,CSGNI,WQQ640_D1,2/11/2022,0:29:00,2022-11-02T00:29:00Z,,34,36,2,2,,,28.49,,,,0.16,0.14775,0.5288,,,0.035,0.01,,,4.323335,,0.06,34.978,34.99578,15,1.735,90.5035,0.3,0.4771,,,
102.100.100/400508,CSGNI,WQQ713_D1,23/02/2023,0:01:00,2023-02-23T00:01:00Z,,35,38,2,2,,,28.71,,13.9,,0.405,0.278915,ND,,,0.135,0.045,,,3.39,,0.045,33.7819,33.77491,8,3.4,92.1616,0.365,ND,,,
102.100.100/400503,CSGNI,WQQ713_D0,23/02/2023,23:48:00,2023-02-23T23:48:00Z,,0,38,2,2,,,28.5,,10.9,,0.12,0.409615,ND,,,0.135,0.015,,,6.59,,0.035,32.4911,32.61024,8,8.45,89.4325,0.49,ND,,,
102.100.100/400504,CSGNI,WQQ713_D0,23/02/2023,23:50:00,2023-02-23T23:50:00Z,,0,38,2,2,,,28.5,,13.5,,0.12,0.409615,ND,,,0.135,0.015,,,6.59,,0.035,32.4911,32.61024,8,8.45,89.4325,0.49,ND,,,
102.100.100/400505,CSGNI,WQQ713_D0,23/02/2023,23:52:00,2023-02-23T23:52:00Z,,0,38,2,2,,,28.5,,22,,0.12,0.409615,ND,,,0.135,0.015,,,6.59,,0.035,32.4911,32.61024,8,8.45,89.4325,0.49,ND,,,
102.100.100/400506,CSGNI,WQQ713_D1,23/02/2023,23:56:00,2023-02-23T23:56:00Z,,35,38,2,2,,,28.71,,11.8,,0.405,0.278915,ND,,,0.135,0.045,,,3.39,,0.045,33.7819,33.77491,8,3.4,92.1616,0.365,ND,,,
102.100.100/400507,CSGNI,WQQ713_D1,23/02/2023,23:59:00,2023-02-23T23:59:00Z,,35,38,2,2,,,28.71,,12.4,,0.405,0.278915,ND,,,0.135,0.045,,,3.39,,0.045,33.7819,33.77491,8,3.4,92.1616,0.365,ND,,,
102.100.100/400545,CSGNI,WQQ779_D0,21/06/2023,0:12:00,2023-06-21T00:12:00Z,,0,39.5,1.6,1.6,,,25.811,,2.49,,0.435,0.11527,0.1426,,,0.015,0.01,,,3.14,,0.105,34.877,34.89518,10,1.39,96.8924,0.09,ND,,,
102.100.100/400546,CSGNI,WQQ779_D0,21/06/2023,0:14:00,2023-06-21T00:14:00Z,,0,39.5,2,2,,,25.811,,2.19,,0.435,0.11527,0.1426,,,0.015,0.01,,,3.14,,0.105,34.877,34.89518,10,1.39,96.8924,0.09,ND,,,
102.100.100/400547,CSGNI,WQQ779_D0,21/06/2023,0:16:00,2023-06-21T00:16:00Z,,0,39.5,2,2,,,25.811,,2.13,,0.435,0.11527,0.1426,,,0.015,0.01,,,3.14,,0.105,34.877,34.89518,10,1.39,96.8924,0.09,ND,,,
102.100.100/400548,CSGNI,WQQ779_D1,21/06/2023,0:22:00,2023-06-21T00:22:00Z,,36,39.5,2,2,,,25.745,,3.43,,0.4,0.210985,0.8939,,,0.02,0.01,,,3.948335,,0.105,34.8827,34.90337,10,1.49,93.7433,0.305,ND,,,
102.100.100/400549,CSGNI,WQQ779_D1,21/06/2023,0:24:00,2023-06-21T00:24:00Z,,36,39.5,2,2,,,25.745,,3.54,,0.4,0.210985,0.8939,,,0.02,0.01,,,3.948335,,0.105,34.8827,34.90337,10,1.49,93.7433,0.305,ND,,,
102.100.100/400550,CSGNI,WQQ779_D1,21/06/2023,0:27:00,2023-06-21T00:27:00Z,,36,39.5,2,2,,,25.745,,4.33,,0.4,0.210985,0.8939,,,0.02,0.01,,,3.948335,,0.105,34.8827,34.90337,10,1.49,93.7433,0.305,ND,,,
102.100.100/403472,CSGNI,WQQ840_D0,25/10/2023,22:14:00,2023-10-25T22:14:00Z,no picoplankton flow cytometry data - instrument error,0,,2,2,,,26.273,,2.94,,0.325,0.056,0.0732,,,0.065,0.015,,,3.59,,0.11,35.2153,35.231,19.5,1.895,95.0334,0.255,,,,
102.100.100/403473,CSGNI,WQQ840_D0,25/10/2023,22:15:00,2023-10-25T22:15:00Z,,0,,2,2,,,26.273,,2.32,,0.325,0.056,0.0732,,,0.065,0.015,,,3.59,,0.11,35.2153,35.231,19.5,1.895,95.0334,0.255,,,,
102.100.100/403474,CSGNI,WQQ840_D0,25/10/2023,22:17:00,2023-10-25T22:17:00Z,,0,,2,2,,,26.273,,3.57,,0.325,0.056,0.0732,,,0.065,0.015,,,3.59,,0.11,35.2153,35.231,19.5,1.895,95.0334,0.255,,,,
102.100.100/403475,CSGNI,WQQ840_D1,25/10/2023,22:20:00,2023-10-25T22:20:00Z,,36,,2,2,,,25.993,,6.58,,0.275,0.1025,0.1399,,,0.08,0.01,,,3.84,,0.11,35.2227,35.229,19.5,2.805,91.5787,0.42,,,,
102.100.100/403476,CSGNI,WQQ840_D1,25/10/2023,22:24:00,2023-10-25T22:24:00Z,,36,,2,2,,,25.993,,3.78,,0.275,0.1025,0.1399,,,0.08,0.01,,,3.84,,0.11,35.2227,35.229,19.5,2.805,91.5787,0.42,,,,
102.100.100/403477,CSGNI,WQQ840_D1,25/10/2023,22:27:00,2023-10-25T22:27:00Z,,36,,2,2,,,25.993,,7.12,,0.275,0.1025,0.1399,,,0.08,0.01,,,3.84,,0.11,35.2227,35.229,19.5,2.805,91.5787,0.42,,,,
102.100.100/403508,CSGNI,WQQ913_D0,20/02/2024,23:38:00,2024-02-20T23:38:00Z,,0,,2,2,,,0,,6.04,,0.24,0.1645,0.265,,,0.025,0.01,,,5.955,,0.045,31.6694,32.092,17,12.535,,0.225,0.3622,,,
102.100.100/403509,CSGNI,WQQ913_D0,20/02/2024,23:38:00,2024-02-20T23:38:00Z,,0,,2,2,,,0,,5.68,,0.24,0.1645,0.265,,,0.025,0.01,,,5.955,,0.045,31.6694,32.092,17,12.535,,0.225,0.3622,,,
102.100.100/403510,CSGNI,WQQ913_D0,20/02/2024,23:38:00,2024-02-20T23:38:00Z,,0,,2,2,,,0,,5.41,,0.24,0.1645,0.265,,,0.025,0.01,,,5.955,,0.045,31.6694,32.092,17,12.535,,0.225,0.3622,,,
102.100.100/403579,CSGNI,WQQ913_D1,20/02/2024,23:38:00,2024-02-20T23:38:00Z,,38,,2,2,,,0,,6.24,,0.455,0.342,0.7014,,,0.58,0.4,,,6.075,,0.18,34.8847,34.512,17,3.68,,0.37,0.7994,,,
102.100.100/403580,CSGNI,WQQ913_D1,20/02/2024,23:38:00,2024-02-20T23:38:00Z,,38,,2,2,,,0,,7.24,,0.455,0.342,0.7014,,,0.58,0.4,,,6.075,,0.18,34.8847,34.512,17,3.68,,0.37,0.7994,,,
102.100.100/403581,CSGNI,WQQ913_D1,20/02/2024,23:38:00,2024-02-20T23:38:00Z,,38,,2,2,,,0,,6.97,,0.455,0.342,0.7014,,,0.58,0.4,,,6.075,,0.18,34.8847,34.512,17,3.68,,0.37,0.7994,,,
102.100.100/403612,CSGNI,WQQ979_D0,8/06/2024,23:45:00,2024-06-08T23:45:00Z,,0,,2,2,,,24.493,,9.16,,0.14,0.1375,0.1337,,,0.035,0.01,,,4.43,,0.08,34.9932,35.01,7,4.585,89.7545,0,1.8168,,,
102.100.100/403613,CSGNI,WQQ979_D0,8/06/2024,23:45:00,2024-06-08T23:45:00Z,,0,,2,2,,,24.493,,8.96,,0.14,0.1375,0.1337,,,0.035,0.01,,,4.43,,0.08,34.9932,35.01,7,4.585,89.7545,0,1.8168,,,
102.100.100/403614,CSGNI,WQQ979_D0,8/06/2024,23:45:00,2024-06-08T23:45:00Z,,0,,2,2,,,24.493,,9.7,,0.14,0.1375,0.1337,,,0.035,0.01,,,4.43,,0.08,34.9932,35.01,7,4.585,89.7545,0,1.8168,,,
102.100.100/403615,CSGNI,WQQ979_D1,8/06/2024,23:45:00,2024-06-08T23:45:00Z,,34.5,,2,2,,,24.978,,6.57,,0.175,0.1265,0.2488,,,0.02,0.01,,,3.655,,0.1,35.3149,35.297,7,1.66,94.0542,0,1.2808,,,
102.100.100/403616,CSGNI,WQQ979_D1,8/06/2024,23:45:00,2024-06-08T23:45:00Z,,34.5,,2,2,,,24.978,,7.62,,0.175,0.1265,0.2488,,,0.02,0.01,,,3.655,,0.1,35.3149,35.297,7,1.66,94.0542,0,1.2808,,,
102.100.100/403617,CSGNI,WQQ979_D1,8/06/2024,23:45:00,2024-06-08T23:45:00Z,,34.5,,2,2,,,24.978,,6.54,,0.175,0.1265,0.2488,,,0.02,0.01,,,3.655,,0.1,35.3149,35.297,7,1.66,94.0542,0,1.2808,,,
102.100.100/404260,CSGNI,WQR051_D1,25/10/2024,23:36,2024-10-25T23:36:00Z,,34,,2,2,,,26.672,,5.09,,0.155,0.125,0.1414,,,0.01,0.01,,,3.24,,0.095,35.3203,35.365,15,1.27,93.7583,0.35,1.1546,,,
102.100.100/404261,CSGNI,WQR051_D1,25/10/2024,23:38,2024-10-25T23:38:00Z,,34,,2,2,,,26.672,,3.89,,0.155,0.125,0.1414,,,0.01,0.01,,,3.24,,0.095,35.3203,35.365,15,1.27,93.7583,0.35,1.1546,,,
102.100.100/404262,CSGNI,WQR051_D1,25/10/2024,23:42,2024-10-25T23:42:00Z,,34,,2,2,,,26.672,,6.15,,0.155,0.125,0.1414,,,0.01,0.01,,,3.24,,0.095,35.3203,35.365,15,1.27,93.7583,0.35,1.1546,,,
102.100.100/404257,CSGNI,WQR051_D0,25/10/2024,23:45,2024-10-25T23:45:00Z,,0,,2,2,,,27.349,,4.07,,0.205,0.073,0.0647,,,0.015,0.01,,,3.54,,0.07,35.4256,35.476,15,1.655,94.9845,0.085,0.8545,,,
102.100.100/404258,CSGNI,WQR051_D0,25/10/2024,23:47,2024-10-25T23:47:00Z,,0,,2,2,,,27.349,,6.46,,0.205,0.073,0.0647,,,0.015,0.01,,,3.54,,0.07,35.4256,35.476,15,1.655,94.9845,0.085,0.8545,,,
102.100.100/404259,CSGNI,WQR051_D0,25/10/2024,23:49,2024-10-25T23:49:00Z,,0,,1.8,1.8,,,27.349,,1.14,,0.205,0.073,0.0647,,,0.015,0.01,,,3.54,,0.07,35.4256,35.476,15,1.655,94.9845,0.085,0.8545,,,
102.100.100/404296,CSGNI,WQR134_D0,12/02/2025,23:17,2025-02-12T23:17:00Z,,0,,2,2,,,28.40206,,26,,0.125,0.796,#N/A,,,0.055,0.02,,,15.495,,0.055,23.8107,24.608,6,17.68,,0.72,,,,
102.100.100/404470,CSGNI,WQR134_D0,12/02/2025,23:19,2025-02-12T23:19:00Z,,0,,2,2,,,28.40206,,19.7,,0.125,0.796,#N/A,,,0.055,0.02,,,15.495,,0.055,23.8107,24.608,6,17.68,,0.72,,,,
102.100.100/404471,CSGNI,WQR134_D0,12/02/2025,23:21,2025-02-12T23:21:00Z,,0,,2,2,,,28.40206,,24.6,,0.125,0.796,#N/A,,,0.055,0.02,,,15.495,,0.055,23.8107,24.608,6,17.68,,0.72,,,,
102.100.100/404472,CSGNI,WQR134_D1,12/02/2025,23:27,2025-02-12T23:27:00Z,,16,,2,2,,,28.74283,,3.72,,0.205,0.33,0.2418,,,0.665,1.545,,,3.275,,0.17,34.4675,34.389,6,4.515,,0.575,0.5673,,,
102.100.100/404473,CSGNI,WQR134_D1,12/02/2025,23:29,2025-02-12T23:29:00Z,,16,,2,2,,,28.74283,,11.7,,0.205,0.33,0.2418,,,0.665,1.545,,,3.275,,0.17,34.4675,34.389,6,4.515,,0.575,0.5673,,,
102.100.100/404474,CSGNI,WQR134_D1,12/02/2025,23:30,2025-02-12T23:30:00Z,,16,,2,2,,,28.74283,,11.6,,0.205,0.33,0.2418,,,0.665,1.545,,,3.275,,0.17,34.4675,34.389,6,4.515,,0.575,0.5673,,,
102.100.100/405280,CSGNI,WQR210_D0,21/06/2025,22:14,2025-06-21T22:14:00Z,,0,,2,2,,,24.4382,,13.7,,0.18,0.2105,0.3224,,,0.05,0.01,,,4.035,,0.06,34.8168,34.825,10,2.52,91.9407,0.41,,,,
102.100.100/405281,CSGNI,WQR210_D0,21/06/2025,22:16,2025-06-21T22:16:00Z,,0,,2,2,,,24.4382,,12,,0.18,0.2105,0.3224,,,0.05,0.01,,,4.035,,0.06,34.8168,34.825,10,2.52,91.9407,0.41,,,,
102.100.100/405282,CSGNI,WQR210_D0,21/06/2025,22:18,2025-06-21T22:18:00Z,,0,,2,2,,,24.4382,,8.06,,0.18,0.2105,0.3224,,,0.05,0.01,,,4.035,,0.06,34.8168,34.825,10,2.52,91.9407,0.41,,,,
102.100.100/405283,CSGNI,WQR210_D1,21/06/2025,22:20,2025-06-21T22:20:00Z,,34,,2,2,,,24.2932,,10.2,,0.19,0.1865,0.3533,,,0.04,0.0075,,,4.695,,0.07,34.8659,34.89,10,2.12,90.791,0.79,,,,
102.100.100/405284,CSGNI,WQR210_D1,21/06/2025,22:22,2025-06-21T22:22:00Z,,34,,2,2,,,24.2932,,3.79,,0.19,0.1865,0.3533,,,0.04,0.0075,,,4.695,,0.07,34.8659,34.89,10,2.12,90.791,0.79,,,,
102.100.100/405285,CSGNI,WQR210_D1,21/06/2025,22:24,2025-06-21T22:24:00Z,,34,,2,2,,,24.2932,,10.7,,0.19,0.1865,0.3533,,,0.04,0.0075,,,4.695,,0.07,34.8659,34.89,10,2.12,90.791,0.79,,,,
102.100.100/138991,CSHOB,EPA VIC Site_Id 1991,23/06/2020,23:15:00,2020-06-23T23:15:00Z,,2,,,,,,12.4196,,28.41,1.66,0.286,1.1,,,1.1469,0.857,1.43e-01,258.266,94.2,,8.286,1.84,35.2353,,4,2.996,,2.7,0.7948,0.714,2.4e-05,8e-06
102.100.100/138992,CSHOB,EPA VIC Site_Id 1991,23/06/2020,23:18:00,2020-06-23T23:18:00Z,,2,,,,,,12.4196,,13.96,1.79,0.286,1.1,,,1.1469,0.857,1.43e-01,258.266,94.2,,8.286,1.84,35.2353,,4,2.996,,2.7,0.7948,0.714,2.4e-05,8e-06
102.100.100/138993,CSHOB,EPA VIC Site_Id 1991,23/06/2020,23:24:00,2020-06-23T23:24:00Z,,2,,,,,,12.4196,,13.37,1.83,0.286,1.1,,,1.1469,0.857,1.43e-01,258.266,94.2,,8.286,1.84,35.2353,,4,2.996,,2.7,0.7948,0.714,2.4e-05,8e-06
102.100.100/138994,CSHOB,EPA VIC Site_Id 1991,29/07/2020,22:50:00,2020-07-29T22:50:00Z,flow cytometry sample not collected,2,,,,,,12.2199,,17,1.44,0.643,0.5,,,0.9233,0.428,1.43e-01,246.14,15.291,,8.018,1.937,36.056,,3,3.994,,4.8,1.3697,0.286,2.1e-05,7e-06
102.100.100/138995,CSHOB,EPA VIC Site_Id 1991,29/07/2020,22:55:00,2020-07-29T22:55:00Z,flow cytometry sample not collected,2,,,,,,12.2199,,7.268,1.65,0.643,0.5,,,0.9233,0.428,1.43e-01,246.14,15.291,,8.018,1.937,36.056,,3,3.994,,4.8,1.3697,0.286,2.1e-05,7e-06
102.100.100/138996,CSHOB,EPA VIC Site_Id 1991,29/07/2020,23:00:00,2020-07-29T23:00:00Z,flow cytometry sample not collected,2,,,,,,12.2199,,7.184,1.57,0.643,0.5,,,0.9233,0.428,1.43e-01,246.14,15.291,,8.018,1.937,36.056,,3,3.994,,4.8,1.3697,0.286,2.1e-05,7e-06
102.100.100/139000,CSHOB,EPA VIC Site_Id 1991,16/09/2020,1:15:00,2020-09-16T01:15:00Z,,2,,,,,,,,13.95,1.59,,,,,,,,,,,,,,,,,,0.9,0.5281,,,
102.100.100/139001,CSHOB,EPA VIC Site_Id 1991,16/09/2020,1:18:00,2020-09-16T01:18:00Z,,2,,,,,,,,9.883,1.73,,,,,,,,,,,,,,,,,,0.9,0.5281,,,
102.100.100/139002,CSHOB,EPA VIC Site_Id 1991,16/09/2020,1:21:00,2020-09-16T01:21:00Z,,2,,,,,,,,28.14,1.96,,,,,,,,,,,,,,,,,,0.9,0.5281,,,
102.100.100/139006,CSHOB,EPA VIC Site_Id 1991,21/10/2020,23:30:00,2020-10-21T23:30:00Z,,2,,,,,,16.2362,,18.1,2.08,0.785,0.5,,,2.0095,0.5,3.57e-01,255.11,61.061,,8.574,2.131,33.0389,,2.5,4.827,,9.2,1.9416,0.143,4.2e-05,8e-06
102.100.100/139007,CSHOB,EPA VIC Site_Id 1991,21/10/2020,23:35:00,2020-10-21T23:35:00Z,,2,,,,,,16.2362,,9.446,2.53,0.785,0.5,,,2.0095,0.5,3.57e-01,255.11,61.061,,8.574,2.131,33.0389,,2.5,4.827,,9.2,1.9416,0.143,4.2e-05,8e-06
102.100.100/139008,CSHOB,EPA VIC Site_Id 1991,21/10/2020,23:40:00,2020-10-21T23:40:00Z,,2,,,,,,16.2362,,56.7,1.94,0.785,0.5,,,2.0095,0.5,3.57e-01,255.11,61.061,,8.574,2.131,33.0389,,2.5,4.827,,9.2,1.9416,0.143,4.2e-05,8e-06
102.100.100/139012,CSHOB,EPA VIC Site_Id 1991,24/11/2020,21:20:00,2020-11-24T21:20:00Z,,2,,,,,,18.9324,,14.31,2.15,1,1.6,,,1.7114,0.785,1.43e-01,212.795,38.826,,8.262,1.55,34.0725,,2.5,4.161,,4.5,1.7907,0.643,2.9e-05,7e-06
102.100.100/139013,CSHOB,EPA VIC Site_Id 1991,24/11/2020,21:23:00,2020-11-24T21:23:00Z,,2,,,,,,18.9324,,16.96,2.25,1,1.6,,,1.7114,0.785,1.43e-01,212.795,38.826,,8.262,1.55,34.0725,,2.5,4.161,,4.5,1.7907,0.643,2.9e-05,7e-06
102.100.100/139014,CSHOB,EPA VIC Site_Id 1991,24/11/2020,21:26:00,2020-11-24T21:26:00Z,,2,,,,,,18.9324,,44.65,2.02,1,1.6,,,1.7114,0.785,1.43e-01,212.795,38.826,,8.262,1.55,34.0725,,2.5,4.161,,4.5,1.7907,0.643,2.9e-05,7e-06
102.100.100/139018,CSHOB,EPA VIC Site_Id 1991,15/12/2020,21:18:00,2020-12-15T21:18:00Z,,2,,,,,,19.8605,,53.6,1.97,0.428,0.5,,,0.7534,0.714,7.14e-02,226.827,315.55,,8.245,1.743,34.437,,3,2.663,,3,0.9145,0.643,3e-05,8e-06
102.100.100/139019,CSHOB,EPA VIC Site_Id 1991,15/12/2020,21:24:00,2020-12-15T21:24:00Z,,2,,,,,,19.8605,,63.56,1.85,0.428,0.5,,,0.7534,0.714,7.14e-02,226.827,315.55,,8.245,1.743,34.437,,3,2.663,,3,0.9145,0.643,3e-05,8e-06
102.100.100/139020,CSHOB,EPA VIC Site_Id 1991,15/12/2020,21:27:00,2020-12-15T21:27:00Z,,2,,,,,,19.8605,,75.26,1.89,0.428,0.5,,,0.7534,0.714,7.14e-02,226.827,315.55,,8.245,1.743,34.437,,3,2.663,,3,0.9145,0.643,3e-05,8e-06
102.100.100/139024,CSHOB,EPA VIC Site_Id 1991,25/02/2021,0:59:00,2021-02-25T00:59:00Z,,2,,,,,,,,27.02,1.71,,,,,,,,,,,,,,,,,,6.2,0.9952,,,
102.100.100/139025,CSHOB,EPA VIC Site_Id 1991,25/02/2021,2:02:00,2021-02-25T02:02:00Z,,2,,,,,,,,135.5,1.64,,,,,,,,,,,,,,,,,,6.2,0.9952,,,
102.100.100/139026,CSHOB,EPA VIC Site_Id 1991,25/02/2021,2:05:00,2021-02-25T02:05:00Z,,2,,,,,,,,28.56,1.63,,,,,,,,,,,,,,,,,,6.2,0.9952,,,
102.100.100/139030,CSHOB,EPA VIC Site_Id 1991,8/04/2021,0:52:00,2021-04-08T00:52:00Z,,2,,,,,,,,5.655,3.92,,,,,,,,,,,,,,,,,,20,1.3024,,,
102.100.100/139031,CSHOB,EPA VIC Site_Id 1991,8/04/2021,0:55:00,2021-04-08T00:55:00Z,,2,,,,,,,,44,1.77,,,,,,,,,,,,,,,,,,20,1.3024,,,
102.100.100/139032,CSHOB,EPA VIC Site_Id 1991,8/04/2021,1:00:00,2021-04-08T01:00:00Z,,2,,,,,,,,57.29,1.94,,,,,,,,,,,,,,,,,,20,1.3024,,,
102.100.100/139036,CSHOB,EPA VIC Site_Id 1991,21/05/2021,5:50:00,2021-05-21T05:50:00Z,,2,,,,,,13.8862,,19.75,1.53,0.571,6.9,,,3.851,0.214,2.14e-01,277.955,180.47,,8.422,2.002,35.3774,,2.5,3.495,,6.5,1.168,0,2.4e-05,1e-05
102.100.100/139037,CSHOB,EPA VIC Site_Id 1991,21/05/2021,5:53:00,2021-05-21T05:53:00Z,,2,,,,,,13.8862,,27,1.89,0.571,6.9,,,3.851,0.214,2.14e-01,277.955,180.47,,8.422,2.002,35.3774,,2.5,3.495,,6.5,1.168,0,2.4e-05,1e-05
102.100.100/139038,CSHOB,EPA VIC Site_Id 1991,21/05/2021,5:56:00,2021-05-21T05:56:00Z,,2,,,,,,13.8862,,22.44,1.94,0.571,6.9,,,3.851,0.214,2.14e-01,277.955,180.47,,8.422,2.002,35.3774,,2.5,3.495,,6.5,1.168,0,2.4e-05,1e-05
102.100.100/139043,CSHOB,EPA VIC Site_Id 1991,30/06/2021,4:27:00,2021-06-30T04:27:00Z,,2,,,,,,,,58.08,2.01,,,,,,,,,,,,,,,,,,,,,,
102.100.100/139044,CSHOB,EPA VIC Site_Id 1991,30/06/2021,4:30:00,2021-06-30T04:30:00Z,,2,,,,,,,,62.5,1.89,,,,,,,,,,,,,,,,,,,,,,
102.100.100/139045,CSHOB,EPA VIC Site_Id 1991,30/06/2021,4:34:00,2021-06-30T04:34:00Z,no sample in vial for flow cytometry,2,,,,,,,,51.01,2.05,,,,,,,,,,,,,,,,,,,,,,
102.100.100/139049,CSHOB,EPA VIC Site_Id 1991,29/07/2021,2:59:00,2021-07-29T02:59:00Z,,2,,,,,,,,46.16,1.98,,,,,,,,,,,,,,,,,,,,,,
102.100.100/139050,CSHOB,EPA VIC Site_Id 1991,29/07/2021,3:02:00,2021-07-29T03:02:00Z,,2,,,,,,,,40.45,1.97,,,,,,,,,,,,,,,,,,,,,,
102.100.100/139051,CSHOB,EPA VIC Site_Id 1991,29/07/2021,3:05:00,2021-07-29T03:05:00Z,,2,,,,,,,,40.43,2.04,,,,,,,,,,,,,,,,,,,,,,
102.100.100/139055,CSHOB,EPA VIC Site_Id 1991,1/09/2021,0:00:00,2021-09-01T00:00:00Z,,2,,,,,,,,26.22,1.9,,,,,,,,,,,,,,,,,,,,,,
102.100.100/139056,CSHOB,EPA VIC Site_Id 1991,1/09/2021,0:03:00,2021-09-01T00:03:00Z,,2,,,,,,,,20.04,2.04,,,,,,,,,,,,,,,,,,,,,,
102.100.100/139057,CSHOB,EPA VIC Site_Id 1991,1/09/2021,0:06:00,2021-09-01T00:06:00Z,,2,,,,,,,,35.34,2,,,,,,,,,,,,,,,,,,,,,,
102.100.100/400580,CSHOB,EPA VIC Site_Id 1991,21/09/2021,22:10:00,2021-09-21T22:10:00Z,,2,,,,,,12.4058,,26.73,1.85,0.857,1.3,,,1.9742,0.5,1.43e-01,262.641,138.88,,8.233,1.324,34.1664,,2,3.828,,3.7,2.1853,0.357,2.2e-05,6e-06
102.100.100/400581,CSHOB,EPA VIC Site_Id 1991,21/09/2021,22:10:00,2021-09-21T22:10:00Z,,2,,,,,,12.4058,,61.2,1.8,0.857,1.3,,,1.9742,0.5,1.43e-01,262.641,138.88,,8.233,1.324,34.1664,,2,3.828,,3.7,2.1853,0.357,2.2e-05,6e-06
102.100.100/400582,CSHOB,EPA VIC Site_Id 1991,21/09/2021,22:10:00,2021-09-21T22:10:00Z,,2,,,,,,12.4058,,12.39,2.29,0.857,1.3,,,1.9742,0.5,1.43e-01,262.641,138.88,,8.233,1.324,34.1664,,2,3.828,,3.7,2.1853,0.357,2.2e-05,6e-06
102.100.100/400586,CSHOB,EPA VIC Site_Id 1991,12/10/2021,3:45:00,2021-10-12T03:45:00Z,,2,,,,,,15.4236,,73.37,1.92,0.214,0.8,,,1.493,0.571,1.43e-01,264.454,329.94,,8.971,1.614,33.7388,,2.5,3.329,,3.3,0.92,0.428,2.9e-05,6e-06
102.100.100/400587,CSHOB,EPA VIC Site_Id 1991,12/10/2021,3:45:00,2021-10-12T03:45:00Z,,2,,,,,,15.4236,,33.89,1.92,0.214,0.8,,,1.493,0.571,1.43e-01,264.454,329.94,,8.971,1.614,33.7388,,2.5,3.329,,3.3,0.92,0.428,2.9e-05,6e-06
102.100.100/400588,CSHOB,EPA VIC Site_Id 1991,12/10/2021,3:45:00,2021-10-12T03:45:00Z,,2,,,,,,15.4236,,121,1.93,0.214,0.8,,,1.493,0.571,1.43e-01,264.454,329.94,,8.971,1.614,33.7388,,2.5,3.329,,3.3,0.92,0.428,2.9e-05,6e-06
102.100.100/400592,CSHOB,EPA VIC Site_Id 1991,5/11/2021,3:04:00,2021-11-05T03:04:00Z,,2,,,,,,16.9207,,42.99,2.13,0.5,1.1,,,2.6629,0.714,1.43e-01,225.733,1016,,8.103,1.517,25.9747,,1,5.159,,2.6,6.9207,0.571,2.2e-05,7e-06
102.100.100/400593,CSHOB,EPA VIC Site_Id 1991,5/11/2021,3:09:00,2021-11-05T03:09:00Z,,2,,,,,,16.9207,,25.3,1.96,0.5,1.1,,,2.6629,0.714,1.43e-01,225.733,1016,,8.103,1.517,25.9747,,1,5.159,,2.6,6.9207,0.571,2.2e-05,7e-06
102.100.100/400594,CSHOB,EPA VIC Site_Id 1991,5/11/2021,3:11:00,2021-11-05T03:11:00Z,,2,,,,,,16.9207,,62.75,2,0.5,1.1,,,2.6629,0.714,1.43e-01,225.733,1016,,8.103,1.517,25.9747,,1,5.159,,2.6,6.9207,0.571,2.2e-05,7e-06
102.100.100/400598,CSHOB,EPA VIC Site_Id 1991,20/12/2021,1:22:00,2021-12-20T01:22:00Z,,2,,,,,,19.7567,,86.86,1.98,0.356971511,1.3,,,0.9674,0.142788604,0.142788604,236.7960498,361.58,,8.033,1.614269523,33.4858,,4.5,6.158455393,,,,,,
102.100.100/400599,CSHOB,EPA VIC Site_Id 1991,20/12/2021,1:25:00,2021-12-20T01:25:00Z,,2,,,,,,19.7567,,166.5,1.91,0.356971511,1.3,,,0.9674,0.142788604,0.142788604,236.7960498,361.58,,8.033,1.614269523,33.4858,,4.5,6.158455393,,,,,,
102.100.100/400600,CSHOB,EPA VIC Site_Id 1991,20/12/2021,1:28:00,2021-12-20T01:28:00Z,,2,,,,,,19.7567,,242.7,1.88,0.356971511,1.3,,,0.9674,0.142788604,0.142788604,236.7960498,361.58,,8.033,1.614269523,33.4858,,4.5,6.158455393,,,,,,
102.100.100/400604,CSHOB,EPA VIC Site_Id 1991,24/01/2022,20:30:00,2022-01-24T20:30:00Z,,2,,,,,,24.5798,,,,0.428,0.5,,,1.2094,0.286,1.43e-01,215.638,384.15,,8.02,1.679,34.0308,,3.5,3.162,,0.9,0.5281,0.143,2.4e-05,7e-06
102.100.100/400605,CSHOB,EPA VIC Site_Id 1991,24/01/2022,20:35:00,2022-01-24T20:35:00Z,,2,,,,,,24.5798,,,,0.428,0.5,,,1.2094,0.286,1.43e-01,215.638,384.15,,8.02,1.679,34.0308,,3.5,3.162,,0.9,0.5281,0.143,2.4e-05,7e-06
102.100.100/400606,CSHOB,EPA VIC Site_Id 1991,24/01/2022,20:38:00,2022-01-24T20:38:00Z,,2,,,,,,24.5798,,,,0.428,0.5,,,1.2094,0.286,1.43e-01,215.638,384.15,,8.02,1.679,34.0308,,3.5,3.162,,0.9,0.5281,0.143,2.4e-05,7e-06
102.100.100/400610,CSHOB,EPA VIC Site_Id 1991,14/02/2022,21:42:00,2022-02-14T21:42:00Z,,2,,,,,,22.3684,,,,0.428,1.6,,,2.0975,0.643,1.43e-01,214.045,53.627,,8.059,2.002,34.2164,,1.5,1.664,,4.3,1.8517,0.5,2.1e-05,7e-06
102.100.100/400611,CSHOB,EPA VIC Site_Id 1991,14/02/2022,21:45:00,2022-02-14T21:45:00Z,,2,,,,,,22.3684,,,,0.428,1.6,,,2.0975,0.643,1.43e-01,214.045,53.627,,8.059,2.002,34.2164,,1.5,1.664,,4.3,1.8517,0.5,2.1e-05,7e-06
102.100.100/400612,CSHOB,EPA VIC Site_Id 1991,14/02/2022,21:48:00,2022-02-14T21:48:00Z,,2,,,,,,22.3684,,,,0.428,1.6,,,2.0975,0.643,1.43e-01,214.045,53.627,,8.059,2.002,34.2164,,1.5,1.664,,4.3,1.8517,0.5,2.1e-05,7e-06
102.100.100/400616,CSHOB,EPA VIC Site_Id 1991,17/03/2022,0:30:00,2022-03-17T00:30:00Z,,2,,,,,,20.8303,,,,1.142,1.6,,,1.9264,1,1.43e-01,203.481,297.41,,8.069,1.937,33.8921,,4,5.326,,2.4,1.1254,0.857,2.5e-05,7e-06
102.100.100/400617,CSHOB,EPA VIC Site_Id 1991,17/03/2022,0:32:00,2022-03-17T00:32:00Z,,2,,,,,,20.8303,,,,1.142,1.6,,,1.9264,1,1.43e-01,203.481,297.41,,8.069,1.937,33.8921,,4,5.326,,2.4,1.1254,0.857,2.5e-05,7e-06
102.100.100/400618,CSHOB,EPA VIC Site_Id 1991,17/03/2022,0:35:00,2022-03-17T00:35:00Z,,2,,,,,,20.8303,,,,1.142,1.6,,,1.9264,1,1.43e-01,203.481,297.41,,8.069,1.937,33.8921,,4,5.326,,2.4,1.1254,0.857,2.5e-05,7e-06
102.100.100/400622,CSHOB,EPA VIC Site_Id 1991,6/05/2022,4:13:00,2022-05-06T04:13:00Z,,1,,,,,,,,,,,,,,,,,,,,,,,,,,,,,,,
102.100.100/400623,CSHOB,EPA VIC Site_Id 1991,6/05/2022,4:13:00,2022-05-06T04:13:00Z,,1,,,,,,,,,,,,,,,,,,,,,,,,,,,,,,,
102.100.100/400624,CSHOB,EPA VIC Site_Id 1991,6/05/2022,4:13:00,2022-05-06T04:13:00Z,,1,,,,,,,,,,,,,,,,,,,,,,,,,,,,,,,
102.100.100/400628,CSHOB,EPA VIC Site_Id 1991,23/05/2022,20:35:00,2022-05-23T20:35:00Z,,2,,,,,,14.1222,,,,0.571,0.5,,,1.0964,0.571,1.43e-01,236.359,102.61,,8.055,1.647,35.221,,1.5,2.496,,6.2,0.9952,0.428,2.3e-05,8e-06
102.100.100/400629,CSHOB,EPA VIC Site_Id 1991,23/05/2022,20:36:00,2022-05-23T20:36:00Z,,2,,,,,,14.1222,,,,0.571,0.5,,,1.0964,0.571,1.43e-01,236.359,102.61,,8.055,1.647,35.221,,1.5,2.496,,6.2,0.9952,0.428,2.3e-05,8e-06
102.100.100/400630,CSHOB,EPA VIC Site_Id 1991,23/05/2022,20:38:00,2022-05-23T20:38:00Z,,2,,,,,,14.1222,,,,0.571,0.5,,,1.0964,0.571,1.43e-01,236.359,102.61,,8.055,1.647,35.221,,1.5,2.496,,6.2,0.9952,0.428,2.3e-05,8e-06
102.100.100/400634,CSHOB,EPA VIC Site_Id 1991,21/06/2022,22:22:00,2022-06-21T22:22:00Z,,1,,,,,,11.7134,,10.8,,1.928,1.3,,,1.545,3.641,2.14e-01,258.704,20.62,,7.991,2.163,34.641,,3.5,5.326,,20,1.3024,3.43,1.3e-05,7e-06
102.100.100/400635,CSHOB,EPA VIC Site_Id 1991,21/06/2022,22:25:00,2022-06-21T22:25:00Z,,1,,,,,,11.7134,,15.2,,1.928,1.3,,,1.545,3.641,2.14e-01,258.704,20.62,,7.991,2.163,34.641,,3.5,5.326,,20,1.3024,3.43,1.3e-05,7e-06
102.100.100/400636,CSHOB,EPA VIC Site_Id 1991,21/06/2022,22:28:00,2022-06-21T22:28:00Z,,1,,,,,,11.7134,,12.6,,1.928,1.3,,,1.545,3.641,2.14e-01,258.704,20.62,,7.991,2.163,34.641,,3.5,5.326,,20,1.3024,3.43,1.3e-05,7e-06
102.100.100/400640,CSHOB,EPA VIC Site_Id 1991,21/07/2022,8:22:00,2022-07-21T08:22:00Z,flow cytometry sample not collected,2,9.9,2,2,,,10.0385,,8.85,,0.643,0.5,,,0.4174,0.5,7.14e-02,275.705,807.17,,8.179,1.711,35.7946,,5.5,2.33,,3,0.3689,0.428,1.8e-05,6e-06
102.100.100/400641,CSHOB,EPA VIC Site_Id 1991,21/07/2022,8:23:00,2022-07-21T08:23:00Z,flow cytometry sample not collected,2,9.9,2,2,,,10.0385,,5.67,,0.643,0.5,,,0.4174,0.5,7.14e-02,275.705,807.17,,8.179,1.711,35.7946,,5.5,2.33,,3,0.3689,0.428,1.8e-05,6e-06
102.100.100/400642,CSHOB,EPA VIC Site_Id 1991,21/07/2022,8:24:00,2022-07-21T08:24:00Z,flow cytometry sample not collected,2,9.9,2,2,,,10.0385,,5.63,,0.643,0.5,,,0.4174,0.5,7.14e-02,275.705,807.17,,8.179,1.711,35.7946,,5.5,2.33,,3,0.3689,0.428,1.8e-05,6e-06
102.100.100/400646,CSHOB,EPA VIC Site_Id 1991,26/08/2022,8:16:00,2022-08-26T08:16:00Z,flow cytometry sample not collected,2,9.6,2,2,,,11.534,,6.99,,0.785,0.8,,,5.5452,0.571,1.43e-01,264.892,60.396,,6.413,1.517,34.471,,3,0.832,,13,2.3881,0.428,2.4e-05,7e-06
102.100.100/400647,CSHOB,EPA VIC Site_Id 1991,26/08/2022,8:18:00,2022-08-26T08:18:00Z,flow cytometry sample not collected,2,9.6,2,2,,,11.534,,17.6,,0.785,0.8,,,5.5452,0.571,1.43e-01,264.892,60.396,,6.413,1.517,34.471,,3,0.832,,13,2.3881,0.428,2.4e-05,7e-06
102.100.100/400648,CSHOB,EPA VIC Site_Id 1991,26/08/2022,8:20:00,2022-08-26T08:20:00Z,flow cytometry sample not collected,2,9.6,1.6,1.6,High biomass/particulate matter,,11.534,,12.3,,0.785,0.8,,,5.5452,0.571,1.43e-01,264.892,60.396,,6.413,1.517,34.471,,3,0.832,,13,2.3881,0.428,2.4e-05,7e-06
102.100.100/402169,CSHOB,EPA VIC Site_Id 1991,12/10/2022,22:15:00,2022-10-12T22:15:00Z,,4,6,2,2,,,,,8.34,,,,,,,,,,,,,,,,,,,12,0.5605,,,
102.100.100/402170,CSHOB,EPA VIC Site_Id 1991,12/10/2022,22:18:00,2022-10-12T22:18:00Z,,4,6,2,2,,,,,20,,,,,,,,,,,,,,,,,,,12,0.5605,,,
102.100.100/402171,CSHOB,EPA VIC Site_Id 1991,12/10/2022,22:25:00,2022-10-12T22:25:00Z,,4,6,2,2,,,,,12.1,,,,,,,,,,,,,,,,,,,12,0.5605,,,
102.100.100/402175,CSHOB,EPA VIC Site_Id 1991,18/11/2022,2:50:00,2022-11-18T02:50:00Z,,2,,0.6,0.6,High biomass/particulate matter,,18.3329,,,,0.643,4.8,,,36.4161,0.214,2.14e-01,293.737,823.35,,8.283,0.129,30.5722,,1.5,2.663,,11,2.5212,0.0714,3.4e-05,8e-06
102.100.100/402176,CSHOB,EPA VIC Site_Id 1991,18/11/2022,2:52:00,2022-11-18T02:52:00Z,,2,,0.6,0.6,High biomass/particulate matter,,18.3329,,,,0.643,4.8,,,36.4161,0.214,2.14e-01,293.737,823.35,,8.283,0.129,30.5722,,1.5,2.663,,11,2.5212,0.0714,3.4e-05,8e-06
102.100.100/402177,CSHOB,EPA VIC Site_Id 1991,18/11/2022,2:55:00,2022-11-18T02:55:00Z,,2,,0.6,0.6,High biomass/particulate matter,,18.3329,,,,0.643,4.8,,,36.4161,0.214,2.14e-01,293.737,823.35,,8.283,0.129,30.5722,,1.5,2.663,,11,2.5212,0.0714,3.4e-05,8e-06
102.100.100/402181,CSHOB,EPA VIC Site_Id 1991,21/12/2022,23:46:00,2022-12-21T23:46:00Z,,10,12.5,0.8,0.8,High biomass/particulate matter,,19.3983,,,,0.214,1.6,,4.338,3.4701,0.714,2.14e-01,227.483,172.1,,8.187,1.227,33.5611,,4,9.154,,6.4,0.5512,0.5,4.1e-05,8e-06
102.100.100/402182,CSHOB,EPA VIC Site_Id 1991,21/12/2022,23:50:00,2022-12-21T23:50:00Z,,10,12.5,1,1,High biomass/particulate matter,,19.3983,,,,0.214,1.6,,4.338,3.4701,0.714,2.14e-01,227.483,172.1,,8.187,1.227,33.5611,,4,9.154,,6.4,0.5512,0.5,4.1e-05,8e-06
102.100.100/402183,CSHOB,EPA VIC Site_Id 1991,21/12/2022,23:55:00,2022-12-21T23:55:00Z,,10,12.5,1,1,High biomass/particulate matter,,19.3983,,,,0.214,1.6,,4.338,3.4701,0.714,2.14e-01,227.483,172.1,,8.187,1.227,33.5611,,4,9.154,,6.4,0.5512,0.5,4.1e-05,8e-06
102.100.100/402187,CSHOB,EPA VIC Site_Id 1991,27/01/2023,1:09:00,2023-01-27T01:09:00Z,,3,5,2,2,,,22.3,,2.32,,,,,4.792,,,,227.5142196,,,,,33.1,,,,,7.6,2.0046,,,
102.100.100/402188,CSHOB,EPA VIC Site_Id 1991,27/01/2023,1:11:00,2023-01-27T01:11:00Z,,3,5,2,2,,,22.3,,22.1,,,,,4.792,,,,227.5142196,,,,,33.1,,,,,7.6,2.0046,,,
102.100.100/402189,CSHOB,EPA VIC Site_Id 1991,27/01/2023,1:13:00,2023-01-27T01:13:00Z,,3,5,2,2,,,22.3,,15.9,,,,,4.792,,,,227.5142196,,,,,33.1,,,,,7.6,2.0046,,,
102.100.100/402193,CSHOB,EPA VIC Site_Id 1991,6/02/2023,4:42:00,2023-02-06T04:42:00Z,,1,10,1.4,1.4,High biomass/particulate matter,,20.7078,,29.8,,0.785,3.7,,,11.5694,1.785,7.14e-02,226.17,526.06,,8.089,1.679,31.9448,,1.5,7.489,,4.2,1.5229,1.71,4.2e-05,8e-06
102.100.100/402194,CSHOB,EPA VIC Site_Id 1991,6/02/2023,4:43:00,2023-02-06T04:43:00Z,,1,10,2,2,,,20.7078,,32.3,,0.785,3.7,,,11.5694,1.785,7.14e-02,226.17,526.06,,8.089,1.679,31.9448,,1.5,7.489,,4.2,1.5229,1.71,4.2e-05,8e-06
102.100.100/402195,CSHOB,EPA VIC Site_Id 1991,6/02/2023,4:45:00,2023-02-06T04:45:00Z,,1,10,1.6,1.6,High biomass/particulate matter,,20.7078,,36.8,,0.785,3.7,,,11.5694,1.785,7.14e-02,226.17,526.06,,8.089,1.679,31.9448,,1.5,7.489,,4.2,1.5229,1.71,4.2e-05,8e-06
102.100.100/402199,CSHOB,EPA VIC Site_Id 1991,2/03/2023,23:00:00,2023-03-02T23:00:00Z,,1,12,2,2,,,20.4944,,44.3,,1.071,0.5,,,7.8367,1.356,2.14e-01,209.451,104.51,,8.088,1.969,33.0917,,2,6.657,,11,1.8958,1.14,4.6e-05,6e-06
102.100.100/402200,CSHOB,EPA VIC Site_Id 1991,2/03/2023,23:02:00,2023-03-02T23:02:00Z,,1,12,2,2,,,20.4944,,19,,1.071,0.5,,,7.8367,1.356,2.14e-01,209.451,104.51,,8.088,1.969,33.0917,,2,6.657,,11,1.8958,1.14,4.6e-05,6e-06
102.100.100/402201,CSHOB,EPA VIC Site_Id 1991,2/03/2023,23:04:00,2023-03-02T23:04:00Z,,1,12,2,2,,,20.4944,,21.8,,1.071,0.5,,,7.8367,1.356,2.14e-01,209.451,104.51,,8.088,1.969,33.0917,,2,6.657,,11,1.8958,1.14,4.6e-05,6e-06
102.100.100/402205,CSHOB,EPA VIC Site_Id 1991,30/05/2023,0:44:00,2023-05-30T00:44:00Z,,2,12,2,2,,,13.2,,23,,,,,3.841,,,,286.2678917,,,,,32.4,,,,,,,,,
102.100.100/402206,CSHOB,EPA VIC Site_Id 1991,30/05/2023,0:46:00,2023-05-30T00:46:00Z,,2,12,2,2,,,13.2,,18.1,,,,,3.841,,,,286.2678917,,,,,32.4,,,,,,,,,
102.100.100/402207,CSHOB,EPA VIC Site_Id 1991,30/05/2023,0:48:00,2023-05-30T00:48:00Z,,2,12,2,2,,,13.2,,13.9,,,,,3.841,,,,286.2678917,,,,,32.4,,,,,,,,,
102.100.100/402211,CSHOB,EPA VIC Site_Id 1991,20/06/2023,23:25:00,2023-06-20T23:25:00Z,Sample frozen after collection. Thawed and filtered on 27/6/23,1,10,2,2,,,11.9749,,0.0191,,0.571,0.3,,,1.0119,0.5,7.14e-02,268.017,130.81,,7.885,1.485,31.7268,,2.5,3.994,,2.1,3.1425,0.428,2.1e-05,6e-06
102.100.100/402212,CSHOB,EPA VIC Site_Id 1991,20/06/2023,23:30:00,2023-06-20T23:30:00Z,Sample frozen after collection. Thawed and filtered on 27/6/23,1,10,2,2,,,11.9749,,0.13,,0.571,0.3,,,1.0119,0.5,7.14e-02,268.017,130.81,,7.885,1.485,31.7268,,2.5,3.994,,2.1,3.1425,0.428,2.1e-05,6e-06
102.100.100/402213,CSHOB,EPA VIC Site_Id 1991,20/06/2023,23:35:00,2023-06-20T23:35:00Z,Sample frozen after collection. Thawed and filtered on 27/6/23,1,10,2,2,,,11.9749,,0.00141,,0.571,0.3,,,1.0119,0.5,7.14e-02,268.017,130.81,,7.885,1.485,31.7268,,2.5,3.994,,2.1,3.1425,0.428,2.1e-05,6e-06
102.100.100/402217,CSHOB,EPA VIC Site_Id 1991,26/07/2023,5:50:00,2023-07-26T05:50:00Z,,1,9.7,2,2,,,,,8.89,,,,,,,,,,,,,,,,,,,,,,,
102.100.100/402218,CSHOB,EPA VIC Site_Id 1991,26/07/2023,5:52:00,2023-07-26T05:52:00Z,,1,9.7,2,2,,,,,6.55,,,,,,,,,,,,,,,,,,,,,,,
102.100.100/402219,CSHOB,EPA VIC Site_Id 1991,26/07/2023,5:55:00,2023-07-26T05:55:00Z,,1,9.7,2,2,,,,,8.71,,,,,,,,,,,,,,,,,,,,,,,
102.100.100/403399,CSHOB,EPA VIC Site_Id 1991,24/08/2023,2:34:00,2023-08-24T02:34:00Z,,2,10.4,2,2,,,11.6,,23.9,,,,,3.875,,,,293.7683605,,,,,34.2,,,,,,,,,
102.100.100/403400,CSHOB,EPA VIC Site_Id 1991,24/08/2023,2:37:00,2023-08-24T02:37:00Z,,2,10.4,2,2,,,11.6,,11.6,,,,,3.875,,,,293.7683605,,,,,34.2,,,,,,,,,
102.100.100/403401,CSHOB,EPA VIC Site_Id 1991,24/08/2023,2:40:00,2023-08-24T02:40:00Z,,2,10.4,2,2,,,11.6,,17.8,,,,,3.875,,,,293.7683605,,,,,34.2,,,,,,,,,
102.100.100/403405,CSHOB,EPA VIC Site_Id 1991,22/09/2023,2:33:00,2023-09-22T02:33:00Z,,2,9,2,2,,,,,34.5,,,,,4.156,,,,305.3315832,,,,,,,,,,,,,,
102.100.100/403406,CSHOB,EPA VIC Site_Id 1991,22/09/2023,2:38:00,2023-09-22T02:38:00Z,,2,9,2,2,,,,,37.2,,,,,4.156,,,,305.3315832,,,,,,,,,,,,,,
102.100.100/403407,CSHOB,EPA VIC Site_Id 1991,22/09/2023,2:42:00,2023-09-22T02:42:00Z,,2,9,2,2,,,,,32.4,,,,,4.156,,,,305.3315832,,,,,,,,,,,,,,
102.100.100/403411,CSHOB,EPA VIC Site_Id 1991,23/10/2023,2:29:00,2023-10-23T02:29:00Z,,2,11.2,2,2,,,14.7,,36.3,,,,,4.156,,,,238.1398837,,,,,34.1,,,,,2.7,0.6619,,,
102.100.100/403412,CSHOB,EPA VIC Site_Id 1991,23/10/2023,2:31:00,2023-10-23T02:31:00Z,,2,11.2,2,2,,,14.7,,38.3,,,,,4.156,,,,238.1398837,,,,,34.1,,,,,2.7,0.6619,,,
102.100.100/403413,CSHOB,EPA VIC Site_Id 1991,23/10/2023,2:33:00,2023-10-23T02:33:00Z,,2,11.2,2,2,,,14.7,,32.9,,,,,4.156,,,,238.1398837,,,,,34.1,,,,,2.7,0.6619,,,
102.100.100/403414,CSHOB,EPA VIC Site_Id 1991,5/12/2023,22:42:00,2023-12-05T22:42:00Z,,2,10,2,2,,,,,56.4,,,,,4.561,,,,,,,,,,,,,,2.7,1.0581,,,
102.100.100/403415,CSHOB,EPA VIC Site_Id 1991,5/12/2023,22:44:00,2023-12-05T22:44:00Z,,2,10,2,2,,,,,60.8,,,,,4.561,,,,,,,,,,,,,,2.7,1.0581,,,
102.100.100/403416,CSHOB,EPA VIC Site_Id 1991,5/12/2023,22:47:00,2023-12-05T22:47:00Z,,2,10,2,2,,,,,45.5,,,,,4.561,,,,,,,,,,,,,,2.7,1.0581,,,
102.100.100/403420,CSHOB,EPA VIC Site_Id 1991,25/01/2024,21:50:00,2024-01-25T21:50:00Z,,1,9,1.6,1.6,,,,,21.8,,,,,,,,,,,,,,,,,,,2.8,1.1713,,,
102.100.100/403421,CSHOB,EPA VIC Site_Id 1991,25/01/2024,21:54:00,2024-01-25T21:54:00Z,,1,9,1.6,1.6,,,,,28.8,,,,,,,,,,,,,,,,,,,2.8,1.1713,,,
102.100.100/403422,CSHOB,EPA VIC Site_Id 1991,25/01/2024,21:59:00,2024-01-25T21:59:00Z,,1,9,1.6,1.6,,,,,23.3,,,,,,,,,,,,,,,,,,,2.8,1.1713,,,
102.100.100/403426,CSHOB,EPA VIC Site_Id 1991,22/03/2024,22:50:00,2024-03-22T22:50:00Z,,1,9.5,2,2,,,,,0.0365,,,,,,,,,,,,,,,,,,,,,,,
102.100.100/403559,CSHOB,EPA VIC Site_Id 1991,22/03/2024,22:53:00,2024-03-22T22:53:00Z,,1,9.5,2,2,,,,,16,,,,,,,,,,,,,,,,,,,,,,,
102.100.100/403560,CSHOB,EPA VIC Site_Id 1991,22/03/2024,22:55:00,2024-03-22T22:55:00Z,,1,9.5,2,2,,,,,18.9,,,,,,,,,,,,,,,,,,,,,,,
102.100.100/403564,CSHOB,EPA VIC Site_Id 1991,16/05/2024,23:50:00,2024-05-16T23:50:00Z,,1,9.4,2,2,,,,,31.5,,,,,,,,,,,,,,,,,,,,,,,
102.100.100/403565,CSHOB,EPA VIC Site_Id 1991,16/05/2024,23:52:00,2024-05-16T23:52:00Z,,1,9.4,2,2,,,,,23.5,,,,,,,,,,,,,,,,,,,,,,,
102.100.100/403566,CSHOB,EPA VIC Site_Id 1991,16/05/2024,23:58:00,2024-05-16T23:58:00Z,,1,9.4,2,2,,,,,13,,,,,,,,,,,,,,,,,,,,,,,
102.100.100/403570,CSHOB,EPA VIC Site_Id 1991,23/09/2024,23:30,2024-09-23T23:30:00Z,,1,9.8,1.9,1.9,High biomass/particulate matter,,,,12.1,,,,,,,,,,,,,,,,,,,,,,,
102.100.100/403571,CSHOB,EPA VIC Site_Id 1991,23/09/2024,23:33,2024-09-23T23:30:00Z,,1,9.8,1.9,1.9,High biomass/particulate matter,,,,11.7,,,,,,,,,,,,,,,,,,,,,,,
102.100.100/403572,CSHOB,EPA VIC Site_Id 1991,23/09/2024,23:35,2024-09-23T23:30:00Z,,1,9.8,1.9,1.9,High biomass/particulate matter,,,,16,,,,,,,,,,,,,,,,,,,,,,,
102.100.100/403576,CSHOB,EPA VIC Site_Id 1991,7/11/2024,22:15,2024-11-07T22:15:00Z,,2,9.5,2,2,,,,,20.3,,,,,,,,,,,,,,,,,,,,,,,
102.100.100/403577,CSHOB,EPA VIC Site_Id 1991,7/11/2024,22:17,2024-11-07T22:17:00Z,,2,9.5,2,2,,,,,19.4,,,,,,,,,,,,,,,,,,,,,,,
102.100.100/403578,CSHOB,EPA VIC Site_Id 1991,7/11/2024,22:19,2024-11-07T22:19:00Z,,2,9.5,2,2,,,,,18.5,,,,,,,,,,,,,,,,,,,,,,,
102.100.100/404300,CSHOB,EPA VIC Site_Id 1991,9/01/2025,21:54,2025-01-09T21:54:00Z,,1,9.6,1.8,1.8,High biomass/particulate matter,,,,13.8,,,,,,,,,,,,,,,,,,,,,,,
102.100.100/404301,CSHOB,EPA VIC Site_Id 1991,9/01/2025,21:56,2025-01-09T21:56:00Z,,1,9.6,1.6,1.6,High biomass/particulate matter,,,,10.2,,,,,,,,,,,,,,,,,,,,,,,
102.100.100/404302,CSHOB,EPA VIC Site_Id 1991,9/01/2025,21:58,2025-01-09T21:58:00Z,,1,9.6,1.7,1.7,High biomass/particulate matter,,,,23.2,,,,,,,,,,,,,,,,,,,,,,,
102.100.100/404309,CSHOB,EPA VIC Site_Id 1991,25/05/2025,4:31,2025-05-25T04:31:00Z,,1,9.3,2,2,,WARNING: Storage or transport conditions compromised,,,,,,,,,,,,,,,,,,,,,,,,,,
102.100.100/404310,CSHOB,EPA VIC Site_Id 1991,25/05/2025,4:33,2025-05-25T04:33:00Z,,1,9.3,2,2,,WARNING: Storage or transport conditions compromised,,,,,,,,,,,,,,,,,,,,,,,,,,
102.100.100/404311,CSHOB,EPA VIC Site_Id 1991,25/05/2025,4:35,2025-05-25T04:35:00Z,,1,9.3,2,2,,WARNING: Storage or transport conditions compromised,,,,,,,,,,,,,,,,,,,,,,,,,,
102.100.100/405267,CSHOB,EPA VIC Site_Id 1991,20/06/2025,1:23,2025-06-20T00:10:00Z,,2,9.8,2,2,,,,,,,,,,,,,,,,,,,,,,,,,,,,
102.100.100/405268,CSHOB,EPA VIC Site_Id 1991,20/06/2025,1:26,2025-06-20T00:13:00Z,,2,9.8,2,2,,,,,,,,,,,,,,,,,,,,,,,,,,,,
102.100.100/405269,CSHOB,EPA VIC Site_Id 1991,20/06/2025,1:29,2025-06-20T00:16:00Z,,2,9.8,2,2,,,,,,,,,,,,,,,,,,,,,,,,,,,,
102.100.100/405273,CSHOB,EPA VIC Site_Id 1991,8/08/2025,0:45,2025-08-08T00:45:00Z,,1,9.5,2,2,,,,,,,,,,,,,,,,,,,,,,,,,,,,
102.100.100/405274,CSHOB,EPA VIC Site_Id 1991,8/08/2025,0:48,2025-08-08T00:48:00Z,,1,9.5,2,2,,,,,,,,,,,,,,,,,,,,,,,,,,,,
102.100.100/405275,CSHOB,EPA VIC Site_Id 1991,8/08/2025,0:52,2025-08-08T00:52:00Z,,1,9.5,2,2,,,,,,,,,,,,,,,,,,,,,,,,,,,,
102.100.100/665359,CSHOB,EPA VIC Site_Id 1991,14/10/2025,22:56,2025-10-14T22:56:00Z,,1,9.9,2,2,,,,,,,,,,,,,,,,,,,,,,,,,,,,
102.100.100/665362,CSHOB,EPA VIC Site_Id 1991,14/10/2025,22:59,2025-10-14T22:59:00Z,,1,9.9,2,2,,,,,,,,,,,,,,,,,,,,,,,,,,,,
102.100.100/665365,CSHOB,EPA VIC Site_Id 1991,14/10/2025,23:02,2025-10-14T23:02:00Z,,1,9.9,2,2,,,,,,,,,,,,,,,,,,,,,,,,,,,,
102.100.100/138997,CSLOR,EPA VIC Site_Id 369,30/07/2020,0:40:00,2020-07-30T00:40:00Z,flow cytometry sample not collected,2,,,,,,10.8431,,,,2.642,0.5,,,0.7978,2.142,2.86e-01,283.268,434.52,,8.327,3.551,36.0503,,5.5,1.664,,12,0.5605,1.86,2.9e-05,1.2e-05
102.100.100/138998,CSLOR,EPA VIC Site_Id 369,30/07/2020,0:45:00,2020-07-30T00:45:00Z,flow cytometry sample not collected,2,,,,,,10.8431,,,,2.642,0.5,,,0.7978,2.142,2.86e-01,283.268,434.52,,8.327,3.551,36.0503,,5.5,1.664,,12,0.5605,1.86,2.9e-05,1.2e-05
102.100.100/138999,CSLOR,EPA VIC Site_Id 369,30/07/2020,0:50:00,2020-07-30T00:50:00Z,flow cytometry sample not collected,2,,,,,,10.8431,,,,2.642,0.5,,,0.7978,2.142,2.86e-01,283.268,434.52,,8.327,3.551,36.0503,,5.5,1.664,,12,0.5605,1.86,2.9e-05,1.2e-05
102.100.100/139003,CSLOR,EPA VIC Site_Id 369,16/09/2020,4:55:00,2020-09-16T04:55:00Z,,2,,,,,,,,,,,,,,,,,,,,,,,,,,,7.5,39.614,,,
102.100.100/139004,CSLOR,EPA VIC Site_Id 369,16/09/2020,4:58:00,2020-09-16T04:58:00Z,,2,,,,,,,,,,,,,,,,,,,,,,,,,,,7.5,39.614,,,
102.100.100/139005,CSLOR,EPA VIC Site_Id 369,16/09/2020,5:01:00,2020-09-16T05:01:00Z,,2,,,,,,,,,,,,,,,,,,,,,,,,,,,7.5,39.614,,,
102.100.100/139009,CSLOR,EPA VIC Site_Id 369,21/10/2020,0:30:00,2020-10-21T00:30:00Z,,2,,,,,,16.3743,,,,1.070914532,0.5,,,0.5697,0.713943022,0.142788604,295.5809738,717.59,,8.714,3.55139295,35.6148,,4,3.828229028,,5.7,0.7132,,,
102.100.100/139010,CSLOR,EPA VIC Site_Id 369,21/10/2020,0:35:00,2020-10-21T00:35:00Z,,2,,,,,,16.3743,,,,1.070914532,0.5,,,0.5697,0.713943022,0.142788604,295.5809738,717.59,,8.714,3.55139295,35.6148,,4,3.828229028,,5.7,0.7132,,,
102.100.100/139011,CSLOR,EPA VIC Site_Id 369,21/10/2020,0:40:00,2020-10-21T00:40:00Z,,2,,,,,,16.3743,,,,1.070914532,0.5,,,0.5697,0.713943022,0.142788604,295.5809738,717.59,,8.714,3.55139295,35.6148,,4,3.828229028,,5.7,0.7132,,,
102.100.100/139015,CSLOR,EPA VIC Site_Id 369,24/11/2020,23:30:00,2020-11-24T23:30:00Z,,2,,,,,,19.2915,,,,3.57,11,,,22.3552,2.713,5.00e-01,322.364,855.48,,8.416,8.717,35.006,,2,8.655,,7.6,2.0046,2.21,5.8e-05,3.2e-05
102.100.100/139016,CSLOR,EPA VIC Site_Id 369,24/11/2020,23:30:00,2020-11-24T23:30:00Z,,2,,,,,,19.2915,,,,3.57,11,,,22.3552,2.713,5.00e-01,322.364,855.48,,8.416,8.717,35.006,,2,8.655,,7.6,2.0046,2.21,5.8e-05,3.2e-05
102.100.100/139017,CSLOR,EPA VIC Site_Id 369,24/11/2020,23:30:00,2020-11-24T23:30:00Z,,2,,,,,,19.2915,,,,3.57,11,,,22.3552,2.713,5.00e-01,322.364,855.48,,8.416,8.717,35.006,,2,8.655,,7.6,2.0046,2.21,5.8e-05,3.2e-05
102.100.100/139021,CSLOR,EPA VIC Site_Id 369,16/12/2020,0:50:00,2020-12-16T00:50:00Z,,2,,,,,,20.2008,,,,0.286,1.1,,,1.0836,0.643,7.14e-02,226.983,1093.5,,8.283,0.194,35.5352,,2.5,14.979,,3.9,1.7517,0.571,2.9e-05,1e-05
102.100.100/139022,CSLOR,EPA VIC Site_Id 369,16/12/2020,0:54:00,2020-12-16T00:54:00Z,,2,,,,,,20.2008,,,,0.286,1.1,,,1.0836,0.643,7.14e-02,226.983,1093.5,,8.283,0.194,35.5352,,2.5,14.979,,3.9,1.7517,0.571,2.9e-05,1e-05
102.100.100/139023,CSLOR,EPA VIC Site_Id 369,16/12/2020,0:58:00,2020-12-16T00:58:00Z,,2,,,,,,20.2008,,,,0.286,1.1,,,1.0836,0.643,7.14e-02,226.983,1093.5,,8.283,0.194,35.5352,,2.5,14.979,,3.9,1.7517,0.571,2.9e-05,1e-05
102.100.100/139028,CSLOR,EPA VIC Site_Id 369,24/02/2021,23:06:00,2021-02-24T23:06:00Z,,2,,,,,,,,,,,,,,,,,,,,,,,,,,,6.3,0.4291,,,
102.100.100/139027,CSLOR,EPA VIC Site_Id 369,24/02/2021,23:11:00,2021-02-24T23:11:00Z,,2,,,,,,,,,,,,,,,,,,,,,,,,,,,6.3,0.4291,,,
102.100.100/139029,CSLOR,EPA VIC Site_Id 369,24/02/2021,23:14:00,2021-02-24T23:14:00Z,,2,,,,,,,,,,,,,,,,,,,,,,,,,,,6.3,0.4291,,,
102.100.100/139033,CSLOR,EPA VIC Site_Id 369,7/04/2021,22:55:00,2021-04-07T22:55:00Z,,2,,,,,,,,,,,,,,,,,,,,,,,,,,,22,0.3963,,,
102.100.100/139034,CSLOR,EPA VIC Site_Id 369,7/04/2021,22:58:00,2021-04-07T22:58:00Z,,2,,,,,,,,,,,,,,,,,,,,,,,,,,,22,0.3963,,,
102.100.100/139035,CSLOR,EPA VIC Site_Id 369,7/04/2021,23:01:00,2021-04-07T23:01:00Z,,2,,,,,,,,,,,,,,,,,,,,,,,,,,,22,0.3963,,,
102.100.100/139039,CSLOR,EPA VIC Site_Id 369,21/05/2021,3:51:00,2021-05-21T03:51:00Z,,2,,,,,,13.3938,,,,0.428,5.1,,,1.4914,0.214,1.43e-01,270.642,665.74,,8.368,2.034,35.926,,3.5,1.331,,3.2,0.5406,0.0714,2.2e-05,1e-05
102.100.100/139041,CSLOR,EPA VIC Site_Id 369,21/05/2021,3:55:00,2021-05-21T03:55:00Z,,2,,,,,,13.3938,,,,0.428,5.1,,,1.4914,0.214,1.43e-01,270.642,665.74,,8.368,2.034,35.926,,3.5,1.331,,3.2,0.5406,0.0714,2.2e-05,1e-05
102.100.100/139042,CSLOR,EPA VIC Site_Id 369,21/05/2021,3:59:00,2021-05-21T03:59:00Z,,2,,,,,,13.3938,,,,0.428,5.1,,,1.4914,0.214,1.43e-01,270.642,665.74,,8.368,2.034,35.926,,3.5,1.331,,3.2,0.5406,0.0714,2.2e-05,1e-05
102.100.100/139046,CSLOR,EPA VIC Site_Id 369,30/06/2021,1:52:00,2021-06-30T01:52:00Z,,2,,,,,,,,,,,,,,,,,,,,,,,,,,,,,,,
102.100.100/139047,CSLOR,EPA VIC Site_Id 369,30/06/2021,1:55:00,2021-06-30T01:55:00Z,,2,,,,,,,,,,,,,,,,,,,,,,,,,,,,,,,
102.100.100/139048,CSLOR,EPA VIC Site_Id 369,30/06/2021,1:58:00,2021-06-30T01:58:00Z,,2,,,,,,,,,,,,,,,,,,,,,,,,,,,,,,,
102.100.100/139052,CSLOR,EPA VIC Site_Id 369,29/07/2021,1:30:00,2021-07-29T01:30:00Z,,2,,,,,,,,,,,,,,,,,,,,,,,,,,,,,,,
102.100.100/139053,CSLOR,EPA VIC Site_Id 369,29/07/2021,1:33:00,2021-07-29T01:33:00Z,,2,,,,,,,,,,,,,,,,,,,,,,,,,,,,,,,
102.100.100/139054,CSLOR,EPA VIC Site_Id 369,29/07/2021,1:37:00,2021-07-29T01:37:00Z,,2,,,,,,,,,,,,,,,,,,,,,,,,,,,,,,,
102.100.100/139058,CSLOR,EPA VIC Site_Id 369,1/09/2021,0:59:00,2021-09-01T00:59:00Z,,2,,,,,,,,,,,,,,,,,,,,,,,,,,,,,,,
102.100.100/139059,CSLOR,EPA VIC Site_Id 369,1/09/2021,1:02:00,2021-09-01T01:02:00Z,,2,,,,,,,,,,,,,,,,,,,,,,,,,,,,,,,
102.100.100/139060,CSLOR,EPA VIC Site_Id 369,1/09/2021,1:05:00,2021-09-01T01:05:00Z,Picoplankton comment - Good data but looks like a very different sample,2,,,,,,,,,,,,,,,,,,,,,,,,,,,,,,,
102.100.100/400583,CSLOR,EPA VIC Site_Id 369,21/09/2021,23:20:00,2021-09-21T23:20:00Z,,2,,,,,,12.5279,,,,0.643,1.1,,,0.936,0.357,1.43e-01,264.079,292.32,,8.774,2.131,35.4722,,5.4,2.496,,2.7,0.6619,0.214,2.3e-05,9e-06
102.100.100/400584,CSLOR,EPA VIC Site_Id 369,21/09/2021,23:20:00,2021-09-21T23:20:00Z,,2,,,,,,12.5279,,,,0.643,1.1,,,0.936,0.357,1.43e-01,264.079,292.32,,8.774,2.131,35.4722,,5.4,2.496,,2.7,0.6619,0.214,2.3e-05,9e-06
102.100.100/400585,CSLOR,EPA VIC Site_Id 369,21/09/2021,23:20:00,2021-09-21T23:20:00Z,,2,,,,,,12.5279,,,,0.643,1.1,,,0.936,0.357,1.43e-01,264.079,292.32,,8.774,2.131,35.4722,,5.4,2.496,,2.7,0.6619,0.214,2.3e-05,9e-06
102.100.100/400589,CSLOR,EPA VIC Site_Id 369,12/10/2021,2:20:00,2021-10-12T02:20:00Z,,2,,,,,,14.8451,,,,0.214,0.3,,,0.4303,0.5,1.43e-01,256.422,126.13,,8.911,1.743,35.3611,,3.5,1.165,,2.7,1.0581,0.357,2.5e-05,6e-06
102.100.100/400590,CSLOR,EPA VIC Site_Id 369,12/10/2021,2:20:00,2021-10-12T02:20:00Z,,2,,,,,,14.8451,,,,0.214,0.3,,,0.4303,0.5,1.43e-01,256.422,126.13,,8.911,1.743,35.3611,,3.5,1.165,,2.7,1.0581,0.357,2.5e-05,6e-06
102.100.100/400591,CSLOR,EPA VIC Site_Id 369,12/10/2021,2:20:00,2021-10-12T02:20:00Z,,2,,,,,,14.8451,,,,0.214,0.3,,,0.4303,0.5,1.43e-01,256.422,126.13,,8.911,1.743,35.3611,,3.5,1.165,,2.7,1.0581,0.357,2.5e-05,6e-06
102.100.100/400595,CSLOR,EPA VIC Site_Id 369,5/11/2021,1:46:00,2021-11-05T01:46:00Z,,2,,,,,,17.5871,,,,0.286,1.3,,,0.9061,0.785,2.14e-01,252.547,687.59,,8.043,2.97,34.8375,,2.5,2.496,,2.8,1.1713,0.571,2.1e-05,1.2e-05
102.100.100/400596,CSLOR,EPA VIC Site_Id 369,5/11/2021,1:48:00,2021-11-05T01:48:00Z,,2,,,,,,17.5871,,,,0.286,1.3,,,0.9061,0.785,2.14e-01,252.547,687.59,,8.043,2.97,34.8375,,2.5,2.496,,2.8,1.1713,0.571,2.1e-05,1.2e-05
102.100.100/400597,CSLOR,EPA VIC Site_Id 369,5/11/2021,1:50:00,2021-11-05T01:50:00Z,,2,,,,,,17.5871,,,,0.286,1.3,,,0.9061,0.785,2.14e-01,252.547,687.59,,8.043,2.97,34.8375,,2.5,2.496,,2.8,1.1713,0.571,2.1e-05,1.2e-05
102.100.100/400601,CSLOR,EPA VIC Site_Id 369,21/12/2021,22:21:00,2021-12-21T22:21:00Z,,2,,,,,,20.0155,,,,0.714,0.8,,,0.9197,0.286,2.14e-01,226.42,262.61,,8.071,2.228,35.2819,,5.5,4.161,,4.5,0.7535,0.0714,1.4e-05,9e-06
102.100.100/400602,CSLOR,EPA VIC Site_Id 369,21/12/2021,22:28:00,2021-12-21T22:28:00Z,,2,,,,,,20.0155,,,,0.714,0.8,,,0.9197,0.286,2.14e-01,226.42,262.61,,8.071,2.228,35.2819,,5.5,4.161,,4.5,0.7535,0.0714,1.4e-05,9e-06
102.100.100/400603,CSLOR,EPA VIC Site_Id 369,21/12/2021,22:33:00,2021-12-21T22:33:00Z,,2,,,,,,20.0155,,,,0.714,0.8,,,0.9197,0.286,2.14e-01,226.42,262.61,,8.071,2.228,35.2819,,5.5,4.161,,4.5,0.7535,0.0714,1.4e-05,9e-06
102.100.100/400607,CSLOR,EPA VIC Site_Id 369,24/01/2022,2:35:00,2022-01-24T02:35:00Z,,2,,,,,,25.91,,,,0.142788604,0.8,,,-10.2714,0.214182906,0.142788604,214.9821864,2317.4,,8.099,2.195406551,35.2823,,3.5,1.830892144,,,,,,
102.100.100/400608,CSLOR,EPA VIC Site_Id 369,24/01/2022,2:35:00,2022-01-24T02:35:00Z,,2,,,,,,25.91,,,,0.142788604,0.8,,,-10.2714,0.214182906,0.142788604,214.9821864,2317.4,,8.099,2.195406551,35.2823,,3.5,1.830892144,,,,,,
102.100.100/400609,CSLOR,EPA VIC Site_Id 369,24/01/2022,2:35:00,2022-01-24T02:35:00Z,,2,,,,,,25.91,,,,0.142788604,0.8,,,-10.2714,0.214182906,0.142788604,214.9821864,2317.4,,8.099,2.195406551,35.2823,,3.5,1.830892144,,,,,,
102.100.100/400613,CSLOR,EPA VIC Site_Id 369,15/02/2022,3:01:00,2022-02-15T03:01:00Z,,2,,,,,,22.5591,,140.5,1.9,0.428,1.3,,,1.1931,0.5,1.43e-01,231.483,1949.4,,8.122,2.712,35.4744,,2.5,0.333,,5.7,0.7132,0.357,2.8e-05,1e-05
102.100.100/400614,CSLOR,EPA VIC Site_Id 369,15/02/2022,3:02:00,2022-02-15T03:02:00Z,,2,,,,,,22.5591,,199.5,1.99,0.428,1.3,,,1.1931,0.5,1.43e-01,231.483,1949.4,,8.122,2.712,35.4744,,2.5,0.333,,5.7,0.7132,0.357,2.8e-05,1e-05
102.100.100/400615,CSLOR,EPA VIC Site_Id 369,15/02/2022,3:03:00,2022-02-15T03:03:00Z,,2,,,,,,22.5591,,90.49,1.96,0.428,1.3,,,1.1931,0.5,1.43e-01,231.483,1949.4,,8.122,2.712,35.4744,,2.5,0.333,,5.7,0.7132,0.357,2.8e-05,1e-05
102.100.100/400619,CSLOR,EPA VIC Site_Id 369,17/03/2022,2:00:00,2022-03-17T02:00:00Z,,2,,,,,,20.8022,,,,0.571,0.8,,,0.9439,1,7.14e-02,230.171,553.82,,8.198,3.229,35.2882,,5.5,0.499,,4.9,0.4265,0.928,3e-05,1.1e-05
102.100.100/400620,CSLOR,EPA VIC Site_Id 369,17/03/2022,2:02:00,2022-03-17T02:02:00Z,,2,,,,,,20.8022,,,,0.571,0.8,,,0.9439,1,7.14e-02,230.171,553.82,,8.198,3.229,35.2882,,5.5,0.499,,4.9,0.4265,0.928,3e-05,1.1e-05
102.100.100/400621,CSLOR,EPA VIC Site_Id 369,17/03/2022,2:05:00,2022-03-17T02:05:00Z,,2,,,,,,20.8022,,,,0.571,0.8,,,0.9439,1,7.14e-02,230.171,553.82,,8.198,3.229,35.2882,,5.5,0.499,,4.9,0.4265,0.928,3e-05,1.1e-05
102.100.100/400625,CSLOR,EPA VIC Site_Id 369,6/05/2022,2:59:00,2022-05-06T02:59:00Z,,1,,,,,,,,,,,,,,,,,,,,,,,,,,,,,,,
102.100.100/400626,CSLOR,EPA VIC Site_Id 369,6/05/2022,2:59:00,2022-05-06T02:59:00Z,,1,,,,,,,,,,,,,,,,,,,,,,,,,,,,,,,
102.100.100/400627,CSLOR,EPA VIC Site_Id 369,6/05/2022,2:59:00,2022-05-06T02:59:00Z,,1,,,,,,,,,,,,,,,,,,,,,,,,,,,,,,,
102.100.100/400631,CSLOR,EPA VIC Site_Id 369,24/05/2022,4:48:00,2022-05-24T04:48:00Z,,2,,,,,,13.4352,,,,0.571,0.8,,,0.9868,1,2.14e-01,268.361,467.84,,8.13,3.874,35.5451,,6.5,4.993,,6.3,0.4291,0.785,2.8e-05,1.4e-05
102.100.100/400632,CSLOR,EPA VIC Site_Id 369,24/05/2022,4:49:00,2022-05-24T04:49:00Z,,2,,,,,,13.4352,,,,0.571,0.8,,,0.9868,1,2.14e-01,268.361,467.84,,8.13,3.874,35.5451,,6.5,4.993,,6.3,0.4291,0.785,2.8e-05,1.4e-05
102.100.100/400633,CSLOR,EPA VIC Site_Id 369,24/05/2022,4:50:00,2022-05-24T04:50:00Z,,2,,,,,,13.4352,,,,0.571,0.8,,,0.9868,1,2.14e-01,268.361,467.84,,8.13,3.874,35.5451,,6.5,4.993,,6.3,0.4291,0.785,2.8e-05,1.4e-05
102.100.100/400637,CSLOR,EPA VIC Site_Id 369,22/06/2022,5:10:00,2022-06-22T05:10:00Z,,1,,,,,,11.4306,,13.3,,3.641,0.5,,,0.5824,6.354,6.43e-01,274.017,474.45,,8.116,3.874,35.2207,,5.5,4.327,,22,0.3963,5.71,3.3e-05,1.5e-05
102.100.100/400638,CSLOR,EPA VIC Site_Id 369,22/06/2022,5:10:00,2022-06-22T05:10:00Z,,1,,,,,,11.4306,,8.35,,3.641,0.5,,,0.5824,6.354,6.43e-01,274.017,474.45,,8.116,3.874,35.2207,,5.5,4.327,,22,0.3963,5.71,3.3e-05,1.5e-05
102.100.100/400639,CSLOR,EPA VIC Site_Id 369,22/06/2022,5:10:00,2022-06-22T05:10:00Z,,1,,,,,,11.4306,,9.52,,3.641,0.5,,,0.5824,6.354,6.43e-01,274.017,474.45,,8.116,3.874,35.2207,,5.5,4.327,,22,0.3963,5.71,3.3e-05,1.5e-05
102.100.100/400643,CSLOR,EPA VIC Site_Id 369,21/07/2022,14:32:00,2022-07-21T14:32:00Z,flow cytometry sample not collected,2,5.1,1.5,1.5,High biomass/particulate matter,,9.9777,,4.62,,3.641,1.3,,,1.1846,4.355,5.00e-01,275.236,585.26,,8.234,4.197,35.2923,,3,2.33,,7.4,1.6379,3.86,3.2e-05,1.4e-05
102.100.100/400644,CSLOR,EPA VIC Site_Id 369,21/07/2022,14:33:00,2022-07-21T14:33:00Z,flow cytometry sample not collected,2,5.1,1.5,1.5,High biomass/particulate matter,,9.9777,,19,,3.641,1.3,,,1.1846,4.355,5.00e-01,275.236,585.26,,8.234,4.197,35.2923,,3,2.33,,7.4,1.6379,3.86,3.2e-05,1.4e-05
102.100.100/400645,CSLOR,EPA VIC Site_Id 369,21/07/2022,14:34:00,2022-07-21T14:34:00Z,flow cytometry sample not collected,2,5.1,1.5,1.5,High biomass/particulate matter,,9.9777,,15,,3.641,1.3,,,1.1846,4.355,5.00e-01,275.236,585.26,,8.234,4.197,35.2923,,3,2.33,,7.4,1.6379,3.86,3.2e-05,1.4e-05
102.100.100/400649,CSLOR,EPA VIC Site_Id 369,26/08/2022,14:20:00,2022-08-26T14:20:00Z,flow cytometry sample not collected,2,5.7,2,2,,,11.6909,,17.6,,0.643,0.3,,,3.553,0.286,1.43e-01,270.111,276.85,,7.755,2.454,35.2241,,5.1,0.333,,2.5,0.4106,0.143,2.5e-05,8e-06
102.100.100/400650,CSLOR,EPA VIC Site_Id 369,26/08/2022,14:22:00,2022-08-26T14:22:00Z,flow cytometry sample not collected,2,5.7,2,2,,,11.6909,,23.7,,0.643,0.3,,,3.553,0.286,1.43e-01,270.111,276.85,,7.755,2.454,35.2241,,5.1,0.333,,2.5,0.4106,0.143,2.5e-05,8e-06
102.100.100/400651,CSLOR,EPA VIC Site_Id 369,26/08/2022,14:24:00,2022-08-26T14:24:00Z,flow cytometry sample not collected,2,5.7,2,2,,,11.6909,,13.4,,0.643,0.3,,,3.553,0.286,1.43e-01,270.111,276.85,,7.755,2.454,35.2241,,5.1,0.333,,2.5,0.4106,0.143,2.5e-05,8e-06
102.100.100/402172,CSLOR,EPA VIC Site_Id 369,12/10/2022,4:12:00,2022-10-12T04:12:00Z,,2.5,4.5,2,2,,,,,15.4,,,,,,,,,,,,,,,,,,,,,,,
102.100.100/402173,CSLOR,EPA VIC Site_Id 369,12/10/2022,4:15:00,2022-10-12T04:15:00Z,,2.5,4.5,2,2,,,,,20.1,,,,,,,,,,,,,,,,,,,,,,,
102.100.100/402174,CSLOR,EPA VIC Site_Id 369,12/10/2022,4:19:00,2022-10-12T04:19:00Z,,2.5,4.5,2,2,,,,,17.2,,,,,,,,,,,,,,,,,,,,,,,
102.100.100/402178,CSLOR,EPA VIC Site_Id 369,18/11/2022,1:15:00,2022-11-18T01:15:00Z,,2,,1.2,1.2,High biomass/particulate matter,,18.4366,,,,15.707,1.3,,,9.1557,5.783,9.28e-01,244.234,1636.3,,8.069,5.166,32.3421,,2,4.161,,5.6,2.6403,4.85,6.8e-05,2e-05
102.100.100/402179,CSLOR,EPA VIC Site_Id 369,18/11/2022,1:17:00,2022-11-18T01:17:00Z,,2,,1.4,1.4,High biomass/particulate matter,,18.4366,,,,15.707,1.3,,,9.1557,5.783,9.28e-01,244.234,1636.3,,8.069,5.166,32.3421,,2,4.161,,5.6,2.6403,4.85,6.8e-05,2e-05
102.100.100/402180,CSLOR,EPA VIC Site_Id 369,18/11/2022,1:20:00,2022-11-18T01:20:00Z,,2,,1.6,1.6,High biomass/particulate matter,,18.4366,,,,15.707,1.3,,,9.1557,5.783,9.28e-01,244.234,1636.3,,8.069,5.166,32.3421,,2,4.161,,5.6,2.6403,4.85,6.8e-05,2e-05
102.100.100/402184,CSLOR,EPA VIC Site_Id 369,21/12/2022,22:14:00,2022-12-21T22:14:00Z,,3,5,1,1,High biomass/particulate matter,,20.1839,,,,0.5,5.3,,4.448,13.7809,9.995,6.43e-01,243.828,123.01,,8.296,4.52,31.9192,,2,7.157,,4.4,1.4776,9.28,5.7e-05,2e-05
102.100.100/402185,CSLOR,EPA VIC Site_Id 369,21/12/2022,22:20:00,2022-12-21T22:20:00Z,,3,5,2,2,,,20.1839,,,,0.5,5.3,,4.448,13.7809,9.995,6.43e-01,243.828,123.01,,8.296,4.52,31.9192,,2,7.157,,4.4,1.4776,9.28,5.7e-05,2e-05
102.100.100/402186,CSLOR,EPA VIC Site_Id 369,21/12/2022,22:30:00,2022-12-21T22:30:00Z,,3,5,2,2,,,20.1839,,,,0.5,5.3,,4.448,13.7809,9.995,6.43e-01,243.828,123.01,,8.296,4.52,31.9192,,2,7.157,,4.4,1.4776,9.28,5.7e-05,2e-05
102.100.100/402190,CSLOR,EPA VIC Site_Id 369,27/01/2023,2:23:00,2023-01-27T02:23:00Z,,8,10,2,2,,,,,22.9,,,,,,,,,,,,,,,,,,,,,,,
102.100.100/402191,CSLOR,EPA VIC Site_Id 369,27/01/2023,2:25:00,2023-01-27T02:25:00Z,,8,10,2,2,,,,,24.4,,,,,,,,,,,,,,,,,,,,,,,
102.100.100/402192,CSLOR,EPA VIC Site_Id 369,27/01/2023,2:30:00,2023-01-27T02:30:00Z,,8,10,2,2,,,,,23.5,,,,,,,,,,,,,,,,,,,,,,,
102.100.100/402196,CSLOR,EPA VIC Site_Id 369,6/02/2023,3:35:00,2023-02-06T03:35:00Z,,1,5.5,2,2,,,19.8247,,28.2,,0.571,0.5,,,0.1722,0.286,7.14e-02,229.171,641.48,,8.116,1.808,34.1983,,5,5.159,,2.1,0.059,0.214,2.9e-05,8e-06
102.100.100/402197,CSLOR,EPA VIC Site_Id 369,6/02/2023,3:37:00,2023-02-06T03:37:00Z,,1,5.5,2,2,,,19.8247,,28.5,,0.571,0.5,,,0.1722,0.286,7.14e-02,229.171,641.48,,8.116,1.808,34.1983,,5,5.159,,2.1,0.059,0.214,2.9e-05,8e-06
102.100.100/402198,CSLOR,EPA VIC Site_Id 369,6/02/2023,3:39:00,2023-02-06T03:39:00Z,,1,5.5,2,2,,,19.8247,,28.8,,0.571,0.5,,,0.1722,0.286,7.14e-02,229.171,641.48,,8.116,1.808,34.1983,,5,5.159,,2.1,0.059,0.214,2.9e-05,8e-06
102.100.100/402202,CSLOR,EPA VIC Site_Id 369,2/03/2023,0:35:00,2023-03-02T00:35:00Z,,1,5.8,2,2,,,20.6384,,50,,0.214,0.8,,,4.6351,0.571,2.14e-01,223.295,937.29,,8.184,2.26,34.5321,,3,3.828,,7.5,0.7501,0.428,3.1e-05,9e-06
102.100.100/402203,CSLOR,EPA VIC Site_Id 369,2/03/2023,0:37:00,2023-03-02T00:37:00Z,,1,5.8,2,2,,,20.6384,,57.6,,0.214,0.8,,,4.6351,0.571,2.14e-01,223.295,937.29,,8.184,2.26,34.5321,,3,3.828,,7.5,0.7501,0.428,3.1e-05,9e-06
102.100.100/402204,CSLOR,EPA VIC Site_Id 369,2/03/2023,0:39:00,2023-03-02T00:39:00Z,no pico - instrument error,1,5.8,2,2,,,20.6384,,44.6,,0.214,0.8,,,4.6351,0.571,2.14e-01,223.295,937.29,,8.184,2.26,34.5321,,3,3.828,,7.5,0.7501,0.428,3.1e-05,9e-06
102.100.100/402208,CSLOR,EPA VIC Site_Id 369,30/05/2023,3:20:00,2023-05-30T03:20:00Z,,2,5.5,2,2,,,12.6,,9.48,,,,,4.09,,,,268.7667979,,,,,35.3,,,,,,,,,
102.100.100/402209,CSLOR,EPA VIC Site_Id 369,30/05/2023,3:23:00,2023-05-30T03:23:00Z,,2,5.5,2,2,,,12.6,,10.5,,,,,4.09,,,,268.7667979,,,,,35.3,,,,,,,,,
102.100.100/402210,CSLOR,EPA VIC Site_Id 369,30/05/2023,3:25:00,2023-05-30T03:25:00Z,,2,5.5,2,2,,,12.6,,6.82,,,,,4.09,,,,268.7667979,,,,,35.3,,,,,,,,,
102.100.100/402214,CSLOR,EPA VIC Site_Id 369,20/06/2023,14:08:00,2023-06-20T14:08:00Z,Sample frozen after collection. Thawed and filtered on 27/6/23,1,5.2,2,2,,,11.2093,,4.22,,0.857,0.3,,,0.5476,2.642,2.14e-01,275.33,252.4,,7.943,3.164,34.5217,,5.3,4.161,,1.1,0.1777,2.43,2.6e-05,1.1e-05
102.100.100/402215,CSLOR,EPA VIC Site_Id 369,20/06/2023,14:13:00,2023-06-20T14:13:00Z,Sample frozen after collection. Thawed and filtered on 27/6/23,1,5.2,2,2,,,11.2093,,5.25,,0.857,0.3,,,0.5476,2.642,2.14e-01,275.33,252.4,,7.943,3.164,34.5217,,5.3,4.161,,1.1,0.1777,2.43,2.6e-05,1.1e-05
102.100.100/402216,CSLOR,EPA VIC Site_Id 369,20/06/2023,14:15:00,2023-06-20T14:15:00Z,Sample frozen after collection. Thawed and filtered on 27/6/23,1,5.2,2,2,,,11.2093,,2.96,,0.857,0.3,,,0.5476,2.642,2.14e-01,275.33,252.4,,7.943,3.164,34.5217,,5.3,4.161,,1.1,0.1777,2.43,2.6e-05,1.1e-05
102.100.100/402220,CSLOR,EPA VIC Site_Id 369,26/07/2023,4:00:00,2023-07-26T04:00:00Z,,1,5.3,2,2,,,,,12.5,,,,,,,,,,,,,,,,,,,,,,,
102.100.100/139061,CSLOR,EPA VIC Site_Id 369,26/07/2023,4:05:00,2023-07-26T04:05:00Z,,1,5.3,2,2,,,,,5.01,,,,,,,,,,,,,,,,,,,,,,,
102.100.100/139062,CSLOR,EPA VIC Site_Id 369,26/07/2023,4:10:00,2023-07-26T04:10:00Z,,1,5.3,2,2,,,,,7.43,,,,,,,,,,,,,,,,,,,,,,,
102.100.100/139063,CSLOR,EPA VIC Site_Id 369,24/08/2023,1:08:00,2023-08-24T01:08:00Z,,2,5.5,2,2,,,11.6,,9.73,,,,,3.972,,,,262.5164073,,,,,35.1,,,,,,,,,
102.100.100/403397,CSLOR,EPA VIC Site_Id 369,24/08/2023,1:11:00,2023-08-24T01:11:00Z,,2,5.5,2,2,,,11.6,,7.11,,,,,3.972,,,,262.5164073,,,,,35.1,,,,,,,,,
102.100.100/403398,CSLOR,EPA VIC Site_Id 369,24/08/2023,1:14:00,2023-08-24T01:14:00Z,,2,5.5,2,2,,,11.6,,12.4,,,,,3.972,,,,262.5164073,,,,,35.1,,,,,,,,,
102.100.100/403402,CSLOR,EPA VIC Site_Id 369,22/09/2023,1:05:00,2023-09-22T01:05:00Z,,2,5.5,2,2,,,,,24.3,,,,,4.217,,,,287.5179699,,,,,,,,,,,,,,
102.100.100/403403,CSLOR,EPA VIC Site_Id 369,22/09/2023,1:17:00,2023-09-22T01:17:00Z,,2,5.5,2,2,,,,,43.9,,,,,4.217,,,,287.5179699,,,,,,,,,,,,,,
102.100.100/403404,CSLOR,EPA VIC Site_Id 369,22/09/2023,1:23:00,2023-09-22T01:23:00Z,,2,5.5,2,2,,,,,42.4,,,,,4.217,,,,287.5179699,,,,,,,,,,,,,,
102.100.100/403408,CSLOR,EPA VIC Site_Id 369,23/10/2023,23:47:00,2023-10-23T23:47:00Z,,2,6,2,2,,,14.9,,2.53,,,,,4.202,,,,242.2026377,,,,,34.3,,,,,,,,,
102.100.100/403409,CSLOR,EPA VIC Site_Id 369,23/10/2023,23:49:00,2023-10-23T23:49:00Z,,2,6,2,2,,,14.9,,6.18,,,,,4.202,,,,242.2026377,,,,,34.3,,,,,,,,,
102.100.100/403410,CSLOR,EPA VIC Site_Id 369,23/10/2023,23:51:00,2023-10-23T23:51:00Z,,2,6,2,2,,,14.9,,21.9,,,,,4.202,,,,242.2026377,,,,,34.3,,,,,,,,,
102.100.100/403419,CSLOR,EPA VIC Site_Id 369,5/12/2023,0:01:00,2023-12-05T00:01:00Z,,2,5.5,2,2,,,,,30,,,,,4.78,,,,,,,,,,,,,,,,,,
102.100.100/403417,CSLOR,EPA VIC Site_Id 369,5/12/2023,23:55:00,2023-12-05T23:55:00Z,,2,5.5,2,2,,,,,22.3,,,,,4.78,,,,,,,,,,,,,,,,,,
102.100.100/403418,CSLOR,EPA VIC Site_Id 369,5/12/2023,23:58:00,2023-12-05T23:58:00Z,,2,5.5,2,2,,,,,23.6,,,,,4.78,,,,,,,,,,,,,,,,,,
102.100.100/403423,CSLOR,EPA VIC Site_Id 369,25/01/2024,23:30:00,2024-01-25T23:30:00Z,,1,5.5,2,2,,,,,19,,,,,,,,,,,,,,,,,,,,,,,
102.100.100/403424,CSLOR,EPA VIC Site_Id 369,25/01/2024,23:34:00,2024-01-25T23:34:00Z,,1,5.5,2,2,,,,,13.8,,,,,,,,,,,,,,,,,,,,,,,
102.100.100/403425,CSLOR,EPA VIC Site_Id 369,25/01/2024,23:38:00,2024-01-25T23:38:00Z,,1,5.5,2,2,,,,,16.7,,,,,,,,,,,,,,,,,,,,,,,
102.100.100/403561,CSLOR,EPA VIC Site_Id 369,22/03/2024,0:24:00,2024-03-22T00:24:00Z,,1,5.7,2,2,,,,,25.5,,,,,,,,,,,,,,,,,,,,,,,
102.100.100/403562,CSLOR,EPA VIC Site_Id 369,22/03/2024,0:27:00,2024-03-22T00:27:00Z,,1,5.7,2,2,,,,,25.1,,,,,,,,,,,,,,,,,,,,,,,
102.100.100/403563,CSLOR,EPA VIC Site_Id 369,22/03/2024,0:30:00,2024-03-22T00:30:00Z,,1,5.7,2,2,,,,,13,,,,,,,,,,,,,,,,,,,,,,,
102.100.100/403567,CSLOR,EPA VIC Site_Id 369,16/05/2024,1:29:00,2024-05-16T01:29:00Z,,1,5.1,2,2,,,,,13.8,,,,,,,,,,,,,,,,,,,,,,,
102.100.100/403568,CSLOR,EPA VIC Site_Id 369,16/05/2024,1:30:00,2024-05-16T01:30:00Z,,1,5.1,2,2,,,,,10.5,,,,,,,,,,,,,,,,,,,,,,,
102.100.100/403569,CSLOR,EPA VIC Site_Id 369,16/05/2024,1:32:00,2024-05-16T01:32:00Z,,1,5.1,2,2,,,,,11.8,,,,,,,,,,,,,,,,,,,,,,,
102.100.100/403573,CSLOR,EPA VIC Site_Id 369,24/09/2024,0:52,2024-09-24T00:52:00Z,,1,5.4,2,2,,,,,14.8,,,,,,,,,,,,,,,,,,,,,,,
102.100.100/403574,CSLOR,EPA VIC Site_Id 369,24/09/2024,0:55,2024-09-24T00:55:00Z,,1,5.4,2,2,,,,,17.6,,,,,,,,,,,,,,,,,,,,,,,
102.100.100/403575,CSLOR,EPA VIC Site_Id 369,24/09/2024,0:58,2024-09-24T00:58:00Z,,1,5.4,1.6,1.6,Other - Intake of air by pump created blockage,,,,11.9,,,,,,,,,,,,,,,,,,,,,,,
102.100.100/404297,CSLOR,EPA VIC Site_Id 369,7/11/2024,23:27,2024-11-07T23:27:00Z,,2,5.4,2,2,,,,,23.3,,,,,,,,,,,,,,,,,,,,,,,
102.100.100/404298,CSLOR,EPA VIC Site_Id 369,7/11/2024,23:29,2024-11-07T23:29:00Z,,2,5.4,2,2,,,,,42.8,,,,,,,,,,,,,,,,,,,,,,,
102.100.100/404299,CSLOR,EPA VIC Site_Id 369,7/11/2024,23:31,2024-11-07T23:31:00Z,,2,5.4,2,2,,,,,47.4,,,,,,,,,,,,,,,,,,,,,,,
102.100.100/404303,CSLOR,EPA VIC Site_Id 369,9/01/2025,23:26,2025-01-09T23:26:00Z,,1,5.4,1.6,1.6,High biomass/particulate matter,,,,24.7,,,,,,,,,,,,,,,,,,,,,,,
102.100.100/404304,CSLOR,EPA VIC Site_Id 369,9/01/2025,23:28,2025-01-09T23:28:00Z,,1,5.4,1.4,1.4,High biomass/particulate matter,,,,24.4,,,,,,,,,,,,,,,,,,,,,,,
102.100.100/404305,CSLOR,EPA VIC Site_Id 369,9/01/2025,23:30,2025-01-09T23:30:00Z,,1,5.4,1.4,1.4,High biomass/particulate matter,,,,27.3,,,,,,,,,,,,,,,,,,,,,,,
102.100.100/404306,CSLOR,EPA VIC Site_Id 369,25/05/2025,22:36,2025-05-25T22:36:00Z,,1,5.4,2,2,,WARNING: Storage or transport conditions compromised,,,,,,,,,,,,,,,,,,,,,,,,,,
102.100.100/404307,CSLOR,EPA VIC Site_Id 369,25/05/2025,22:38,2025-05-25T22:38:00Z,,1,5.4,2,2,,WARNING: Storage or transport conditions compromised,,,,,,,,,,,,,,,,,,,,,,,,,,
102.100.100/404308,CSLOR,EPA VIC Site_Id 369,25/05/2025,22:40,2025-05-25T22:40:00Z,,1,5.4,2,2,,WARNING: Storage or transport conditions compromised,,,,,,,,,,,,,,,,,,,,,,,,,,
102.100.100/405270,CSLOR,EPA VIC Site_Id 369,20/06/2025,23:32,2025-06-20T01:27:00Z,,2,5.4,2,2,,,,,,,,,,,,,,,,,,,,,,,,,,,,
102.100.100/405271,CSLOR,EPA VIC Site_Id 369,20/06/2025,23:35,2025-06-20T01:30:00Z,,2,5.4,2,2,,,,,,,,,,,,,,,,,,,,,,,,,,,,
102.100.100/405272,CSLOR,EPA VIC Site_Id 369,20/06/2025,23:38,2025-06-20T01:33:00Z,,2,5.4,2,2,,,,,,,,,,,,,,,,,,,,,,,,,,,,
102.100.100/405276,CSLOR,EPA VIC Site_Id 369,8/08/2025,2:14,2025-08-08T02:14:00Z,,1,5.5,2,2,,,,,,,,,,,,,,,,,,,,,,,,,,,,
102.100.100/405277,CSLOR,EPA VIC Site_Id 369,8/08/2025,2:16,2025-08-08T02:16:00Z,,1,5.5,2,2,,,,,,,,,,,,,,,,,,,,,,,,,,,,
102.100.100/405278,CSLOR,EPA VIC Site_Id 369,8/08/2025,2:19,2025-08-08T02:19:00Z,,1,5.5,2,2,,,,,,,,,,,,,,,,,,,,,,,,,,,,
102.100.100/665368,CSLOR,EPA VIC Site_Id 369,15/10/2025,0:21,2025-10-15T00:21:00Z,,1,5.6,2,2,,,,,,,,,,,,,,,,,,,,,,,,,,,,
102.100.100/665371,CSLOR,EPA VIC Site_Id 369,15/10/2025,0:23,2025-10-15T00:23:00Z,,1,5.6,2,2,,,,,,,,,,,,,,,,,,,,,,,,,,,,
102.100.100/665374,CSLOR,EPA VIC Site_Id 369,15/10/2025,0:25,2025-10-15T00:25:00Z,,1,5.6,2,2,,,,,,,,,,,,,,,,,,,,,,,,,,,,
102.100.100/138833,CSPTD,WQQ190_D0,14/07/2020,2:25:00,2020-07-14T02:25:00Z,,0.5,16,2,2,,,23.297,,,,0.0299,0.274,0.233,,,0.15,BDL,,,6.37,,0.05,35.06,35.075,2.5,5,74.6,2.31,ND,,,
102.100.100/138834,CSPTD,WQQ190_D0,14/07/2020,2:25:00,2020-07-14T02:25:00Z,,0.5,16,2,2,,,23.297,,,,0.0299,0.274,0.233,,,0.15,BDL,,,6.37,,0.05,35.06,35.075,2.5,5,74.6,2.31,ND,,,
102.100.100/138835,CSPTD,WQQ190_D0,14/07/2020,2:25:00,2020-07-14T02:25:00Z,,0.5,16,2,2,,,23.297,,,,0.0299,0.274,0.233,,,0.15,BDL,,,6.37,,0.05,35.06,35.075,2.5,5,74.6,2.31,ND,,,
102.100.100/138836,CSPTD,WQQ190_D1,14/07/2020,2:30:00,2020-07-14T02:30:00Z,,12,16,2,2,,,23.244,,,,0.0268,0.322,0.45,,,0.08,BDL,,,6.69,,0.045,35.07,35.065,2.5,5.1,72.5,2.72,ND,,,
102.100.100/138837,CSPTD,WQQ190_D1,14/07/2020,2:30:00,2020-07-14T02:30:00Z,,12,16,2,2,,,23.244,,,,0.0268,0.322,0.45,,,0.08,BDL,,,6.69,,0.045,35.07,35.065,2.5,5.1,72.5,2.72,ND,,,
102.100.100/138838,CSPTD,WQQ190_D1,14/07/2020,2:30:00,2020-07-14T02:30:00Z,,12,16,2,2,,,23.244,,,,0.0268,0.322,0.45,,,0.08,BDL,,,6.69,,0.045,35.07,35.065,2.5,5.1,72.5,2.72,ND,,,
102.100.100/138881,CSPTD,WQQ243_D0,29/09/2020,3:05:00,2020-09-29T03:05:00Z,,0.5,16,2,2,,,25.008,,,,BDL,0.157,0.097,,,0.11,BDL,,,6.45,,0.075,35.17,35.188,3.5,2.96,79.9,1.37,1.55,,,
102.100.100/138882,CSPTD,WQQ243_D0,29/09/2020,3:05:00,2020-09-29T03:05:00Z,,0.5,16,2,2,,,25.008,,,,BDL,0.157,0.097,,,0.11,BDL,,,6.45,,0.075,35.17,35.188,3.5,2.96,79.9,1.37,1.55,,,
102.100.100/138883,CSPTD,WQQ243_D0,29/09/2020,3:05:00,2020-09-29T03:05:00Z,,0.5,16,2,2,,,25.008,,,,BDL,0.157,0.097,,,0.11,BDL,,,6.45,,0.075,35.17,35.188,3.5,2.96,79.9,1.37,1.55,,,
102.100.100/138884,CSPTD,WQQ243_D1,29/09/2020,3:15:00,2020-09-29T03:15:00Z,,13,16,2,2,,,25.787,,,,BDL,0.235,0.197,,,0.08,BDL,,,6.01,,0.06,35.17,35.183,3.5,2.99,82.4,1.81,1.49,,,
102.100.100/138885,CSPTD,WQQ243_D1,29/09/2020,3:15:00,2020-09-29T03:15:00Z,,13,16,2,2,,,25.787,,,,BDL,0.235,0.197,,,0.08,BDL,,,6.01,,0.06,35.17,35.183,3.5,2.99,82.4,1.81,1.49,,,
102.100.100/138886,CSPTD,WQQ243_D1,29/09/2020,3:15:00,2020-09-29T03:15:00Z,,13,16,2,2,,,25.787,,,,BDL,0.235,0.197,,,0.08,BDL,,,6.01,,0.06,35.17,35.183,3.5,2.99,82.4,1.81,1.49,,,
102.100.100/138929,CSPTD,WQQ318_D0,15/02/2021,2:05:00,2021-02-15T02:05:00Z,,0.5,18,2,2,,,30.34,,,,0.4684,0.198,0.219,,,0.28,0.03,,,5.76,,BDL,30.23,31.029,13,11.26,93.2,0.27,ND,,,
102.100.100/138930,CSPTD,WQQ318_D0,15/02/2021,2:05:00,2021-02-15T02:05:00Z,,0.5,18,2,2,,,30.34,,,,0.4684,0.198,0.219,,,0.28,0.03,,,5.76,,BDL,30.23,31.029,13,11.26,93.2,0.27,ND,,,
102.100.100/138931,CSPTD,WQQ318_D0,15/02/2021,2:06:00,2021-02-15T02:06:00Z,,0.5,18,2,2,,,30.34,,,,0.4684,0.198,0.219,,,0.28,0.03,,,5.76,,BDL,30.23,31.029,13,11.26,93.2,0.27,ND,,,
102.100.100/138932,CSPTD,WQQ318_D1,15/02/2021,2:06:00,2021-02-15T02:06:00Z,,14,18,2,2,,,29.492,,,,0.0178,0.384,0.756,,,0.09,BDL,,,8.82,,BDL,30.69,33.629,13,2.74,75.6,0.6,ND,,,
102.100.100/138933,CSPTD,WQQ318_D1,15/02/2021,2:07:00,2021-02-15T02:07:00Z,,14,18,2,2,,,29.492,,,,0.0178,0.384,0.756,,,0.09,BDL,,,8.82,,BDL,30.69,33.629,13,2.74,75.6,0.6,ND,,,
102.100.100/138934,CSPTD,WQQ318_D1,15/02/2021,2:07:00,2021-02-15T02:07:00Z,,14,18,2,2,,,29.492,,,,0.0178,0.384,0.756,,,0.09,BDL,,,8.82,,BDL,30.69,33.629,13,2.74,75.6,0.6,ND,,,
102.100.100/138971,CSPTD,WQQ444_D0,3/10/2021,23:01:00,2021-10-03T23:01:00Z,,0,17,2,2,,,25.791,,,,0.11,0.137,0.0336,,,0.065,BDL,,,4.237,,0.05,35.2199,35.229,9,2.15,86.147,0.544,ND,,,
102.100.100/138972,CSPTD,WQQ444_D0,3/10/2021,23:02:00,2021-10-03T23:02:00Z,,0,17,2,2,,,25.791,,,,0.11,0.137,0.0336,,,0.065,BDL,,,4.237,,0.05,35.2199,35.229,9,2.15,86.147,0.544,ND,,,
102.100.100/138973,CSPTD,WQQ444_D0,3/10/2021,23:03:00,2021-10-03T23:03:00Z,,0,17,2,2,,,25.791,,,,0.11,0.137,0.0336,,,0.065,BDL,,,4.237,,0.05,35.2199,35.229,9,2.15,86.147,0.544,ND,,,
102.100.100/138974,CSPTD,WQQ444_D1,3/10/2021,23:04:00,2021-10-03T23:04:00Z,,14,17,2,2,,,25.254,,,,0.155,0.3248,0.1758,,,0.055,BDL,,,2.553,,0.055,35.2208,35.228,9,1.93,79.113,1.559,ND,,,
102.100.100/138975,CSPTD,WQQ444_D1,3/10/2021,23:05:00,2021-10-03T23:05:00Z,,14,17,2,2,,,25.254,,,,0.155,0.3248,0.1758,,,0.055,BDL,,,2.553,,0.055,35.2208,35.228,9,1.93,79.113,1.559,ND,,,
102.100.100/138977,CSPTD,WQQ444_D1,3/10/2021,23:06:00,2021-10-03T23:06:00Z,,14,17,2,2,,,25.254,,,,0.155,0.3248,0.1758,,,0.055,BDL,,,2.553,,0.055,35.2208,35.228,9,1.93,79.113,1.559,ND,,,
102.100.100/142705,CSPTD,WQQ517_D0,12/02/2022,4:25:00,2022-02-12T04:25:00Z,,0,17,2,2,,,30.179,,,,0.125,0.0954,0.081,,,0.03,BDL,,,4.47,,BDL,33.2579,33.293,9,8.21,95.7507,0.05,ND,,,
102.100.100/142706,CSPTD,WQQ517_D0,12/02/2022,4:27:00,2022-02-12T04:27:00Z,,0,17,2,2,,,30.179,,,,0.125,0.0954,0.081,,,0.03,BDL,,,4.47,,BDL,33.2579,33.293,9,8.21,95.7507,0.05,ND,,,
102.100.100/142707,CSPTD,WQQ517_D0,12/02/2022,4:28:00,2022-02-12T04:28:00Z,,0,17,2,2,,,30.179,,,,0.125,0.0954,0.081,,,0.03,BDL,,,4.47,,BDL,33.2579,33.293,9,8.21,95.7507,0.05,ND,,,
102.100.100/142708,CSPTD,WQQ517_D1,12/02/2022,4:29:00,2022-02-12T04:29:00Z,,13,17,2,2,,,29.472,,,,0.355,0.1802,0.1377,,,0.035,BDL,,,5.653,,0.02,33.8317,33.786,9,4.43,89.7376,0.199,ND,,,
102.100.100/142709,CSPTD,WQQ517_D1,12/02/2022,4:32:00,2022-02-12T04:32:00Z,,13,17,2,2,,,29.472,,,,0.355,0.1802,0.1377,,,0.035,BDL,,,5.653,,0.02,33.8317,33.786,9,4.43,89.7376,0.199,ND,,,
102.100.100/142710,CSPTD,WQQ517_D1,12/02/2022,4:34:00,2022-02-12T04:34:00Z,,13,17,2,2,,,29.472,,,,0.355,0.1802,0.1377,,,0.035,BDL,,,5.653,,0.02,33.8317,33.786,9,4.43,89.7376,0.199,ND,,,
102.100.100/142750,CSPTD,WQQ583_D1,8/06/2022,23:05:00,2022-06-08T23:05:00Z,,13,17,2,2,,,26.061,,2.69,,0.5,0.3032,0.3229,,,0.13,BDL,,,5.203,,0.03,33.7419,33.75,4,4.25,77.2379,1.524,1.7677,,,
102.100.100/142751,CSPTD,WQQ583_D1,8/06/2022,23:07:00,2022-06-08T23:07:00Z,,13,17,2,2,,,26.061,,3.84,,0.5,0.3032,0.3229,,,0.13,BDL,,,5.203,,0.03,33.7419,33.75,4,4.25,77.2379,1.524,1.7677,,,
102.100.100/142752,CSPTD,WQQ583_D1,8/06/2022,23:09:00,2022-06-08T23:09:00Z,,13,17,2,2,,,26.061,,7.06,,0.5,0.3032,0.3229,,,0.13,BDL,,,5.203,,0.03,33.7419,33.75,4,4.25,77.2379,1.524,1.7677,,,
102.100.100/142747,CSPTD,WQQ583_D0,8/06/2022,23:10:00,2022-06-08T23:10:00Z,,0,17,2,2,,,26.075,,18,,0.28,0.2989,0.3429,,,0.085,BDL,,,5.57,,0.04,33.7398,33.756,4,4.225,76.2261,1.609,1.5745,,,
102.100.100/142748,CSPTD,WQQ583_D0,8/06/2022,23:12:00,2022-06-08T23:12:00Z,,0,17,2,2,,,26.075,,3,,0.28,0.2989,0.3429,,,0.085,BDL,,,5.57,,0.04,33.7398,33.756,4,4.225,76.2261,1.609,1.5745,,,
102.100.100/142749,CSPTD,WQQ583_D0,8/06/2022,23:13:00,2022-06-08T23:13:00Z,,0,17,2,2,,,26.075,,4.06,,0.28,0.2989,0.3429,,,0.085,BDL,,,5.57,,0.04,33.7398,33.756,4,4.225,76.2261,1.609,1.5745,,,
102.100.100/142789,CSPTD,WQQ644_D0,2/11/2022,5:26:00,2022-11-02T05:26:00Z,,0,18.5,2,2,,,ND,,,,0.11,0.206235,0.3763,,,0.03,0.01,,,8.065,,0.065,34.9889,35.01447,0,2.515,70.1448,2.31,2.2356,,,
102.100.100/142790,CSPTD,WQQ644_D0,2/11/2022,5:28:00,2022-11-02T05:28:00Z,,0,18.5,2,2,,,ND,,,,0.11,0.206235,0.3763,,,0.03,0.01,,,8.065,,0.065,34.9889,35.01447,0,2.515,70.1448,2.31,2.2356,,,
102.100.100/142791,CSPTD,WQQ644_D0,2/11/2022,5:30:00,2022-11-02T05:30:00Z,,0,18.5,2,2,,,ND,,,,0.11,0.206235,0.3763,,,0.03,0.01,,,8.065,,0.065,34.9889,35.01447,0,2.515,70.1448,2.31,2.2356,,,
102.100.100/142792,CSPTD,WQQ644_D1,2/11/2022,5:33:00,2022-11-02T05:33:00Z,,13,18.5,2,2,,,ND,,,,0.325,0.19905,0.3244,,,0.04,0.01,,,7.431665,,0.06,34.988,35.01575,0,2.355,52.9167,2.71,4.3704,,,
102.100.100/142793,CSPTD,WQQ644_D1,2/11/2022,5:35:00,2022-11-02T05:35:00Z,,13,18.5,2,2,,,ND,,,,0.325,0.19905,0.3244,,,0.04,0.01,,,7.431665,,0.06,34.988,35.01575,0,2.355,52.9167,2.71,4.3704,,,
102.100.100/142794,CSPTD,WQQ644_D1,2/11/2022,5:38:00,2022-11-02T05:38:00Z,,13,18.5,2,2,,,ND,,,,0.325,0.19905,0.3244,,,0.04,0.01,,,7.431665,,0.06,34.988,35.01575,0,2.355,52.9167,2.71,4.3704,,,
102.100.100/400515,CSPTD,WQQ717_D0,24/02/2023,4:35:00,2023-02-24T04:35:00Z,,0,15,2,2,,,28.681,,26.9,,0.075,0.548565,0.2675,,,0.095,0.01,,,9.22333,,0.04,32.6459,32.67839,5,7.13,82.9378,1.105,ND,,,
102.100.100/400516,CSPTD,WQQ717_D0,24/02/2023,4:37:00,2023-02-24T04:37:00Z,,0,15,2,2,,,28.681,,16.5,,0.075,0.548565,0.2675,,,0.095,0.01,,,9.22333,,0.04,32.6459,32.67839,5,7.13,82.9378,1.105,ND,,,
102.100.100/400517,CSPTD,WQQ717_D0,24/02/2023,4:38:00,2023-02-24T04:38:00Z,,0,15,2,2,,,28.681,,20.9,,0.075,0.548565,0.2675,,,0.095,0.01,,,9.22333,,0.04,32.6459,32.67839,5,7.13,82.9378,1.105,ND,,,
102.100.100/400518,CSPTD,WQQ717_D1,24/02/2023,4:40:00,2023-02-24T04:40:00Z,,12,15,2,2,,,28.568,,7.24,,0.1,0.400355,0.3809,,,0.05,0.01,,,8.031665,,0.01,32.6415,32.67299,5,7.195,79.104,1.29,ND,,,
102.100.100/400519,CSPTD,WQQ717_D1,24/02/2023,4:42:00,2023-02-24T04:42:00Z,,12,15,2,2,,,28.568,,19.8,,0.1,0.400355,0.3809,,,0.05,0.01,,,8.031665,,0.01,32.6415,32.67299,5,7.195,79.104,1.29,ND,,,
102.100.100/400520,CSPTD,WQQ717_D1,24/02/2023,4:44:00,2023-02-24T04:44:00Z,,12,15,2,2,,,28.568,,23,,0.1,0.400355,0.3809,,,0.05,0.01,,,8.031665,,0.01,32.6415,32.67299,5,7.195,79.104,1.29,ND,,,
102.100.100/400557,CSPTD,WQQ783_D0,21/06/2023,5:15:00,2023-06-21T05:15:00Z,,0,16,2,2,,,24.817,,13.2,,0.18,0.34272,0.5242,,,0.01,0.01,,,10.431665,,0.035,34.4065,34.42573,4,2.6,80.2341,1.11,ND,,,
102.100.100/400558,CSPTD,WQQ783_D0,21/06/2023,5:18:00,2023-06-21T05:18:00Z,,0,16,2,2,,,24.817,,10.2,,0.18,0.34272,0.5242,,,0.01,0.01,,,10.431665,,0.035,34.4065,34.42573,4,2.6,80.2341,1.11,ND,,,
102.100.100/400559,CSPTD,WQQ783_D0,21/06/2023,5:21:00,2023-06-21T05:21:00Z,,0,16,2,2,,,24.817,,14.4,,0.18,0.34272,0.5242,,,0.01,0.01,,,10.431665,,0.035,34.4065,34.42573,4,2.6,80.2341,1.11,ND,,,
102.100.100/400560,CSPTD,WQQ783_D1,21/06/2023,5:23:00,2023-06-21T05:23:00Z,,13,16,2,2,,,24.584,,9.58,,0.155,0.467255,0.7129,,,0.01,0.01,,,7.965,,0.045,34.3967,34.40781,4,2.655,73.3381,1.735,ND,,,
102.100.100/400561,CSPTD,WQQ783_D1,21/06/2023,5:26:00,2023-06-21T05:26:00Z,,13,16,2,2,,,24.584,,10.5,,0.155,0.467255,0.7129,,,0.01,0.01,,,7.965,,0.045,34.3967,34.40781,4,2.655,73.3381,1.735,ND,,,
102.100.100/400562,CSPTD,WQQ783_D1,21/06/2023,5:28:00,2023-06-21T05:28:00Z,,13,16,2,2,,,24.584,,6.84,,0.155,0.467255,0.7129,,,0.01,0.01,,,7.965,,0.045,34.3967,34.40781,4,2.655,73.3381,1.735,ND,,,
102.100.100/403490,CSPTD,WQQ844_D0,26/10/2023,22:53:00,2023-10-26T22:53:00Z,,0,,2,2,,,26.408,,4.37,,0.34,0.082,0.0874,,,0.04,0.01,,,3.985,,0.115,35.3026,35.346,9,1.625,89.0967,0.12,,,,
102.100.100/403491,CSPTD,WQQ844_D0,26/10/2023,22:55:00,2023-10-26T22:55:00Z,,0,,2,2,,,26.408,,2.64,,0.34,0.082,0.0874,,,0.04,0.01,,,3.985,,0.115,35.3026,35.346,9,1.625,89.0967,0.12,,,,
102.100.100/403492,CSPTD,WQQ844_D0,26/10/2023,22:56:00,2023-10-26T22:56:00Z,,0,,2,2,,,26.408,,3.65,,0.34,0.082,0.0874,,,0.04,0.01,,,3.985,,0.115,35.3026,35.346,9,1.625,89.0967,0.12,,,,
102.100.100/403493,CSPTD,WQQ844_D1,26/10/2023,22:58:00,2023-10-26T22:58:00Z,,15.2,,2,2,,,26.293,,5.5,,0.17,0.107,0.1329,,,0.015,0.01,,,5.1,,0.11,35.3021,35.331,9,1.845,87.7543,1.01,,,,
102.100.100/403494,CSPTD,WQQ844_D1,26/10/2023,23:00:00,2023-10-26T23:00:00Z,,15.2,,2,2,,,26.293,,2.75,,0.17,0.107,0.1329,,,0.015,0.01,,,5.1,,0.11,35.3021,35.331,9,1.845,87.7543,1.01,,,,
102.100.100/403495,CSPTD,WQQ844_D1,26/10/2023,23:02:00,2023-10-26T23:02:00Z,,15.2,,2,2,,,26.293,,3.12,,0.17,0.107,0.1329,,,0.015,0.01,,,5.1,,0.11,35.3021,35.331,9,1.845,87.7543,1.01,,,,
102.100.100/403594,CSPTD,WQQ917_D0,21/02/2024,22:06:00,2024-02-21T22:06:00Z,,0,,2,2,,,0,,8.43,,0.205,0.314,0.2917,,,0.01,0.01,,,7.065,,0.045,32.8125,32.772,8,8.29,,0.815,0.9632,,,
102.100.100/403595,CSPTD,WQQ917_D0,21/02/2024,22:06:00,2024-02-21T22:06:00Z,,0,,2,2,,,0,,9.95,,0.205,0.314,0.2917,,,0.01,0.01,,,7.065,,0.045,32.8125,32.772,8,8.29,,0.815,0.9632,,,
102.100.100/403596,CSPTD,WQQ917_D0,21/02/2024,22:06:00,2024-02-21T22:06:00Z,,0,,2,2,,,0,,11.7,,0.205,0.314,0.2917,,,0.01,0.01,,,7.065,,0.045,32.8125,32.772,8,8.29,,0.815,0.9632,,,
102.100.100/403597,CSPTD,WQQ917_D1,21/02/2024,22:06:00,2024-02-21T22:06:00Z,,15,,2,2,,,0,,11.4,,0.255,0.347,0.3291,,,0.01,0.01,,,5.515,,0.05,32.8257,32.812,8,8.345,,0.865,0.9832,,,
102.100.100/403598,CSPTD,WQQ917_D1,21/02/2024,22:06:00,2024-02-21T22:06:00Z,,15,,2,2,,,0,,10.1,,0.255,0.347,0.3291,,,0.01,0.01,,,5.515,,0.05,32.8257,32.812,8,8.345,,0.865,0.9832,,,
102.100.100/403599,CSPTD,WQQ917_D1,21/02/2024,22:06:00,2024-02-21T22:06:00Z,,15,,2,2,,,0,,5.7,,0.255,0.347,0.3291,,,0.01,0.01,,,5.515,,0.05,32.8257,32.812,8,8.345,,0.865,0.9832,,,
102.100.100/403808,CSPTD,WQQ983_D0,9/06/2024,4:30:00,2024-06-09T04:30:00Z,,0,,2,2,,,24.52,,8.04,,0.09,0.206,0.227,,,0.055,0.01,,,8.33,,0.08,34.8318,34.832,3.5,6.185,76.4699,0,2.6488,,,
102.100.100/403809,CSPTD,WQQ983_D0,9/06/2024,4:30:00,2024-06-09T04:30:00Z,,0,,2,2,,,24.52,,14.3,,0.09,0.206,0.227,,,0.055,0.01,,,8.33,,0.08,34.8318,34.832,3.5,6.185,76.4699,0,2.6488,,,
102.100.100/403810,CSPTD,WQQ983_D0,9/06/2024,4:30:00,2024-06-09T04:30:00Z,,0,,2,2,,,24.52,,5.7,,0.09,0.206,0.227,,,0.055,0.01,,,8.33,,0.08,34.8318,34.832,3.5,6.185,76.4699,0,2.6488,,,
102.100.100/403811,CSPTD,WQQ983_D1,9/06/2024,4:30:00,2024-06-09T04:30:00Z,,12,,2,2,,,24.523,,12.3,,0.105,0.2095,0.4048,,,0.03,0.01,,,8.8,,0.08,34.8326,34.833,3.5,6.22,59.9186,0,5.1868,,,
102.100.100/403812,CSPTD,WQQ983_D1,9/06/2024,4:30:00,2024-06-09T04:30:00Z,,12,,2,2,,,24.523,,5.56,,0.105,0.2095,0.4048,,,0.03,0.01,,,8.8,,0.08,34.8326,34.833,3.5,6.22,59.9186,0,5.1868,,,
102.100.100/403813,CSPTD,WQQ983_D1,9/06/2024,4:30:00,2024-06-09T04:30:00Z,,12,,2,2,,,24.523,,14.3,,0.105,0.2095,0.4048,,,0.03,0.01,,,8.8,,0.08,34.8326,34.833,3.5,6.22,59.9186,0,5.1868,,,
102.100.100/404272,CSPTD,WQR055_D1,26/10/2024,4:33,2024-10-26T04:33:00Z,,13,,2,2,,,27.114,,2.59,,0.38,0.1765,0.197,,,0.06,0.01,,,5.49,,0.095,35.4005,35.424,6,2.36,84.4879,0.87,1.8491,,,
102.100.100/404273,CSPTD,WQR055_D1,26/10/2024,4:38,2024-10-26T04:38:00Z,,13,,2,2,,,27.114,,7.1,,0.38,0.1765,0.197,,,0.06,0.01,,,5.49,,0.095,35.4005,35.424,6,2.36,84.4879,0.87,1.8491,,,
102.100.100/404274,CSPTD,WQR055_D1,26/10/2024,4:40,2024-10-26T04:40:00Z,,13,,2,2,,,27.114,,8.85,,0.38,0.1765,0.197,,,0.06,0.01,,,5.49,,0.095,35.4005,35.424,6,2.36,84.4879,0.87,1.8491,,,
102.100.100/404269,CSPTD,WQR055_D0,26/10/2024,4:42,2024-10-26T04:42:00Z,,0,,2,2,,,27.45,,5.6,,0.17,0.1085,0.0653,,,0.01,0.01,,,4.35,,0.08,35.4138,35.439,6,2.275,88.4128,0.64,1.4522,,,
102.100.100/404270,CSPTD,WQR055_D0,26/10/2024,4:44,2024-10-26T04:44:00Z,,0,,2,2,,,27.45,,7.51,,0.17,0.1085,0.0653,,,0.01,0.01,,,4.35,,0.08,35.4138,35.439,6,2.275,88.4128,0.64,1.4522,,,
102.100.100/404271,CSPTD,WQR055_D0,26/10/2024,4:45,2024-10-26T04:45:00Z,,0,,2,2,,,27.45,,3.97,,0.17,0.1085,0.0653,,,0.01,0.01,,,4.35,,0.08,35.4138,35.439,6,2.275,88.4128,0.64,1.4522,,,
102.100.100/404487,CSPTD,WQR138_D0,13/02/2025,22:03,2025-02-13T22:03:00Z,,0,,2,2,,,29.02493,,19.1,,0.405,0.2965,0.3487,,,0.175,0.025,,,9.725,,0.03,25.2158,25.858,10,17.05,,0.485,0.4399,,,
102.100.100/404488,CSPTD,WQR138_D0,13/02/2025,23:04,2025-02-13T23:04:00Z,,0,,2,2,,,29.02493,,15.2,,0.405,0.2965,0.3487,,,0.175,0.025,,,9.725,,0.03,25.2158,25.858,10,17.05,,0.485,0.4399,,,
102.100.100/404489,CSPTD,WQR138_D0,13/02/2025,23:05,2025-02-13T23:05:00Z,,0,,2,2,,,29.02493,,13.4,,0.405,0.2965,0.3487,,,0.175,0.025,,,9.725,,0.03,25.2158,25.858,10,17.05,,0.485,0.4399,,,
102.100.100/404490,CSPTD,WQR138_D1,13/02/2025,23:07,2025-02-13T23:07:00Z,,15,,2,2,,,29.67572,,10.3,,0.11,0.4665,0.2697,,,0.04,0.0075,,,8.27,,0.04,32.6056,29.963,10,11.7,,0.66,0.7193,,,
102.100.100/404491,CSPTD,WQR138_D1,13/02/2025,23:09,2025-02-13T23:09:00Z,,15,,2,2,,,29.67572,,9.61,,0.11,0.4665,0.2697,,,0.04,0.0075,,,8.27,,0.04,32.6056,29.963,10,11.7,,0.66,0.7193,,,
102.100.100/404492,CSPTD,WQR138_D1,13/02/2025,23:10,2025-02-13T23:10:00Z,,15,,2,2,,,29.67572,,9.68,,0.11,0.4665,0.2697,,,0.04,0.0075,,,8.27,,0.04,32.6056,29.963,10,11.7,,0.66,0.7193,,,
102.100.100/405286,CSPTD,WQR214_D0,22/06/2025,2:02,2025-06-22T02:02:00Z,,0,,2,2,,,23.4785,,8.57,,0.2,0.364,0.3451,,,0.03,0.0075,,,8.895,,0.09,34.3784,34.376,4,5.86,77.5191,2.005,,,,
102.100.100/405287,CSPTD,WQR214_D0,22/06/2025,2:03,2025-06-22T02:03:00Z,,0,,2,2,,,23.4785,,10.6,,0.2,0.364,0.3451,,,0.03,0.0075,,,8.895,,0.09,34.3784,34.376,4,5.86,77.5191,2.005,,,,
102.100.100/405288,CSPTD,WQR214_D0,22/06/2025,2:05,2025-06-22T02:05:00Z,,0,,2,2,,,23.4785,,10.9,,0.2,0.364,0.3451,,,0.03,0.0075,,,8.895,,0.09,34.3784,34.376,4,5.86,77.5191,2.005,,,,
102.100.100/405289,CSPTD,WQR214_D1,22/06/2025,2:07,2025-06-22T02:07:00Z,,10,,2,2,,,23.4299,,6.65,,0.205,0.4375,0.6435,,,0.025,0.0125,,,9.585,,0.095,34.3769,34.372,4,5.805,76.3518,2.23,,,,
102.100.100/405290,CSPTD,WQR214_D1,22/06/2025,2:08,2025-06-22T02:08:00Z,,10,,2,2,,,23.4299,,13.6,,0.205,0.4375,0.6435,,,0.025,0.0125,,,9.585,,0.095,34.3769,34.372,4,5.805,76.3518,2.23,,,,
102.100.100/405291,CSPTD,WQR214_D1,22/06/2025,2:09,2025-06-22T02:09:00Z,,10,,2,2,,,23.4299,,13.7,,0.205,0.4375,0.6435,,,0.025,0.0125,,,9.585,,0.095,34.3769,34.372,4,5.805,76.3518,2.23,,,,
102.100.100/138824,CSRMR,WQQ185_D0,13/07/2020,3:15:00,2020-07-13T03:15:00Z,,2,8,2,2,,,23.196,,,,ND,0.275,0.192,,,0.25,BDL,,,8.88,,0.065,33.31,33.627,3,13.43,75,1.77,ND,,,
102.100.100/138825,CSRMR,WQQ185_D0,13/07/2020,3:15:00,2020-07-13T03:15:00Z,,2,8,2,2,,,23.196,,,,ND,0.275,0.192,,,0.25,BDL,,,8.88,,0.065,33.31,33.627,3,13.43,75,1.77,ND,,,
102.100.100/138826,CSRMR,WQQ185_D0,13/07/2020,3:15:00,2020-07-13T03:15:00Z,,2,8,2,2,,,23.196,,,,ND,0.275,0.192,,,0.25,BDL,,,8.88,,0.065,33.31,33.627,3,13.43,75,1.77,ND,,,
102.100.100/138866,CSRMR,WQQ238_D0,28/09/2020,3:35:00,2020-09-28T03:35:00Z,,2,8,2,2,,,26.317,,,,ND,0.169,0.154,,,0.04,BDL,,,8.21,,0.05,34.6,34.633,6,6.89,82.5,0.89,0.92,,,
102.100.100/138867,CSRMR,WQQ238_D0,28/09/2020,3:35:00,2020-09-28T03:35:00Z,,2,8,2,2,,,26.317,,,,ND,0.169,0.154,,,0.04,BDL,,,8.21,,0.05,34.6,34.633,6,6.89,82.5,0.89,0.92,,,
102.100.100/138868,CSRMR,WQQ238_D0,28/09/2020,3:35:00,2020-09-28T03:35:00Z,,2,8,2,2,,,26.317,,,,ND,0.169,0.154,,,0.04,BDL,,,8.21,,0.05,34.6,34.633,6,6.89,82.5,0.89,0.92,,,
102.100.100/138908,CSRMR,WQQ305_D0,13/02/2021,4:20:00,2021-02-13T04:20:00Z,,2,13,2,2,,,ND,,,,ND,0.218,0.299,,,0.24,BDL,,,8.52,,BDL,30.92,32.566,3.5,9.87,81.5,0.61,ND,,,
102.100.100/138909,CSRMR,WQQ305_D0,13/02/2021,4:22:00,2021-02-13T04:22:00Z,,2,13,2,2,,,ND,,,,ND,0.218,0.299,,,0.24,BDL,,,8.52,,BDL,30.92,32.566,3.5,9.87,81.5,0.61,ND,,,
102.100.100/138910,CSRMR,WQQ305_D0,13/02/2021,4:24:00,2021-02-13T04:24:00Z,,2,13,2,2,,,ND,,,,ND,0.218,0.299,,,0.24,BDL,,,8.52,,BDL,30.92,32.566,3.5,9.87,81.5,0.61,ND,,,
102.100.100/138950,CSRMR,WQQ431_D0,1/10/2021,23:52:00,2021-10-01T23:52:00Z,,2,9,2,2,,,25.203,,,,0.17,0.5546,0.238,,,0.085,0.025,,,11.25,,0.035,34.9269,34.826,3.5,7.835,64.8661,2.249,ND,,,
102.100.100/138951,CSRMR,WQQ431_D0,1/10/2021,23:53:00,2021-10-01T23:53:00Z,,2,9,2,2,,,25.203,,,,0.17,0.5546,0.238,,,0.085,0.025,,,11.25,,0.035,34.9269,34.826,3.5,7.835,64.8661,2.249,ND,,,
102.100.100/138952,CSRMR,WQQ431_D0,1/10/2021,23:54:00,2021-10-01T23:54:00Z,,2,9,2,2,,,25.203,,,,0.17,0.5546,0.238,,,0.085,0.025,,,11.25,,0.035,34.9269,34.826,3.5,7.835,64.8661,2.249,ND,,,
102.100.100/142690,CSRMR,WQQ504_D0,10/02/2022,23:48:00,2022-02-10T23:48:00Z,,2,9,2,2,,,29.958,,,,0.455,0.1176,0.1071,,,0.09,0.02,,,5.603,,BDL,33.4753,33.413,8,8.315,95.1904,0.05,ND,,,
102.100.100/142691,CSRMR,WQQ504_D0,10/02/2022,23:50:00,2022-02-10T23:50:00Z,,2,9,2,2,,,29.958,,,,0.455,0.1176,0.1071,,,0.09,0.02,,,5.603,,BDL,33.4753,33.413,8,8.315,95.1904,0.05,ND,,,
102.100.100/142692,CSRMR,WQQ504_D0,10/02/2022,23:52:00,2022-02-10T23:52:00Z,,2,9,2,2,,,29.958,,,,0.455,0.1176,0.1071,,,0.09,0.02,,,5.603,,BDL,33.4753,33.413,8,8.315,95.1904,0.05,ND,,,
102.100.100/142732,CSRMR,WQQ570_D0,7/06/2022,0:26:00,2022-06-07T00:26:00Z,,2,7,2,2,,,25.83,,6.8,,0.125,0.424,0.4042,,,1.01,BDL,,,9.187,,0.03,31.5068,31.865,6,18.66,86.2118,0.619,0.8115,,,
102.100.100/142733,CSRMR,WQQ570_D0,7/06/2022,0:28:00,2022-06-07T00:28:00Z,,2,7,2,2,,,25.83,,45.1,,0.125,0.424,0.4042,,,1.01,BDL,,,9.187,,0.03,31.5068,31.865,6,18.66,86.2118,0.619,0.8115,,,
102.100.100/142734,CSRMR,WQQ570_D0,7/06/2022,0:30:00,2022-06-07T00:30:00Z,,2,7,2,2,,,25.83,,,,0.125,0.424,0.4042,,,1.01,BDL,,,9.187,,0.03,31.5068,31.865,6,18.66,86.2118,0.619,0.8115,,,
102.100.100/142774,CSRMR,WQQ630_D0,31/10/2022,23:50:00,2022-10-31T23:50:00Z,,2,0,2,2,,,27.724,,,,0.3,0.3505,0.3698,,,0.08,0.015,,,9.70667,,0.085,34.9996,35.0378,3.5,2.615,72.5085,2.14,1.7189,,,
102.100.100/142775,CSRMR,WQQ630_D0,31/10/2022,23:53:00,2022-10-31T23:53:00Z,,2,0,2,2,,,27.724,,,,0.3,0.3505,0.3698,,,0.08,0.015,,,9.70667,,0.085,34.9996,35.0378,3.5,2.615,72.5085,2.14,1.7189,,,
102.100.100/142776,CSRMR,WQQ630_D0,31/10/2022,23:54:00,2022-10-31T23:54:00Z,,2,0,2,2,,,27.724,,,,0.3,0.3505,0.3698,,,0.08,0.015,,,9.70667,,0.085,34.9996,35.0378,3.5,2.615,72.5085,2.14,1.7189,,,
102.100.100/400500,CSRMR,WQQ704_D0,23/02/2023,0:26:00,2023-02-23T00:26:00Z,,2,8,2,2,,,28.332,,17.5,,0.4,0.47446,0.2892,,,0.27,0.045,,,11.19667,,0.07,31.0516,31.44768,2.5,17.49,65.6873,2.88,ND,,,
102.100.100/400501,CSRMR,WQQ704_D0,23/02/2023,0:29:00,2023-02-23T00:29:00Z,,2,8,2,2,,,28.332,,20.9,,0.4,0.47446,0.2892,,,0.27,0.045,,,11.19667,,0.07,31.0516,31.44768,2.5,17.49,65.6873,2.88,ND,,,
102.100.100/400502,CSRMR,WQQ704_D0,23/02/2023,0:31:00,2023-02-23T00:31:00Z,,2,8,2,2,,,28.332,,16.2,,0.4,0.47446,0.2892,,,0.27,0.045,,,11.19667,,0.07,31.0516,31.44768,2.5,17.49,65.6873,2.88,ND,,,
102.100.100/400542,CSRMR,WQQ770_D0,19/06/2023,23:48:00,2023-06-19T23:48:00Z,,2,9,2,2,,,24.384,,11.9,,0.31,0.51357,0.4817,,,0.12,0.03,,,10.873335,,0.05,33.8394,33.88892,4,4.965,79.958,1.915,ND,,,
102.100.100/400543,CSRMR,WQQ770_D0,19/06/2023,23:51:00,2023-06-19T23:51:00Z,,2,9,2,2,,,24.384,,13.7,,0.31,0.51357,0.4817,,,0.12,0.03,,,10.873335,,0.05,33.8394,33.88892,4,4.965,79.958,1.915,ND,,,
102.100.100/400544,CSRMR,WQQ770_D0,19/06/2023,23:53:00,2023-06-19T23:53:00Z,,2,9,2,2,,,24.384,,10.5,,0.31,0.51357,0.4817,,,0.12,0.03,,,10.873335,,0.05,33.8394,33.88892,4,4.965,79.958,1.915,ND,,,
102.100.100/403469,CSRMR,WQQ831_D0,24/10/2023,23:04:00,2023-10-24T23:04:00Z,,2,,2,2,,,27.011,,13.7,,0.19,0.142,,,,0.03,0.01,,,6.405,,0.105,,35.156,8,5.675,,0.885,,,,
102.100.100/403470,CSRMR,WQQ831_D0,24/10/2023,23:10:00,2023-10-24T23:10:00Z,,2,,2,2,,,27.011,,13.4,,0.19,0.142,,,,0.03,0.01,,,6.405,,0.105,,35.156,8,5.675,,0.885,,,,
102.100.100/403471,CSRMR,WQQ831_D0,24/10/2023,23:11:00,2023-10-24T23:11:00Z,,2,,2,2,,,27.011,,7.07,,0.19,0.142,,,,0.03,0.01,,,6.405,,0.105,,35.156,8,5.675,,0.885,,,,
102.100.100/138821,CSTRM,WQQ184_D0,12/07/2020,5:47:00,2020-07-12T05:47:00Z,,2,8,2,2,,,23.234,,,,ND,0.402,0.767,,,BDL,BDL,,,13.96,,0.025,31.79,32.05,2,26.49,63.6,2.8,ND,,,
102.100.100/138822,CSTRM,WQQ184_D0,12/07/2020,5:47:00,2020-07-12T05:47:00Z,,2,8,2,2,,,23.234,,,,ND,0.402,0.767,,,BDL,BDL,,,13.96,,0.025,31.79,32.05,2,26.49,63.6,2.8,ND,,,
102.100.100/138823,CSTRM,WQQ184_D0,12/07/2020,5:47:00,2020-07-12T05:47:00Z,,2,8,2,2,,,23.234,,,,ND,0.402,0.767,,,BDL,BDL,,,13.96,,0.025,31.79,32.05,2,26.49,63.6,2.8,ND,,,
102.100.100/138863,CSTRM,WQQ237_D0,27/09/2020,6:20:00,2020-09-27T06:20:00Z,,2,8,2,2,,,26.836,,,,ND,0.2,0.258,,,0.07,BDL,,,10.13,,0.055,34.36,34.327,4,13.72,83.5,1.1,0.95,,,
102.100.100/138864,CSTRM,WQQ237_D0,27/09/2020,6:20:00,2020-09-27T06:20:00Z,,2,8,2,2,,,26.836,,,,ND,0.2,0.258,,,0.07,BDL,,,10.13,,0.055,34.36,34.327,4,13.72,83.5,1.1,0.95,,,
102.100.100/138865,CSTRM,WQQ237_D0,27/09/2020,6:20:00,2020-09-27T06:20:00Z,,2,8,2,2,,,26.836,,,,ND,0.2,0.258,,,0.07,BDL,,,10.13,,0.055,34.36,34.327,4,13.72,83.5,1.1,0.95,,,
102.100.100/138905,CSTRM,WQQ296_D0,11/02/2021,3:02:00,2021-02-11T03:02:00Z,,2,8,2,2,,,ND,,,,ND,1.279,1.03,,,0.22,0.07,,,29.42,,0.035,30.52,29.193,3,26.9,53.3,5.54,ND,,,
102.100.100/138906,CSTRM,WQQ296_D0,11/02/2021,3:04:00,2021-02-11T03:04:00Z,,2,8,2,2,,,ND,,,,ND,1.279,1.03,,,0.22,0.07,,,29.42,,0.035,30.52,29.193,3,26.9,53.3,5.54,ND,,,
102.100.100/138907,CSTRM,WQQ296_D0,11/02/2021,3:06:00,2021-02-11T03:06:00Z,,2,8,2,2,,,ND,,,,ND,1.279,1.03,,,0.22,0.07,,,29.42,,0.035,30.52,29.193,3,26.9,53.3,5.54,ND,,,
102.100.100/138947,CSTRM,WQQ422_D0,29/09/2021,23:40:00,2021-09-29T23:40:00Z,,2,8,2,2,,,25.628,,,,0.14,1.3455,0.6956,,,0.19,0.055,,,31.29,,0.075,34.8774,34.865,1.5,12.94,19.4601,14.08,ND,,,
102.100.100/138948,CSTRM,WQQ422_D0,29/09/2021,23:43:00,2021-09-29T23:43:00Z,,2,8,2,2,,,25.628,,,,0.14,1.3455,0.6956,,,0.19,0.055,,,31.29,,0.075,34.8774,34.865,1.5,12.94,19.4601,14.08,ND,,,
102.100.100/138949,CSTRM,WQQ422_D0,29/09/2021,23:45:00,2021-09-29T23:45:00Z,,2,8,2,2,,,25.628,,,,0.14,1.3455,0.6956,,,0.19,0.055,,,31.29,,0.075,34.8774,34.865,1.5,12.94,19.4601,14.08,ND,,,
102.100.100/142687,CSTRM,WQQ495_D0,8/02/2022,23:52:00,2022-02-08T23:52:00Z,,2,8,2,2,,,ND,,,,0.16,0.2946,0.2602,,,0.07,BDL,,,9.223,,BDL,33.1252,31.908,5,21.47,82.2149,1.052,ND,,,
102.100.100/142688,CSTRM,WQQ495_D0,8/02/2022,23:54:00,2022-02-08T23:54:00Z,,2,8,2,2,,,ND,,,,0.16,0.2946,0.2602,,,0.07,BDL,,,9.223,,BDL,33.1252,31.908,5,21.47,82.2149,1.052,ND,,,
102.100.100/142689,CSTRM,WQQ495_D0,8/02/2022,23:56:00,2022-02-08T23:56:00Z,,2,8,2,2,,,ND,,,,0.16,0.2946,0.2602,,,0.07,BDL,,,9.223,,BDL,33.1252,31.908,5,21.47,82.2149,1.052,ND,,,
102.100.100/142729,CSTRM,WQQ561_D0,4/06/2022,10:57:00,2022-06-04T10:57:00Z,,2,8,2,2,,,26.201,,,,0.29,0.3107,0.4491,,,0.61,0.05,,,9.403,,0.035,32.6941,32.73,7,13.64,88.0584,0.469,0.5868,,,
102.100.100/142730,CSTRM,WQQ561_D0,4/06/2022,11:01:00,2022-06-04T11:01:00Z,,2,8,2,2,,,26.201,,,,0.29,0.3107,0.4491,,,0.61,0.05,,,9.403,,0.035,32.6941,32.73,7,13.64,88.0584,0.469,0.5868,,,
102.100.100/142731,CSTRM,WQQ561_D0,4/06/2022,11:03:00,2022-06-04T11:03:00Z,,2,8,2,2,,,26.201,,,,0.29,0.3107,0.4491,,,0.61,0.05,,,9.403,,0.035,32.6941,32.73,7,13.64,88.0584,0.469,0.5868,,,
102.100.100/142771,CSTRM,WQQ622_D0,29/10/2022,23:17:00,2022-10-29T23:17:00Z,,2,0,2,2,,,29.489,,,,1.05,0.21034,0.2412,,,0.165,0.055,,,8.915,,0.04,33.6235,33.5316,5.5,16.295,85.4012,0.6,0.5973,,,
102.100.100/142772,CSTRM,WQQ622_D0,29/10/2022,23:18:00,2022-10-29T23:18:00Z,,2,0,2,2,,,29.489,,,,1.05,0.21034,0.2412,,,0.165,0.055,,,8.915,,0.04,33.6235,33.5316,5.5,16.295,85.4012,0.6,0.5973,,,
102.100.100/142773,CSTRM,WQQ622_D0,29/10/2022,23:19:00,2022-10-29T23:19:00Z,,2,0,2,2,,,29.489,,,,1.05,0.21034,0.2412,,,0.165,0.055,,,8.915,,0.04,33.6235,33.5316,5.5,16.295,85.4012,0.6,0.5973,,,
102.100.100/400497,CSTRM,WQQ695_D0,20/02/2023,23:15:00,2023-02-20T23:15:00Z,,2,7,2,2,,,28.31,,29.2,,0.125,0.532095,0.2892,,,0.17,0.01,,,17.11333,,0.04,28.739,28.99019,2,21.575,55.7229,3,ND,,,
102.100.100/400498,CSTRM,WQQ695_D0,20/02/2023,23:18:00,2023-02-20T23:18:00Z,,2,7,2,2,,,28.31,,25.5,,0.125,0.532095,0.2892,,,0.17,0.01,,,17.11333,,0.04,28.739,28.99019,2,21.575,55.7229,3,ND,,,
102.100.100/400499,CSTRM,WQQ695_D0,20/02/2023,23:21:00,2023-02-20T23:21:00Z,,2,7,2,2,,,28.31,,2.18,,0.125,0.532095,0.2892,,,0.17,0.01,,,17.11333,,0.04,28.739,28.99019,2,21.575,55.7229,3,ND,,,
102.100.100/400539,CSTRM,WQQ761_D0,17/06/2023,23:09:00,2023-06-17T23:09:00Z,,2,8.5,1.9,1.9,,,24.187,,14.5,,0.12,0.77807,1.0946,,,0.03,0.01,,,15.863335,,0.04,34.0014,34.22347,3,5,71.996,2.83,ND,,,
102.100.100/400540,CSTRM,WQQ761_D0,17/06/2023,23:10:00,2023-06-17T23:10:00Z,,2,8.5,1.93,1.93,,,24.187,,11.1,,0.12,0.77807,1.0946,,,0.03,0.01,,,15.863335,,0.04,34.0014,34.22347,3,5,71.996,2.83,ND,,,
102.100.100/400541,CSTRM,WQQ761_D0,17/06/2023,23:11:00,2023-06-17T23:11:00Z,,2,8.5,2,2,,,24.187,,17.6,,0.12,0.77807,1.0946,,,0.03,0.01,,,15.863335,,0.04,34.0014,34.22347,3,5,71.996,2.83,ND,,,
102.100.100/402166,CSTRM,WQQ822_D0,22/10/2023,23:33:00,2023-10-22T23:33:00Z,,2,,1.9,1.9,,,26.85,,16.7,,0.275,0.685,,,,0.06,0.01,,,20.7,,0.075,,35.073,2.5,10.29,,4.33,,,,
102.100.100/402167,CSTRM,WQQ822_D0,22/10/2023,23:35:00,2023-10-22T23:35:00Z,,2,,1.9,1.9,,,26.85,,22.4,,0.275,0.685,,,,0.06,0.01,,,20.7,,0.075,,35.073,2.5,10.29,,4.33,,,,
102.100.100/402168,CSTRM,WQQ822_D0,22/10/2023,23:38:00,2023-10-22T23:38:00Z,,2,,1.9,1.9,,,26.85,,23.2,,0.275,0.685,,,,0.06,0.01,,,20.7,,0.075,,35.073,2.5,10.29,,4.33,,,,
102.100.100/138621,CSTRP,,18/06/2020,11:45:00,2020-06-18T11:45:00Z,,2,,,,,,18.2,,,,,,,,,,,,,,,,,,,,,,,,,
102.100.100/138622,CSTRP,,18/06/2020,11:50:00,2020-06-18T11:50:00Z,,2,,,,,,18.4,,,,,,,,,,,,,,,,,,,,,,,,,
102.100.100/138623,CSTRP,,18/06/2020,12:00:00,2020-06-18T12:00:00Z,,2,,,,,,18,,,,,,,,,,,,,,,,,,,,,,,,,
102.100.100/138624,CSTRP,,2/07/2020,13:01:00,2020-07-02T13:01:00Z,,2,,,,,,17.4,,,,,,,,,,,,,,,,,,,,,,,,,
102.100.100/138625,CSTRP,,2/07/2020,13:08:00,2020-07-02T13:08:00Z,,2,,,,,,17.4,,,,,,,,,,,,,,,,,,,,,,,,,
102.100.100/138626,CSTRP,,2/07/2020,13:15:00,2020-07-02T13:15:00Z,,2,,,,,,17.2,,,,,,,,,,,,,,,,,,,,,,,,,
102.100.100/138627,CSTRP,,16/07/2020,12:15:00,2020-07-16T12:15:00Z,,2,,,,High biomass/particulate matter,,13.8,,,,,,,,,,,,,,,,,,,,,,,,,
102.100.100/138628,CSTRP,,16/07/2020,12:30:00,2020-07-16T12:30:00Z,,2,,,,High biomass/particulate matter,,13.9,,,,,,,,,,,,,,,,,,,,,,,,,
102.100.100/138629,CSTRP,,16/07/2020,12:40:00,2020-07-16T12:40:00Z,,2,,,,High biomass/particulate matter,,13.8,,,,,,,,,,,,,,,,,,,,,,,,,
102.100.100/138630,CSTRP,,30/07/2020,13:15:00,2020-07-30T13:15:00Z,,2,,,,,,17.7,,,,,,,,,,,,,,,,,,,,,,,,,
102.100.100/138631,CSTRP,,30/07/2020,13:20:00,2020-07-30T13:20:00Z,,2,,,,,,17.7,,,,,,,,,,,,,,,,,,,,,,,,,
102.100.100/138632,CSTRP,,30/07/2020,13:30:00,2020-07-30T13:30:00Z,,2,,,,,,17.7,,,,,,,,,,,,,,,,,,,,,,,,,
102.100.100/138633,CSTRP,,13/08/2020,13:30:00,2020-08-13T13:30:00Z,,2,,,,High biomass/particulate matter,,16.8,,,,,,,,,,,,,,,,,,,,,,,,,
102.100.100/138634,CSTRP,,13/08/2020,13:40:00,2020-08-13T13:40:00Z,,2,,,,High biomass/particulate matter,,17.1,,,,,,,,,,,,,,,,,,,,,,,,,
102.100.100/138635,CSTRP,,13/08/2020,13:45:00,2020-08-13T13:45:00Z,,2,,,,High biomass/particulate matter,,17,,,,,,,,,,,,,,,,,,,,,,,,,
102.100.100/138636,CSTRP,,27/08/2020,13:20:00,2020-08-27T13:20:00Z,,2,,,,,,16.1,,,,,,,,,,,,,,,,,,,,,,,,,
102.100.100/138637,CSTRP,,27/08/2020,13:30:00,2020-08-27T13:30:00Z,,2,,,,,,16.5,,,,,,,,,,,,,,,,,,,,,,,,,
102.100.100/138638,CSTRP,,27/08/2020,13:35:00,2020-08-27T13:35:00Z,,2,,,,,,16.7,,,,,,,,,,,,,,,,,,,,,,,,,
102.100.100/138639,CSTRP,,10/09/2020,13:00:00,2020-09-10T13:00:00Z,,2,,,,,,17.4,,,,,,,,,,,,,,,,,,,,,,,,,
102.100.100/138640,CSTRP,,10/09/2020,13:10:00,2020-09-10T13:10:00Z,,2,,,,,,17.6,,,,,,,,,,,,,,,,,,,,,,,,,
102.100.100/138641,CSTRP,,10/09/2020,13:20:00,2020-09-10T13:20:00Z,,2,,,,,,17.3,,,,,,,,,,,,,,,,,,,,,,,,,
102.100.100/138642,CSTRP,,24/09/2020,12:30:00,2020-09-24T12:30:00Z,,2,,2,2,,,18.7,,,,,,,,,,,,,,,,,,,,,,,,,
102.100.100/138643,CSTRP,,24/09/2020,12:40:00,2020-09-24T12:40:00Z,,2,,2,2,,,19.2,,,,,,,,,,,,,,,,,,,,,,,,,
102.100.100/138644,CSTRP,,24/09/2020,12:45:00,2020-09-24T12:45:00Z,,2,,2,2,,,18.8,,,,,,,,,,,,,,,,,,,,,,,,,
102.100.100/138645,CSTRP,,8/10/2020,14:00:00,2020-10-08T14:00:00Z,,2,,2,2,,,18.8,,,,,,,,,,,,,,,,,,,,,,,,,
102.100.100/138646,CSTRP,,8/10/2020,14:15:00,2020-10-08T14:15:00Z,,2,,2,2,,,18.8,,,,,,,,,,,,,,,,,,,,,,,,,
102.100.100/138647,CSTRP,,8/10/2020,14:30:00,2020-10-08T14:30:00Z,,2,,2,2,,,18.7,,,,,,,,,,,,,,,,,,,,,,,,,
102.100.100/138648,CSTRP,,22/10/2020,12:55:00,2020-10-22T12:55:00Z,,2,,2,2,,,20.3,,,,,,,,,,,,,,,,,,,,,,,,,
102.100.100/138649,CSTRP,,22/10/2020,13:00:00,2020-10-22T13:00:00Z,,2,,2,2,,,20.4,,,,,,,,,,,,,,,,,,,,,,,,,
102.100.100/138650,CSTRP,,22/10/2020,13:10:00,2020-10-22T13:10:00Z,,2,,2,2,,,20.4,,,,,,,,,,,,,,,,,,,,,,,,,
102.100.100/138651,CSTRP,,5/11/2020,12:50:00,2020-11-05T12:50:00Z,,2,,2,2,,,18.5,,,,,,,,,,,,,,,,,,,,,,,,,
102.100.100/138652,CSTRP,,5/11/2020,12:55:00,2020-11-05T12:55:00Z,,2,,2,2,,,18.5,hylims harvest issue - data coming,,,,,,,,,,,,,,,,,,,,,,,,
102.100.100/138653,CSTRP,,5/11/2020,13:05:00,2020-11-05T13:05:00Z,,2,,2,2,,,18.7,,,,,,,,,,,,,,,,,,,,,,,,,
102.100.100/138654,CSTRP,,19/11/2020,13:05:00,2020-11-19T13:05:00Z,,2,,2,2,,,22.3,,,,,,,,,,,,,,,,,,,,,,,,,
102.100.100/138655,CSTRP,,19/11/2020,13:10:00,2020-11-19T13:10:00Z,,2,,2,2,,,22.3,,,,,,,,,,,,,,,,,,,,,,,,,
102.100.100/138656,CSTRP,,19/11/2020,13:15:00,2020-11-19T13:15:00Z,,2,,2,2,,,22.4,,,,,,,,,,,,,,,,,,,,,,,,,
102.100.100/138657,CSTRP,,3/12/2020,11:30:00,2020-12-03T11:30:00Z,,2,,2,2,,,19.9,,,,,,,,,,,,,,,,,,,,,,,,,
102.100.100/138658,CSTRP,,3/12/2020,11:40:00,2020-12-03T11:40:00Z,,2,,2,2,,,19.8,,,,,,,,,,,,,,,,,,,,,,,,,
102.100.100/138659,CSTRP,,3/12/2020,11:45:00,2020-12-03T11:45:00Z,,2,,2,2,,,19.9,,,,,,,,,,,,,,,,,,,,,,,,,
102.100.100/138660,CSTRP,,17/12/2020,11:47:00,2020-12-17T11:47:00Z,,2,,2,2,,,23.7,,,,,,,,,,,,,,,,,,,,,,,,,
102.100.100/138661,CSTRP,,17/12/2020,11:54:00,2020-12-17T11:54:00Z,,2,,2,2,,,23.8,,,,,,,,,,,,,,,,,,,,,,,,,
102.100.100/138662,CSTRP,,17/12/2020,11:59:00,2020-12-17T11:59:00Z,,2,,2,2,,,23.9,,,,,,,,,,,,,,,,,,,,,,,,,
102.100.100/138663,CSTRP,,30/12/2020,12:19:00,2020-12-30T12:19:00Z,,2,,2,2,,,21.3,,,,,,,,,,,,,,,,,,,,,,,,,
102.100.100/138664,CSTRP,,30/12/2020,12:25:00,2020-12-30T12:25:00Z,,2,,2,2,,,21.3,,,,,,,,,,,,,,,,,,,,,,,,,
102.100.100/138665,CSTRP,,30/12/2020,12:30:00,2020-12-30T12:30:00Z,,2,,2,2,,,21.2,,,,,,,,,,,,,,,,,,,,,,,,,
102.100.100/138666,CSTRP,,14/01/2021,11:30:00,2021-01-14T11:30:00Z,,2,,2,2,,,24.3,,,,,,,,,,,,,,,,,,,,,,,,,
102.100.100/138667,CSTRP,,14/01/2021,11:35:00,2021-01-14T11:35:00Z,,2,,2,2,,,24.4,,,,,,,,,,,,,,,,,,,,,,,,,
102.100.100/138668,CSTRP,,14/01/2021,11:40:00,2021-01-14T11:40:00Z,,2,,2,2,,,24.4,,,,,,,,,,,,,,,,,,,,,,,,,
102.100.100/138669,CSTRP,,28/01/2021,11:26:00,2021-01-28T11:26:00Z,,2,,2,2,,,21,,,,,,,,,,,,,,,,,,,,,,,,,
102.100.100/138670,CSTRP,,28/01/2021,11:34:00,2021-01-28T11:34:00Z,,2,,2,2,,,20.8,,,,,,,,,,,,,,,,,,,,,,,,,
102.100.100/138671,CSTRP,,28/01/2021,11:38:00,2021-01-28T11:38:00Z,,2,,2,2,,,20.8,,,,,,,,,,,,,,,,,,,,,,,,,
102.100.100/138672,CSTRP,,11/02/2021,11:34:00,2021-02-11T11:34:00Z,,2,,2,2,,,23.2,,,,,,,,,,,,,,,,,,,,,,,,,
102.100.100/138673,CSTRP,,11/02/2021,11:45:00,2021-02-11T11:45:00Z,,2,,2,2,,,23,,,,,,,,,,,,,,,,,,,,,,,,,
102.100.100/138674,CSTRP,,11/02/2021,11:50:00,2021-02-11T11:50:00Z,,2,,2,2,,,23.1,,,,,,,,,,,,,,,,,,,,,,,,,
102.100.100/138675,CSTRP,,26/02/2021,13:10:00,2021-02-26T13:10:00Z,,2,,2,2,,,23.7,,,,,,,,,,,,,,,,,,,,,,,,,
102.100.100/138676,CSTRP,,26/02/2021,13:15:00,2021-02-26T13:15:00Z,,2,,2,2,,,23.8,,,,,,,,,,,,,,,,,,,,,,,,,
102.100.100/138678,CSTRP,,26/02/2021,13:20:00,2021-02-26T13:20:00Z,,2,,2,2,,,23.7,,,,,,,,,,,,,,,,,,,,,,,,,
102.100.100/138679,CSTRP,,11/03/2021,10:51:00,2021-03-11T10:51:00Z,,2,,2,2,,,23.2,,,,,,,,,,,,,,,,,,,,,,,,,
102.100.100/138680,CSTRP,,11/03/2021,10:57:00,2021-03-11T10:57:00Z,,2,,2,2,,,23.2,,,,,,,,,,,,,,,,,,,,,,,,,
102.100.100/138681,CSTRP,,11/03/2021,11:02:00,2021-03-11T11:02:00Z,,2,,2,2,,,23.4,,,,,,,,,,,,,,,,,,,,,,,,,
102.100.100/138682,CSTRP,,25/03/2021,12:39:00,2021-03-25T12:39:00Z,,2,,0.5,0.5,High biomass/particulate matter,,23.7,,,,,,,,,,,,,,,,,,,,,,,,,
102.100.100/138683,CSTRP,,25/03/2021,12:47:00,2021-03-25T12:47:00Z,,2,,0.5,0.5,High biomass/particulate matter,,23.8,,,,,,,,,,,,,,,,,,,,,,,,,
102.100.100/138684,CSTRP,,25/03/2021,13:02:00,2021-03-25T13:02:00Z,,2,,0.5,0.5,High biomass/particulate matter,,24.2,,,,,,,,,,,,,,,,,,,,,,,,,
102.100.100/138685,CSTRP,,8/04/2021,12:40:00,2021-04-08T12:40:00Z,,2,,2,2,,,23.7,,,,,,,,,,,,,,,,,,,,,,,,,
102.100.100/138686,CSTRP,,8/04/2021,12:45:00,2021-04-08T12:45:00Z,,2,,2,2,,,23.8,,,,,,,,,,,,,,,,,,,,,,,,,
102.100.100/138687,CSTRP,,8/04/2021,12:52:00,2021-04-08T12:52:00Z,,2,,2,2,,,23.9,,,,,,,,,,,,,,,,,,,,,,,,,
102.100.100/138688,CSTRP,,22/04/2021,12:37:00,2021-04-22T12:37:00Z,,2,,1.5,1.5,High biomass/particulate matter,,23.7,,,,,,,,,,,,,,,,,,,,,,,,,
102.100.100/138689,CSTRP,,22/04/2021,12:39:00,2021-04-22T12:39:00Z,,2,,1.7,1.7,High biomass/particulate matter,,23.8,,,,,,,,,,,,,,,,,,,,,,,,,
102.100.100/138690,CSTRP,,22/04/2021,12:44:00,2021-04-22T12:44:00Z,,2,,1.7,1.7,High biomass/particulate matter,,23.9,,,,,,,,,,,,,,,,,,,,,,,,,
102.100.100/138691,CSTRP,,6/05/2021,10:46:00,2021-05-06T10:46:00Z,,2,,1,1,,,20.1,,,,,,,,,,,,,,,,,,,,,,,,,
102.100.100/138692,CSTRP,,6/05/2021,10:53:00,2021-05-06T10:53:00Z,,2,,1,1,,,20.2,,,,,,,,,,,,,,,,,,,,,,,,,
102.100.100/138693,CSTRP,,6/05/2021,11:00:00,2021-05-06T11:00:00Z,,2,,1,1,,,20.5,,,,,,,,,,,,,,,,,,,,,,,,,
102.100.100/138694,CSTRP,,20/05/2021,11:56:00,2021-05-20T11:56:00Z,,2,,2,2,,,16.5,,,,,,,,,,,,,,,,,,,,,,,,,
102.100.100/138695,CSTRP,,20/05/2021,12:01:00,2021-05-20T12:01:00Z,,2,,2,2,,,16.4,,,,,,,,,,,,,,,,,,,,,,,,,
102.100.100/138696,CSTRP,,20/05/2021,12:06:00,2021-05-20T12:06:00Z,,2,,2,2,,,16.6,,,,,,,,,,,,,,,,,,,,,,,,,
102.100.100/138697,CSTRP,,3/06/2021,12:29:00,2021-06-03T12:29:00Z,,2,,2,2,,,15.5,,,,,,,,,,,,,,,,,,,,,,,,,
102.100.100/138698,CSTRP,,3/06/2021,12:35:00,2021-06-03T12:35:00Z,,2,,2,2,,,15.4,,,,,,,,,,,,,,,,,,,,,,,,,
102.100.100/138699,CSTRP,,3/06/2021,12:39:00,2021-06-03T12:39:00Z,,2,,2,2,,,15.5,,,,,,,,,,,,,,,,,,,,,,,,,
102.100.100/142530,CSTRP,,17/06/2021,12:13:00,2021-06-17T12:13:00Z,Samples mislabelled (formerly 102.100.100/138621) but discovered prior to analysis and relabelled. Formerly 102.100.100/138621,2,,2,2,,,,,,,,,,,,,,,,,,,,,,,,,,,,
102.100.100/142531,CSTRP,,17/06/2021,12:15:00,2021-06-17T12:15:00Z,Samples mislabelled (formerly 102.100.100/138622) but discovered prior to analysis and relabelled. Formerly 102.100.100/138622,2,,2,2,,,,,,,,,,,,,,,,,,,,,,,,,,,,
102.100.100/142532,CSTRP,,17/06/2021,12:20:00,2021-06-17T12:20:00Z,Samples mislabelled (formerly 102.100.100/138623) but discovered prior to analysis and relabelled. Formerly 102.100.100/138623,2,,2,2,,,,,,,,,,,,,,,,,,,,,,,,,,,,
102.100.100/142533,CSTRP,,1/07/2021,10:54:00,2021-07-01T10:54:00Z,,2,,2,2,,,,,,,,,,,,,,,,,,,,,,,,,,,,
102.100.100/142534,CSTRP,,1/07/2021,11:01:00,2021-07-01T11:01:00Z,,2,,2,2,,,,,,,,,,,,,,,,,,,,,,,,,,,,
102.100.100/142535,CSTRP,,1/07/2021,11:05:00,2021-07-01T11:05:00Z,,2,,2,2,,,,,,,,,,,,,,,,,,,,,,,,,,,,
102.100.100/142536,CSTRP,,29/07/2021,13:25:00,2021-07-29T13:25:00Z,,2,,2,2,,,,,,,,,,,,,,,,,,,,,,,,,,,,
102.100.100/142537,CSTRP,,29/07/2021,13:30:00,2021-07-29T13:30:00Z,,2,,2,2,,,,,,,,,,,,,,,,,,,,,,,,,,,,
102.100.100/142538,CSTRP,,29/07/2021,13:34:00,2021-07-29T13:34:00Z,,2,,2,2,,,,,,,,,,,,,,,,,,,,,,,,,,,,
102.100.100/142539,CSTRP,,12/08/2021,11:47:00,2021-08-12T11:47:00Z,,2,,2,2,,,,,,,,,,,,,,,,,,,,,,,,,,,,
102.100.100/142540,CSTRP,,12/08/2021,11:51:00,2021-08-12T11:51:00Z,,2,,2,2,,,,,,,,,,,,,,,,,,,,,,,,,,,,
102.100.100/142541,CSTRP,,12/08/2021,11:56:00,2021-08-12T11:56:00Z,,2,,2,2,,,,,,,,,,,,,,,,,,,,,,,,,,,,
102.100.100/142542,CSTRP,,26/08/2021,12:13:00,2021-08-26T12:13:00Z,,2,,2,2,,,,,,,,,,,,,,,,,,,,,,,,,,,,
102.100.100/142543,CSTRP,,26/08/2021,12:16:00,2021-08-26T12:16:00Z,,2,,2,2,,,,,,,,,,,,,,,,,,,,,,,,,,,,
102.100.100/142544,CSTRP,,26/08/2021,12:20:00,2021-08-26T12:20:00Z,,2,,2,2,,,,,,,,,,,,,,,,,,,,,,,,,,,,
102.100.100/142545,CSTRP,,9/09/2021,11:06:00,2021-09-09T11:06:00Z,,2,,2,2,,,,,,,,,,,,,,,,,,,,,,,,,,,,
102.100.100/142546,CSTRP,,9/09/2021,11:10:00,2021-09-09T11:10:00Z,,2,,2,2,,,,,,,,,,,,,,,,,,,,,,,,,,,,
102.100.100/142547,CSTRP,,9/09/2021,11:15:00,2021-09-09T11:15:00Z,,2,,2,2,,,,,,,,,,,,,,,,,,,,,,,,,,,,
102.100.100/142548,CSTRP,,22/09/2021,12:52:00,2021-09-22T12:52:00Z,,2,,2,2,,,,,,,,,,,,,,,,,,,,,,,,,,,,
102.100.100/142549,CSTRP,,22/09/2021,12:57:00,2021-09-22T12:57:00Z,,2,,2,2,,,,,,,,,,,,,,,,,,,,,,,,,,,,
102.100.100/142550,CSTRP,,22/09/2021,13:03:00,2021-09-22T13:03:00Z,,2,,2,2,,,,,,,,,,,,,,,,,,,,,,,,,,,,
102.100.100/142551,CSTRP,,7/10/2021,9:27:00,2021-10-07T09:27:00Z,,2,,2,2,,,,,,,,,,,,,,,,,,,,,,,,,,,,
102.100.100/142552,CSTRP,,7/10/2021,9:30:00,2021-10-07T09:30:00Z,,2,,2,2,,,,,,,,,,,,,,,,,,,,,,,,,,,,
102.100.100/142553,CSTRP,,7/10/2021,9:35:00,2021-10-07T09:35:00Z,,2,,2,2,,,,,,,,,,,,,,,,,,,,,,,,,,,,
102.100.100/142554,CSTRP,,21/10/2021,12:21:00,2021-10-21T12:21:00Z,,2,,2,2,,,,,,,,,,,,,,,,,,,,,,,,,,,,
102.100.100/142555,CSTRP,,21/10/2021,12:24:00,2021-10-21T12:24:00Z,,2,,2,2,,,,,,,,,,,,,,,,,,,,,,,,,,,,
102.100.100/142556,CSTRP,,21/10/2021,12:29:00,2021-10-21T12:29:00Z,,2,,2,2,,,,,,,,,,,,,,,,,,,,,,,,,,,,
102.100.100/142557,CSTRP,,4/11/2021,12:07:00,2021-11-04T12:07:00Z,,2,,2,2,,,,,,,,,,,,,,,,,,,,,,,,,,,,
102.100.100/142558,CSTRP,,4/11/2021,12:10:00,2021-11-04T12:10:00Z,,2,,2,2,,,,,,,,,,,,,,,,,,,,,,,,,,,,
102.100.100/142559,CSTRP,,4/11/2021,12:15:00,2021-11-04T12:15:00Z,,2,,2,2,,,,,,,,,,,,,,,,,,,,,,,,,,,,
102.100.100/142560,CSTRP,,18/11/2021,14:51:00,2021-11-18T14:51:00Z,,2,,2,2,,,,,,,,,,,,,,,,,,,,,,,,,,,,
102.100.100/142561,CSTRP,,18/11/2021,14:55:00,2021-11-18T14:55:00Z,,2,,2,2,,,,,,,,,,,,,,,,,,,,,,,,,,,,
102.100.100/142562,CSTRP,,18/11/2021,14:57:00,2021-11-18T14:57:00Z,,2,,2,2,,,,,,,,,,,,,,,,,,,,,,,,,,,,
102.100.100/142563,CSTRP,,2/12/2021,11:58:00,2021-12-02T11:58:00Z,,2,,2,2,,,,,,,,,,,,,,,,,,,,,,,,,,,,
102.100.100/142564,CSTRP,,2/12/2021,12:04:00,2021-12-02T12:04:00Z,,2,,2,2,,,,,,,,,,,,,,,,,,,,,,,,,,,,
102.100.100/142565,CSTRP,,2/12/2021,12:08:00,2021-12-02T12:08:00Z,,2,,2,2,,,,,,,,,,,,,,,,,,,,,,,,,,,,
102.100.100/142566,CSTRP,,16/12/2021,13:22:00,2021-12-16T13:22:00Z,,2,,2,2,,,,,,,,,,,,,,,,,,,,,,,,,,,,
102.100.100/142567,CSTRP,,16/12/2021,13:26:00,2021-12-16T13:26:00Z,,2,,2,2,,,,,,,,,,,,,,,,,,,,,,,,,,,,
102.100.100/142568,CSTRP,,16/12/2021,13:31:00,2021-12-16T13:31:00Z,,2,,2,2,,,,,,,,,,,,,,,,,,,,,,,,,,,,
102.100.100/142569,CSTRP,,28/12/2021,12:12:00,2021-12-28T12:12:00Z,,2,,2,2,,,,,,,,,,,,,,,,,,,,,,,,,,,,
102.100.100/142570,CSTRP,,28/12/2021,12:15:00,2021-12-28T12:15:00Z,,2,,2,2,,,,,,,,,,,,,,,,,,,,,,,,,,,,
102.100.100/142571,CSTRP,,28/12/2021,12:19:00,2021-12-28T12:19:00Z,,2,,2,2,,,,,,,,,,,,,,,,,,,,,,,,,,,,
102.100.100/142574,CSTRP,,13/01/2022,10:00:00,2022-01-13T10:00:00Z,,2,,2,2,,,,,,,,,,,,,,,,,,,,,,,,,,,,
102.100.100/142573,CSTRP,,13/01/2022,10:05:00,2022-01-13T10:05:00Z,,2,,2,2,,,,,,,,,,,,,,,,,,,,,,,,,,,,
102.100.100/142572,CSTRP,,13/01/2022,10:10:00,2022-01-13T10:10:00Z,,2,,2,2,,,,,,,,,,,,,,,,,,,,,,,,,,,,
102.100.100/142575,CSTRP,,27/01/2022,10:52:00,2022-01-27T10:52:00Z,,2,,1.8,1.8,High biomass/particulate matter,,,,,,,,,,,,,,,,,,,,,,,,,,,
102.100.100/142576,CSTRP,,27/01/2022,10:58:00,2022-01-27T10:58:00Z,,2,,1.9,1.9,High biomass/particulate matter,,,,,,,,,,,,,,,,,,,,,,,,,,,
102.100.100/142577,CSTRP,,27/01/2022,11:02:00,2022-01-27T11:02:00Z,,2,,1.9,1.9,High biomass/particulate matter,,,,,,,,,,,,,,,,,,,,,,,,,,,
102.100.100/142578,CSTRP,,10/02/2022,11:24:00,2022-02-10T11:24:00Z,,2,,2,2,,,,,,,,,,,,,,,,,,,,,,,,,,,,
102.100.100/142579,CSTRP,,10/02/2022,11:28:00,2022-02-10T11:28:00Z,,2,,1.57,1.57,High biomass/particulate matter,,,,,,,,,,,,,,,,,,,,,,,,,,,
102.100.100/142580,CSTRP,,10/02/2022,11:33:00,2022-02-10T11:33:00Z,,2,,2,2,,,,,,,,,,,,,,,,,,,,,,,,,,,,
102.100.100/142581,CSTRP,,24/02/2022,10:54:00,2022-02-24T10:54:00Z,,2,,2,2,,,,,,,,,,,,,,,,,,,,,,,,,,,,
102.100.100/142582,CSTRP,,24/02/2022,11:00:00,2022-02-24T11:00:00Z,,2,,2,2,,,,,,,,,,,,,,,,,,,,,,,,,,,,
102.100.100/142583,CSTRP,,24/02/2022,11:06:00,2022-02-24T11:06:00Z,,2,,2,2,,,,,,,,,,,,,,,,,,,,,,,,,,,,
102.100.100/142586,CSTRP,,24/03/2022,10:38:00,2022-03-24T10:38:00Z,,2,,1.45,1.45,High biomass/particulate matter,,,,92.12,1.87,,,,,,,,,,,,,,,,,,,,,,
102.100.100/142584,CSTRP,,24/03/2022,10:39:00,2022-03-24T10:39:00Z,,2,,2,2,,,,,98.58,1.88,,,,,,,,,,,,,,,,,,,,,,
102.100.100/142585,CSTRP,,24/03/2022,10:44:00,2022-03-24T10:44:00Z,,2,,1.53,1.53,High biomass/particulate matter,,,,92.14,1.9,,,,,,,,,,,,,,,,,,,,,,
102.100.100/142587,CSTRP,,8/04/2022,11:35:00,2022-04-08T11:35:00Z,,2,,1.6,1.6,High biomass/particulate matter,,,,20.58,2.02,,,,,,,,,,,,,,,,,,,,,,
102.100.100/142588,CSTRP,,8/04/2022,11:38:00,2022-04-08T11:38:00Z,,2,,0.5,0.5,High biomass/particulate matter,,,,21.5,1.99,,,,,,,,,,,,,,,,,,,,,,
102.100.100/142589,CSTRP,,8/04/2022,11:42:00,2022-04-08T11:42:00Z,,2,,0.5,0.5,"High biomass/particulate matter,",,,,25.08,1.81,,,,,,,,,,,,,,,,,,,,,,
102.100.100/142590,CSTRP,,21/04/2022,13:21:00,2022-04-21T13:21:00Z,,2,,0.5,0.5,High biomass/particulate matter,,,,73.57,2,,,,,,,,,,,,,,,,,,,,,,
102.100.100/142591,CSTRP,,21/04/2022,13:25:00,2022-04-21T13:25:00Z,,2,,2,2,,,,,72.33,1.9,,,,,,,,,,,,,,,,,,,,,,
102.100.100/142592,CSTRP,,21/04/2022,13:28:00,2022-04-21T13:28:00Z,,2,,2,2,,,,,69.83,1.87,,,,,,,,,,,,,,,,,,,,,,
102.100.100/142593,CSTRP,,5/05/2022,11:36:00,2022-05-05T11:36:00Z,,2,,2,2,,,,,80.29,1.91,,,,,,,,,,,,,,,,,,,,,,
102.100.100/142594,CSTRP,,5/05/2022,11:41:00,2022-05-05T11:41:00Z,,2,,2,2,,,,,89.88,1.87,,,,,,,,,,,,,,,,,,,,,,
102.100.100/142595,CSTRP,,5/05/2022,11:45:00,2022-05-05T11:45:00Z,,2,,2,2,,,,,69.16,1.94,,,,,,,,,,,,,,,,,,,,,,
102.100.100/142596,CSTRP,,19/05/2022,10:05:00,2022-05-19T10:05:00Z,,2,,2,2,,,,,21.82,1.86,,,,,,,,,,,,,,,,,,,,,,
102.100.100/142597,CSTRP,,19/05/2022,10:10:00,2022-05-19T10:10:00Z,,2,,2,2,,,,,32.31,1.82,,,,,,,,,,,,,,,,,,,,,,
102.100.100/142598,CSTRP,,19/05/2022,10:15:00,2022-05-19T10:15:00Z,,2,,2,2,,,,,39.83,1.81,,,,,,,,,,,,,,,,,,,,,,
102.100.100/142599,CSTRP,,2/06/2022,1:47:00,2022-06-02T01:47:00Z,,2,,2,2,,,,,32.7,,,,,,,,,,,,,,,,,,,,,,,
102.100.100/142600,CSTRP,,2/06/2022,1:51:00,2022-06-02T01:51:00Z,,2,,2,2,,,,,26.1,,,,,,,,,,,,,,,,,,,,,,,
102.100.100/142601,CSTRP,,2/06/2022,1:56:00,2022-06-02T01:56:00Z,,2,,2,2,,,,,34.1,,,,,,,,,,,,,,,,,,,,,,,
102.100.100/142602,CSTRP,,16/06/2022,3:59:00,2022-06-16T03:59:00Z,,2,,2,2,,,,,33.3,,,,,,,,,,,,,,,,,,,,,,,
102.100.100/142603,CSTRP,,16/06/2022,4:04:00,2022-06-16T04:04:00Z,,2,,2,2,,,,,22.1,,,,,,,,,,,,,,,,,,,,,,,
102.100.100/142604,CSTRP,,16/06/2022,4:08:00,2022-06-16T04:08:00Z,,2,,2,2,,,,,19.2,,,,,,,,,,,,,,,,,,,,,,,
102.100.100/142605,CSTRP,,30/06/2022,1:42:00,2022-06-30T01:42:00Z,,2,,2,2,,,,,49.6,,,,,,,,,,,,,,,,,,,,,,,
102.100.100/142606,CSTRP,,30/06/2022,1:47:00,2022-06-30T01:47:00Z,,2,,2,2,,,,,40.2,,,,,,,,,,,,,,,,,,,,,,,
102.100.100/142607,CSTRP,,30/06/2022,1:51:00,2022-06-30T01:51:00Z,,2,,2,2,,,,,30.4,,,,,,,,,,,,,,,,,,,,,,,
102.100.100/402221,CSTRP,,14/07/2022,0:59:00,2022-07-14T00:59:00Z,,2,,2,2,,,,,18.8,,,,,,,,,,,,,,,,,,,,,,,
102.100.100/402222,CSTRP,,14/07/2022,1:04:00,2022-07-14T01:04:00Z,,2,,2,2,,,,,20,,,,,,,,,,,,,,,,,,,,,,,
102.100.100/402223,CSTRP,,14/07/2022,1:09:00,2022-07-14T01:09:00Z,,2,,2,2,,,,,20.8,,,,,,,,,,,,,,,,,,,,,,,
102.100.100/402224,CSTRP,,28/07/2022,0:56:00,2022-07-28T00:56:00Z,,2,,2,2,,,,,25.1,,,,,,,,,,,,,,,,,,,,,,,
102.100.100/402225,CSTRP,,28/07/2022,0:59:00,2022-07-28T00:59:00Z,,2,,2,2,,,,,25.2,,,,,,,,,,,,,,,,,,,,,,,
102.100.100/402226,CSTRP,,28/07/2022,1:02:00,2022-07-28T01:02:00Z,,2,,2,2,,,,,29.3,,,,,,,,,,,,,,,,,,,,,,,
102.100.100/402227,CSTRP,,11/08/2022,1:10:00,2022-08-11T01:10:00Z,,2,,1,1,,,,,35.8,,,,,,,,,,,,,,,,,,,,,,,
102.100.100/402228,CSTRP,,11/08/2022,1:14:00,2022-08-11T01:14:00Z,,2,,1,1,,,,,33.5,,,,,,,,,,,,,,,,,,,,,,,
102.100.100/402229,CSTRP,,11/08/2022,1:19:00,2022-08-11T01:19:00Z,,2,,1,1,,,,,25.7,,,,,,,,,,,,,,,,,,,,,,,
102.100.100/402230,CSTRP,,25/08/2022,0:00:00,2022-08-25T00:00:00Z,nutrient sample compromised not analysed,2,,1,1,,,,,17.2,,,,,,,,,,,,,,,,,,,,,,,
102.100.100/402231,CSTRP,,25/08/2022,0:02:00,2022-08-25T00:02:00Z,nutrient sample compromised not analysed,2,,1,1,,,,,8.56,,,,,,,,,,,,,,,,,,,,,,,
102.100.100/402232,CSTRP,,25/08/2022,0:04:00,2022-08-25T00:04:00Z,nutrient sample compromised not analysed,2,,1,1,,,,,18.8,,,,,,,,,,,,,,,,,,,,,,,
102.100.100/402233,CSTRP,,8/09/2022,0:51:00,2022-09-08T00:51:00Z,,2,,1,1,,,,,12.4,,,,,,,,,,,,,,,,,,,,,,,
102.100.100/402234,CSTRP,,8/09/2022,0:58:00,2022-09-08T00:58:00Z,,2,,1,1,,,,,23.9,,,,,,,,,,,,,,,,,,,,,,,
102.100.100/402235,CSTRP,,8/09/2022,1:02:00,2022-09-08T01:02:00Z,,2,,1,1,,,,,13.2,,,,,,,,,,,,,,,,,,,,,,,
102.100.100/402236,CSTRP,,21/09/2022,2:18:00,2022-09-21T02:18:00Z,,2,,1.94,1.94,Other - Filters were clogged,,,,46.6,,,,,,,,,,,,,,,,,,,,,,,
102.100.100/402237,CSTRP,,21/09/2022,2:24:00,2022-09-21T02:24:00Z,,2,,1.87,1.87,Other - Filters were clogged,,,,32.5,,,,,,,,,,,,,,,,,,,,,,,
102.100.100/402238,CSTRP,,21/09/2022,2:30:00,2022-09-21T02:30:00Z,,2,,1.785,1.785,Other - Filters were clogged,,,,28.8,,,,,,,,,,,,,,,,,,,,,,,
102.100.100/402239,CSTRP,,6/10/2022,3:35:00,2022-10-06T03:35:00Z,,2,,1.44,1.44,Other - Filters were clogged,,,,25.8,,,,,,,,,,,,,,,,,,,,,,,
102.100.100/402240,CSTRP,,6/10/2022,3:39:00,2022-10-06T03:39:00Z,,2,,1.33,1.33,Other - Filters were clogged,,,,17,,,,,,,,,,,,,,,,,,,,,,,
102.100.100/402241,CSTRP,,6/10/2022,3:42:00,2022-10-06T03:42:00Z,,2,,1.44,1.44,Other - Filters were clogged,,,,28.1,,,,,,,,,,,,,,,,,,,,,,,
102.100.100/402242,CSTRP,,19/10/2022,19:58:00,2022-10-19T19:58:00Z,,2,,2,2,,,,,30.4,,,,,,,,,,,,,,,,,,,,,,,
102.100.100/402243,CSTRP,,19/10/2022,20:03:00,2022-10-19T20:03:00Z,,2,,2,2,,,,,19,,,,,,,,,,,,,,,,,,,,,,,
102.100.100/402244,CSTRP,,19/10/2022,20:08:00,2022-10-19T20:08:00Z,,2,,2,2,,,,,52.8,,,,,,,,,,,,,,,,,,,,,,,
102.100.100/402245,CSTRP,,3/11/2022,0:35:00,2022-11-03T00:35:00Z,,2,,2,2,,,,,45.1,,,,,,,,,,,,,,,,,,,,,,,
102.100.100/402246,CSTRP,,3/11/2022,0:41:00,2022-11-03T00:41:00Z,,2,,2,2,,,,,39.3,,,,,,,,,,,,,,,,,,,,,,,
102.100.100/402247,CSTRP,,3/11/2022,0:46:00,2022-11-03T00:46:00Z,,2,,2,2,,,,,46.4,,,,,,,,,,,,,,,,,,,,,,,
102.100.100/402248,CSTRP,,17/11/2022,0:36:00,2022-11-17T00:36:00Z,,2,,2,2,,,,,35.5,,,,,,,,,,,,,,,,,,,,,,,
102.100.100/402249,CSTRP,,17/11/2022,0:41:00,2022-11-17T00:41:00Z,,2,,2,2,,,,,58.4,,,,,,,,,,,,,,,,,,,,,,,
102.100.100/402250,CSTRP,,17/11/2022,0:54:00,2022-11-17T00:54:00Z,,2,,1.64,1.64,Other - Filters were clogged,,,,49.1,,,,,,,,,,,,,,,,,,,,,,,
102.100.100/402251,CSTRP,,1/12/2022,0:32:00,2022-12-01T00:32:00Z,,2,,2,2,,,,,35.1,,,,,,,,,,,,,,,,,,,,,,,
102.100.100/402252,CSTRP,,1/12/2022,0:40:00,2022-12-01T00:40:00Z,,2,,2,2,,,,,35.6,,,,,,,,,,,,,,,,,,,,,,,
102.100.100/402253,CSTRP,,1/12/2022,0:45:00,2022-12-01T00:45:00Z,,2,,2,2,,,,,40.5,,,,,,,,,,,,,,,,,,,,,,,
102.100.100/402254,CSTRP,,15/12/2022,23:20:00,2022-12-15T23:20:00Z,,2,,1,1,Other - Filters were clogged,,,,23.7,,,,,,,,,,,,,,,,,,,,,,,
102.100.100/402255,CSTRP,,15/12/2022,23:25:00,2022-12-15T23:25:00Z,,2,,1,1,Other - Filters were clogged,,,,17.3,,,,,,,,,,,,,,,,,,,,,,,
102.100.100/402256,CSTRP,,15/12/2022,23:31:00,2022-12-15T23:31:00Z,,2,,1,1,Other - Filters were clogged,,,,22.3,,,,,,,,,,,,,,,,,,,,,,,
102.100.100/402257,CSTRP,,29/12/2022,0:03:00,2022-12-29T00:03:00Z,,2,,1.28,1.28,Other - Filters were clogged,,,,42.2,,,,,,,,,,,,,,,,,,,,,,,
102.100.100/402258,CSTRP,,29/12/2022,0:07:00,2022-12-29T00:07:00Z,,2,,1.29,1.29,Other - Filters were clogged,,,,63.9,,,,,,,,,,,,,,,,,,,,,,,
102.100.100/402259,CSTRP,,29/12/2022,0:12:00,2022-12-29T00:12:00Z,,2,,1.38,1.38,Other - Filters were clogged,,,,54,,,,,,,,,,,,,,,,,,,,,,,
102.100.100/402263,CSTRP,,12/01/2023,0:07:00,2023-01-12T00:07:00Z,,2,,1.76,1.76,Other - Filters were clogged,,,,8.67,,,,,,,,,,,,,,,,,,,,,,,
102.100.100/402264,CSTRP,,12/01/2023,0:12:00,2023-01-12T00:12:00Z,,2,,1.37,1.37,Other - Filters were clogged,,,,16.6,,,,,,,,,,,,,,,,,,,,,,,
102.100.100/402265,CSTRP,,12/01/2023,0:17:00,2023-01-12T00:17:00Z,,2,,1.43,1.43,Other - Filters were clogged,,,,20.4,,,,,,,,,,,,,,,,,,,,,,,
102.100.100/402260,CSTRP,,12/01/2023,0:20:00,2023-01-12T00:20:00Z,,2,,2,2,,,,,62.3,,,,,,,,,,,,,,,,,,,,,,,
102.100.100/402261,CSTRP,,12/01/2023,0:25:00,2023-01-12T00:25:00Z,,2,,1.46,1.46,Other - Filters were clogged,,,,38.6,,,,,,,,,,,,,,,,,,,,,,,
102.100.100/402262,CSTRP,,12/01/2023,0:29:00,2023-01-12T00:29:00Z,no bacterial flow cytometry data - instrument error,2,,2,2,,,,,63.2,,,,,,,,,,,,,,,,,,,,,,,
102.100.100/402266,CSTRP,,9/02/2023,23:44:00,2023-02-09T23:44:00Z,,2,,2,2,,,,,60.5,,,,,,,,,,,,,,,,,,,,,,,
102.100.100/402267,CSTRP,,9/02/2023,23:48:00,2023-02-09T23:48:00Z,,2,,1.59,1.59,Other - Filters were clogged,,,,31.6,,,,,,,,,,,,,,,,,,,,,,,
102.100.100/402268,CSTRP,,9/02/2023,23:54:00,2023-02-09T23:54:00Z,,2,,2,2,,,,,31.4,,,,,,,,,,,,,,,,,,,,,,,
102.100.100/402269,CSTRP,,23/02/2023,0:29:00,2023-02-23T00:29:00Z,,2,,2,2,,,,,61.8,,,,,,,,,,,,,,,,,,,,,,,
102.100.100/402270,CSTRP,,23/02/2023,0:34:00,2023-02-23T00:34:00Z,,2,,2,2,,,,,65.8,,,,,,,,,,,,,,,,,,,,,,,
102.100.100/402271,CSTRP,,23/02/2023,0:38:00,2023-02-23T00:38:00Z,,2,,2,2,,,,,43.1,,,,,,,,,,,,,,,,,,,,,,,
102.100.100/402272,CSTRP,,9/03/2023,21:25:00,2023-03-09T21:25:00Z,,2,,2,2,,,,,22.2,,,,,,,,,,,,,,,,,,,,,,,
102.100.100/402273,CSTRP,,9/03/2023,21:27:00,2023-03-09T21:27:00Z,,2,,2,2,,,,,0.315,,,,,,,,,,,,,,,,,,,,,,,
102.100.100/402274,CSTRP,,9/03/2023,21:30:00,2023-03-09T21:30:00Z,,2,,2,2,,,,,41.4,,,,,,,,,,,,,,,,,,,,,,,
102.100.100/402275,CSTRP,,22/03/2023,23:19:00,2023-03-22T23:19:00Z,,2,,2,2,,,,,62.1,,,,,,,,,,,,,,,,,,,,,,,
102.100.100/402276,CSTRP,,22/03/2023,23:25:00,2023-03-22T23:25:00Z,,2,,2,2,,,,,50,,,,,,,,,,,,,,,,,,,,,,,
102.100.100/402277,CSTRP,,22/03/2023,23:30:00,2023-03-22T23:30:00Z,,2,,2,2,,,,,59.6,,,,,,,,,,,,,,,,,,,,,,,
102.100.100/402278,CSTRP,,6/04/2023,0:42:00,2023-04-06T00:42:00Z,,2,,2,2,,,,,23.7,,,,,,,,,,,,,,,,,,,,,,,
102.100.100/402279,CSTRP,,6/04/2023,0:46:00,2023-04-06T00:46:00Z,,2,,2,2,,,,,23.2,,,,,,,,,,,,,,,,,,,,,,,
102.100.100/402280,CSTRP,,6/04/2023,0:49:00,2023-04-06T00:49:00Z,,2,,2,2,,,,,24.9,,,,,,,,,,,,,,,,,,,,,,,
102.100.100/402281,CSTRP,,20/04/2023,2:29:00,2023-04-20T02:29:00Z,,2,,0.72,0.72,Other - Filters were clogged,,,,30.8,,,,,,,,,,,,,,,,,,,,,,,
102.100.100/402282,CSTRP,,20/04/2023,2:32:00,2023-04-20T02:32:00Z,,2,,0.685,0.685,Other - Filters were clogged,,,,23.8,,,,,,,,,,,,,,,,,,,,,,,
102.100.100/402283,CSTRP,,20/04/2023,2:37:00,2023-04-20T02:37:00Z,,2,,0.66,0.66,Other - Filters were clogged,,,,36.2,,,,,,,,,,,,,,,,,,,,,,,
102.100.100/402284,CSTRP,,4/05/2023,0:29:00,2023-05-04T00:29:00Z,,2,,2,2,,,,,34.2,,,,,,,,,,,,,,,,,,,,,,,
102.100.100/402285,CSTRP,,4/05/2023,0:34:00,2023-05-04T00:34:00Z,,2,,2,2,,,,,75.3,,,,,,,,,,,,,,,,,,,,,,,
102.100.100/402286,CSTRP,,4/05/2023,0:39:00,2023-05-04T00:39:00Z,,2,,2,2,,,,,35.2,,,,,,,,,,,,,,,,,,,,,,,
102.100.100/402287,CSTRP,,18/05/2023,0:36:00,2023-05-18T00:36:00Z,,2,,2,2,,,,,7.54,,,,,,,,,,,,,,,,,,,,,,,
102.100.100/402288,CSTRP,,18/05/2023,0:41:00,2023-05-18T00:41:00Z,,2,,2,2,,,,,24.1,,,,,,,,,,,,,,,,,,,,,,,
102.100.100/402289,CSTRP,,18/05/2023,0:46:00,2023-05-18T00:46:00Z,,2,,2,2,,,,,6.93,,,,,,,,,,,,,,,,,,,,,,,
102.100.100/402290,CSTRP,,1/06/2023,2:13:00,2023-06-01T02:13:00Z,,2,,2,2,,,,,14.1,,,,,,,,,,,,,,,,,,,,,,,
102.100.100/402291,CSTRP,,1/06/2023,2:19:00,2023-06-01T02:19:00Z,,2,,2,2,,,,,18.3,,,,,,,,,,,,,,,,,,,,,,,
102.100.100/402292,CSTRP,,1/06/2023,2:23:00,2023-06-01T02:23:00Z,,2,,2,2,,,,,8.73,,,,,,,,,,,,,,,,,,,,,,,
102.100.100/402293,CSTRP,,15/06/2023,1:57:00,2023-06-15T01:57:00Z,no picoplankton flow cytometry data - instrument error,2,,2,2,,,,,11.6,,,,,,,,,,,,,,,,,,,,,,,
102.100.100/402294,CSTRP,,15/06/2023,2:04:00,2023-06-15T02:04:00Z,,2,,2,2,,,,,9.54,,,,,,,,,,,,,,,,,,,,,,,
102.100.100/402295,CSTRP,,15/06/2023,2:13:00,2023-06-15T02:13:00Z,,2,,2,2,,,,,9.24,,,,,,,,,,,,,,,,,,,,,,,
102.100.100/402296,CSTRP,,29/06/2023,0:06:00,2023-06-29T00:06:00Z,,2,,2,2,,,,,23.1,,,,,,,,,,,,,,,,,,,,,,,
102.100.100/402297,CSTRP,,29/06/2023,0:12:00,2023-06-29T00:12:00Z,,2,,2,2,,,,,20.8,,,,,,,,,,,,,,,,,,,,,,,
102.100.100/402298,CSTRP,,29/06/2023,0:18:00,2023-06-29T00:18:00Z,,2,,2,2,,,,,19.7,,,,,,,,,,,,,,,,,,,,,,,
102.100.100/403361,CSTRP,,13/07/2023,1:30:00,2023-07-13T01:30:00Z,,2,,2,2,,,,,21,,,,,,,,,,,,,,,,,,,,,,,
102.100.100/403362,CSTRP,,13/07/2023,1:30:00,2023-07-13T01:30:00Z,,2,,2,2,,,,,17.1,,,,,,,,,,,,,,,,,,,,,,,
102.100.100/403363,CSTRP,,13/07/2023,1:30:00,2023-07-13T01:30:00Z,,2,,2,2,,,,,18.7,,,,,,,,,,,,,,,,,,,,,,,
102.100.100/403364,CSTRP,,27/07/2023,1:30:00,2023-07-27T01:30:00Z,,2,,2,2,,,,,15.1,,,,,,,,,,,,,,,,,,,,,,,
102.100.100/403365,CSTRP,,27/07/2023,1:30:00,2023-07-27T01:30:00Z,,2,,2,2,,,,,16.9,,,,,,,,,,,,,,,,,,,,,,,
102.100.100/403366,CSTRP,,27/07/2023,1:30:00,2023-07-27T01:30:00Z,,2,,2,2,,,,,16.3,,,,,,,,,,,,,,,,,,,,,,,
102.100.100/403367,CSTRP,,10/08/2023,0:44:00,2023-08-10T00:44:00Z,,2,,2,2,,,,,25,,,,,,,,,,,,,,,,,,,,,,,
102.100.100/403368,CSTRP,,10/08/2023,0:47:00,2023-08-10T00:47:00Z,,2,,2,2,,,,,22.8,,,,,,,,,,,,,,,,,,,,,,,
102.100.100/403369,CSTRP,,10/08/2023,0:52:00,2023-08-10T00:52:00Z,,2,,2,2,,,,,24.6,,,,,,,,,,,,,,,,,,,,,,,
102.100.100/403370,CSTRP,,24/08/2023,0:59:00,2023-08-24T00:59:00Z,,2,,2,2,,,,,29.6,,,,,,,,,,,,,,,,,,,,,,,
102.100.100/403371,CSTRP,,24/08/2023,1:05:00,2023-08-24T01:05:00Z,,2,,2,2,,,,,23,,,,,,,,,,,,,,,,,,,,,,,
102.100.100/403372,CSTRP,,24/08/2023,1:11:00,2023-08-24T01:11:00Z,,2,,2,2,,,,,34,,,,,,,,,,,,,,,,,,,,,,,
102.100.100/403373,CSTRP,,7/09/2023,1:29:00,2023-09-07T01:29:00Z,,2,,0.44,0.44,Other - Filters were clogged,,,,18.7,,,,,,,,,,,,,,,,,,,,,,,
102.100.100/403374,CSTRP,,7/09/2023,1:36:00,2023-09-07T01:36:00Z,,2,,1,1,Other - Filters were clogged,,,,21.3,,,,,,,,,,,,,,,,,,,,,,,
102.100.100/403375,CSTRP,,7/09/2023,1:44:00,2023-09-07T01:44:00Z,,2,,1,1,Other - Filters were clogged,,,,21.7,,,,,,,,,,,,,,,,,,,,,,,
102.100.100/403376,CSTRP,,21/09/2023,2:16:00,2023-09-21T02:16:00Z,,2,,2,2,,,,,48.6,,,,,,,,,,,,,,,,,,,,,,,
102.100.100/403377,CSTRP,,21/09/2023,2:22:00,2023-09-21T02:22:00Z,,2,,2,2,,,,,39.9,,,,,,,,,,,,,,,,,,,,,,,
102.100.100/403378,CSTRP,,21/09/2023,2:28:00,2023-09-21T02:28:00Z,,2,,2,2,,,,,31.2,,,,,,,,,,,,,,,,,,,,,,,
102.100.100/403427,CSTRP,,4/10/2023,22:40:00,2023-10-04T22:40:00Z,,2,,1.46,1.46,Other - Filters were clogged,,,,25.7,,,,,,,,,,,,,,,,,,,,,,,
102.100.100/403428,CSTRP,,4/10/2023,22:45:00,2023-10-04T22:45:00Z,,2,,1.32,1.32,Other - Filters were clogged,,,,24.6,,,,,,,,,,,,,,,,,,,,,,,
102.100.100/403429,CSTRP,,4/10/2023,22:50:00,2023-10-04T22:50:00Z,,2,,1.33,1.33,Other - Filters were clogged,,,,20.9,,,,,,,,,,,,,,,,,,,,,,,
102.100.100/403430,CSTRP,,19/10/2023,1:00:00,2023-10-19T01:00:00Z,,2,,2,2,,,,,28.3,,,,,,,,,,,,,,,,,,,,,,,
102.100.100/403431,CSTRP,,19/10/2023,1:05:00,2023-10-19T01:05:00Z,,2,,2,2,,,,,40.9,,,,,,,,,,,,,,,,,,,,,,,
102.100.100/403432,CSTRP,,19/10/2023,1:11:00,2023-10-19T01:11:00Z,,2,,2,2,,,,,23.4,,,,,,,,,,,,,,,,,,,,,,,
102.100.100/403433,CSTRP,,1/11/2023,22:59:00,2023-11-01T22:59:00Z,,2,,1.28,1.28,Other - Filters were clogged,,,,43.7,,,,,,,,,,,,,,,,,,,,,,,
102.100.100/403434,CSTRP,,1/11/2023,23:05:00,2023-11-01T23:05:00Z,,2,,1.12,1.12,Other - Filters were clogged,,,,32.4,,,,,,,,,,,,,,,,,,,,,,,
102.100.100/403435,CSTRP,,1/11/2023,23:09:00,2023-11-01T23:09:00Z,,2,,1.22,1.22,Other - Filters were clogged,,,,33.9,,,,,,,,,,,,,,,,,,,,,,,
102.100.100/403436,CSTRP,,16/11/2023,1:37:00,2023-11-16T01:37:00Z,,2,,2,2,,,,,21.4,,,,,,,,,,,,,,,,,,,,,,,
102.100.100/403437,CSTRP,,16/11/2023,1:46:00,2023-11-16T01:46:00Z,,2,,2,2,,,,,21.4,,,,,,,,,,,,,,,,,,,,,,,
102.100.100/403438,CSTRP,,16/11/2023,1:51:00,2023-11-16T01:51:00Z,,2,,2,2,,,,,39.6,,,,,,,,,,,,,,,,,,,,,,,
102.100.100/403439,CSTRP,,30/11/2023,21:32:00,2023-11-30T21:32:00Z,,2,,2,2,,,,,19.3,,,,,,,,,,,,,,,,,,,,,,,
102.100.100/403440,CSTRP,,30/11/2023,21:38:00,2023-11-30T21:38:00Z,,2,,2,2,,,,,32.4,,,,,,,,,,,,,,,,,,,,,,,
102.100.100/403441,CSTRP,,30/11/2023,21:43:00,2023-11-30T21:43:00Z,,2,,2,2,,,,,29.6,,,,,,,,,,,,,,,,,,,,,,,
102.100.100/403442,CSTRP,,13/12/2023,21:14:00,2023-12-13T21:14:00Z,,2,,1,1,Other - Filters were clogged,,,,9.26,,,,,,,,,,,,,,,,,,,,,,,
102.100.100/403443,CSTRP,,13/12/2023,21:18:00,2023-12-13T21:18:00Z,,2,,1,1,Other - Filters were clogged,,,,11.6,,,,,,,,,,,,,,,,,,,,,,,
102.100.100/403444,CSTRP,,13/12/2023,21:23:00,2023-12-13T21:23:00Z,,2,,1,1,Other - Filters were clogged,,,,11,,,,,,,,,,,,,,,,,,,,,,,
102.100.100/403445,CSTRP,,27/12/2023,23:27:00,2023-12-27T23:27:00Z,very high recreational boat use on sampling day,2,,2,2,,,,,42.7,,,,,,,,,,,,,,,,,,,,,,,
102.100.100/403446,CSTRP,,27/12/2023,23:31:00,2023-12-27T23:31:00Z,very high recreational boat use on sampling day,2,,2,2,,,,,43.2,,,,,,,,,,,,,,,,,,,,,,,
102.100.100/403447,CSTRP,,27/12/2023,23:35:00,2023-12-27T23:35:00Z,very high recreational boat use on sampling day,2,,2,2,,,,,49.2,,,,,,,,,,,,,,,,,,,,,,,
102.100.100/403511,CSTRP,,11/01/2024,0:31:00,2024-01-11T00:31:00Z,,2,,2,2,,,,,12.7,,,,,,,,,,,,,,,,,,,,,,,
102.100.100/403512,CSTRP,,11/01/2024,0:35:00,2024-01-11T00:35:00Z,,2,,2,2,,,,,12.8,,,,,,,,,,,,,,,,,,,,,,,
102.100.100/403513,CSTRP,,11/01/2024,0:40:00,2024-01-11T00:40:00Z,,2,,2,2,,,,,14.5,,,,,,,,,,,,,,,,,,,,,,,
102.100.100/403514,CSTRP,,25/01/2024,1:09:00,2024-01-25T01:09:00Z,,2,,2,2,,,,,24.4,,,,,,,,,,,,,,,,,,,,,,,
102.100.100/403515,CSTRP,,25/01/2024,1:14:00,2024-01-25T01:14:00Z,,2,,2,2,,,,,26,,,,,,,,,,,,,,,,,,,,,,,
102.100.100/403516,CSTRP,,25/01/2024,1:18:00,2024-01-25T01:18:00Z,,2,,2,2,,,,,43.9,,,,,,,,,,,,,,,,,,,,,,,
102.100.100/403517,CSTRP,,8/02/2024,21:10:00,2024-02-08T21:10:00Z,,2,,,,,,,,13.8,,,,,,,,,,,,,,,,,,,,,,,
102.100.100/403518,CSTRP,,8/02/2024,21:15:00,2024-02-08T21:15:00Z,,2,,,,,,,,0.202,,,,,,,,,,,,,,,,,,,,,,,
102.100.100/403519,CSTRP,,8/02/2024,21:20:00,2024-02-08T21:20:00Z,,2,,,,,,,,13.8,,,,,,,,,,,,,,,,,,,,,,,
102.100.100/403520,CSTRP,,21/02/2024,23:05:00,2024-02-21T23:05:00Z,,2,,2,2,,,,,26.2,,,,,,,,,,,,,,,,,,,,,,,
102.100.100/403521,CSTRP,,21/02/2024,23:08:00,2024-02-21T23:08:00Z,,2,,2,2,,,,,27.1,,,,,,,,,,,,,,,,,,,,,,,
102.100.100/403522,CSTRP,,21/02/2024,23:12:00,2024-02-21T23:12:00Z,,2,,2,2,,,,,31.3,,,,,,,,,,,,,,,,,,,,,,,
102.100.100/403523,CSTRP,,6/03/2024,23:42:00,2024-03-06T23:42:00Z,,2,,2,2,,,,,13.6,,,,,,,,,,,,,,,,,,,,,,,
102.100.100/403524,CSTRP,,6/03/2024,23:48:00,2024-03-06T23:48:00Z,,2,,2,2,,,,,12.9,,,,,,,,,,,,,,,,,,,,,,,
102.100.100/403525,CSTRP,,6/03/2024,23:53:00,2024-03-06T23:53:00Z,,2,,2,2,,,,,24.8,,,,,,,,,,,,,,,,,,,,,,,
102.100.100/403526,CSTRP,,20/03/2024,23:54:00,2024-03-20T23:54:00Z,,2,,2,2,,,,,21.7,,,,,,,,,,,,,,,,,,,,,,,
102.100.100/403527,CSTRP,,20/03/2024,23:59:00,2024-03-20T23:59:00Z,,2,,2,2,,,,,19.3,,,,,,,,,,,,,,,,,,,,,,,
102.100.100/403528,CSTRP,,21/03/2024,0:04:00,2024-03-21T00:04:00Z,,2,,2,2,,,,,34,,,,,,,,,,,,,,,,,,,,,,,
102.100.100/403529,CSTRP,,3/04/2024,22:48:00,2024-04-03T22:48:00Z,,2,,2,2,,,,,34,,,,,,,,,,,,,,,,,,,,,,,
102.100.100/403530,CSTRP,,3/04/2024,22:53:00,2024-04-03T22:53:00Z,,2,,2,2,,,,,28,,,,,,,,,,,,,,,,,,,,,,,
102.100.100/403531,CSTRP,,3/04/2024,22:58:00,2024-04-03T22:58:00Z,,2,,2,2,,,,,39.8,,,,,,,,,,,,,,,,,,,,,,,
102.100.100/403532,CSTRP,,18/04/2024,0:01:00,2024-04-18T00:01:00Z,,2,,1.96,1.96,Other - Filters were clogged,,,,20,,,,,,,,,,,,,,,,,,,,,,,
102.100.100/403533,CSTRP,,18/04/2024,0:06:00,2024-04-18T00:06:00Z,,2,,1.65,1.65,Other - Filters were clogged,,,,15.6,,,,,,,,,,,,,,,,,,,,,,,
102.100.100/403534,CSTRP,,18/04/2024,0:11:00,2024-04-18T00:11:00Z,,2,,1.73,1.73,Other - Filters were clogged,,,,18.2,,,,,,,,,,,,,,,,,,,,,,,
102.100.100/403832,CSTRP,,2/05/2024,0:34:00,2024-05-02T00:34:00Z,Large(~1m) fish carcass at sampling site. Sampled during heavy rain. ,2,,1,1,Other - Filters were clogged,,,,14.3,,,,,,,,,,,,,,,,,,,,,,,
102.100.100/403833,CSTRP,,2/05/2024,0:38:00,2024-05-02T00:38:00Z,Large(~1m) fish carcass at sampling site. Sampled during heavy rain. ,2,,1,1,Other - Filters were clogged,,,,14.5,,,,,,,,,,,,,,,,,,,,,,,
102.100.100/403834,CSTRP,,2/05/2024,0:43:00,2024-05-02T00:43:00Z,Large(~1m) fish carcass at sampling site. Sampled during heavy rain. ,2,,1,1,Other - Filters were clogged,,,,18.2,,,,,,,,,,,,,,,,,,,,,,,
102.100.100/403835,CSTRP,,15/05/2024,22:26:00,2024-05-15T22:26:00Z,,2,,2,2,,,,,19.6,,,,,,,,,,,,,,,,,,,,,,,
102.100.100/403836,CSTRP,,15/05/2024,22:31:00,2024-05-15T22:31:00Z,,2,,2,2,,,,,27,,,,,,,,,,,,,,,,,,,,,,,
102.100.100/403837,CSTRP,,15/05/2024,22:36:00,2024-05-15T22:36:00Z,,2,,2,2,,,,,17.6,,,,,,,,,,,,,,,,,,,,,,,
102.100.100/403838,CSTRP,,29/05/2024,22:13:00,2024-05-29T22:13:00Z,Very low tide (0.3m),2,,1,1,Other - Filters were clogged,,,,22.4,,,,,,,,,,,,,,,,,,,,,,,
102.100.100/403839,CSTRP,,29/05/2024,22:19:00,2024-05-29T22:19:00Z,Very low tide (0.3m),2,,1,1,Other - Filters were clogged,,,,19.2,,,,,,,,,,,,,,,,,,,,,,,
102.100.100/403840,CSTRP,,29/05/2024,22:26:00,2024-05-29T22:26:00Z,Very low tide (0.3m),2,,1,1,Other - Filters were clogged,,,,17.5,,,,,,,,,,,,,,,,,,,,,,,
102.100.100/403841,CSTRP,,12/06/2024,22:36:00,2024-06-12T22:36:00Z,,2,,1.21,1.21,Other - Filters were clogged,,,,15.5,,,,,,,,,,,,,,,,,,,,,,,
102.100.100/403842,CSTRP,,12/06/2024,22:41:00,2024-06-12T22:41:00Z,,2,,1.71,1.71,Other - Filters were clogged,,,,17.6,,,,,,,,,,,,,,,,,,,,,,,
102.100.100/403843,CSTRP,,12/06/2024,22:46:00,2024-06-12T22:46:00Z,,2,,2,2,,,,,16.3,,,,,,,,,,,,,,,,,,,,,,,
102.100.100/403844,CSTRP,,26/06/2024,22:53:00,2024-06-26T22:53:00Z,,2,,1.53,1.53,Other - Filters were clogged,,,,21.1,,,,,,,,,,,,,,,,,,,,,,,
102.100.100/403845,CSTRP,,26/06/2024,22:58:00,2024-06-26T22:58:00Z,,2,,1.42,1.42,Other - Filters were clogged,,,,21.5,,,,,,,,,,,,,,,,,,,,,,,
102.100.100/403846,CSTRP,,26/06/2024,23:04:00,2024-06-26T23:04:00Z,,2,,1.405,1.405,Other - Filters were clogged,,,,20,,,,,,,,,,,,,,,,,,,,,,,
102.100.100/403847,CSTRP,,10/07/2024,23:11:00,2024-07-10T23:11:00Z,,2,,1.16,1.16,Other - Filters were clogged,,,,16.6,,,,,,,,,,,,,,,,,,,,,,,
102.100.100/403848,CSTRP,,10/07/2024,23:15:00,2024-07-10T23:15:00Z,,2,,1.23,1.23,Other - Filters were clogged,,,,11.2,,,,,,,,,,,,,,,,,,,,,,,
102.100.100/403849,CSTRP,,10/07/2024,23:19:00,2024-07-10T23:19:00Z,,2,,1.305,1.305,Other - Filters were clogged,,,,18.4,,,,,,,,,,,,,,,,,,,,,,,
102.100.100/403850,CSTRP,,26/07/2024,0:20:00,2024-07-26T00:20:00Z,,2,,2,2,,,,,13.7,,,,,,,,,,,,,,,,,,,,,,,
102.100.100/403851,CSTRP,,26/07/2024,0:24:00,2024-07-26T00:24:00Z,,2,,1.713,1.713,Other - Filters were clogged,,,,11.4,,,,,,,,,,,,,,,,,,,,,,,
102.100.100/403852,CSTRP,,26/07/2024,0:29:00,2024-07-26T00:29:00Z,,2,,2,2,,,,,15.3,,,,,,,,,,,,,,,,,,,,,,,
102.100.100/403853,CSTRP,,7/08/2024,23:04:00,2024-08-07T23:04:00Z,,2,,2,2,,,,,20.9,,,,,,,,,,,,,,,,,,,,,,,
102.100.100/403854,CSTRP,,7/08/2024,23:09:00,2024-08-07T23:09:00Z,,2,,1.85,1.85,Other - Filters were clogged,,,,15.3,,,,,,,,,,,,,,,,,,,,,,,
102.100.100/403855,CSTRP,,7/08/2024,23:14:00,2024-08-07T23:14:00Z,,2,,1.76,1.76,Other - Filters were clogged,,,,16.2,,,,,,,,,,,,,,,,,,,,,,,
102.100.100/403856,CSTRP,,21/08/2024,23:57:00,2024-08-21T23:57:00Z,,2,,2,2,,,,,15.6,,,,,,,,,,,,,,,,,,,,,,,
102.100.100/403857,CSTRP,,22/08/2024,0:01:00,2024-08-22T00:01:00Z,,2,,2,2,,,,,11.8,,,,,,,,,,,,,,,,,,,,,,,
102.100.100/403858,CSTRP,,22/08/2024,0:07:00,2024-08-22T00:07:00Z,,2,,2,2,,,,,12.1,,,,,,,,,,,,,,,,,,,,,,,
102.100.100/403859,CSTRP,,5/09/2024,21:03:00,2024-09-05T21:03:00Z,,2,,2,2,,,,,41.2,,,,,,,,,,,,,,,,,,,,,,,
102.100.100/403860,CSTRP,,5/09/2024,21:08:00,2024-09-05T21:08:00Z,,2,,2,2,,,,,25.6,,,,,,,,,,,,,,,,,,,,,,,
102.100.100/403861,CSTRP,,5/09/2024,21:14:00,2024-09-05T21:14:00Z,,2,,2,2,,,,,30.8,,,,,,,,,,,,,,,,,,,,,,,
102.100.100/403862,CSTRP,,19/09/2024,21:07:00,2024-09-19T21:07:00Z,,2,,2,2,,,,,23.5,,,,,,,,,,,,,,,,,,,,,,,
102.100.100/403863,CSTRP,,19/09/2024,21:12:00,2024-09-19T21:12:00Z,,2,,2,2,,,,,29.1,,,,,,,,,,,,,,,,,,,,,,,
102.100.100/403864,CSTRP,,19/09/2024,21:18:00,2024-09-19T21:18:00Z,,2,,2,2,,,,,29.6,,,,,,,,,,,,,,,,,,,,,,,
102.100.100/404312,CSTRP,,3/10/2024,12:09:00,2024-10-03T02:09:00T,Neap tide; very low tide when sampled,2,,2,2,,,,,14.1,,,,,,,,,,,,,,,,,,,,,,,
102.100.100/404313,CSTRP,,3/10/2024,12:14:00,2024-10-03T02:14:00T,Neap tide; very low tide when sampled,2,,2,2,,,,,8.07,,,,,,,,,,,,,,,,,,,,,,,
102.100.100/404314,CSTRP,,3/10/2024,12:19:00,2024-10-03T02:19:00T,Neap tide; very low tide when sampled,2,,2,2,,,,,22.4,,,,,,,,,,,,,,,,,,,,,,,
102.100.100/404318,CSTRP,,17/10/2024,12:09:00,2024-10-17T00:23:00T,,2,,2,2,,,,,9.91,,,,,,,,,,,,,,,,,,,,,,,
102.100.100/404319,CSTRP,,17/10/2024,12:14:00,2024-10-17T00:28:00T,,2,,2,2,,,,,14.9,,,,,,,,,,,,,,,,,,,,,,,
102.100.100/404320,CSTRP,,17/10/2024,12:19:00,2024-10-17T00:35:00T,,2,,2,2,,,,,13.8,,,,,,,,,,,,,,,,,,,,,,,
102.100.100/404324,CSTRP,,31/10/2024,10:36:00,2024-10-30T23:36:00T,"Sampling location full of seaweed, seagrass",2,,2,2,,,,,32.3,,,,,,,,,,,,,,,,,,,,,,,
102.100.100/404325,CSTRP,,31/10/2024,10:41:00,2024-10-30T23:41:00T,"Sampling location full of seaweed, seagrass",2,,2,2,,,,,28.4,,,,,,,,,,,,,,,,,,,,,,,
102.100.100/404326,CSTRP,,31/10/2024,10:47:00,2024-10-30T23:47:00T,"Sampling location full of seaweed, seagrass",2,,1.5,1.5,high biomass/particulate matter.,,,,20.7,,,,,,,,,,,,,,,,,,,,,,,
102.100.100/404327,CSTRP,,14/11/2024,10:43:00,2024-11-13T23:43:00T,,2,,2,2,,,,,20.9,,,,,,,,,,,,,,,,,,,,,,,
102.100.100/404328,CSTRP,,14/11/2024,10:49:00,2024-11-13T23:49:00T,,2,,2,2,,,,,27.3,,,,,,,,,,,,,,,,,,,,,,,
102.100.100/404329,CSTRP,,14/11/2024,10:55:00,2024-11-13T23:55:00T,,2,,1.95,1.95,,,,,31,,,,,,,,,,,,,,,,,,,,,,,
102.100.100/404330,CSTRP,,28/11/2024,9:37:00,2024-11-27T22:37:00T,,2,,2,2,,,,,24.3,,,,,,,,,,,,,,,,,,,,,,,
102.100.100/404331,CSTRP,,28/11/2024,9:41:00,2024-11-27T22:41:00T,,2,,2,2,,,,,34.4,,,,,,,,,,,,,,,,,,,,,,,
102.100.100/404332,CSTRP,,28/11/2024,9:47:00,2024-11-27T22:47:00T,,2,,2,2,,,,,47,,,,,,,,,,,,,,,,,,,,,,,
102.100.100/404333,CSTRP,,12/12/2024,10:35:00,2024-12-11T23:35:00T,,2,,2,2,,,,,25.3,,,,,,,,,,,,,,,,,,,,,,,
102.100.100/404334,CSTRP,,12/12/2024,10:40:00,2024-12-11T23:40:00T,,2,,2,2,,,,,45.1,,,,,,,,,,,,,,,,,,,,,,,
102.100.100/404335,CSTRP,,12/12/2024,10:46:00,2024-12-11T23:46:00T,,2,,2,2,,,,,32.9,,,,,,,,,,,,,,,,,,,,,,,
102.100.100/404339,CSTRP,,9/01/2025,10:21:00,2025-01-08T23:21:00T,,2,,2,2,,,,,24.4,,,,,,,,,,,,,,,,,,,,,,,
102.100.100/404340,CSTRP,,9/01/2025,10:30:00,2025-01-08T23:30:00T,,2,,2,2,,,,,50.5,,,,,,,,,,,,,,,,,,,,,,,
102.100.100/404341,CSTRP,,9/01/2025,10:40:00,2025-01-08T23:40:00T,,2,,2,2,,,,,34.9,,,,,,,,,,,,,,,,,,,,,,,
102.100.100/404336,CSTRP,,23/01/2025,10:49:00,2025-01-22T23:49:00T,,2,,2,2,,,,,29.1,,,,,,,,,,,,,,,,,,,,,,,
102.100.100/404337,CSTRP,,23/01/2025,10:58:00,2025-01-22T23:58:00T,,2,,2,2,,,,,34.1,,,,,,,,,,,,,,,,,,,,,,,
102.100.100/404338,CSTRP,,23/01/2025,11:08:00,2025-01-23T00:08:00T,,2,,2,2,,,,,35.5,,,,,,,,,,,,,,,,,,,,,,,
102.100.100/404342,CSTRP,,6/02/2025,10:12:00,2025-02-05T23:12:00T,,2,,2,2,,,,,41,,,,,,,,,,,,,,,,,,,,,,,
102.100.100/404343,CSTRP,,6/02/2025,10:20:00,2025-02-05T23:20:00T,,2,,2,2,,,,,32.2,,,,,,,,,,,,,,,,,,,,,,,
102.100.100/404344,CSTRP,,6/02/2025,10:28:00,2025-02-05T23:28:00T,,2,,2,2,,,,,39.7,,,,,,,,,,,,,,,,,,,,,,,
102.100.100/404348,CSTRP,,5/03/2025,19:38:00,2025-03-05T19:38:00T,,2,,0.63,0.63,high biomass/particulate matter.,,22.7,,36.7,,,,,5.36,,,,,,,,,37.3,,,,,,,,,
102.100.100/404349,CSTRP,,5/03/2025,19:45:00,2025-03-05T19:45:00T,,2,,0.54,0.54,high biomass/particulate matter.,,22.6,,52.4,,,,,5.35,,,,,,,,,37.3,,,,,,,,,
102.100.100/404350,CSTRP,,5/03/2025,19:55:00,2025-03-05T19:55:00T,,2,,0.64,0.64,high biomass/particulate matter.,,22.7,,68.5,,,,,5.35,,,,,,,,,37.2,,,,,,,,,
102.100.100/404347,CSTRP,,19/03/2025,0:04:00,2025-03-19T00:04:00T,,2,,2,2,,,22.6,,33,,,,,5.34,,,,,,,,,37.2,,,,,,,,,
102.100.100/404345,CSTRP,,19/03/2025,23:48:00,2025-03-19T23:48:00T,,2,,2,2,,,22.6,,66.3,,,,,5.34,,,,,,,,,37.2,,,,,,,,,
102.100.100/404346,CSTRP,,19/03/2025,23:56:00,2025-03-19T23:56:00T,,2,,2,2,,,22.6,,37.4,,,,,5.33,,,,,,,,,37.1,,,,,,,,,
102.100.100/404351,CSTRP,,2/04/2025,20:30:00,2025-04-02T20:30:00T,little fish in water,2,,1.15,1.15,high biomass/particulate matter.,,19.9,,,,,,,5.26,,,,,,,,,39,,,,,,,,,
102.100.100/404352,CSTRP,,2/04/2025,20:42:00,2025-04-02T20:42:00T,,2,,1.05,1.05,high biomass/particulate matter.,,20.1,,,,,,,5.26,,,,,,,,,38.8,,,,,,,,,
102.100.100/404353,CSTRP,,2/04/2025,20:54:00,2025-04-02T20:54:00T,,2,,1.08,1.08,high biomass/particulate matter.,,19.8,,,,,,,5.25,,,,,,,,,39,,,,,,,,,
102.100.100/404387,CSTRP,,16/04/2025,21:21:00,2025-04-16T21:21:00T,,2,,2,2,,,,,,,,,,,,,,,,,,,,,,,,,,,,
102.100.100/404388,CSTRP,,16/04/2025,21:28:00,2025-04-16T21:28:00T,,2,,2,2,,,,,,,,,,,,,,,,,,,,,,,,,,,,
102.100.100/404389,CSTRP,,16/04/2025,21:34:00,2025-04-16T21:34:00T,,2,,2,2,,,,,,,,,,,,,,,,,,,,,,,,,,,,
102.100.100/404390,CSTRP,,30/04/2025,23:36:00,2025-04-30T23:36:00T,,2,,2,2,high biomass/particulate matter.,,18.2,,,,,,,5.19,,,,,,,,,40,,,,,,,,,
102.100.100/404391,CSTRP,,30/04/2025,23:48:00,2025-04-30T23:48:00T,,2,,1.89,1.89,high biomass/particulate matter.,,18.1,,,,,,,5.2,,,,,,,,,40.2,,,,,,,,,
102.100.100/404392,CSTRP,,30/04/2025,23:51:00,2025-04-30T23:51:00T,,2,,1.94,1.94,high biomass/particulate matter.,,18.1,,,,,,,5.19,,,,,,,,,40.1,,,,,,,,,
102.100.100/404393,CSTRP,,28/05/2025,21:37:00,2025-05-28T21:37:00T,,2,,2,2,,,17,,,,,,,5.13,,,,,,,,,40.7,,,,,,,,,
102.100.100/404394,CSTRP,,28/05/2025,21:41:00,2025-05-28T21:41:00T,,2,,2,2,,,17,,,,,,,5.19,,,,,,,,,41.2,,,,,,,,,
102.100.100/404395,CSTRP,,28/05/2025,21:45:00,2025-05-28T21:45:00T,,2,,2,2,,,17.1,,,,,,,5.18,,,,,,,,,41,,,,,,,,,
102.100.100/404396,CSTRP,,12/06/2025,22:10:00,2025-06-12T22:10:00T,,2,,2,2,,,,,,,,,,,,,,,,,,,,,,,,,,,,
102.100.100/404397,CSTRP,,12/06/2025,22:14:00,2025-06-12T22:14:00T,,2,,2,2,,,,,,,,,,,,,,,,,,,,,,,,,,,,
102.100.100/404398,CSTRP,,12/06/2025,22:20:00,2025-06-12T22:20:00T,,2,,2,2,,,,,,,,,,,,,,,,,,,,,,,,,,,,
102.100.100/404399,CSTRP,,26/06/2025,0:46:00,2025-06-26T00:46:00T,,2,,2,2,,,,,,,,,,,,,,,,,,,,,,,,,,,,
102.100.100/404400,CSTRP,,26/06/2025,0:51:00,2025-06-26T00:51:00T,,2,,1.9,1.9,high biomass/particulate matter.,,,,,,,,,,,,,,,,,,,,,,,,,,,
102.100.100/404401,CSTRP,,26/06/2025,0:59:00,2025-06-26T00:59:00T,,2,,1.95,1.95,high biomass/particulate matter.,,,,,,,,,,,,,,,,,,,,,,,,,,,
102.100.100/404402,CSTRP,,10/07/2025,1:38:00,2025-07-10T01:38:00Z,,2,,2,2,,,,,,,,,,,,,,,,,,,,,,,,,,,,
102.100.100/404403,CSTRP,,10/07/2025,1:44:00,2025-07-10T01:44:00Z,2L split across 2x sterivex filters,2,,2,2,high biomass/particulate matter.,,,,,,,,,,,,,,,,,,,,,,,,,,,
102.100.100/404404,CSTRP,,10/07/2025,1:51:00,2025-07-10T01:51:00Z,,2,,2,2,,,,,,,,,,,,,,,,,,,,,,,,,,,,
102.100.100/405317,CSTRP,,24/07/2025,1:32:00,2025-07-24T01:32:00Z,,2,,2,2,,,,,,,,,,,,,,,,,,,,,,,,,,,,
102.100.100/405318,CSTRP,,24/07/2025,1:41:00,2025-07-24T01:41:00Z,,2,,2,2,,,,,,,,,,,,,,,,,,,,,,,,,,,,
102.100.100/405319,CSTRP,,24/07/2025,1:46:00,2025-07-24T01:46:00Z,,2,,2,2,,,,,,,,,,,,,,,,,,,,,,,,,,,,
102.100.100/405320,CSTRP,,7/08/2025,0:37:00,2025-08-07T00:37:00Z,2L split across 2x sterivex filters,2,,2,2,high biomass/particulate matter.,,,,,,,,,,,,,,,,,,,,,,,,,,,
102.100.100/405321,CSTRP,,7/08/2025,0:45:00,2025-08-07T00:45:00Z,2L split across 2x sterivex filters,2,,2,2,high biomass/particulate matter.,,,,,,,,,,,,,,,,,,,,,,,,,,,
102.100.100/405322,CSTRP,,7/08/2025,0:51:00,2025-08-07T00:51:00Z,2L split across 2x sterivex filters,2,,2,2,high biomass/particulate matter.,,,,,,,,,,,,,,,,,,,,,,,,,,,
102.100.100/405323,CSTRP,,4/09/2025,0:30:00,2025-09-04T00:30:00Z,,2,,2,2,,,,,,,,,,,,,,,,,,,,,,,,,,,,
102.100.100/405324,CSTRP,,4/09/2025,0:35:00,2025-09-04T00:35:00Z,,2,,2,2,,,,,,,,,,,,,,,,,,,,,,,,,,,,
102.100.100/405325,CSTRP,,4/09/2025,0:40:00,2025-09-04T00:40:00Z,,2,,2,2,,,,,,,,,,,,,,,,,,,,,,,,,,,,
102.100.100/405326,CSTRP,,18/09/2025,0:27:00,2025-09-18T00:27:00Z,,2,,2,2,,,,,,,,,,,,,,,,,,,,,,,,,,,,
102.100.100/405327,CSTRP,,18/09/2025,0:32:00,2025-09-18T00:32:00Z,,2,,2,2,,,,,,,,,,,,,,,,,,,,,,,,,,,,
102.100.100/405328,CSTRP,,18/09/2025,0:39:00,2025-09-18T00:39:00Z,,2,,2,2,,,,,,,,,,,,,,,,,,,,,,,,,,,,
102.100.100/405329,CSTRP,,2/10/2025,0:22:00,2025-10-02T00:22:00Z,,2,,2,2,,,,,,,,,,,,,,,,,,,,,,,,,,,,
102.100.100/405330,CSTRP,,2/10/2025,0:27:00,2025-10-02T00:27:00Z,,2,,2,2,,,,,,,,,,,,,,,,,,,,,,,,,,,,
102.100.100/405331,CSTRP,,2/10/2025,0:35:00,2025-10-02T00:35:00Z,,2,,2,2,,,,,,,,,,,,,,,,,,,,,,,,,,,,
102.100.100/405332,CSTRP,,15/10/2025,23:17:00,2025-10-15T23:17:00Z,,2,,2,2,,,,,,,,,,,,,,,,,,,,,,,,,,,,
102.100.100/405333,CSTRP,,15/10/2025,23:24:00,2025-10-15T23:24:00Z,,2,,2,2,,,,,,,,,,,,,,,,,,,,,,,,,,,,
102.100.100/405334,CSTRP,,15/10/2025,23:30:00,2025-10-15T23:30:00Z,,2,,2,2,,,,,,,,,,,,,,,,,,,,,,,,,,,,
102.100.100/405335,CSTRP,,29/10/2025,23:10:00,2025-10-29T23:10:00Z,,2,,2,2,,,,,,,,,,,,,,,,,,,,,,,,,,,,
102.100.100/405336,CSTRP,,29/10/2025,23:15:00,2025-10-29T23:15:00Z,,2,,2,2,,,,,,,,,,,,,,,,,,,,,,,,,,,,
102.100.100/405337,CSTRP,,29/10/2025,23:20:00,2025-10-29T23:20:00Z,,2,,2,2,,,,,,,,,,,,,,,,,,,,,,,,,,,,
102.100.100/405338,CSTRP,,12/11/2025,23:22:00,2025-11-12T23:22:00Z,,2,,2,2,,,,,,,,,,,,,,,,,,,,,,,,,,,,
102.100.100/405339,CSTRP,,12/11/2025,23:26:00,2025-11-12T23:26:00Z,,2,,2,2,,,,,,,,,,,,,,,,,,,,,,,,,,,,
102.100.100/405340,CSTRP,,12/11/2025,23:32:00,2025-11-12T23:32:00Z,,2,,2,2,,,,,,,,,,,,,,,,,,,,,,,,,,,,
102.100.100/138851,CSYKK,WQQ188_D0,15/07/2020,1:40:00,2020-07-15T01:40:00Z,,0.5,10,2,2,,,22.404,,,,0.0292,0.533,0.437,,,0.11,BDL,,,12.54,,0.065,34.87,34.884,2,7.87,51.8,5.02,ND,,,
102.100.100/138852,CSYKK,WQQ188_D0,15/07/2020,1:40:00,2020-07-15T01:40:00Z,,0.5,10,2,2,,,22.404,,,,0.0292,0.533,0.437,,,0.11,BDL,,,12.54,,0.065,34.87,34.884,2,7.87,51.8,5.02,ND,,,
102.100.100/138853,CSYKK,WQQ188_D0,15/07/2020,1:40:00,2020-07-15T01:40:00Z,,0.5,10,2,2,,,22.404,,,,0.0292,0.533,0.437,,,0.11,BDL,,,12.54,,0.065,34.87,34.884,2,7.87,51.8,5.02,ND,,,
102.100.100/138854,CSYKK,WQQ188_D1,15/07/2020,1:45:00,2020-07-15T01:45:00Z,,7,10,2,2,,,22.37,,,,0.0244,0.512,0.7,,,0.08,BDL,,,14.29,,0.065,34.96,35.057,2,6.75,46.4,7.11,ND,,,
102.100.100/138855,CSYKK,WQQ188_D1,15/07/2020,1:45:00,2020-07-15T01:45:00Z,,7,10,2,2,,,22.37,,,,0.0244,0.512,0.7,,,0.08,BDL,,,14.29,,0.065,34.96,35.057,2,6.75,46.4,7.11,ND,,,
102.100.100/138856,CSYKK,WQQ188_D1,15/07/2020,1:45:00,2020-07-15T01:45:00Z,,7,10,2,2,,,22.37,,,,0.0244,0.512,0.7,,,0.08,BDL,,,14.29,,0.065,34.96,35.057,2,6.75,46.4,7.11,ND,,,
102.100.100/138875,CSYKK,WQQ241_D0,28/09/2020,23:07:00,2020-09-28T23:07:00Z,,0.5,10,2,2,,,25.719,,,,BDL,0.321,0.242,,,0.08,BDL,,,14.29,,0.075,35.13,35.134,2,6.16,59.3,4.62,3.25,,,
102.100.100/138876,CSYKK,WQQ241_D0,28/09/2020,23:07:00,2020-09-28T23:07:00Z,,0.5,10,2,2,,,25.719,,,,BDL,0.321,0.242,,,0.08,BDL,,,14.29,,0.075,35.13,35.134,2,6.16,59.3,4.62,3.25,,,
102.100.100/142686,CSYKK,WQQ241_D0,28/09/2020,23:07:00,2020-09-28T23:07:00Z,,0.5,10,2,2,,WARNING: Samples mislabelled (Sample_ID); formerly 102.100.100/138877,25.719,,,,BDL,0.321,0.242,,,0.08,BDL,,,14.29,,0.075,35.13,35.134,2,6.16,59.3,4.62,3.25,,,
102.100.100/138878,CSYKK,WQQ241_D1,28/09/2020,23:17:00,2020-09-28T23:17:00Z,,8,10,2,2,,,25.691,,,,BDL,0.475,0.442,,,0.03,BDL,,,15.66,,0.07,35.12,35.184,2,5.65,57.3,6.79,4.28,,,
102.100.100/138879,CSYKK,WQQ241_D1,28/09/2020,23:17:00,2020-09-28T23:17:00Z,,8,10,2,2,,,25.691,,,,BDL,0.475,0.442,,,0.03,BDL,,,15.66,,0.07,35.12,35.184,2,5.65,57.3,6.79,4.28,,,
102.100.100/138880,CSYKK,WQQ241_D1,28/09/2020,23:17:00,2020-09-28T23:17:00Z,,8,10,2,2,,,25.691,,,,BDL,0.475,0.442,,,0.03,BDL,,,15.66,,0.07,35.12,35.184,2,5.65,57.3,6.79,4.28,,,
102.100.100/138917,CSYKK,WQQ316_D0,14/02/2021,4:24:00,2021-02-14T04:24:00Z,,0.5,11,2,2,,,30.614,,,,BDL,0.232,ND,,,0.23,BDL,,,9.84,,BDL,32.02,32.076,6,9.5,84.4,0.7,ND,,,
102.100.100/138918,CSYKK,WQQ316_D0,14/02/2021,4:24:00,2021-02-14T04:24:00Z,,0.5,11,2,2,,,30.614,,,,BDL,0.232,ND,,,0.23,BDL,,,9.84,,BDL,32.02,32.076,6,9.5,84.4,0.7,ND,,,
102.100.100/138919,CSYKK,WQQ316_D0,14/02/2021,4:25:00,2021-02-14T04:25:00Z,,0.5,11,2,2,,,30.614,,,,BDL,0.232,ND,,,0.23,BDL,,,9.84,,BDL,32.02,32.076,6,9.5,84.4,0.7,ND,,,
102.100.100/138920,CSYKK,WQQ316_D1,14/02/2021,4:26:00,2021-02-14T04:26:00Z,,7,11,2,2,,,29.8,,,,0.0015,0.298,0.242,,,0.2,BDL,,,9.13,,BDL,33.12,33.177,6,5.27,91.8,1.3,ND,,,
102.100.100/138921,CSYKK,WQQ316_D1,14/02/2021,4:26:00,2021-02-14T04:26:00Z,,7,11,2,2,,,29.8,,,,0.0015,0.298,0.242,,,0.2,BDL,,,9.13,,BDL,33.12,33.177,6,5.27,91.8,1.3,ND,,,
102.100.100/138922,CSYKK,WQQ316_D1,14/02/2021,4:27:00,2021-02-14T04:27:00Z,,7,11,2,2,,,29.8,,,,0.0015,0.298,0.242,,,0.2,BDL,,,9.13,,BDL,33.12,33.177,6,5.27,91.8,1.3,ND,,,
102.100.100/138959,CSYKK,WQQ442_D0,3/10/2021,0:22:00,2021-10-03T00:22:00Z,,0,11,2,2,,,25.717,,,,0.15,0.2956,0.1078,,,0.06,BDL,,,8.028,,0.055,35.0995,35.097,4,4.535,70.5599,1.814,ND,,,
102.100.100/138960,CSYKK,WQQ442_D0,3/10/2021,0:23:00,2021-10-03T00:23:00Z,,0,11,2,2,,,25.717,,,,0.15,0.2956,0.1078,,,0.06,BDL,,,8.028,,0.055,35.0995,35.097,4,4.535,70.5599,1.814,ND,,,
102.100.100/138961,CSYKK,WQQ442_D0,3/10/2021,0:24:00,2021-10-03T00:24:00Z,,0,11,2,2,,,25.717,,,,0.15,0.2956,0.1078,,,0.06,BDL,,,8.028,,0.055,35.0995,35.097,4,4.535,70.5599,1.814,ND,,,
102.100.100/138962,CSYKK,WQQ442_D1,3/10/2021,0:25:00,2021-10-03T00:25:00Z,,7,11,2,2,,,25.104,,,,0.31,0.4445,0.2564,,,0.065,BDL,,,8.595,,0.065,35.1483,35.145,4,3.265,72.8413,2.294,ND,,,
102.100.100/138963,CSYKK,WQQ442_D1,3/10/2021,0:26:00,2021-10-03T00:26:00Z,,7,11,2,2,,,25.104,,,,0.31,0.4445,0.2564,,,0.065,BDL,,,8.595,,0.065,35.1483,35.145,4,3.265,72.8413,2.294,ND,,,
102.100.100/138964,CSYKK,WQQ442_D1,3/10/2021,0:27:00,2021-10-03T00:27:00Z,,7,11,2,2,,,25.104,,,,0.31,0.4445,0.2564,,,0.065,BDL,,,8.595,,0.065,35.1483,35.145,4,3.265,72.8413,2.294,ND,,,
102.100.100/142702,CSYKK,WQQ515_D1,12/02/2022,1:22:00,2022-02-12T01:22:00Z,,8,11,2,2,,,29.514,,,,BDL,0.2956,ND,,,0.025,BDL,,,8.028,,0.03,ND,33.756,9,4.27,ND,0.929,ND,,,
102.100.100/142703,CSYKK,WQQ515_D1,12/02/2022,1:23:00,2022-02-12T01:23:00Z,,8,11,2,2,,,29.514,,,,BDL,0.2956,ND,,,0.025,BDL,,,8.028,,0.03,ND,33.756,9,4.27,ND,0.929,ND,,,
102.100.100/142704,CSYKK,WQQ515_D1,12/02/2022,1:27:00,2022-02-12T01:27:00Z,,8,11,2,2,,,29.514,,,,BDL,0.2956,ND,,,0.025,BDL,,,8.028,,0.03,ND,33.756,9,4.27,ND,0.929,ND,,,
102.100.100/142699,CSYKK,WQQ515_D0,12/02/2022,1:28:00,2022-02-12T01:28:00Z,,0,11,2,2,,,29.837,,,,0.255,0.2471,ND,,,0.04,0.025,,,7.412,,BDL,ND,32.786,9,13,ND,0.364,ND,,,
102.100.100/142700,CSYKK,WQQ515_D0,12/02/2022,1:29:00,2022-02-12T01:29:00Z,,0,11,2,2,,,29.837,,,,0.255,0.2471,ND,,,0.04,0.025,,,7.412,,BDL,ND,32.786,9,13,ND,0.364,ND,,,
102.100.100/142701,CSYKK,WQQ515_D0,12/02/2022,1:31:00,2022-02-12T01:31:00Z,,0,11,2,2,,,29.837,,,,0.255,0.2471,ND,,,0.04,0.025,,,7.412,,BDL,ND,32.786,9,13,ND,0.364,ND,,,
102.100.100/142762,CSYKK,WQQ581_D1,9/06/2022,2:54:00,2022-06-09T02:54:00Z,,7,11,2,2,,,25.88,,,,0.225,0.4283,0.4218,,,0.03,BDL,,,8.878,,0.035,33.7559,33.826,5,4.91,70.6575,2.799,2.159,,,
102.100.100/142763,CSYKK,WQQ581_D1,9/06/2022,2:55:00,2022-06-09T02:55:00Z,,7,11,2,2,,,25.88,,,,0.225,0.4283,0.4218,,,0.03,BDL,,,8.878,,0.035,33.7559,33.826,5,4.91,70.6575,2.799,2.159,,,
102.100.100/142764,CSYKK,WQQ581_D1,9/06/2022,2:57:00,2022-06-09T02:57:00Z,,7,11,2,2,,,25.88,,,,0.225,0.4283,0.4218,,,0.03,BDL,,,8.878,,0.035,33.7559,33.826,5,4.91,70.6575,2.799,2.159,,,
102.100.100/142759,CSYKK,WQQ581_D0,9/06/2022,2:58:00,2022-06-09T02:58:00Z,,0,11,2,2,,,25.903,,,,0.32,0.4186,0.1489,,,0.235,BDL,,,10.08,,0.04,33.7434,33.825,5,4.895,72.4156,2.404,1.8636,,,
102.100.100/142760,CSYKK,WQQ581_D0,9/06/2022,3:00:00,2022-06-09T03:00:00Z,,0,11,2,2,,,25.903,,,,0.32,0.4186,0.1489,,,0.235,BDL,,,10.08,,0.04,33.7434,33.825,5,4.895,72.4156,2.404,1.8636,,,
102.100.100/142761,CSYKK,WQQ581_D0,9/06/2022,3:01:00,2022-06-09T03:01:00Z,,0,11,2,2,,,25.903,,,,0.32,0.4186,0.1489,,,0.235,BDL,,,10.08,,0.04,33.7434,33.825,5,4.895,72.4156,2.404,1.8636,,,
102.100.100/142783,CSYKK,WQQ642_D0,2/11/2022,2:23:00,2022-11-02T02:23:00Z,,0,10.5,2,2,,,28.917,,,,0.175,0.302685,1.2011,,,0.07,0.02,,,8.998335,,0.075,35.0123,35.06112,3,3.805,70.488,2.095,1.2673,,,
102.100.100/142784,CSYKK,WQQ642_D0,2/11/2022,2:25:00,2022-11-02T02:25:00Z,,0,10.5,2,2,,,28.917,,,,0.175,0.302685,1.2011,,,0.07,0.02,,,8.998335,,0.075,35.0123,35.06112,3,3.805,70.488,2.095,1.2673,,,
102.100.100/142785,CSYKK,WQQ642_D0,2/11/2022,2:26:00,2022-11-02T02:26:00Z,,0,10.5,2,2,,,28.917,,,,0.175,0.302685,1.2011,,,0.07,0.02,,,8.998335,,0.075,35.0123,35.06112,3,3.805,70.488,2.095,1.2673,,,
102.100.100/142786,CSYKK,WQQ642-D1,2/11/2022,2:28:00,2022-11-02T02:28:00Z,,7,10.5,2,2,,,28.907,,,,0.115,0.273955,0.3023,,,0.02,0.01,,,8.256665,,0.055,35.0132,35.0321,3,3.68,73.91,2.02,1.6907,,,
102.100.100/142787,CSYKK,WQQ642-D1,2/11/2022,2:31:00,2022-11-02T02:31:00Z,,7,10.5,2,2,,,28.907,,,,0.115,0.273955,0.3023,,,0.02,0.01,,,8.256665,,0.055,35.0132,35.0321,3,3.68,73.91,2.02,1.6907,,,
102.100.100/142788,CSYKK,WQQ642-D1,2/11/2022,2:33:00,2022-11-02T02:33:00Z,,7,10.5,2,2,,,28.907,,,,0.115,0.273955,0.3023,,,0.02,0.01,,,8.256665,,0.055,35.0132,35.0321,3,3.68,73.91,2.02,1.6907,,,
102.100.100/400509,CSYKK,WQQ715_D0,24/02/2023,0:38:00,2023-02-24T00:38:00Z,,0,9.4,2,2,,,28.459,,42,,0.09,0.66589,0.2675,,,0.05,0.01,,,13.51333,,0.025,31.3595,31.45723,3,10.14,66.1413,2.21,ND,,,
102.100.100/400510,CSYKK,WQQ715_D0,24/02/2023,0:40:00,2023-02-24T00:40:00Z,,0,9.4,2,2,,,28.459,,34.1,,0.09,0.66589,0.2675,,,0.05,0.01,,,13.51333,,0.025,31.3595,31.45723,3,10.14,66.1413,2.21,ND,,,
102.100.100/400511,CSYKK,WQQ715_D0,24/02/2023,0:41:00,2023-02-24T00:41:00Z,,0,9.4,2,2,,,28.459,,42.9,,0.09,0.66589,0.2675,,,0.05,0.01,,,13.51333,,0.025,31.3595,31.45723,3,10.14,66.1413,2.21,ND,,,
102.100.100/400512,CSYKK,WQQ715_D1,24/02/2023,0:43:00,2023-02-24T00:43:00Z,,7,9.4,2,2,,,28.423,,3.43,,0.235,0.734845,0.3481,,,0.055,0.01,,,11.163335,,0.03,32.3867,32.3713,3,11.86,75.555,1.51,ND,,,
102.100.100/400513,CSYKK,WQQ715_D1,24/02/2023,0:45:00,2023-02-24T00:45:00Z,,7,9.4,2,2,,,28.423,,27.6,,0.235,0.734845,0.3481,,,0.055,0.01,,,11.163335,,0.03,32.3867,32.3713,3,11.86,75.555,1.51,ND,,,
102.100.100/400514,CSYKK,WQQ715_D1,24/02/2023,0:47:00,2023-02-24T00:47:00Z,,7,9.4,2,2,,,28.423,,30.5,,0.235,0.734845,0.3481,,,0.055,0.01,,,11.163335,,0.03,32.3867,32.3713,3,11.86,75.555,1.51,ND,,,
102.100.100/400551,CSYKK,WQQ781_D0,21/06/2023,2:04:00,2023-06-21T02:04:00Z,,0,11,2,2,,,24.51,,12,,0.51,0.416825,0.4113,,,0.02,0.01,,,10.756665,,0.045,33.622,33.58726,5,9.66,72.6464,1.88,ND,,,
102.100.100/400552,CSYKK,WQQ781_D0,21/06/2023,2:06:00,2023-06-21T02:06:00Z,,0,11,2,2,,,24.51,,8.66,,0.51,0.416825,0.4113,,,0.02,0.01,,,10.756665,,0.045,33.622,33.58726,5,9.66,72.6464,1.88,ND,,,
102.100.100/400553,CSYKK,WQQ781_D0,21/06/2023,2:08:00,2023-06-21T02:08:00Z,,0,11,2,2,,,24.51,,8.41,,0.51,0.416825,0.4113,,,0.02,0.01,,,10.756665,,0.045,33.622,33.58726,5,9.66,72.6464,1.88,ND,,,
102.100.100/400554,CSYKK,WQQ781_D1,21/06/2023,2:10:00,2023-06-21T02:10:00Z,,8,11,1.8,1.8,,,24.254,,8.46,,0.205,0.48269,0.664,,,0.01,0.01,,,9.415,,0.07,34.0955,34.11432,5,5.03,67.7187,2.78,0.5042,,,
102.100.100/400555,CSYKK,WQQ781_D1,21/06/2023,2:12:00,2023-06-21T02:12:00Z,,8,11,2,2,,,24.254,,8.53,,0.205,0.48269,0.664,,,0.01,0.01,,,9.415,,0.07,34.0955,34.11432,5,5.03,67.7187,2.78,0.5042,,,
102.100.100/400556,CSYKK,WQQ781_D1,21/06/2023,2:14:00,2023-06-21T02:14:00Z,,8,11,2,2,,,24.254,,8.08,,0.205,0.48269,0.664,,,0.01,0.01,,,9.415,,0.07,34.0955,34.11432,5,5.03,67.7187,2.78,0.5042,,,
102.100.100/403478,CSYKK,WQQ842_D0,27/10/2023,2:00:00,2023-10-27T02:00:00Z,,0,,2,2,,,28.402,,11.8,,0.235,0.216,0.1833,,,0.03,0.01,,,11.715,,0.085,35.2846,35.32,2.5,6.39,66.8468,1.98,,,,
102.100.100/403479,CSYKK,WQQ842_D0,27/10/2023,2:01:00,2023-10-27T02:01:00Z,,0,,2,2,,,28.402,,13.2,,0.235,0.216,0.1833,,,0.03,0.01,,,11.715,,0.085,35.2846,35.32,2.5,6.39,66.8468,1.98,,,,
102.100.100/403480,CSYKK,WQQ842_D0,27/10/2023,2:02:00,2023-10-27T02:02:00Z,,0,,2,2,,,28.402,,16.7,,0.235,0.216,0.1833,,,0.03,0.01,,,11.715,,0.085,35.2846,35.32,2.5,6.39,66.8468,1.98,,,,
102.100.100/403481,CSYKK,WQQ842_D1,27/10/2023,2:04:00,2023-10-27T02:04:00Z,,7,,2,2,,,26.424,,14.4,,0.175,0.356,0.3554,,,0.03,0.01,,,13.08,,0.11,35.2149,35.238,2.5,4.66,66.7935,2.74,,,,
102.100.100/403482,CSYKK,WQQ842_D1,27/10/2023,2:06:00,2023-10-27T02:06:00Z,,7,,2,2,,,26.424,,6.28,,0.175,0.356,0.3554,,,0.03,0.01,,,13.08,,0.11,35.2149,35.238,2.5,4.66,66.7935,2.74,,,,
102.100.100/403483,CSYKK,WQQ842_D1,27/10/2023,2:07:00,2023-10-27T02:07:00Z,,7,,2,2,,,26.424,,15.6,,0.175,0.356,0.3554,,,0.03,0.01,,,13.08,,0.11,35.2149,35.238,2.5,4.66,66.7935,2.74,,,,
102.100.100/403582,CSYKK,WQQ915_D0,21/02/2024,0:56:00,2024-02-21T00:56:00Z,,0,,2,2,,,0,,22.6,,0.16,0.3025,0.4353,,,0.01,0.01,,,9.125,,0.035,31.7666,32.088,4.5,12.005,,0.885,1.1856,,,
102.100.100/403583,CSYKK,WQQ915_D0,21/02/2024,0:56:00,2024-02-21T00:56:00Z,,0,,2,2,,,0,,16.1,,0.16,0.3025,0.4353,,,0.01,0.01,,,9.125,,0.035,31.7666,32.088,4.5,12.005,,0.885,1.1856,,,
102.100.100/403584,CSYKK,WQQ915_D0,21/02/2024,0:56:00,2024-02-21T00:56:00Z,,0,,2,2,,,0,,22.4,,0.16,0.3025,0.4353,,,0.01,0.01,,,9.125,,0.035,31.7666,32.088,4.5,12.005,,0.885,1.1856,,,
102.100.100/403585,CSYKK,WQQ915_D1,21/02/2024,0:56:00,2024-02-21T00:56:00Z,,9,,2,2,,,0,,14.6,,0.195,0.2135,0.4727,,,0.01,0.01,,,6.225,,0.035,32.5641,32.458,4.5,10.18,,0.6,0.7026,,,
102.100.100/403586,CSYKK,WQQ915_D1,21/02/2024,0:56:00,2024-02-21T00:56:00Z,,9,,2,2,,,0,,10.2,,0.195,0.2135,0.4727,,,0.01,0.01,,,6.225,,0.035,32.5641,32.458,4.5,10.18,,0.6,0.7026,,,
102.100.100/403587,CSYKK,WQQ915_D1,21/02/2024,0:56:00,2024-02-21T00:56:00Z,,9,,2,2,,,0,,14.6,,0.195,0.2135,0.4727,,,0.01,0.01,,,6.225,,0.035,32.5641,32.458,4.5,10.18,,0.6,0.7026,,,
102.100.100/403618,CSYKK,WQQ981_D0,9/06/2024,1:34:00,2024-06-09T01:34:00Z,,0,,2,2,,,23.602,,21.7,,0.38,0.48,0.4405,,,0.12,0.025,,,14.395,,0.085,33.9421,33.825,2.5,15.795,60.6512,0,3.8405,,,
102.100.100/403619,CSYKK,WQQ981_D0,9/06/2024,1:34:00,2024-06-09T01:34:00Z,,0,,2,2,,,23.602,,31.3,,0.38,0.48,0.4405,,,0.12,0.025,,,14.395,,0.085,33.9421,33.825,2.5,15.795,60.6512,0,3.8405,,,
102.100.100/403620,CSYKK,WQQ981_D0,9/06/2024,1:34:00,2024-06-09T01:34:00Z,,0,,2,2,,,23.602,,22.5,,0.38,0.48,0.4405,,,0.12,0.025,,,14.395,,0.085,33.9421,33.825,2.5,15.795,60.6512,0,3.8405,,,
102.100.100/403805,CSYKK,WQQ981_D1,9/06/2024,1:34:00,2024-06-09T01:34:00Z,,16.5,,2,2,,,23.899,,11.2,,0.23,0.356,0.6158,,,0.035,0.01,,,10.395,,0.09,34.5812,34.602,2.5,8.765,66.7096,0,3.6805,,,
102.100.100/403806,CSYKK,WQQ981_D1,9/06/2024,1:34:00,2024-06-09T01:34:00Z,,16.5,,2,2,,,23.899,,15.6,,0.23,0.356,0.6158,,,0.035,0.01,,,10.395,,0.09,34.5812,34.602,2.5,8.765,66.7096,0,3.6805,,,
102.100.100/403807,CSYKK,WQQ981_D1,9/06/2024,1:34:00,2024-06-09T01:34:00Z,,16.5,,2,2,,,23.899,,19.3,,0.23,0.356,0.6158,,,0.035,0.01,,,10.395,,0.09,34.5812,34.602,2.5,8.765,66.7096,0,3.6805,,,
102.100.100/404266,CSYKK,WQR053_D1,26/10/2024,1:26,2024-10-26T01:26:00Z,,7,,2,2,,,27.404,,16,,0.15,0.3465,0.1807,,,0.01,0.01,,,8.825,,0.09,35.4146,35.536,5,3.68,83.2542,1.415,1.8005,,,
102.100.100/404267,CSYKK,WQR053_D1,26/10/2024,1:28,2024-10-26T01:28:00Z,,7,,2,2,,,27.404,,11.9,,0.15,0.3465,0.1807,,,0.01,0.01,,,8.825,,0.09,35.4146,35.536,5,3.68,83.2542,1.415,1.8005,,,
102.100.100/404268,CSYKK,WQR053_D1,26/10/2024,1:30,2024-10-26T01:30:00Z,,7,,2,2,,,27.404,,18.4,,0.15,0.3465,0.1807,,,0.01,0.01,,,8.825,,0.09,35.4146,35.536,5,3.68,83.2542,1.415,1.8005,,,
102.100.100/404263,CSYKK,WQR053_D0,26/10/2024,1:31,2024-10-26T01:31:00Z,,0,,2,2,,,28.067,,8.37,,0.3,0.272,0.0203,,,0.025,0.005,,,8.45,,0.1,35.5449,35.595,5,4.765,84.3912,0.925,1.5392,,,
102.100.100/404264,CSYKK,WQR053_D0,26/10/2024,1:33,2024-10-26T01:33:00Z,,0,,2,2,,,28.067,,11.6,,0.3,0.272,0.0203,,,0.025,0.005,,,8.45,,0.1,35.5449,35.595,5,4.765,84.3912,0.925,1.5392,,,
102.100.100/404265,CSYKK,WQR053_D0,26/10/2024,1:35,2024-10-26T01:35:00Z,,0,,2,2,,,28.067,,6.14,,0.3,0.272,0.0203,,,0.025,0.005,,,8.45,,0.1,35.5449,35.595,5,4.765,84.3912,0.925,1.5392,,,
102.100.100/404475,CSYKK,WQR136_D0,13/02/2025,0:37,2025-02-13T00:37:00Z,,0,,2,2,,,28.56919,,23.5,,0.245,0.8205,0.4433,,,0.065,0.02,,,13.95,,0.05,25.4591,26.634,7.5,17.695,,1.01,0.4174,,,
102.100.100/404476,CSYKK,WQR136_D0,13/02/2025,0:39,2025-02-13T00:39:00Z,,0,,2,2,,,28.56919,,22.1,,0.245,0.8205,0.4433,,,0.065,0.02,,,13.95,,0.05,25.4591,26.634,7.5,17.695,,1.01,0.4174,,,
102.100.100/404477,CSYKK,WQR136_D0,13/02/2025,0:41,2025-02-13T00:41:00Z,,0,,2,2,,,28.56919,,17.3,,0.245,0.8205,0.4433,,,0.065,0.02,,,13.95,,0.05,25.4591,26.634,7.5,17.695,,1.01,0.4174,,,
102.100.100/404478,CSYKK,WQR136_D1,13/02/2025,0:44,2025-02-13T00:44:00Z,,10,,2,2,,,29.38439,,15,,0.29,1.022,0.8402,,,0.1,0.045,,,13.65,,0.06,32.5941,27.825,7.5,15.62,,1.525,1.934,,,
102.100.100/404479,CSYKK,WQR136_D1,13/02/2025,0:46,2025-02-13T00:46:00Z,,10,,2,2,,,29.38439,,15.9,,0.29,1.022,0.8402,,,0.1,0.045,,,13.65,,0.06,32.5941,27.825,7.5,15.62,,1.525,1.934,,,
102.100.100/404480,CSYKK,WQR136_D1,13/02/2025,0:47,2025-02-13T00:47:00Z,,10,,2,2,,,29.38439,,15.8,,0.29,1.022,0.8402,,,0.1,0.045,,,13.65,,0.06,32.5941,27.825,7.5,15.62,,1.525,1.934,,,
102.100.100/405307,CSYKK,WQR212_D1,23/06/2025,1:07,2025-06-23T01:07:00Z,,6,,2,2,,,23.351,,17.5,,0.16,0.78,0.7818,,,0.02,0.025,,,14.2,,0.11,34.1848,34.187,2,9.14,44.9182,8.06,,,,
102.100.100/405308,CSYKK,WQR212_D1,23/06/2025,1:10,2025-06-23T01:10:00Z,,6,,2,2,,,23.351,,20.2,,0.16,0.78,0.7818,,,0.02,0.025,,,14.2,,0.11,34.1848,34.187,2,9.14,44.9182,8.06,,,,
102.100.100/405309,CSYKK,WQR212_D1,23/06/2025,1:11,2025-06-23T01:11:00Z,,6,,2,2,,,23.351,,17.3,,0.16,0.78,0.7818,,,0.02,0.025,,,14.2,,0.11,34.1848,34.187,2,9.14,44.9182,8.06,,,,
102.100.100/405304,CSYKK,WQR212_D0,23/06/2025,1:15,2025-06-23T01:15:00Z,,0,,2,2,,,23.411,,26.5,,0.145,0.7285,0.7236,,,0.02,0.02,,,12.685,,0.1,34.1764,34.204,2,6.59,50.4255,4.92,,,,
102.100.100/405305,CSYKK,WQR212_D0,23/06/2025,1:18,2025-06-23T01:18:00Z,,0,,2,2,,,23.411,,22.8,,0.145,0.7285,0.7236,,,0.02,0.02,,,12.685,,0.1,34.1764,34.204,2,6.59,50.4255,4.92,,,,
102.100.100/405306,CSYKK,WQR212_D0,23/06/2025,1:20,2025-06-23T01:20:00Z,,0,,2,2,,,23.411,,16.1,,0.145,0.7285,0.7236,,,0.02,0.02,,,12.685,,0.1,34.1764,34.204,2,6.59,50.4255,4.92,,,,
